{
    "componentChunkName": "component---src-components-info-page-tsx",
    "path": "/foundation/typography/headings",
    "result": {"data":{"mdx":{"id":"8e04408d-b4b9-55b2-83e9-dd2174c9f388","frontmatter":{"title":"Headings","intro":"Headings help to provide a quick, organized way to organize the main sections of a website.","core":{"githubLink":"design-system/src/styles/base/_typography.scss","sketchLink":"KvvZ7YV","storybookLink":"foundations-typography-headings--all-headings"},"healthcare":{"sketchLink":"25qAbyl","storybookLink":null,"githubLink":null},"medicare":{"sketchLink":"ZOarvL7","storybookLink":null,"githubLink":null}},"slug":"foundation/typography/headings","body":"var _excluded = [\"components\"];\n\nfunction _extends() { _extends = Object.assign || function (target) { for (var i = 1; i < arguments.length; i++) { var source = arguments[i]; for (var key in source) { if (Object.prototype.hasOwnProperty.call(source, key)) { target[key] = source[key]; } } } return target; }; return _extends.apply(this, arguments); }\n\nfunction _objectWithoutProperties(source, excluded) { if (source == null) return {}; var target = _objectWithoutPropertiesLoose(source, excluded); var key, i; if (Object.getOwnPropertySymbols) { var sourceSymbolKeys = Object.getOwnPropertySymbols(source); for (i = 0; i < sourceSymbolKeys.length; i++) { key = sourceSymbolKeys[i]; if (excluded.indexOf(key) >= 0) continue; if (!Object.prototype.propertyIsEnumerable.call(source, key)) continue; target[key] = source[key]; } } return target; }\n\nfunction _objectWithoutPropertiesLoose(source, excluded) { if (source == null) return {}; var target = {}; var sourceKeys = Object.keys(source); var key, i; for (i = 0; i < sourceKeys.length; i++) { key = sourceKeys[i]; if (excluded.indexOf(key) >= 0) continue; target[key] = source[key]; } return target; }\n\n/* @jsxRuntime classic */\n\n/* @jsx mdx */\nvar _frontmatter = {\n  \"title\": \"Headings\",\n  \"order\": 10,\n  \"intro\": \"Headings help to provide a quick, organized way to organize the main sections of a website.\",\n  \"core\": {\n    \"githubLink\": \"design-system/src/styles/base/_typography.scss\",\n    \"sketchLink\": \"KvvZ7YV\",\n    \"storybookLink\": \"foundations-typography-headings--all-headings\"\n  },\n  \"healthcare\": {\n    \"sketchLink\": \"25qAbyl\"\n  },\n  \"medicare\": {\n    \"sketchLink\": \"ZOarvL7\"\n  }\n};\n\nvar makeShortcode = function makeShortcode(name) {\n  return function MDXDefaultShortcode(props) {\n    console.warn(\"Component \" + name + \" was not imported, exported, or provided by MDXProvider as global scope\");\n    return mdx(\"div\", props);\n  };\n};\n\nvar ThemeContent = makeShortcode(\"ThemeContent\");\nvar CloseIconThin = makeShortcode(\"CloseIconThin\");\nvar EmbeddedExample = makeShortcode(\"EmbeddedExample\");\nvar ResponsiveExample = makeShortcode(\"ResponsiveExample\");\nvar layoutProps = {\n  _frontmatter: _frontmatter\n};\nvar MDXLayout = \"wrapper\";\nreturn function MDXContent(_ref) {\n  var components = _ref.components,\n      props = _objectWithoutProperties(_ref, _excluded);\n\n  return mdx(MDXLayout, _extends({}, layoutProps, props, {\n    components: components,\n    mdxType: \"MDXLayout\"\n  }), mdx(Alert, {\n    heading: \"Typography sizing updates!\",\n    mdxType: \"Alert\"\n  }, mdx(\"p\", {\n    className: \"ds-c-alert__text\"\n  }, \"We've updated typography sizing variables and class names to make them more agnostic. Read about\", ' ', mdx(\"a\", {\n    href: \"/getting-started/developers/theming/#updating-font-sizing\"\n  }, \"how you can update\"), \".\")), mdx(ThemeContent, {\n    onlyThemes: ['healthcare'],\n    mdxType: \"ThemeContent\"\n  }, mdx(\"p\", null, \"Open Sans serves as the base font for the site. The full Open Sans type family consists of a variety of weights including light, regular, semibold, bold, and extrabold which allows for a wide range of type treatments and hierarchies within a page while still maintaining a unified look and feel. \"), mdx(\"p\", null, \"Sans-serifs have been proven to be easier to read on-screen and are incredibly adaptable when resized and displayed across different platforms and browsers. Accordingly, Open Sans is used for body type, secondary and tertiary headlines, and instructional text. \"), mdx(\"p\", null, mdx(\"strong\", {\n    parentName: \"p\"\n  }, \"Web font stack:\"), \" Open Sans > Helvetica > Arial > Verdana > Sans-Serif \"), mdx(\"ul\", null, mdx(\"li\", {\n    parentName: \"ul\"\n  }, \"Open Sans font is used for headings and body content.\"), mdx(\"li\", {\n    parentName: \"ul\"\n  }, \"Standard body text is Open Sans Regular, 16px, #333, 24px line-height, 32px bottom-margin on paragraphs.\"), mdx(\"li\", {\n    parentName: \"ul\"\n  }, \"Smallest paragraph text for legibility reasons is Open Sans Regular, 14px, #333, 20px line-height, 28px bottom-margin on paragraphs (except for legal/caption text).\"), mdx(\"li\", {\n    parentName: \"ul\"\n  }, \"Uppercase font should not be used.\"))), mdx(\"p\", null, \"The design system doesn't style base HTML typography elements (like \", mdx(\"inlineCode\", {\n    parentName: \"p\"\n  }, \"h1\"), \", \", mdx(\"inlineCode\", {\n    parentName: \"p\"\n  }, \"h2\"), \", \", mdx(\"inlineCode\", {\n    parentName: \"p\"\n  }, \"p\"), \", etc) in order to avoid conflicting with any existing site styles.\"), mdx(\"h2\", {\n    \"id\": \"examples\",\n    \"style\": {\n      \"position\": \"relative\"\n    }\n  }, mdx(\"a\", {\n    parentName: \"h2\",\n    \"href\": \"#examples\",\n    \"aria-label\": \"examples permalink\",\n    \"className\": \"anchor before\"\n  }, mdx(\"svg\", {\n    parentName: \"a\",\n    \"aria-hidden\": \"true\",\n    \"focusable\": \"false\",\n    \"height\": \"16\",\n    \"version\": \"1.1\",\n    \"viewBox\": \"0 0 16 16\",\n    \"width\": \"16\"\n  }, mdx(\"path\", {\n    parentName: \"svg\",\n    \"fillRule\": \"evenodd\",\n    \"d\": \"M4 9h1v1H4c-1.5 0-3-1.69-3-3.5S2.55 3 4 3h4c1.45 0 3 1.69 3 3.5 0 1.41-.91 2.72-2 3.25V8.59c.58-.45 1-1.27 1-2.09C10 5.22 8.98 4 8 4H4c-.98 0-2 1.22-2 2.5S3 9 4 9zm9-3h-1v1h1c1 0 2 1.22 2 2.5S13.98 12 13 12H9c-.98 0-2-1.22-2-2.5 0-.83.42-1.64 1-2.09V6.25c-1.09.53-2 1.84-2 3.25C6 11.31 7.55 13 9 13h4c1.45 0 3-1.69 3-3.5S14.5 6 13 6z\"\n  }))), \"Examples\"), mdx(\"h3\", {\n    \"id\": \"heading--5xl\",\n    \"style\": {\n      \"position\": \"relative\"\n    }\n  }, mdx(\"a\", {\n    parentName: \"h3\",\n    \"href\": \"#heading--5xl\",\n    \"aria-label\": \"heading  5xl permalink\",\n    \"className\": \"anchor before\"\n  }, mdx(\"svg\", {\n    parentName: \"a\",\n    \"aria-hidden\": \"true\",\n    \"focusable\": \"false\",\n    \"height\": \"16\",\n    \"version\": \"1.1\",\n    \"viewBox\": \"0 0 16 16\",\n    \"width\": \"16\"\n  }, mdx(\"path\", {\n    parentName: \"svg\",\n    \"fillRule\": \"evenodd\",\n    \"d\": \"M4 9h1v1H4c-1.5 0-3-1.69-3-3.5S2.55 3 4 3h4c1.45 0 3 1.69 3 3.5 0 1.41-.91 2.72-2 3.25V8.59c.58-.45 1-1.27 1-2.09C10 5.22 8.98 4 8 4H4c-.98 0-2 1.22-2 2.5S3 9 4 9zm9-3h-1v1h1c1 0 2 1.22 2 2.5S13.98 12 13 12H9c-.98 0-2-1.22-2-2.5 0-.83.42-1.64 1-2.09V6.25c-1.09.53-2 1.84-2 3.25C6 11.31 7.55 13 9 13h4c1.45 0 3-1.69 3-3.5S14.5 6 13 6z\"\n  }))), \"Heading--5xl\"), mdx(ThemeContent, {\n    onlyThemes: ['medicare'],\n    mdxType: \"ThemeContent\"\n  }, mdx(Badge, {\n    variation: \"alert\",\n    mdxType: \"Badge\"\n  }, mdx(CloseIconThin, {\n    mdxType: \"CloseIconThin\"\n  }), \" Unused by Medicare.\")), mdx(ThemeContent, {\n    neverThemes: ['medicare'],\n    mdxType: \"ThemeContent\"\n  }, mdx(EmbeddedExample, {\n    mdxType: \"EmbeddedExample\"\n  }, mdx(\"h1\", {\n    className: \"ds-text-heading--5xl\"\n  }, loremIpsumGenerator('s')))), mdx(\"h3\", {\n    \"id\": \"heading--4xl\",\n    \"style\": {\n      \"position\": \"relative\"\n    }\n  }, mdx(\"a\", {\n    parentName: \"h3\",\n    \"href\": \"#heading--4xl\",\n    \"aria-label\": \"heading  4xl permalink\",\n    \"className\": \"anchor before\"\n  }, mdx(\"svg\", {\n    parentName: \"a\",\n    \"aria-hidden\": \"true\",\n    \"focusable\": \"false\",\n    \"height\": \"16\",\n    \"version\": \"1.1\",\n    \"viewBox\": \"0 0 16 16\",\n    \"width\": \"16\"\n  }, mdx(\"path\", {\n    parentName: \"svg\",\n    \"fillRule\": \"evenodd\",\n    \"d\": \"M4 9h1v1H4c-1.5 0-3-1.69-3-3.5S2.55 3 4 3h4c1.45 0 3 1.69 3 3.5 0 1.41-.91 2.72-2 3.25V8.59c.58-.45 1-1.27 1-2.09C10 5.22 8.98 4 8 4H4c-.98 0-2 1.22-2 2.5S3 9 4 9zm9-3h-1v1h1c1 0 2 1.22 2 2.5S13.98 12 13 12H9c-.98 0-2-1.22-2-2.5 0-.83.42-1.64 1-2.09V6.25c-1.09.53-2 1.84-2 3.25C6 11.31 7.55 13 9 13h4c1.45 0 3-1.69 3-3.5S14.5 6 13 6z\"\n  }))), \"Heading--4xl\"), mdx(ThemeContent, {\n    onlyThemes: ['medicare'],\n    mdxType: \"ThemeContent\"\n  }, mdx(Badge, {\n    variation: \"alert\",\n    mdxType: \"Badge\"\n  }, mdx(CloseIconThin, {\n    mdxType: \"CloseIconThin\"\n  }), \" Unused by Medicare.\")), mdx(ThemeContent, {\n    onlyThemes: ['healthcare'],\n    mdxType: \"ThemeContent\"\n  }, mdx(\"p\", null, \"Heading--4xl is used for the heading on landing pages that serve as an entry point to a section on HC.gov when the heading needs to be larger and bolder to stand out.\")), mdx(ThemeContent, {\n    neverThemes: ['medicare'],\n    mdxType: \"ThemeContent\"\n  }, mdx(EmbeddedExample, {\n    mdxType: \"EmbeddedExample\"\n  }, mdx(\"h1\", {\n    className: \"ds-text-heading--4xl\"\n  }, loremIpsumGenerator('s')))), mdx(\"h3\", {\n    \"id\": \"heading--3xl\",\n    \"style\": {\n      \"position\": \"relative\"\n    }\n  }, mdx(\"a\", {\n    parentName: \"h3\",\n    \"href\": \"#heading--3xl\",\n    \"aria-label\": \"heading  3xl permalink\",\n    \"className\": \"anchor before\"\n  }, mdx(\"svg\", {\n    parentName: \"a\",\n    \"aria-hidden\": \"true\",\n    \"focusable\": \"false\",\n    \"height\": \"16\",\n    \"version\": \"1.1\",\n    \"viewBox\": \"0 0 16 16\",\n    \"width\": \"16\"\n  }, mdx(\"path\", {\n    parentName: \"svg\",\n    \"fillRule\": \"evenodd\",\n    \"d\": \"M4 9h1v1H4c-1.5 0-3-1.69-3-3.5S2.55 3 4 3h4c1.45 0 3 1.69 3 3.5 0 1.41-.91 2.72-2 3.25V8.59c.58-.45 1-1.27 1-2.09C10 5.22 8.98 4 8 4H4c-.98 0-2 1.22-2 2.5S3 9 4 9zm9-3h-1v1h1c1 0 2 1.22 2 2.5S13.98 12 13 12H9c-.98 0-2-1.22-2-2.5 0-.83.42-1.64 1-2.09V6.25c-1.09.53-2 1.84-2 3.25C6 11.31 7.55 13 9 13h4c1.45 0 3-1.69 3-3.5S14.5 6 13 6z\"\n  }))), \"Heading--3xl\"), mdx(EmbeddedExample, {\n    mdxType: \"EmbeddedExample\"\n  }, mdx(\"h1\", {\n    className: \"ds-text-heading--3xl\"\n  }, loremIpsumGenerator('s'))), mdx(\"h3\", {\n    \"id\": \"heading--2xl\",\n    \"style\": {\n      \"position\": \"relative\"\n    }\n  }, mdx(\"a\", {\n    parentName: \"h3\",\n    \"href\": \"#heading--2xl\",\n    \"aria-label\": \"heading  2xl permalink\",\n    \"className\": \"anchor before\"\n  }, mdx(\"svg\", {\n    parentName: \"a\",\n    \"aria-hidden\": \"true\",\n    \"focusable\": \"false\",\n    \"height\": \"16\",\n    \"version\": \"1.1\",\n    \"viewBox\": \"0 0 16 16\",\n    \"width\": \"16\"\n  }, mdx(\"path\", {\n    parentName: \"svg\",\n    \"fillRule\": \"evenodd\",\n    \"d\": \"M4 9h1v1H4c-1.5 0-3-1.69-3-3.5S2.55 3 4 3h4c1.45 0 3 1.69 3 3.5 0 1.41-.91 2.72-2 3.25V8.59c.58-.45 1-1.27 1-2.09C10 5.22 8.98 4 8 4H4c-.98 0-2 1.22-2 2.5S3 9 4 9zm9-3h-1v1h1c1 0 2 1.22 2 2.5S13.98 12 13 12H9c-.98 0-2-1.22-2-2.5 0-.83.42-1.64 1-2.09V6.25c-1.09.53-2 1.84-2 3.25C6 11.31 7.55 13 9 13h4c1.45 0 3-1.69 3-3.5S14.5 6 13 6z\"\n  }))), \"Heading--2xl\"), mdx(EmbeddedExample, {\n    mdxType: \"EmbeddedExample\"\n  }, mdx(\"h1\", {\n    className: \"ds-text-heading--2xl\"\n  }, loremIpsumGenerator('s'))), mdx(\"h3\", {\n    \"id\": \"heading--xl\",\n    \"style\": {\n      \"position\": \"relative\"\n    }\n  }, mdx(\"a\", {\n    parentName: \"h3\",\n    \"href\": \"#heading--xl\",\n    \"aria-label\": \"heading  xl permalink\",\n    \"className\": \"anchor before\"\n  }, mdx(\"svg\", {\n    parentName: \"a\",\n    \"aria-hidden\": \"true\",\n    \"focusable\": \"false\",\n    \"height\": \"16\",\n    \"version\": \"1.1\",\n    \"viewBox\": \"0 0 16 16\",\n    \"width\": \"16\"\n  }, mdx(\"path\", {\n    parentName: \"svg\",\n    \"fillRule\": \"evenodd\",\n    \"d\": \"M4 9h1v1H4c-1.5 0-3-1.69-3-3.5S2.55 3 4 3h4c1.45 0 3 1.69 3 3.5 0 1.41-.91 2.72-2 3.25V8.59c.58-.45 1-1.27 1-2.09C10 5.22 8.98 4 8 4H4c-.98 0-2 1.22-2 2.5S3 9 4 9zm9-3h-1v1h1c1 0 2 1.22 2 2.5S13.98 12 13 12H9c-.98 0-2-1.22-2-2.5 0-.83.42-1.64 1-2.09V6.25c-1.09.53-2 1.84-2 3.25C6 11.31 7.55 13 9 13h4c1.45 0 3-1.69 3-3.5S14.5 6 13 6z\"\n  }))), \"Heading--xl\"), mdx(EmbeddedExample, {\n    mdxType: \"EmbeddedExample\"\n  }, mdx(\"h1\", {\n    className: \"ds-text-heading--xl\"\n  }, loremIpsumGenerator('s'))), mdx(\"h3\", {\n    \"id\": \"heading--lg\",\n    \"style\": {\n      \"position\": \"relative\"\n    }\n  }, mdx(\"a\", {\n    parentName: \"h3\",\n    \"href\": \"#heading--lg\",\n    \"aria-label\": \"heading  lg permalink\",\n    \"className\": \"anchor before\"\n  }, mdx(\"svg\", {\n    parentName: \"a\",\n    \"aria-hidden\": \"true\",\n    \"focusable\": \"false\",\n    \"height\": \"16\",\n    \"version\": \"1.1\",\n    \"viewBox\": \"0 0 16 16\",\n    \"width\": \"16\"\n  }, mdx(\"path\", {\n    parentName: \"svg\",\n    \"fillRule\": \"evenodd\",\n    \"d\": \"M4 9h1v1H4c-1.5 0-3-1.69-3-3.5S2.55 3 4 3h4c1.45 0 3 1.69 3 3.5 0 1.41-.91 2.72-2 3.25V8.59c.58-.45 1-1.27 1-2.09C10 5.22 8.98 4 8 4H4c-.98 0-2 1.22-2 2.5S3 9 4 9zm9-3h-1v1h1c1 0 2 1.22 2 2.5S13.98 12 13 12H9c-.98 0-2-1.22-2-2.5 0-.83.42-1.64 1-2.09V6.25c-1.09.53-2 1.84-2 3.25C6 11.31 7.55 13 9 13h4c1.45 0 3-1.69 3-3.5S14.5 6 13 6z\"\n  }))), \"Heading--lg\"), mdx(EmbeddedExample, {\n    mdxType: \"EmbeddedExample\"\n  }, mdx(\"h1\", {\n    className: \"ds-text-heading--lg\"\n  }, loremIpsumGenerator('s'))), mdx(\"h3\", {\n    \"id\": \"heading--md\",\n    \"style\": {\n      \"position\": \"relative\"\n    }\n  }, mdx(\"a\", {\n    parentName: \"h3\",\n    \"href\": \"#heading--md\",\n    \"aria-label\": \"heading  md permalink\",\n    \"className\": \"anchor before\"\n  }, mdx(\"svg\", {\n    parentName: \"a\",\n    \"aria-hidden\": \"true\",\n    \"focusable\": \"false\",\n    \"height\": \"16\",\n    \"version\": \"1.1\",\n    \"viewBox\": \"0 0 16 16\",\n    \"width\": \"16\"\n  }, mdx(\"path\", {\n    parentName: \"svg\",\n    \"fillRule\": \"evenodd\",\n    \"d\": \"M4 9h1v1H4c-1.5 0-3-1.69-3-3.5S2.55 3 4 3h4c1.45 0 3 1.69 3 3.5 0 1.41-.91 2.72-2 3.25V8.59c.58-.45 1-1.27 1-2.09C10 5.22 8.98 4 8 4H4c-.98 0-2 1.22-2 2.5S3 9 4 9zm9-3h-1v1h1c1 0 2 1.22 2 2.5S13.98 12 13 12H9c-.98 0-2-1.22-2-2.5 0-.83.42-1.64 1-2.09V6.25c-1.09.53-2 1.84-2 3.25C6 11.31 7.55 13 9 13h4c1.45 0 3-1.69 3-3.5S14.5 6 13 6z\"\n  }))), \"Heading--md\"), mdx(EmbeddedExample, {\n    mdxType: \"EmbeddedExample\"\n  }, mdx(\"h1\", {\n    className: \"ds-text-heading--md\"\n  }, loremIpsumGenerator('s'))), mdx(\"h3\", {\n    \"id\": \"heading--sm\",\n    \"style\": {\n      \"position\": \"relative\"\n    }\n  }, mdx(\"a\", {\n    parentName: \"h3\",\n    \"href\": \"#heading--sm\",\n    \"aria-label\": \"heading  sm permalink\",\n    \"className\": \"anchor before\"\n  }, mdx(\"svg\", {\n    parentName: \"a\",\n    \"aria-hidden\": \"true\",\n    \"focusable\": \"false\",\n    \"height\": \"16\",\n    \"version\": \"1.1\",\n    \"viewBox\": \"0 0 16 16\",\n    \"width\": \"16\"\n  }, mdx(\"path\", {\n    parentName: \"svg\",\n    \"fillRule\": \"evenodd\",\n    \"d\": \"M4 9h1v1H4c-1.5 0-3-1.69-3-3.5S2.55 3 4 3h4c1.45 0 3 1.69 3 3.5 0 1.41-.91 2.72-2 3.25V8.59c.58-.45 1-1.27 1-2.09C10 5.22 8.98 4 8 4H4c-.98 0-2 1.22-2 2.5S3 9 4 9zm9-3h-1v1h1c1 0 2 1.22 2 2.5S13.98 12 13 12H9c-.98 0-2-1.22-2-2.5 0-.83.42-1.64 1-2.09V6.25c-1.09.53-2 1.84-2 3.25C6 11.31 7.55 13 9 13h4c1.45 0 3-1.69 3-3.5S14.5 6 13 6z\"\n  }))), \"Heading--sm\"), mdx(EmbeddedExample, {\n    mdxType: \"EmbeddedExample\"\n  }, mdx(\"h1\", {\n    className: \"ds-text-heading--sm\"\n  }, loremIpsumGenerator('s'))), mdx(\"h2\", {\n    \"id\": \"code\",\n    \"style\": {\n      \"position\": \"relative\"\n    }\n  }, mdx(\"a\", {\n    parentName: \"h2\",\n    \"href\": \"#code\",\n    \"aria-label\": \"code permalink\",\n    \"className\": \"anchor before\"\n  }, mdx(\"svg\", {\n    parentName: \"a\",\n    \"aria-hidden\": \"true\",\n    \"focusable\": \"false\",\n    \"height\": \"16\",\n    \"version\": \"1.1\",\n    \"viewBox\": \"0 0 16 16\",\n    \"width\": \"16\"\n  }, mdx(\"path\", {\n    parentName: \"svg\",\n    \"fillRule\": \"evenodd\",\n    \"d\": \"M4 9h1v1H4c-1.5 0-3-1.69-3-3.5S2.55 3 4 3h4c1.45 0 3 1.69 3 3.5 0 1.41-.91 2.72-2 3.25V8.59c.58-.45 1-1.27 1-2.09C10 5.22 8.98 4 8 4H4c-.98 0-2 1.22-2 2.5S3 9 4 9zm9-3h-1v1h1c1 0 2 1.22 2 2.5S13.98 12 13 12H9c-.98 0-2-1.22-2-2.5 0-.83.42-1.64 1-2.09V6.25c-1.09.53-2 1.84-2 3.25C6 11.31 7.55 13 9 13h4c1.45 0 3-1.69 3-3.5S14.5 6 13 6z\"\n  }))), \"Code\"), mdx(\"h3\", {\n    \"id\": \"responsive-typography\",\n    \"style\": {\n      \"position\": \"relative\"\n    }\n  }, mdx(\"a\", {\n    parentName: \"h3\",\n    \"href\": \"#responsive-typography\",\n    \"aria-label\": \"responsive typography permalink\",\n    \"className\": \"anchor before\"\n  }, mdx(\"svg\", {\n    parentName: \"a\",\n    \"aria-hidden\": \"true\",\n    \"focusable\": \"false\",\n    \"height\": \"16\",\n    \"version\": \"1.1\",\n    \"viewBox\": \"0 0 16 16\",\n    \"width\": \"16\"\n  }, mdx(\"path\", {\n    parentName: \"svg\",\n    \"fillRule\": \"evenodd\",\n    \"d\": \"M4 9h1v1H4c-1.5 0-3-1.69-3-3.5S2.55 3 4 3h4c1.45 0 3 1.69 3 3.5 0 1.41-.91 2.72-2 3.25V8.59c.58-.45 1-1.27 1-2.09C10 5.22 8.98 4 8 4H4c-.98 0-2 1.22-2 2.5S3 9 4 9zm9-3h-1v1h1c1 0 2 1.22 2 2.5S13.98 12 13 12H9c-.98 0-2-1.22-2-2.5 0-.83.42-1.64 1-2.09V6.25c-1.09.53-2 1.84-2 3.25C6 11.31 7.55 13 9 13h4c1.45 0 3-1.69 3-3.5S14.5 6 13 6z\"\n  }))), \"Responsive typography\"), mdx(\"p\", null, mdx(\"inlineCode\", {\n    parentName: \"p\"\n  }, \".ds-type-heading-5xl\"), \", \", mdx(\"inlineCode\", {\n    parentName: \"p\"\n  }, \"ds-type-heading-4xl\"), \", and \", mdx(\"inlineCode\", {\n    parentName: \"p\"\n  }, \"ds-type-heading-3xl\"), \" classes are responsive by default.\"), mdx(\"table\", null, mdx(\"thead\", {\n    parentName: \"table\"\n  }, mdx(\"tr\", {\n    parentName: \"thead\"\n  }, mdx(\"th\", {\n    parentName: \"tr\",\n    \"align\": null\n  }, \"Font class\"), mdx(\"th\", {\n    parentName: \"tr\",\n    \"align\": null\n  }, \"545px and below\"), mdx(\"th\", {\n    parentName: \"tr\",\n    \"align\": null\n  }, \"545px to 768px\"), mdx(\"th\", {\n    parentName: \"tr\",\n    \"align\": null\n  }, \"768px and above\"))), mdx(\"tbody\", {\n    parentName: \"table\"\n  }, mdx(\"tr\", {\n    parentName: \"tbody\"\n  }, mdx(\"td\", {\n    parentName: \"tr\",\n    \"align\": null\n  }, mdx(\"inlineCode\", {\n    parentName: \"td\"\n  }, \".ds-type-heading-5xl\")), mdx(\"td\", {\n    parentName: \"tr\",\n    \"align\": null\n  }, \"36px\"), mdx(\"td\", {\n    parentName: \"tr\",\n    \"align\": null\n  }, \"48px\"), mdx(\"td\", {\n    parentName: \"tr\",\n    \"align\": null\n  }, \"60px\")), mdx(\"tr\", {\n    parentName: \"tbody\"\n  }, mdx(\"td\", {\n    parentName: \"tr\",\n    \"align\": null\n  }, mdx(\"inlineCode\", {\n    parentName: \"td\"\n  }, \".ds-type-heading-4xl\")), mdx(\"td\", {\n    parentName: \"tr\",\n    \"align\": null\n  }, \"36px\"), mdx(\"td\", {\n    parentName: \"tr\",\n    \"align\": null\n  }, \"36px\"), mdx(\"td\", {\n    parentName: \"tr\",\n    \"align\": null\n  }, \"48px\")), mdx(\"tr\", {\n    parentName: \"tbody\"\n  }, mdx(\"td\", {\n    parentName: \"tr\",\n    \"align\": null\n  }, mdx(\"inlineCode\", {\n    parentName: \"td\"\n  }, \".ds-type-heading-3xl\")), mdx(\"td\", {\n    parentName: \"tr\",\n    \"align\": null\n  }, \"30px\"), mdx(\"td\", {\n    parentName: \"tr\",\n    \"align\": null\n  }, \"30px\"), mdx(\"td\", {\n    parentName: \"tr\",\n    \"align\": null\n  }, \"36px\")))), mdx(ResponsiveExample, {\n    storyId: \"foundations-typography-headings--responsive-headings\",\n    title: \"Responsive typography example\",\n    mdxType: \"ResponsiveExample\"\n  }), mdx(\"p\", null, \"To apply responsive typography elsewhere, use the \", mdx(\"a\", {\n    parentName: \"p\",\n    \"href\": \"/design-system/branch/pwolfert/blog-article-feedback/utilities/font/font-size/#responsive-font-sizes\"\n  }, \"font size utility class\"), \".\\nSince the base typography margins and line height is measured in \", mdx(\"inlineCode\", {\n    parentName: \"p\"\n  }, \"em\"), \" units,\\nthey'll automatically adjust as you change the font size.\"), mdx(\"h3\", {\n    \"id\": \"styles\",\n    \"style\": {\n      \"position\": \"relative\"\n    }\n  }, mdx(\"a\", {\n    parentName: \"h3\",\n    \"href\": \"#styles\",\n    \"aria-label\": \"styles permalink\",\n    \"className\": \"anchor before\"\n  }, mdx(\"svg\", {\n    parentName: \"a\",\n    \"aria-hidden\": \"true\",\n    \"focusable\": \"false\",\n    \"height\": \"16\",\n    \"version\": \"1.1\",\n    \"viewBox\": \"0 0 16 16\",\n    \"width\": \"16\"\n  }, mdx(\"path\", {\n    parentName: \"svg\",\n    \"fillRule\": \"evenodd\",\n    \"d\": \"M4 9h1v1H4c-1.5 0-3-1.69-3-3.5S2.55 3 4 3h4c1.45 0 3 1.69 3 3.5 0 1.41-.91 2.72-2 3.25V8.59c.58-.45 1-1.27 1-2.09C10 5.22 8.98 4 8 4H4c-.98 0-2 1.22-2 2.5S3 9 4 9zm9-3h-1v1h1c1 0 2 1.22 2 2.5S13.98 12 13 12H9c-.98 0-2-1.22-2-2.5 0-.83.42-1.64 1-2.09V6.25c-1.09.53-2 1.84-2 3.25C6 11.31 7.55 13 9 13h4c1.45 0 3-1.69 3-3.5S14.5 6 13 6z\"\n  }))), \"Styles\"), mdx(\"p\", null, \"The following Sass variables can be overridden to change the type sizes:\"), mdx(\"ul\", null, mdx(\"li\", {\n    parentName: \"ul\"\n  }, mdx(\"inlineCode\", {\n    parentName: \"li\"\n  }, \"$font-size-5xl\")), mdx(\"li\", {\n    parentName: \"ul\"\n  }, mdx(\"inlineCode\", {\n    parentName: \"li\"\n  }, \"$font-size-4xl\")), mdx(\"li\", {\n    parentName: \"ul\"\n  }, mdx(\"inlineCode\", {\n    parentName: \"li\"\n  }, \"$font-size-3xl\")), mdx(\"li\", {\n    parentName: \"ul\"\n  }, mdx(\"inlineCode\", {\n    parentName: \"li\"\n  }, \"$font-size-2xl\")), mdx(\"li\", {\n    parentName: \"ul\"\n  }, mdx(\"inlineCode\", {\n    parentName: \"li\"\n  }, \"$font-size-xl\")), mdx(\"li\", {\n    parentName: \"ul\"\n  }, mdx(\"inlineCode\", {\n    parentName: \"li\"\n  }, \"$font-size-lg\")), mdx(\"li\", {\n    parentName: \"ul\"\n  }, mdx(\"inlineCode\", {\n    parentName: \"li\"\n  }, \"$font-size-md\"), \", uses \", mdx(\"inlineCode\", {\n    parentName: \"li\"\n  }, \"$font-size-base\")), mdx(\"li\", {\n    parentName: \"ul\"\n  }, mdx(\"inlineCode\", {\n    parentName: \"li\"\n  }, \"$font-size-sm\"))), mdx(\"h2\", {\n    \"id\": \"guidance\",\n    \"style\": {\n      \"position\": \"relative\"\n    }\n  }, mdx(\"a\", {\n    parentName: \"h2\",\n    \"href\": \"#guidance\",\n    \"aria-label\": \"guidance permalink\",\n    \"className\": \"anchor before\"\n  }, mdx(\"svg\", {\n    parentName: \"a\",\n    \"aria-hidden\": \"true\",\n    \"focusable\": \"false\",\n    \"height\": \"16\",\n    \"version\": \"1.1\",\n    \"viewBox\": \"0 0 16 16\",\n    \"width\": \"16\"\n  }, mdx(\"path\", {\n    parentName: \"svg\",\n    \"fillRule\": \"evenodd\",\n    \"d\": \"M4 9h1v1H4c-1.5 0-3-1.69-3-3.5S2.55 3 4 3h4c1.45 0 3 1.69 3 3.5 0 1.41-.91 2.72-2 3.25V8.59c.58-.45 1-1.27 1-2.09C10 5.22 8.98 4 8 4H4c-.98 0-2 1.22-2 2.5S3 9 4 9zm9-3h-1v1h1c1 0 2 1.22 2 2.5S13.98 12 13 12H9c-.98 0-2-1.22-2-2.5 0-.83.42-1.64 1-2.09V6.25c-1.09.53-2 1.84-2 3.25C6 11.31 7.55 13 9 13h4c1.45 0 3-1.69 3-3.5S14.5 6 13 6z\"\n  }))), \"Guidance\"), mdx(ThemeContent, {\n    onlyThemes: ['healthcare'],\n    mdxType: \"ThemeContent\"\n  }, mdx(\"h3\", {\n    \"id\": \"layout\",\n    \"style\": {\n      \"position\": \"relative\"\n    }\n  }, mdx(\"a\", {\n    parentName: \"h3\",\n    \"href\": \"#layout\",\n    \"aria-label\": \"layout permalink\",\n    \"className\": \"anchor before\"\n  }, mdx(\"svg\", {\n    parentName: \"a\",\n    \"aria-hidden\": \"true\",\n    \"focusable\": \"false\",\n    \"height\": \"16\",\n    \"version\": \"1.1\",\n    \"viewBox\": \"0 0 16 16\",\n    \"width\": \"16\"\n  }, mdx(\"path\", {\n    parentName: \"svg\",\n    \"fillRule\": \"evenodd\",\n    \"d\": \"M4 9h1v1H4c-1.5 0-3-1.69-3-3.5S2.55 3 4 3h4c1.45 0 3 1.69 3 3.5 0 1.41-.91 2.72-2 3.25V8.59c.58-.45 1-1.27 1-2.09C10 5.22 8.98 4 8 4H4c-.98 0-2 1.22-2 2.5S3 9 4 9zm9-3h-1v1h1c1 0 2 1.22 2 2.5S13.98 12 13 12H9c-.98 0-2-1.22-2-2.5 0-.83.42-1.64 1-2.09V6.25c-1.09.53-2 1.84-2 3.25C6 11.31 7.55 13 9 13h4c1.45 0 3-1.69 3-3.5S14.5 6 13 6z\"\n  }))), \"Layout\"), mdx(\"p\", null, \"There should always be a parent/child relationship between headers and content on the page. Every header should have a relationship to something else on the page. This can apply to many different relationships like a header and a form group or a header and list of links. Stray headers or content should be reevaluated.\"), mdx(\"ul\", null, mdx(\"li\", {\n    parentName: \"ul\"\n  }, \"Paragraph styles should never be used as a parent to another text element.\"), mdx(\"li\", {\n    parentName: \"ul\"\n  }, \"Header elements should never have equal or smaller font size than the paragraph element.\"), mdx(\"li\", {\n    parentName: \"ul\"\n  }, \"Not all paragraphs need a header, but all headers need children.\"), mdx(\"li\", {\n    parentName: \"ul\"\n  }, \"Every page should have one heading 1 (H1)\"), mdx(\"li\", {\n    parentName: \"ul\"\n  }, \"Headings style appearing under H1 should follow a logical order for information design and supporting various assistive technology devices/software.\")), mdx(\"h3\", {\n    \"id\": \"dont\",\n    \"style\": {\n      \"position\": \"relative\"\n    }\n  }, mdx(\"a\", {\n    parentName: \"h3\",\n    \"href\": \"#dont\",\n    \"aria-label\": \"dont permalink\",\n    \"className\": \"anchor before\"\n  }, mdx(\"svg\", {\n    parentName: \"a\",\n    \"aria-hidden\": \"true\",\n    \"focusable\": \"false\",\n    \"height\": \"16\",\n    \"version\": \"1.1\",\n    \"viewBox\": \"0 0 16 16\",\n    \"width\": \"16\"\n  }, mdx(\"path\", {\n    parentName: \"svg\",\n    \"fillRule\": \"evenodd\",\n    \"d\": \"M4 9h1v1H4c-1.5 0-3-1.69-3-3.5S2.55 3 4 3h4c1.45 0 3 1.69 3 3.5 0 1.41-.91 2.72-2 3.25V8.59c.58-.45 1-1.27 1-2.09C10 5.22 8.98 4 8 4H4c-.98 0-2 1.22-2 2.5S3 9 4 9zm9-3h-1v1h1c1 0 2 1.22 2 2.5S13.98 12 13 12H9c-.98 0-2-1.22-2-2.5 0-.83.42-1.64 1-2.09V6.25c-1.09.53-2 1.84-2 3.25C6 11.31 7.55 13 9 13h4c1.45 0 3-1.69 3-3.5S14.5 6 13 6z\"\n  }))), \"Don't\"), mdx(\"ul\", null, mdx(\"li\", {\n    parentName: \"ul\"\n  }, \"Don't use a smaller header font size than the body font size\"), mdx(\"li\", {\n    parentName: \"ul\"\n  }, \"Don't use stray headers\"))), mdx(ThemeContent, {\n    onlyThemes: ['medicare'],\n    mdxType: \"ThemeContent\"\n  }, mdx(\"h3\", {\n    \"id\": \"mobile\",\n    \"style\": {\n      \"position\": \"relative\"\n    }\n  }, mdx(\"a\", {\n    parentName: \"h3\",\n    \"href\": \"#mobile\",\n    \"aria-label\": \"mobile permalink\",\n    \"className\": \"anchor before\"\n  }, mdx(\"svg\", {\n    parentName: \"a\",\n    \"aria-hidden\": \"true\",\n    \"focusable\": \"false\",\n    \"height\": \"16\",\n    \"version\": \"1.1\",\n    \"viewBox\": \"0 0 16 16\",\n    \"width\": \"16\"\n  }, mdx(\"path\", {\n    parentName: \"svg\",\n    \"fillRule\": \"evenodd\",\n    \"d\": \"M4 9h1v1H4c-1.5 0-3-1.69-3-3.5S2.55 3 4 3h4c1.45 0 3 1.69 3 3.5 0 1.41-.91 2.72-2 3.25V8.59c.58-.45 1-1.27 1-2.09C10 5.22 8.98 4 8 4H4c-.98 0-2 1.22-2 2.5S3 9 4 9zm9-3h-1v1h1c1 0 2 1.22 2 2.5S13.98 12 13 12H9c-.98 0-2-1.22-2-2.5 0-.83.42-1.64 1-2.09V6.25c-1.09.53-2 1.84-2 3.25C6 11.31 7.55 13 9 13h4c1.45 0 3-1.69 3-3.5S14.5 6 13 6z\"\n  }))), \"Mobile\"), mdx(\"p\", null, \"Header sizes should be reduced on mobile screen sizes. Header sizes can be reduced depending on the designers discretion but you can generally use this guide for reducing your header sizes. \"), mdx(\"ul\", null, mdx(\"li\", {\n    parentName: \"ul\"\n  }, \"3xLarge to 2xLarge - Down 2 sizes\"), mdx(\"li\", {\n    parentName: \"ul\"\n  }, \"Xlarge to Large - Down 1 size\"), mdx(\"li\", {\n    parentName: \"ul\"\n  }, \"Medium to Small - No change in size\")), mdx(\"h2\", {\n    \"id\": \"typography-spacing\",\n    \"style\": {\n      \"position\": \"relative\"\n    }\n  }, mdx(\"a\", {\n    parentName: \"h2\",\n    \"href\": \"#typography-spacing\",\n    \"aria-label\": \"typography spacing permalink\",\n    \"className\": \"anchor before\"\n  }, mdx(\"svg\", {\n    parentName: \"a\",\n    \"aria-hidden\": \"true\",\n    \"focusable\": \"false\",\n    \"height\": \"16\",\n    \"version\": \"1.1\",\n    \"viewBox\": \"0 0 16 16\",\n    \"width\": \"16\"\n  }, mdx(\"path\", {\n    parentName: \"svg\",\n    \"fillRule\": \"evenodd\",\n    \"d\": \"M4 9h1v1H4c-1.5 0-3-1.69-3-3.5S2.55 3 4 3h4c1.45 0 3 1.69 3 3.5 0 1.41-.91 2.72-2 3.25V8.59c.58-.45 1-1.27 1-2.09C10 5.22 8.98 4 8 4H4c-.98 0-2 1.22-2 2.5S3 9 4 9zm9-3h-1v1h1c1 0 2 1.22 2 2.5S13.98 12 13 12H9c-.98 0-2-1.22-2-2.5 0-.83.42-1.64 1-2.09V6.25c-1.09.53-2 1.84-2 3.25C6 11.31 7.55 13 9 13h4c1.45 0 3-1.69 3-3.5S14.5 6 13 6z\"\n  }))), \"Typography Spacing\"), mdx(\"p\", null, \"Spacing between text elements can make an impact on the overall design and having a consistent spacing between elements improves the flow of a page and improves consistency between products.\"), mdx(\"p\", null, \"Here are some spacing elements that can help create guides for spacing between elements. \"), mdx(\"h3\", {\n    \"id\": \"how-to-use-spacers\",\n    \"style\": {\n      \"position\": \"relative\"\n    }\n  }, mdx(\"a\", {\n    parentName: \"h3\",\n    \"href\": \"#how-to-use-spacers\",\n    \"aria-label\": \"how to use spacers permalink\",\n    \"className\": \"anchor before\"\n  }, mdx(\"svg\", {\n    parentName: \"a\",\n    \"aria-hidden\": \"true\",\n    \"focusable\": \"false\",\n    \"height\": \"16\",\n    \"version\": \"1.1\",\n    \"viewBox\": \"0 0 16 16\",\n    \"width\": \"16\"\n  }, mdx(\"path\", {\n    parentName: \"svg\",\n    \"fillRule\": \"evenodd\",\n    \"d\": \"M4 9h1v1H4c-1.5 0-3-1.69-3-3.5S2.55 3 4 3h4c1.45 0 3 1.69 3 3.5 0 1.41-.91 2.72-2 3.25V8.59c.58-.45 1-1.27 1-2.09C10 5.22 8.98 4 8 4H4c-.98 0-2 1.22-2 2.5S3 9 4 9zm9-3h-1v1h1c1 0 2 1.22 2 2.5S13.98 12 13 12H9c-.98 0-2-1.22-2-2.5 0-.83.42-1.64 1-2.09V6.25c-1.09.53-2 1.84-2 3.25C6 11.31 7.55 13 9 13h4c1.45 0 3-1.69 3-3.5S14.5 6 13 6z\"\n  }))), \"How to use spacers\"), mdx(\"ul\", null, mdx(\"li\", {\n    parentName: \"ul\"\n  }, \"Use spacers that correspond to the header being applied. If you use a \", mdx(\"inlineCode\", {\n    parentName: \"li\"\n  }, \"heading--lg\"), \" header, apply a \", mdx(\"inlineCode\", {\n    parentName: \"li\"\n  }, \"$spacer-5\"), \" spacer to the body content below the header. \"), mdx(\"li\", {\n    parentName: \"ul\"\n  }, \"When it comes to content relationships. Header sizes should be of equal or smaller size to the body content.\")), mdx(\"table\", null, mdx(\"thead\", {\n    parentName: \"table\"\n  }, mdx(\"tr\", {\n    parentName: \"thead\"\n  }, mdx(\"th\", {\n    parentName: \"tr\",\n    \"align\": null\n  }, \"Header size\"), mdx(\"th\", {\n    parentName: \"tr\",\n    \"align\": null\n  }, \"Variable\"), mdx(\"th\", {\n    parentName: \"tr\",\n    \"align\": null\n  }, \"Value\"), mdx(\"th\", {\n    parentName: \"tr\",\n    \"align\": null\n  }, \"Example\"))), mdx(\"tbody\", {\n    parentName: \"table\"\n  }, mdx(\"tr\", {\n    parentName: \"tbody\"\n  }, mdx(\"td\", {\n    parentName: \"tr\",\n    \"align\": null\n  }, \"Heading--sm\"), mdx(\"td\", {\n    parentName: \"tr\",\n    \"align\": null\n  }, \"$spacer-3\"), mdx(\"td\", {\n    parentName: \"tr\",\n    \"align\": null\n  }, \"24px\"), mdx(\"td\", {\n    parentName: \"tr\",\n    \"align\": null\n  }, mdx(\"div\", {\n    className: \"ds-u-fill--secondary example-spacer-3\"\n  }))), mdx(\"tr\", {\n    parentName: \"tbody\"\n  }, mdx(\"td\", {\n    parentName: \"tr\",\n    \"align\": null\n  }, \"Heading--md\"), mdx(\"td\", {\n    parentName: \"tr\",\n    \"align\": null\n  }, \"$spacer-4\"), mdx(\"td\", {\n    parentName: \"tr\",\n    \"align\": null\n  }, \"32px\"), mdx(\"td\", {\n    parentName: \"tr\",\n    \"align\": null\n  }, mdx(\"div\", {\n    className: \"ds-u-fill--secondary example-spacer-4\"\n  }))), mdx(\"tr\", {\n    parentName: \"tbody\"\n  }, mdx(\"td\", {\n    parentName: \"tr\",\n    \"align\": null\n  }, \"Heading--lg\"), mdx(\"td\", {\n    parentName: \"tr\",\n    \"align\": null\n  }, \"$spacer-5\"), mdx(\"td\", {\n    parentName: \"tr\",\n    \"align\": null\n  }, \"40px\"), mdx(\"td\", {\n    parentName: \"tr\",\n    \"align\": null\n  }, mdx(\"div\", {\n    className: \"ds-u-fill--secondary example-spacer-5\"\n  }))), mdx(\"tr\", {\n    parentName: \"tbody\"\n  }, mdx(\"td\", {\n    parentName: \"tr\",\n    \"align\": null\n  }, \"Heading--xl\"), mdx(\"td\", {\n    parentName: \"tr\",\n    \"align\": null\n  }, \"$spacer-6\"), mdx(\"td\", {\n    parentName: \"tr\",\n    \"align\": null\n  }, \"48px\"), mdx(\"td\", {\n    parentName: \"tr\",\n    \"align\": null\n  }, mdx(\"div\", {\n    className: \"ds-u-fill--secondary example-spacer-6\"\n  }))), mdx(\"tr\", {\n    parentName: \"tbody\"\n  }, mdx(\"td\", {\n    parentName: \"tr\",\n    \"align\": null\n  }, \"Heading--2xl\"), mdx(\"td\", {\n    parentName: \"tr\",\n    \"align\": null\n  }, \"$spacer-7\"), mdx(\"td\", {\n    parentName: \"tr\",\n    \"align\": null\n  }, \"56px\"), mdx(\"td\", {\n    parentName: \"tr\",\n    \"align\": null\n  }, mdx(\"div\", {\n    className: \"ds-u-fill--secondary example-spacer-7\"\n  }))), mdx(\"tr\", {\n    parentName: \"tbody\"\n  }, mdx(\"td\", {\n    parentName: \"tr\",\n    \"align\": null\n  }, \"Heading--3xl\"), mdx(\"td\", {\n    parentName: \"tr\",\n    \"align\": null\n  }, \"No variable\"), mdx(\"td\", {\n    parentName: \"tr\",\n    \"align\": null\n  }, \"72px\"), mdx(\"td\", {\n    parentName: \"tr\",\n    \"align\": null\n  })))), mdx(\"h3\", {\n    \"id\": \"spacing-example\",\n    \"style\": {\n      \"position\": \"relative\"\n    }\n  }, mdx(\"a\", {\n    parentName: \"h3\",\n    \"href\": \"#spacing-example\",\n    \"aria-label\": \"spacing example permalink\",\n    \"className\": \"anchor before\"\n  }, mdx(\"svg\", {\n    parentName: \"a\",\n    \"aria-hidden\": \"true\",\n    \"focusable\": \"false\",\n    \"height\": \"16\",\n    \"version\": \"1.1\",\n    \"viewBox\": \"0 0 16 16\",\n    \"width\": \"16\"\n  }, mdx(\"path\", {\n    parentName: \"svg\",\n    \"fillRule\": \"evenodd\",\n    \"d\": \"M4 9h1v1H4c-1.5 0-3-1.69-3-3.5S2.55 3 4 3h4c1.45 0 3 1.69 3 3.5 0 1.41-.91 2.72-2 3.25V8.59c.58-.45 1-1.27 1-2.09C10 5.22 8.98 4 8 4H4c-.98 0-2 1.22-2 2.5S3 9 4 9zm9-3h-1v1h1c1 0 2 1.22 2 2.5S13.98 12 13 12H9c-.98 0-2-1.22-2-2.5 0-.83.42-1.64 1-2.09V6.25c-1.09.53-2 1.84-2 3.25C6 11.31 7.55 13 9 13h4c1.45 0 3-1.69 3-3.5S14.5 6 13 6z\"\n  }))), \"Spacing example\"), mdx(EmbeddedExample, {\n    mdxType: \"EmbeddedExample\"\n  }, mdx(\"h1\", {\n    className: \"ds-text-heading--2xl ds-h1\"\n  }, \"Heading--2xl\"), mdx(\"div\", {\n    className: \"utility-example example-spacer-7 ds-u-display--flex ds-u-align-items--center ds-u-justify-content--center\"\n  }, \"$spacer-7\"), mdx(\"p\", {\n    className: \"ds-text-body--md\"\n  }, loremIpsumGenerator('l')), mdx(\"h1\", {\n    className: \"ds-text-heading--lg ds-h1\"\n  }, \"Heading--lg\"), mdx(\"div\", {\n    className: \"utility-example example-spacer-5 ds-u-display--flex ds-u-align-items--center ds-u-justify-content--center\"\n  }, \"$spacer-5\"), mdx(\"p\", {\n    className: \"ds-text-body--md\"\n  }, loremIpsumGenerator('l')))), mdx(ThemeContent, {\n    onlyThemes: ['healthcare'],\n    mdxType: \"ThemeContent\"\n  }, \"- The default size for body content is 16px. - The Rubrik font is used for body content. - The Montserrat font is used for headers, some menu components, and the big button (Landing). - The smallest paragraph text for legibility to the Medicare audience should not be smaller than 16 px (except for legal/caption text). - Uppercase font should not be used (exception for form elements).\"), mdx(ThemeContent, {\n    onlyThemes: ['medicare'],\n    mdxType: \"ThemeContent\"\n  }, mdx(\"h3\", {\n    \"id\": \"header-styles\",\n    \"style\": {\n      \"position\": \"relative\"\n    }\n  }, mdx(\"a\", {\n    parentName: \"h3\",\n    \"href\": \"#header-styles\",\n    \"aria-label\": \"header styles permalink\",\n    \"className\": \"anchor before\"\n  }, mdx(\"svg\", {\n    parentName: \"a\",\n    \"aria-hidden\": \"true\",\n    \"focusable\": \"false\",\n    \"height\": \"16\",\n    \"version\": \"1.1\",\n    \"viewBox\": \"0 0 16 16\",\n    \"width\": \"16\"\n  }, mdx(\"path\", {\n    parentName: \"svg\",\n    \"fillRule\": \"evenodd\",\n    \"d\": \"M4 9h1v1H4c-1.5 0-3-1.69-3-3.5S2.55 3 4 3h4c1.45 0 3 1.69 3 3.5 0 1.41-.91 2.72-2 3.25V8.59c.58-.45 1-1.27 1-2.09C10 5.22 8.98 4 8 4H4c-.98 0-2 1.22-2 2.5S3 9 4 9zm9-3h-1v1h1c1 0 2 1.22 2 2.5S13.98 12 13 12H9c-.98 0-2-1.22-2-2.5 0-.83.42-1.64 1-2.09V6.25c-1.09.53-2 1.84-2 3.25C6 11.31 7.55 13 9 13h4c1.45 0 3-1.69 3-3.5S14.5 6 13 6z\"\n  }))), \"Header styles\"), mdx(\"p\", null, \"There are five header styles that can be used:\"), mdx(EmbeddedExample, {\n    mdxType: \"EmbeddedExample\"\n  }, mdx(\"h3\", {\n    className: \"ds-text-heading--lg\"\n  }, \"1. Default header\"), mdx(\"p\", null, \"This is the header style that would be used in most cases\"), mdx(\"h3\", {\n    className: \"ds-text-heading--lg\"\n  }, \"2. Teal header\"), mdx(\"p\", null, \"Only used for landing pages and marketing material to apply emphasis to words within a header. \"), mdx(\"h3\", {\n    className: \"ds-text-heading--lg\"\n  }, mdx(\"a\", {\n    href: \"javascript:void(0);\"\n  }, \"3. Link header\")), mdx(\"p\", null, \"Used when you need to have a header as a link\"), mdx(\"div\", {\n    className: \"ds-base--inverse ds-u-padding--2\"\n  }, mdx(\"h3\", {\n    className: \"ds-text-heading--lg\"\n  }, \"4. Header on dark backgrounds\"), mdx(\"p\", null, \"Used on dark backgrounds only\"), mdx(\"h3\", {\n    className: \"ds-text-heading--lg\"\n  }, mdx(\"a\", {\n    href: \"javascript:void(0);\"\n  }, \"5. Header link on dark backgrounds\")), mdx(\"p\", null, \"Used for header links on dark backgrounds.\"))), mdx(\"h3\", {\n    \"id\": \"eyebroweyelash-header\",\n    \"style\": {\n      \"position\": \"relative\"\n    }\n  }, mdx(\"a\", {\n    parentName: \"h3\",\n    \"href\": \"#eyebroweyelash-header\",\n    \"aria-label\": \"eyebroweyelash header permalink\",\n    \"className\": \"anchor before\"\n  }, mdx(\"svg\", {\n    parentName: \"a\",\n    \"aria-hidden\": \"true\",\n    \"focusable\": \"false\",\n    \"height\": \"16\",\n    \"version\": \"1.1\",\n    \"viewBox\": \"0 0 16 16\",\n    \"width\": \"16\"\n  }, mdx(\"path\", {\n    parentName: \"svg\",\n    \"fillRule\": \"evenodd\",\n    \"d\": \"M4 9h1v1H4c-1.5 0-3-1.69-3-3.5S2.55 3 4 3h4c1.45 0 3 1.69 3 3.5 0 1.41-.91 2.72-2 3.25V8.59c.58-.45 1-1.27 1-2.09C10 5.22 8.98 4 8 4H4c-.98 0-2 1.22-2 2.5S3 9 4 9zm9-3h-1v1h1c1 0 2 1.22 2 2.5S13.98 12 13 12H9c-.98 0-2-1.22-2-2.5 0-.83.42-1.64 1-2.09V6.25c-1.09.53-2 1.84-2 3.25C6 11.31 7.55 13 9 13h4c1.45 0 3-1.69 3-3.5S14.5 6 13 6z\"\n  }))), \"Eyebrow/Eyelash header\"), mdx(\"p\", null, \"In some cases it is better to group header elements into a header component. This can be referred to the Eyelash/Eyebrow header where you have a main header and an optional top header (eyebrow) and bottom header (eyelash) header. \"), mdx(\"p\", null, \"You can find this symbol on the components page\"), mdx(\"p\", null, \"This is an optional header design and not required to be used. If you do choose to use this header design then the header elements should go in order. \"), mdx(\"ol\", null, mdx(\"li\", {\n    parentName: \"ol\"\n  }, \"Main header\"), mdx(\"li\", {\n    parentName: \"ol\"\n  }, \"Eyebrow header\"), mdx(\"li\", {\n    parentName: \"ol\"\n  }, \"Eyelash header\")), mdx(\"div\", {\n    className: \"ds-u-border--1 ds-u-padding--2\"\n  }, mdx(\"code\", null, \".ds-text-heading--md .ds-u-margin-bottom--0\"), mdx(\"br\", null), mdx(\"code\", null, \".ds-text-heading--3xl .ds-u-margin--0\"), mdx(\"br\", null), mdx(\"code\", null, \".ds-text-body--md .ds-u-margin-top--0\"), mdx(\"h3\", {\n    className: \"ds-text-heading--md ds-u-margin-bottom--0\"\n  }, \"Eyebrow header\"), mdx(\"h1\", {\n    className: \"ds-text-heading--3xl ds-u-margin--0\"\n  }, \"Main header\"), mdx(\"p\", {\n    className: \"ds-text-body--md ds-u-margin-top--0\"\n  }, \"Eyelash header\"))));\n}\n;\nMDXContent.isMDXComponent = true;","tableOfContents":{"items":[{"url":"#examples","title":"Examples","items":[{"url":"#heading--5xl","title":"Heading--5xl"},{"url":"#heading--4xl","title":"Heading--4xl"},{"url":"#heading--3xl","title":"Heading--3xl"},{"url":"#heading--2xl","title":"Heading--2xl"},{"url":"#heading--xl","title":"Heading--xl"},{"url":"#heading--lg","title":"Heading--lg"},{"url":"#heading--md","title":"Heading--md"},{"url":"#heading--sm","title":"Heading--sm"}]},{"url":"#code","title":"Code","items":[{"url":"#responsive-typography","title":"Responsive typography"},{"url":"#styles","title":"Styles"}]},{"url":"#guidance","title":"Guidance","items":[{"url":"#layout","title":"Layout"},{"url":"#dont","title":"Don't"},{"url":"#mobile","title":"Mobile"}]},{"url":"#typography-spacing","title":"Typography Spacing","items":[{"url":"#how-to-use-spacers","title":"How to use spacers"},{"url":"#spacing-example","title":"Spacing example"},{"url":"#header-styles","title":"Header styles"},{"url":"#eyebroweyelash-header","title":"Eyebrow/Eyelash header"}]}]}}},"pageContext":{"id":"8e04408d-b4b9-55b2-83e9-dd2174c9f388"}},
    "staticQueryHashes": ["1050346478","3481578012"]}