{"componentChunkName":"component---src-components-page-templates-info-page-tsx","path":"/components/alert/","result":{"data":{"mdx":{"id":"c3d9140d-92fd-55a7-8324-7a1afed3d6a3","frontmatter":{"title":"Alert","intro":"Alerts give feedback to users, provide critical information, and/or offer key supplementary details about a task.","core":{"githubLink":"design-system/src/components/Alert","sketchLink":"9P3rvwn","storybookLink":"components-alert--docs"},"healthcare":{"sketchLink":"nRKbw3z","storybookLink":null,"githubLink":null},"medicare":{"sketchLink":"1K9gg0y","storybookLink":null,"githubLink":null}},"slug":"components/alert","body":"const _excluded = [\"components\"];\nfunction _extends() { _extends = Object.assign ? Object.assign.bind() : function (target) { for (var i = 1; i < arguments.length; i++) { var source = arguments[i]; for (var key in source) { if (Object.prototype.hasOwnProperty.call(source, key)) { target[key] = source[key]; } } } return target; }; return _extends.apply(this, arguments); }\nfunction _objectWithoutProperties(source, excluded) { if (source == null) return {}; var target = _objectWithoutPropertiesLoose(source, excluded); var key, i; if (Object.getOwnPropertySymbols) { var sourceSymbolKeys = Object.getOwnPropertySymbols(source); for (i = 0; i < sourceSymbolKeys.length; i++) { key = sourceSymbolKeys[i]; if (excluded.indexOf(key) >= 0) continue; if (!Object.prototype.propertyIsEnumerable.call(source, key)) continue; target[key] = source[key]; } } return target; }\nfunction _objectWithoutPropertiesLoose(source, excluded) { if (source == null) return {}; var target = {}; var sourceKeys = Object.keys(source); var key, i; for (i = 0; i < sourceKeys.length; i++) { key = sourceKeys[i]; if (excluded.indexOf(key) >= 0) continue; target[key] = source[key]; } return target; }\n/* @jsxRuntime classic */\n/* @jsx mdx */\n\nconst _frontmatter = {\n  \"title\": \"Alert\",\n  \"intro\": \"Alerts give feedback to users, provide critical information, and/or offer key supplementary details about a task.\",\n  \"core\": {\n    \"githubLink\": \"design-system/src/components/Alert\",\n    \"sketchLink\": \"9P3rvwn\",\n    \"storybookLink\": \"components-alert--docs\"\n  },\n  \"healthcare\": {\n    \"sketchLink\": \"nRKbw3z\"\n  },\n  \"medicare\": {\n    \"sketchLink\": \"1K9gg0y\"\n  }\n};\nconst makeShortcode = name => function MDXDefaultShortcode(props) {\n  console.warn(\"Component \" + name + \" was not imported, exported, or provided by MDXProvider as global scope\");\n  return mdx(\"div\", props);\n};\nconst ThemeContent = makeShortcode(\"ThemeContent\");\nconst StorybookExample = makeShortcode(\"StorybookExample\");\nconst MaturityChecklist = makeShortcode(\"MaturityChecklist\");\nconst SeeStorybookForGuidance = makeShortcode(\"SeeStorybookForGuidance\");\nconst ComponentThemeOptions = makeShortcode(\"ComponentThemeOptions\");\nconst layoutProps = {\n  _frontmatter\n};\nconst MDXLayout = \"wrapper\";\nreturn function MDXContent(_ref) {\n  let {\n      components\n    } = _ref,\n    props = _objectWithoutProperties(_ref, _excluded);\n  return mdx(MDXLayout, _extends({}, layoutProps, props, {\n    components: components,\n    mdxType: \"MDXLayout\"\n  }), mdx(\"h2\", {\n    \"id\": \"examples\",\n    \"style\": {\n      \"position\": \"relative\"\n    }\n  }, mdx(\"a\", {\n    parentName: \"h2\",\n    \"href\": \"#examples\",\n    \"aria-label\": \"examples permalink\",\n    \"className\": \"anchor before\"\n  }, mdx(\"svg\", {\n    parentName: \"a\",\n    \"aria-hidden\": \"true\",\n    \"focusable\": \"false\",\n    \"height\": \"16\",\n    \"version\": \"1.1\",\n    \"viewBox\": \"0 0 16 16\",\n    \"width\": \"16\"\n  }, mdx(\"path\", {\n    parentName: \"svg\",\n    \"fillRule\": \"evenodd\",\n    \"d\": \"M4 9h1v1H4c-1.5 0-3-1.69-3-3.5S2.55 3 4 3h4c1.45 0 3 1.69 3 3.5 0 1.41-.91 2.72-2 3.25V8.59c.58-.45 1-1.27 1-2.09C10 5.22 8.98 4 8 4H4c-.98 0-2 1.22-2 2.5S3 9 4 9zm9-3h-1v1h1c1 0 2 1.22 2 2.5S13.98 12 13 12H9c-.98 0-2-1.22-2-2.5 0-.83.42-1.64 1-2.09V6.25c-1.09.53-2 1.84-2 3.25C6 11.31 7.55 13 9 13h4c1.45 0 3-1.69 3-3.5S14.5 6 13 6z\"\n  }))), `Examples`), mdx(\"h3\", {\n    \"id\": \"informational-default\",\n    \"style\": {\n      \"position\": \"relative\"\n    }\n  }, mdx(\"a\", {\n    parentName: \"h3\",\n    \"href\": \"#informational-default\",\n    \"aria-label\": \"informational default permalink\",\n    \"className\": \"anchor before\"\n  }, mdx(\"svg\", {\n    parentName: \"a\",\n    \"aria-hidden\": \"true\",\n    \"focusable\": \"false\",\n    \"height\": \"16\",\n    \"version\": \"1.1\",\n    \"viewBox\": \"0 0 16 16\",\n    \"width\": \"16\"\n  }, mdx(\"path\", {\n    parentName: \"svg\",\n    \"fillRule\": \"evenodd\",\n    \"d\": \"M4 9h1v1H4c-1.5 0-3-1.69-3-3.5S2.55 3 4 3h4c1.45 0 3 1.69 3 3.5 0 1.41-.91 2.72-2 3.25V8.59c.58-.45 1-1.27 1-2.09C10 5.22 8.98 4 8 4H4c-.98 0-2 1.22-2 2.5S3 9 4 9zm9-3h-1v1h1c1 0 2 1.22 2 2.5S13.98 12 13 12H9c-.98 0-2-1.22-2-2.5 0-.83.42-1.64 1-2.09V6.25c-1.09.53-2 1.84-2 3.25C6 11.31 7.55 13 9 13h4c1.45 0 3-1.69 3-3.5S14.5 6 13 6z\"\n  }))), `Informational (Default)`), mdx(ThemeContent, {\n    onlyThemes: ['healthcare'],\n    mdxType: \"ThemeContent\"\n  }, mdx(\"p\", null, `Provides supplementary information, or highlights a tool or step available to the user, that may be helpful to users regarding their current action or task, but is optional or not critical. Can provide guidance on what the user needs to do to proceed. Provides additional information, such as definitions, explanations, or criteria, that the user may find helpful as they answer questions with unfamiliar terminology or policy considerations.`)), mdx(ThemeContent, {\n    onlyThemes: ['medicare'],\n    mdxType: \"ThemeContent\"\n  }, mdx(\"p\", null, `Does not require an icon.`), mdx(\"p\", null, `Provides supplementary information, or highlights a tool or step available to the user, that may be helpful to users regarding their current action or task, but is optional or not critical. Can provide guidance on what the user needs to do to proceed.`)), mdx(StorybookExample, {\n    componentName: \"alert\",\n    storyId: \"components-alert--default\",\n    mdxType: \"StorybookExample\"\n  }), mdx(\"h3\", {\n    \"id\": \"error\",\n    \"style\": {\n      \"position\": \"relative\"\n    }\n  }, mdx(\"a\", {\n    parentName: \"h3\",\n    \"href\": \"#error\",\n    \"aria-label\": \"error permalink\",\n    \"className\": \"anchor before\"\n  }, mdx(\"svg\", {\n    parentName: \"a\",\n    \"aria-hidden\": \"true\",\n    \"focusable\": \"false\",\n    \"height\": \"16\",\n    \"version\": \"1.1\",\n    \"viewBox\": \"0 0 16 16\",\n    \"width\": \"16\"\n  }, mdx(\"path\", {\n    parentName: \"svg\",\n    \"fillRule\": \"evenodd\",\n    \"d\": \"M4 9h1v1H4c-1.5 0-3-1.69-3-3.5S2.55 3 4 3h4c1.45 0 3 1.69 3 3.5 0 1.41-.91 2.72-2 3.25V8.59c.58-.45 1-1.27 1-2.09C10 5.22 8.98 4 8 4H4c-.98 0-2 1.22-2 2.5S3 9 4 9zm9-3h-1v1h1c1 0 2 1.22 2 2.5S13.98 12 13 12H9c-.98 0-2-1.22-2-2.5 0-.83.42-1.64 1-2.09V6.25c-1.09.53-2 1.84-2 3.25C6 11.31 7.55 13 9 13h4c1.45 0 3-1.69 3-3.5S14.5 6 13 6z\"\n  }))), `Error`), mdx(ThemeContent, {\n    onlyThemes: ['healthcare'],\n    mdxType: \"ThemeContent\"\n  }, mdx(\"p\", null, `Informs users of an error or critical failure. Often used to block them from proceeding until they resolve the issue including system alerts.`)), mdx(ThemeContent, {\n    onlyThemes: ['medicare'],\n    mdxType: \"ThemeContent\"\n  }, mdx(\"p\", null, `Requires an icon.`), mdx(\"p\", null, `Informs users of an error or critical failure. Often used to block them from proceeding until they resolve the issue including system alerts.`)), mdx(StorybookExample, {\n    componentName: \"error alert\",\n    storyId: \"components-alert--error\",\n    mdxType: \"StorybookExample\"\n  }), mdx(\"h3\", {\n    \"id\": \"warning\",\n    \"style\": {\n      \"position\": \"relative\"\n    }\n  }, mdx(\"a\", {\n    parentName: \"h3\",\n    \"href\": \"#warning\",\n    \"aria-label\": \"warning permalink\",\n    \"className\": \"anchor before\"\n  }, mdx(\"svg\", {\n    parentName: \"a\",\n    \"aria-hidden\": \"true\",\n    \"focusable\": \"false\",\n    \"height\": \"16\",\n    \"version\": \"1.1\",\n    \"viewBox\": \"0 0 16 16\",\n    \"width\": \"16\"\n  }, mdx(\"path\", {\n    parentName: \"svg\",\n    \"fillRule\": \"evenodd\",\n    \"d\": \"M4 9h1v1H4c-1.5 0-3-1.69-3-3.5S2.55 3 4 3h4c1.45 0 3 1.69 3 3.5 0 1.41-.91 2.72-2 3.25V8.59c.58-.45 1-1.27 1-2.09C10 5.22 8.98 4 8 4H4c-.98 0-2 1.22-2 2.5S3 9 4 9zm9-3h-1v1h1c1 0 2 1.22 2 2.5S13.98 12 13 12H9c-.98 0-2-1.22-2-2.5 0-.83.42-1.64 1-2.09V6.25c-1.09.53-2 1.84-2 3.25C6 11.31 7.55 13 9 13h4c1.45 0 3-1.69 3-3.5S14.5 6 13 6z\"\n  }))), `Warning`), mdx(ThemeContent, {\n    onlyThemes: ['healthcare'],\n    mdxType: \"ThemeContent\"\n  }, mdx(\"p\", null, `Informs users that their entry or selection may have unexpected or undesirable results, some of which may not be easily undone. Highlights information a user should be aware of in order to help them avoid taking an action that is likely to result in a negative outcome or understand when content/data is missing from the page.`)), mdx(ThemeContent, {\n    onlyThemes: ['medicare'],\n    mdxType: \"ThemeContent\"\n  }, mdx(\"p\", null, `Requires an icon.`), mdx(\"p\", null, `Informs users that their entry or selection may have unexpected or undesirable results, some of which may not be easily undone.`)), mdx(StorybookExample, {\n    componentName: \"warning alert\",\n    storyId: \"components-alert--warning\",\n    mdxType: \"StorybookExample\"\n  }), mdx(\"h3\", {\n    \"id\": \"success\",\n    \"style\": {\n      \"position\": \"relative\"\n    }\n  }, mdx(\"a\", {\n    parentName: \"h3\",\n    \"href\": \"#success\",\n    \"aria-label\": \"success permalink\",\n    \"className\": \"anchor before\"\n  }, mdx(\"svg\", {\n    parentName: \"a\",\n    \"aria-hidden\": \"true\",\n    \"focusable\": \"false\",\n    \"height\": \"16\",\n    \"version\": \"1.1\",\n    \"viewBox\": \"0 0 16 16\",\n    \"width\": \"16\"\n  }, mdx(\"path\", {\n    parentName: \"svg\",\n    \"fillRule\": \"evenodd\",\n    \"d\": \"M4 9h1v1H4c-1.5 0-3-1.69-3-3.5S2.55 3 4 3h4c1.45 0 3 1.69 3 3.5 0 1.41-.91 2.72-2 3.25V8.59c.58-.45 1-1.27 1-2.09C10 5.22 8.98 4 8 4H4c-.98 0-2 1.22-2 2.5S3 9 4 9zm9-3h-1v1h1c1 0 2 1.22 2 2.5S13.98 12 13 12H9c-.98 0-2-1.22-2-2.5 0-.83.42-1.64 1-2.09V6.25c-1.09.53-2 1.84-2 3.25C6 11.31 7.55 13 9 13h4c1.45 0 3-1.69 3-3.5S14.5 6 13 6z\"\n  }))), `Success`), mdx(ThemeContent, {\n    onlyThemes: ['healthcare'],\n    mdxType: \"ThemeContent\"\n  }, mdx(\"p\", null, `Confirms the successful completion of a step or task, or receipt of information provided by the user. Suggests a path forward that may be beneficial to the user, based on their selections or entries.`)), mdx(ThemeContent, {\n    onlyThemes: ['medicare'],\n    mdxType: \"ThemeContent\"\n  }, mdx(\"p\", null, `Does not require an icon.`), mdx(\"p\", null, `Confirms the successful completion of a step or task, or receipt of information provided by the user.`)), mdx(StorybookExample, {\n    componentName: \"success alert\",\n    storyId: \"components-alert--success\",\n    mdxType: \"StorybookExample\"\n  }), mdx(ThemeContent, {\n    onlyThemes: ['medicare'],\n    mdxType: \"ThemeContent\"\n  }, mdx(\"h3\", {\n    \"id\": \"note\",\n    \"style\": {\n      \"position\": \"relative\"\n    }\n  }, mdx(\"a\", {\n    parentName: \"h3\",\n    \"href\": \"#note\",\n    \"aria-label\": \"note permalink\",\n    \"className\": \"anchor before\"\n  }, mdx(\"svg\", {\n    parentName: \"a\",\n    \"aria-hidden\": \"true\",\n    \"focusable\": \"false\",\n    \"height\": \"16\",\n    \"version\": \"1.1\",\n    \"viewBox\": \"0 0 16 16\",\n    \"width\": \"16\"\n  }, mdx(\"path\", {\n    parentName: \"svg\",\n    \"fillRule\": \"evenodd\",\n    \"d\": \"M4 9h1v1H4c-1.5 0-3-1.69-3-3.5S2.55 3 4 3h4c1.45 0 3 1.69 3 3.5 0 1.41-.91 2.72-2 3.25V8.59c.58-.45 1-1.27 1-2.09C10 5.22 8.98 4 8 4H4c-.98 0-2 1.22-2 2.5S3 9 4 9zm9-3h-1v1h1c1 0 2 1.22 2 2.5S13.98 12 13 12H9c-.98 0-2-1.22-2-2.5 0-.83.42-1.64 1-2.09V6.25c-1.09.53-2 1.84-2 3.25C6 11.31 7.55 13 9 13h4c1.45 0 3-1.69 3-3.5S14.5 6 13 6z\"\n  }))), `Note`), mdx(\"p\", null, `Not in the design system yet.`), mdx(\"p\", null, `Does not require an icon.`), mdx(\"p\", null, `Explains concepts which may include math or maybe not.`)), mdx(\"h3\", {\n    \"id\": \"lightweight\",\n    \"style\": {\n      \"position\": \"relative\"\n    }\n  }, mdx(\"a\", {\n    parentName: \"h3\",\n    \"href\": \"#lightweight\",\n    \"aria-label\": \"lightweight permalink\",\n    \"className\": \"anchor before\"\n  }, mdx(\"svg\", {\n    parentName: \"a\",\n    \"aria-hidden\": \"true\",\n    \"focusable\": \"false\",\n    \"height\": \"16\",\n    \"version\": \"1.1\",\n    \"viewBox\": \"0 0 16 16\",\n    \"width\": \"16\"\n  }, mdx(\"path\", {\n    parentName: \"svg\",\n    \"fillRule\": \"evenodd\",\n    \"d\": \"M4 9h1v1H4c-1.5 0-3-1.69-3-3.5S2.55 3 4 3h4c1.45 0 3 1.69 3 3.5 0 1.41-.91 2.72-2 3.25V8.59c.58-.45 1-1.27 1-2.09C10 5.22 8.98 4 8 4H4c-.98 0-2 1.22-2 2.5S3 9 4 9zm9-3h-1v1h1c1 0 2 1.22 2 2.5S13.98 12 13 12H9c-.98 0-2-1.22-2-2.5 0-.83.42-1.64 1-2.09V6.25c-1.09.53-2 1.84-2 3.25C6 11.31 7.55 13 9 13h4c1.45 0 3-1.69 3-3.5S14.5 6 13 6z\"\n  }))), `Lightweight`), mdx(ThemeContent, {\n    onlyThemes: ['medicare'],\n    mdxType: \"ThemeContent\"\n  }, mdx(Badge, {\n    variation: \"alert\",\n    mdxType: \"Badge\"\n  }, mdx(CloseIconThin, {\n    mdxType: \"CloseIconThin\"\n  }), \" Unused by Medicare.\")), mdx(ThemeContent, {\n    onlyThemes: ['healthcare'],\n    mdxType: \"ThemeContent\"\n  }, mdx(\"p\", null, `Used to show important but not as urgent messages as standard alerts.`)), mdx(ThemeContent, {\n    neverThemes: ['medicare'],\n    mdxType: \"ThemeContent\"\n  }, mdx(StorybookExample, {\n    componentName: \"lightweight alert\",\n    storyId: \"components-alert--lightweight\",\n    mdxType: \"StorybookExample\"\n  })), mdx(\"h2\", {\n    \"id\": \"guidance\",\n    \"style\": {\n      \"position\": \"relative\"\n    }\n  }, mdx(\"a\", {\n    parentName: \"h2\",\n    \"href\": \"#guidance\",\n    \"aria-label\": \"guidance permalink\",\n    \"className\": \"anchor before\"\n  }, mdx(\"svg\", {\n    parentName: \"a\",\n    \"aria-hidden\": \"true\",\n    \"focusable\": \"false\",\n    \"height\": \"16\",\n    \"version\": \"1.1\",\n    \"viewBox\": \"0 0 16 16\",\n    \"width\": \"16\"\n  }, mdx(\"path\", {\n    parentName: \"svg\",\n    \"fillRule\": \"evenodd\",\n    \"d\": \"M4 9h1v1H4c-1.5 0-3-1.69-3-3.5S2.55 3 4 3h4c1.45 0 3 1.69 3 3.5 0 1.41-.91 2.72-2 3.25V8.59c.58-.45 1-1.27 1-2.09C10 5.22 8.98 4 8 4H4c-.98 0-2 1.22-2 2.5S3 9 4 9zm9-3h-1v1h1c1 0 2 1.22 2 2.5S13.98 12 13 12H9c-.98 0-2-1.22-2-2.5 0-.83.42-1.64 1-2.09V6.25c-1.09.53-2 1.84-2 3.25C6 11.31 7.55 13 9 13h4c1.45 0 3-1.69 3-3.5S14.5 6 13 6z\"\n  }))), `Guidance`), mdx(\"h3\", {\n    \"id\": \"usage\",\n    \"style\": {\n      \"position\": \"relative\"\n    }\n  }, mdx(\"a\", {\n    parentName: \"h3\",\n    \"href\": \"#usage\",\n    \"aria-label\": \"usage permalink\",\n    \"className\": \"anchor before\"\n  }, mdx(\"svg\", {\n    parentName: \"a\",\n    \"aria-hidden\": \"true\",\n    \"focusable\": \"false\",\n    \"height\": \"16\",\n    \"version\": \"1.1\",\n    \"viewBox\": \"0 0 16 16\",\n    \"width\": \"16\"\n  }, mdx(\"path\", {\n    parentName: \"svg\",\n    \"fillRule\": \"evenodd\",\n    \"d\": \"M4 9h1v1H4c-1.5 0-3-1.69-3-3.5S2.55 3 4 3h4c1.45 0 3 1.69 3 3.5 0 1.41-.91 2.72-2 3.25V8.59c.58-.45 1-1.27 1-2.09C10 5.22 8.98 4 8 4H4c-.98 0-2 1.22-2 2.5S3 9 4 9zm9-3h-1v1h1c1 0 2 1.22 2 2.5S13.98 12 13 12H9c-.98 0-2-1.22-2-2.5 0-.83.42-1.64 1-2.09V6.25c-1.09.53-2 1.84-2 3.25C6 11.31 7.55 13 9 13h4c1.45 0 3-1.69 3-3.5S14.5 6 13 6z\"\n  }))), `Usage`), mdx(\"ul\", null, mdx(\"li\", {\n    parentName: \"ul\"\n  }, `Don’t overdo it — too many notifications will either overwhelm or annoy the user and are likely to be ignored.`), mdx(\"li\", {\n    parentName: \"ul\"\n  }, `Write the message in concise, human readable language; avoid jargon and computer code.`), mdx(\"li\", {\n    parentName: \"ul\"\n  }, `Don’t include notifications that aren’t related to the user’s current goal.`), mdx(\"li\", {\n    parentName: \"ul\"\n  }, `When the user is required to do something in response to an alert, let them know what they need to do and make that task as easy as possible.`), mdx(\"li\", {\n    parentName: \"ul\"\n  }, `Be mindful of other elements on the page that may compete for the user’s attention.`)), mdx(\"h3\", {\n    \"id\": \"when-to-use\",\n    \"style\": {\n      \"position\": \"relative\"\n    }\n  }, mdx(\"a\", {\n    parentName: \"h3\",\n    \"href\": \"#when-to-use\",\n    \"aria-label\": \"when to use permalink\",\n    \"className\": \"anchor before\"\n  }, mdx(\"svg\", {\n    parentName: \"a\",\n    \"aria-hidden\": \"true\",\n    \"focusable\": \"false\",\n    \"height\": \"16\",\n    \"version\": \"1.1\",\n    \"viewBox\": \"0 0 16 16\",\n    \"width\": \"16\"\n  }, mdx(\"path\", {\n    parentName: \"svg\",\n    \"fillRule\": \"evenodd\",\n    \"d\": \"M4 9h1v1H4c-1.5 0-3-1.69-3-3.5S2.55 3 4 3h4c1.45 0 3 1.69 3 3.5 0 1.41-.91 2.72-2 3.25V8.59c.58-.45 1-1.27 1-2.09C10 5.22 8.98 4 8 4H4c-.98 0-2 1.22-2 2.5S3 9 4 9zm9-3h-1v1h1c1 0 2 1.22 2 2.5S13.98 12 13 12H9c-.98 0-2-1.22-2-2.5 0-.83.42-1.64 1-2.09V6.25c-1.09.53-2 1.84-2 3.25C6 11.31 7.55 13 9 13h4c1.45 0 3-1.69 3-3.5S14.5 6 13 6z\"\n  }))), `When to use`), mdx(\"ul\", null, mdx(\"li\", {\n    parentName: \"ul\"\n  }, `As a validation message that alerts someone that they just did something that needs to be corrected or as confirmation that a task was completed successfully.`), mdx(\"li\", {\n    parentName: \"ul\"\n  }, `As a callout or notification for important or timely information. This includes errors, warnings, and general information.`), mdx(\"li\", {\n    parentName: \"ul\"\n  }, `Drawing focus to an error or an incomplete task by prompting the user to review or take other action.`), mdx(\"li\", {\n    parentName: \"ul\"\n  }, `Confirming the successful competition of a task.`), mdx(\"li\", {\n    parentName: \"ul\"\n  }, `Providing key supplementary or contextual information to support the successful completion of tasks or aid overall comprehension.`)), mdx(ThemeContent, {\n    onlyThemes: ['medicare'],\n    mdxType: \"ThemeContent\"\n  }, mdx(\"h3\", {\n    \"id\": \"dont-use\",\n    \"style\": {\n      \"position\": \"relative\"\n    }\n  }, mdx(\"a\", {\n    parentName: \"h3\",\n    \"href\": \"#dont-use\",\n    \"aria-label\": \"dont use permalink\",\n    \"className\": \"anchor before\"\n  }, mdx(\"svg\", {\n    parentName: \"a\",\n    \"aria-hidden\": \"true\",\n    \"focusable\": \"false\",\n    \"height\": \"16\",\n    \"version\": \"1.1\",\n    \"viewBox\": \"0 0 16 16\",\n    \"width\": \"16\"\n  }, mdx(\"path\", {\n    parentName: \"svg\",\n    \"fillRule\": \"evenodd\",\n    \"d\": \"M4 9h1v1H4c-1.5 0-3-1.69-3-3.5S2.55 3 4 3h4c1.45 0 3 1.69 3 3.5 0 1.41-.91 2.72-2 3.25V8.59c.58-.45 1-1.27 1-2.09C10 5.22 8.98 4 8 4H4c-.98 0-2 1.22-2 2.5S3 9 4 9zm9-3h-1v1h1c1 0 2 1.22 2 2.5S13.98 12 13 12H9c-.98 0-2-1.22-2-2.5 0-.83.42-1.64 1-2.09V6.25c-1.09.53-2 1.84-2 3.25C6 11.31 7.55 13 9 13h4c1.45 0 3-1.69 3-3.5S14.5 6 13 6z\"\n  }))), `Don't use`), mdx(\"ul\", null, mdx(\"li\", {\n    parentName: \"ul\"\n  }, `You need to display alerts that aren’t related to the user’s current goal.`))), mdx(\"h3\", {\n    \"id\": \"when-to-consider-alternatives\",\n    \"style\": {\n      \"position\": \"relative\"\n    }\n  }, mdx(\"a\", {\n    parentName: \"h3\",\n    \"href\": \"#when-to-consider-alternatives\",\n    \"aria-label\": \"when to consider alternatives permalink\",\n    \"className\": \"anchor before\"\n  }, mdx(\"svg\", {\n    parentName: \"a\",\n    \"aria-hidden\": \"true\",\n    \"focusable\": \"false\",\n    \"height\": \"16\",\n    \"version\": \"1.1\",\n    \"viewBox\": \"0 0 16 16\",\n    \"width\": \"16\"\n  }, mdx(\"path\", {\n    parentName: \"svg\",\n    \"fillRule\": \"evenodd\",\n    \"d\": \"M4 9h1v1H4c-1.5 0-3-1.69-3-3.5S2.55 3 4 3h4c1.45 0 3 1.69 3 3.5 0 1.41-.91 2.72-2 3.25V8.59c.58-.45 1-1.27 1-2.09C10 5.22 8.98 4 8 4H4c-.98 0-2 1.22-2 2.5S3 9 4 9zm9-3h-1v1h1c1 0 2 1.22 2 2.5S13.98 12 13 12H9c-.98 0-2-1.22-2-2.5 0-.83.42-1.64 1-2.09V6.25c-1.09.53-2 1.84-2 3.25C6 11.31 7.55 13 9 13h4c1.45 0 3-1.69 3-3.5S14.5 6 13 6z\"\n  }))), `When to consider alternatives`), mdx(\"ul\", null, mdx(\"li\", {\n    parentName: \"ul\"\n  }, `On long forms, always include in-line validation in addition to any error messages that appear at the top of the form. When possible, simplify forms by rewriting and where possible, splitting long forms across multiple pages`), mdx(\"li\", {\n    parentName: \"ul\"\n  }, `If an action will result in destroying a user’s work (for example, deleting an application) use a more intrusive pattern, such as a confirmation modal dialogue, to allow the user to confirm that this is what they want.`), mdx(\"li\", {\n    parentName: \"ul\"\n  }, `When you need to display content that isn't related to the user’s current goal.`)), mdx(\"p\", null, mdx(\"strong\", {\n    parentName: \"p\"\n  }, `When the alert is for an error:`)), mdx(\"ul\", null, mdx(\"li\", {\n    parentName: \"ul\"\n  }, `Be polite in error messages — don’t place blame on the user.`), mdx(\"li\", {\n    parentName: \"ul\"\n  }, `Users generally won’t read documentation but will read a message that helps them resolve an error; include some educational material in your error message.`), mdx(\"li\", {\n    parentName: \"ul\"\n  }, `If the error relates to specific text fields, give these fields an error state as well.`)), mdx(\"h3\", {\n    \"id\": \"display--behavior\",\n    \"style\": {\n      \"position\": \"relative\"\n    }\n  }, mdx(\"a\", {\n    parentName: \"h3\",\n    \"href\": \"#display--behavior\",\n    \"aria-label\": \"display  behavior permalink\",\n    \"className\": \"anchor before\"\n  }, mdx(\"svg\", {\n    parentName: \"a\",\n    \"aria-hidden\": \"true\",\n    \"focusable\": \"false\",\n    \"height\": \"16\",\n    \"version\": \"1.1\",\n    \"viewBox\": \"0 0 16 16\",\n    \"width\": \"16\"\n  }, mdx(\"path\", {\n    parentName: \"svg\",\n    \"fillRule\": \"evenodd\",\n    \"d\": \"M4 9h1v1H4c-1.5 0-3-1.69-3-3.5S2.55 3 4 3h4c1.45 0 3 1.69 3 3.5 0 1.41-.91 2.72-2 3.25V8.59c.58-.45 1-1.27 1-2.09C10 5.22 8.98 4 8 4H4c-.98 0-2 1.22-2 2.5S3 9 4 9zm9-3h-1v1h1c1 0 2 1.22 2 2.5S13.98 12 13 12H9c-.98 0-2-1.22-2-2.5 0-.83.42-1.64 1-2.09V6.25c-1.09.53-2 1.84-2 3.25C6 11.31 7.55 13 9 13h4c1.45 0 3-1.69 3-3.5S14.5 6 13 6z\"\n  }))), `Display & behavior`), mdx(\"ul\", null, mdx(\"li\", {\n    parentName: \"ul\"\n  }, `Alerts are static and shouldn't be associated with a timer or dismiss button.`), mdx(\"li\", {\n    parentName: \"ul\"\n  }, `Can be displayed statically on page load or dynamically loaded.`), mdx(\"li\", {\n    parentName: \"ul\"\n  }, `When the user is required to do something in response to an alert, let them know what they need to do and make that task as easy as possible.`)), mdx(ThemeContent, {\n    onlyThemes: ['healthcare'],\n    mdxType: \"ThemeContent\"\n  }, mdx(\"ul\", null, mdx(\"li\", {\n    parentName: \"ul\"\n  }, `Having icons is the preferred use for alerts. Some alerts might have a large amount of content and may need the extra space and in those cases the icon can be removed. Removing the icon should be considered a exception. Validate the design and spacing on mobile to help make this decision.`)), mdx(\"h3\", {\n    \"id\": \"design-guidelines\",\n    \"style\": {\n      \"position\": \"relative\"\n    }\n  }, mdx(\"a\", {\n    parentName: \"h3\",\n    \"href\": \"#design-guidelines\",\n    \"aria-label\": \"design guidelines permalink\",\n    \"className\": \"anchor before\"\n  }, mdx(\"svg\", {\n    parentName: \"a\",\n    \"aria-hidden\": \"true\",\n    \"focusable\": \"false\",\n    \"height\": \"16\",\n    \"version\": \"1.1\",\n    \"viewBox\": \"0 0 16 16\",\n    \"width\": \"16\"\n  }, mdx(\"path\", {\n    parentName: \"svg\",\n    \"fillRule\": \"evenodd\",\n    \"d\": \"M4 9h1v1H4c-1.5 0-3-1.69-3-3.5S2.55 3 4 3h4c1.45 0 3 1.69 3 3.5 0 1.41-.91 2.72-2 3.25V8.59c.58-.45 1-1.27 1-2.09C10 5.22 8.98 4 8 4H4c-.98 0-2 1.22-2 2.5S3 9 4 9zm9-3h-1v1h1c1 0 2 1.22 2 2.5S13.98 12 13 12H9c-.98 0-2-1.22-2-2.5 0-.83.42-1.64 1-2.09V6.25c-1.09.53-2 1.84-2 3.25C6 11.31 7.55 13 9 13h4c1.45 0 3-1.69 3-3.5S14.5 6 13 6z\"\n  }))), `Design guidelines`), mdx(\"h4\", {\n    \"id\": \"placement\",\n    \"style\": {\n      \"position\": \"relative\"\n    }\n  }, mdx(\"a\", {\n    parentName: \"h4\",\n    \"href\": \"#placement\",\n    \"aria-label\": \"placement permalink\",\n    \"className\": \"anchor before\"\n  }, mdx(\"svg\", {\n    parentName: \"a\",\n    \"aria-hidden\": \"true\",\n    \"focusable\": \"false\",\n    \"height\": \"16\",\n    \"version\": \"1.1\",\n    \"viewBox\": \"0 0 16 16\",\n    \"width\": \"16\"\n  }, mdx(\"path\", {\n    parentName: \"svg\",\n    \"fillRule\": \"evenodd\",\n    \"d\": \"M4 9h1v1H4c-1.5 0-3-1.69-3-3.5S2.55 3 4 3h4c1.45 0 3 1.69 3 3.5 0 1.41-.91 2.72-2 3.25V8.59c.58-.45 1-1.27 1-2.09C10 5.22 8.98 4 8 4H4c-.98 0-2 1.22-2 2.5S3 9 4 9zm9-3h-1v1h1c1 0 2 1.22 2 2.5S13.98 12 13 12H9c-.98 0-2-1.22-2-2.5 0-.83.42-1.64 1-2.09V6.25c-1.09.53-2 1.84-2 3.25C6 11.31 7.55 13 9 13h4c1.45 0 3-1.69 3-3.5S14.5 6 13 6z\"\n  }))), `Placement`), mdx(\"ul\", null, mdx(\"li\", {\n    parentName: \"ul\"\n  }, `Place all alerts below the main page title.`), mdx(\"li\", {\n    parentName: \"ul\"\n  }, `Default alerts provide more impact and should be used sparingly. Focus on using default alerts as top-level elements.`, mdx(\"ul\", {\n    parentName: \"li\"\n  }, mdx(\"li\", {\n    parentName: \"ul\"\n  }, `Exception: Warning alerts can be used as needed within the page.`))), mdx(\"li\", {\n    parentName: \"ul\"\n  }, `Lightweight alerts are more targeted and should be focused on specific elements within the context of the page.`))), mdx(\"h3\", {\n    \"id\": \"accessibility\",\n    \"style\": {\n      \"position\": \"relative\"\n    }\n  }, mdx(\"a\", {\n    parentName: \"h3\",\n    \"href\": \"#accessibility\",\n    \"aria-label\": \"accessibility permalink\",\n    \"className\": \"anchor before\"\n  }, mdx(\"svg\", {\n    parentName: \"a\",\n    \"aria-hidden\": \"true\",\n    \"focusable\": \"false\",\n    \"height\": \"16\",\n    \"version\": \"1.1\",\n    \"viewBox\": \"0 0 16 16\",\n    \"width\": \"16\"\n  }, mdx(\"path\", {\n    parentName: \"svg\",\n    \"fillRule\": \"evenodd\",\n    \"d\": \"M4 9h1v1H4c-1.5 0-3-1.69-3-3.5S2.55 3 4 3h4c1.45 0 3 1.69 3 3.5 0 1.41-.91 2.72-2 3.25V8.59c.58-.45 1-1.27 1-2.09C10 5.22 8.98 4 8 4H4c-.98 0-2 1.22-2 2.5S3 9 4 9zm9-3h-1v1h1c1 0 2 1.22 2 2.5S13.98 12 13 12H9c-.98 0-2-1.22-2-2.5 0-.83.42-1.64 1-2.09V6.25c-1.09.53-2 1.84-2 3.25C6 11.31 7.55 13 9 13h4c1.45 0 3-1.69 3-3.5S14.5 6 13 6z\"\n  }))), `Accessibility`), mdx(\"ul\", null, mdx(\"li\", {\n    parentName: \"ul\"\n  }, `Use alerts sparingly as to avoid creating too much \"noise\" in screen readers, making it difficult to understand the overall layout of the page.`), mdx(\"li\", {\n    parentName: \"ul\"\n  }, `Users who are viewing the content need it to be placed in an effective location and to draw attention even when CSS is turned off. Content can help here too, using word choices that make the importance of the message clear.`), mdx(\"li\", {\n    parentName: \"ul\"\n  }, `Users who hear this content through assistive technology, such as a screen reader, will need to be alerted when the alert component visually appears, and that can be done using `, mdx(\"inlineCode\", {\n    parentName: \"li\"\n  }, `aria-live`), `.`), mdx(\"li\", {\n    parentName: \"ul\"\n  }, `Users who are using a keyboard to navigate the page will need to be able to access the alert and its content in the right order.`), mdx(\"li\", {\n    parentName: \"ul\"\n  }, `Do not visually hide alert messages on the page and then make them visible when they are needed. Users of older assistive technologies may still be able to perceive the alert messages even if they are not currently applicable.`), mdx(\"li\", {\n    parentName: \"ul\"\n  }, `Use the `, mdx(\"abbr\", {\n    title: \"Accessible rich internet applications\"\n  }, `ARIA`), ` `, mdx(\"inlineCode\", {\n    parentName: \"li\"\n  }, `role=\"alert\"`), ` to inform assistive technologies of a time-sensitive and important message that is not interactive. If the message is interactive, use the `, mdx(\"inlineCode\", {\n    parentName: \"li\"\n  }, `role=\"alertdialog\"`), ` instead. Both include an implicit use of `, mdx(\"inlineCode\", {\n    parentName: \"li\"\n  }, `aria-live=\"assertive\"`), `. Refer to the `, mdx(\"a\", {\n    parentName: \"li\",\n    \"href\": \"/design-system/branch/pwolfert/release-10.1-blog-post/components/modal-dialog/\"\n  }, `Dialog component’s full documentation`), ` when using `, mdx(\"inlineCode\", {\n    parentName: \"li\"\n  }, `role=\"alertdialog\"`), `.`), mdx(\"li\", {\n    parentName: \"ul\"\n  }, `If you have multiple alert components on a page, tailor the accessible text to differentiate between each by using an `, mdx(\"inlineCode\", {\n    parentName: \"li\"\n  }, `aria-label`), ` or `, mdx(\"inlineCode\", {\n    parentName: \"li\"\n  }, `aria-labelledby`), ` attribute.`)), mdx(ThemeContent, {\n    onlyThemes: ['healthcare'],\n    mdxType: \"ThemeContent\"\n  }, mdx(\"h4\", {\n    \"id\": \"for-dynamic-alerts\",\n    \"style\": {\n      \"position\": \"relative\"\n    }\n  }, mdx(\"a\", {\n    parentName: \"h4\",\n    \"href\": \"#for-dynamic-alerts\",\n    \"aria-label\": \"for dynamic alerts permalink\",\n    \"className\": \"anchor before\"\n  }, mdx(\"svg\", {\n    parentName: \"a\",\n    \"aria-hidden\": \"true\",\n    \"focusable\": \"false\",\n    \"height\": \"16\",\n    \"version\": \"1.1\",\n    \"viewBox\": \"0 0 16 16\",\n    \"width\": \"16\"\n  }, mdx(\"path\", {\n    parentName: \"svg\",\n    \"fillRule\": \"evenodd\",\n    \"d\": \"M4 9h1v1H4c-1.5 0-3-1.69-3-3.5S2.55 3 4 3h4c1.45 0 3 1.69 3 3.5 0 1.41-.91 2.72-2 3.25V8.59c.58-.45 1-1.27 1-2.09C10 5.22 8.98 4 8 4H4c-.98 0-2 1.22-2 2.5S3 9 4 9zm9-3h-1v1h1c1 0 2 1.22 2 2.5S13.98 12 13 12H9c-.98 0-2-1.22-2-2.5 0-.83.42-1.64 1-2.09V6.25c-1.09.53-2 1.84-2 3.25C6 11.31 7.55 13 9 13h4c1.45 0 3-1.69 3-3.5S14.5 6 13 6z\"\n  }))), `For dynamic alerts`), mdx(\"ul\", null, mdx(\"li\", {\n    parentName: \"ul\"\n  }, mdx(\"p\", {\n    parentName: \"li\"\n  }, `If dynamically loaded, be mindful of when the alert displays on the page. For example, an alert could appear on a page due to an error or progressive disclosure. Where and how the content appears visually should align with how and when a screen reader user hears the content. Errors need immediate attention, but content through progressive disclosure may not.`)), mdx(\"li\", {\n    parentName: \"ul\"\n  }, mdx(\"p\", {\n    parentName: \"li\"\n  }, `When a user's actions require dynamically displaying an alert, such as with success or error states, inject the alert inside an already existing `, mdx(\"inlineCode\", {\n    parentName: \"p\"\n  }, `<div>`), ` with `, mdx(\"inlineCode\", {\n    parentName: \"p\"\n  }, `aria-live=\"polite\"`), ` and `, mdx(\"inlineCode\", {\n    parentName: \"p\"\n  }, `aria-relevant=\"additions removals\"`), ` or `, mdx(\"inlineCode\", {\n    parentName: \"p\"\n  }, `role=\"alert\"`), `. These ARIA attributes ensure screen readers will announce alerts that have been added or updated dynamically.`), mdx(\"ul\", {\n    parentName: \"li\"\n  }, mdx(\"li\", {\n    parentName: \"ul\"\n  }, `For example, your empty `, mdx(\"inlineCode\", {\n    parentName: \"li\"\n  }, `<div>`), ` on page load would appear as:`)), mdx(\"pre\", {\n    parentName: \"li\"\n  }, mdx(\"code\", {\n    parentName: \"pre\",\n    \"className\": \"language-html\"\n  }, `<div aria-live=\"polite\" aria-relevant=\"additions removals\"></div>\n`)), mdx(\"p\", {\n    parentName: \"li\"\n  }, `And when the user performs an action that displays an alert, add the alert to the existing `, mdx(\"inlineCode\", {\n    parentName: \"p\"\n  }, `<div>`), `:`), mdx(\"pre\", {\n    parentName: \"li\"\n  }, mdx(\"code\", {\n    parentName: \"pre\",\n    \"className\": \"language-html\"\n  }, `<div aria-live=\"polite\" aria-relevant=\"additions removals\">\n  <div role=\"region\" class=\"ds-c-alert ds-c-alert--error\">...</div>\n</div>\n`))), mdx(\"li\", {\n    parentName: \"ul\"\n  }, mdx(\"p\", {\n    parentName: \"li\"\n  }, `The value of the `, mdx(\"inlineCode\", {\n    parentName: \"p\"\n  }, `aria-live`), ` attribute is used to update assistive technologies on the degree of importance.`), mdx(\"ul\", {\n    parentName: \"li\"\n  }, mdx(\"li\", {\n    parentName: \"ul\"\n  }, mdx(\"inlineCode\", {\n    parentName: \"li\"\n  }, `aria-live=\"polite\"`), ` will notify users of updates but generally do not interrupt the current task, with the updates having a low priority.`), mdx(\"li\", {\n    parentName: \"ul\"\n  }, mdx(\"inlineCode\", {\n    parentName: \"li\"\n  }, `aria-live=\"assertive\"`), ` will immediately notify the user, potentially clearing the speech queue of previous updates. Don't use the assertive value unless the interruption is imperative.`), mdx(\"li\", {\n    parentName: \"ul\"\n  }, `Use `, mdx(\"inlineCode\", {\n    parentName: \"li\"\n  }, `aria-relevant=\"additions removals\"`), ` (tailored to the appropriate value) to communicate the types of changes that have occurred to an `, mdx(\"inlineCode\", {\n    parentName: \"li\"\n  }, `aria-live`), ` region. Assistive technologies only need to be informed of content removal when its removal represents an important change.`))), mdx(\"li\", {\n    parentName: \"ul\"\n  }, mdx(\"p\", {\n    parentName: \"li\"\n  }, `If you choose to shift focus to the alert, be mindful that using other techniques like `, mdx(\"inlineCode\", {\n    parentName: \"p\"\n  }, `role=\"alert\"`), `, and `, mdx(\"inlineCode\", {\n    parentName: \"p\"\n  }, `aria-live=\"polite\"`), ` will cause some browser and screen reader combinations to read out the content more than once. Typically, shifting focus alone will be enough to alert screen readers of the content.`)))), mdx(\"h4\", {\n    \"id\": \"accessibility-testing\",\n    \"style\": {\n      \"position\": \"relative\"\n    }\n  }, mdx(\"a\", {\n    parentName: \"h4\",\n    \"href\": \"#accessibility-testing\",\n    \"aria-label\": \"accessibility testing permalink\",\n    \"className\": \"anchor before\"\n  }, mdx(\"svg\", {\n    parentName: \"a\",\n    \"aria-hidden\": \"true\",\n    \"focusable\": \"false\",\n    \"height\": \"16\",\n    \"version\": \"1.1\",\n    \"viewBox\": \"0 0 16 16\",\n    \"width\": \"16\"\n  }, mdx(\"path\", {\n    parentName: \"svg\",\n    \"fillRule\": \"evenodd\",\n    \"d\": \"M4 9h1v1H4c-1.5 0-3-1.69-3-3.5S2.55 3 4 3h4c1.45 0 3 1.69 3 3.5 0 1.41-.91 2.72-2 3.25V8.59c.58-.45 1-1.27 1-2.09C10 5.22 8.98 4 8 4H4c-.98 0-2 1.22-2 2.5S3 9 4 9zm9-3h-1v1h1c1 0 2 1.22 2 2.5S13.98 12 13 12H9c-.98 0-2-1.22-2-2.5 0-.83.42-1.64 1-2.09V6.25c-1.09.53-2 1.84-2 3.25C6 11.31 7.55 13 9 13h4c1.45 0 3-1.69 3-3.5S14.5 6 13 6z\"\n  }))), `Accessibility testing`), mdx(\"h5\", {\n    \"id\": \"general\",\n    \"style\": {\n      \"position\": \"relative\"\n    }\n  }, mdx(\"a\", {\n    parentName: \"h5\",\n    \"href\": \"#general\",\n    \"aria-label\": \"general permalink\",\n    \"className\": \"anchor before\"\n  }, mdx(\"svg\", {\n    parentName: \"a\",\n    \"aria-hidden\": \"true\",\n    \"focusable\": \"false\",\n    \"height\": \"16\",\n    \"version\": \"1.1\",\n    \"viewBox\": \"0 0 16 16\",\n    \"width\": \"16\"\n  }, mdx(\"path\", {\n    parentName: \"svg\",\n    \"fillRule\": \"evenodd\",\n    \"d\": \"M4 9h1v1H4c-1.5 0-3-1.69-3-3.5S2.55 3 4 3h4c1.45 0 3 1.69 3 3.5 0 1.41-.91 2.72-2 3.25V8.59c.58-.45 1-1.27 1-2.09C10 5.22 8.98 4 8 4H4c-.98 0-2 1.22-2 2.5S3 9 4 9zm9-3h-1v1h1c1 0 2 1.22 2 2.5S13.98 12 13 12H9c-.98 0-2-1.22-2-2.5 0-.83.42-1.64 1-2.09V6.25c-1.09.53-2 1.84-2 3.25C6 11.31 7.55 13 9 13h4c1.45 0 3-1.69 3-3.5S14.5 6 13 6z\"\n  }))), `General`), mdx(\"ul\", null, mdx(\"li\", {\n    parentName: \"ul\"\n  }, `The alert should have a `, mdx(\"a\", {\n    parentName: \"li\",\n    \"href\": \"https://www.w3.org/WAI/ARIA/apg/practices/names-and-descriptions/\"\n  }, `unique, accessible name`), `.`), mdx(\"li\", {\n    parentName: \"ul\"\n  }, `The alert purpose should be clear in the context of the whole page.`)), mdx(\"h5\", {\n    \"id\": \"keyboard-testing\",\n    \"style\": {\n      \"position\": \"relative\"\n    }\n  }, mdx(\"a\", {\n    parentName: \"h5\",\n    \"href\": \"#keyboard-testing\",\n    \"aria-label\": \"keyboard testing permalink\",\n    \"className\": \"anchor before\"\n  }, mdx(\"svg\", {\n    parentName: \"a\",\n    \"aria-hidden\": \"true\",\n    \"focusable\": \"false\",\n    \"height\": \"16\",\n    \"version\": \"1.1\",\n    \"viewBox\": \"0 0 16 16\",\n    \"width\": \"16\"\n  }, mdx(\"path\", {\n    parentName: \"svg\",\n    \"fillRule\": \"evenodd\",\n    \"d\": \"M4 9h1v1H4c-1.5 0-3-1.69-3-3.5S2.55 3 4 3h4c1.45 0 3 1.69 3 3.5 0 1.41-.91 2.72-2 3.25V8.59c.58-.45 1-1.27 1-2.09C10 5.22 8.98 4 8 4H4c-.98 0-2 1.22-2 2.5S3 9 4 9zm9-3h-1v1h1c1 0 2 1.22 2 2.5S13.98 12 13 12H9c-.98 0-2-1.22-2-2.5 0-.83.42-1.64 1-2.09V6.25c-1.09.53-2 1.84-2 3.25C6 11.31 7.55 13 9 13h4c1.45 0 3-1.69 3-3.5S14.5 6 13 6z\"\n  }))), `Keyboard testing`), mdx(\"ul\", null, mdx(\"li\", {\n    parentName: \"ul\"\n  }, `When using features that trigger the display of an alert, I should see or hear the alert announced, but focus DOES NOT transfer automatically when the alert appears.`), mdx(\"li\", {\n    parentName: \"ul\"\n  }, `When using features that trigger the display of an `, mdx(\"a\", {\n    parentName: \"li\",\n    \"href\": \"/design-system/branch/pwolfert/release-10.1-blog-post/components/modal-dialog/\"\n  }, `alert dialog (modal)`), `, I should see or hear the alert announced, and focus DOES transfer automatically when the alert appears.`)), mdx(\"h5\", {\n    \"id\": \"screen-reader-testing\",\n    \"style\": {\n      \"position\": \"relative\"\n    }\n  }, mdx(\"a\", {\n    parentName: \"h5\",\n    \"href\": \"#screen-reader-testing\",\n    \"aria-label\": \"screen reader testing permalink\",\n    \"className\": \"anchor before\"\n  }, mdx(\"svg\", {\n    parentName: \"a\",\n    \"aria-hidden\": \"true\",\n    \"focusable\": \"false\",\n    \"height\": \"16\",\n    \"version\": \"1.1\",\n    \"viewBox\": \"0 0 16 16\",\n    \"width\": \"16\"\n  }, mdx(\"path\", {\n    parentName: \"svg\",\n    \"fillRule\": \"evenodd\",\n    \"d\": \"M4 9h1v1H4c-1.5 0-3-1.69-3-3.5S2.55 3 4 3h4c1.45 0 3 1.69 3 3.5 0 1.41-.91 2.72-2 3.25V8.59c.58-.45 1-1.27 1-2.09C10 5.22 8.98 4 8 4H4c-.98 0-2 1.22-2 2.5S3 9 4 9zm9-3h-1v1h1c1 0 2 1.22 2 2.5S13.98 12 13 12H9c-.98 0-2-1.22-2-2.5 0-.83.42-1.64 1-2.09V6.25c-1.09.53-2 1.84-2 3.25C6 11.31 7.55 13 9 13h4c1.45 0 3-1.69 3-3.5S14.5 6 13 6z\"\n  }))), `Screen reader testing`), mdx(\"p\", null, `When using a screen reader (NVDA, JAWS, VoiceOver, TalkBack):`), mdx(\"ul\", null, mdx(\"li\", {\n    parentName: \"ul\"\n  }, `Using features that trigger the display of an alert:`, mdx(\"ul\", {\n    parentName: \"li\"\n  }, mdx(\"li\", {\n    parentName: \"ul\"\n  }, `The alert is announced when it appears`), mdx(\"li\", {\n    parentName: \"ul\"\n  }, `It identifies itself as an alert`))), mdx(\"li\", {\n    parentName: \"ul\"\n  }, `Navigating the page announces the accessible name of the alert, followed by the alert content.`)), mdx(ThemeContent, {\n    onlyThemes: ['healthcare'],\n    mdxType: \"ThemeContent\"\n  }, mdx(\"h3\", {\n    \"id\": \"content\",\n    \"style\": {\n      \"position\": \"relative\"\n    }\n  }, mdx(\"a\", {\n    parentName: \"h3\",\n    \"href\": \"#content\",\n    \"aria-label\": \"content permalink\",\n    \"className\": \"anchor before\"\n  }, mdx(\"svg\", {\n    parentName: \"a\",\n    \"aria-hidden\": \"true\",\n    \"focusable\": \"false\",\n    \"height\": \"16\",\n    \"version\": \"1.1\",\n    \"viewBox\": \"0 0 16 16\",\n    \"width\": \"16\"\n  }, mdx(\"path\", {\n    parentName: \"svg\",\n    \"fillRule\": \"evenodd\",\n    \"d\": \"M4 9h1v1H4c-1.5 0-3-1.69-3-3.5S2.55 3 4 3h4c1.45 0 3 1.69 3 3.5 0 1.41-.91 2.72-2 3.25V8.59c.58-.45 1-1.27 1-2.09C10 5.22 8.98 4 8 4H4c-.98 0-2 1.22-2 2.5S3 9 4 9zm9-3h-1v1h1c1 0 2 1.22 2 2.5S13.98 12 13 12H9c-.98 0-2-1.22-2-2.5 0-.83.42-1.64 1-2.09V6.25c-1.09.53-2 1.84-2 3.25C6 11.31 7.55 13 9 13h4c1.45 0 3-1.69 3-3.5S14.5 6 13 6z\"\n  }))), `Content`), mdx(\"ul\", null, mdx(\"li\", {\n    parentName: \"ul\"\n  }, `Consider the amount of text placed in an alert. Aim for the shortest possible amount of text to convey the concept or issue.`), mdx(\"li\", {\n    parentName: \"ul\"\n  }, `Write the message in concise, plain language; avoid jargon and computer code.`), mdx(\"li\", {\n    parentName: \"ul\"\n  }, `Alerts support various types and lengths of content from ~45 to ~80 characters wide, including lists and navigational links.`)), mdx(\"h4\", {\n    \"id\": \"heading-content\",\n    \"style\": {\n      \"position\": \"relative\"\n    }\n  }, mdx(\"a\", {\n    parentName: \"h4\",\n    \"href\": \"#heading-content\",\n    \"aria-label\": \"heading content permalink\",\n    \"className\": \"anchor before\"\n  }, mdx(\"svg\", {\n    parentName: \"a\",\n    \"aria-hidden\": \"true\",\n    \"focusable\": \"false\",\n    \"height\": \"16\",\n    \"version\": \"1.1\",\n    \"viewBox\": \"0 0 16 16\",\n    \"width\": \"16\"\n  }, mdx(\"path\", {\n    parentName: \"svg\",\n    \"fillRule\": \"evenodd\",\n    \"d\": \"M4 9h1v1H4c-1.5 0-3-1.69-3-3.5S2.55 3 4 3h4c1.45 0 3 1.69 3 3.5 0 1.41-.91 2.72-2 3.25V8.59c.58-.45 1-1.27 1-2.09C10 5.22 8.98 4 8 4H4c-.98 0-2 1.22-2 2.5S3 9 4 9zm9-3h-1v1h1c1 0 2 1.22 2 2.5S13.98 12 13 12H9c-.98 0-2-1.22-2-2.5 0-.83.42-1.64 1-2.09V6.25c-1.09.53-2 1.84-2 3.25C6 11.31 7.55 13 9 13h4c1.45 0 3-1.69 3-3.5S14.5 6 13 6z\"\n  }))), `Heading content`), mdx(\"ul\", null, mdx(\"li\", {\n    parentName: \"ul\"\n  }, `Is bolded and acts as the title of the alert`), mdx(\"li\", {\n    parentName: \"ul\"\n  }, `Helps to group or frame the information in the alert`), mdx(\"li\", {\n    parentName: \"ul\"\n  }, `Shouldn't end in a period`)), mdx(\"h4\", {\n    \"id\": \"error-content\",\n    \"style\": {\n      \"position\": \"relative\"\n    }\n  }, mdx(\"a\", {\n    parentName: \"h4\",\n    \"href\": \"#error-content\",\n    \"aria-label\": \"error content permalink\",\n    \"className\": \"anchor before\"\n  }, mdx(\"svg\", {\n    parentName: \"a\",\n    \"aria-hidden\": \"true\",\n    \"focusable\": \"false\",\n    \"height\": \"16\",\n    \"version\": \"1.1\",\n    \"viewBox\": \"0 0 16 16\",\n    \"width\": \"16\"\n  }, mdx(\"path\", {\n    parentName: \"svg\",\n    \"fillRule\": \"evenodd\",\n    \"d\": \"M4 9h1v1H4c-1.5 0-3-1.69-3-3.5S2.55 3 4 3h4c1.45 0 3 1.69 3 3.5 0 1.41-.91 2.72-2 3.25V8.59c.58-.45 1-1.27 1-2.09C10 5.22 8.98 4 8 4H4c-.98 0-2 1.22-2 2.5S3 9 4 9zm9-3h-1v1h1c1 0 2 1.22 2 2.5S13.98 12 13 12H9c-.98 0-2-1.22-2-2.5 0-.83.42-1.64 1-2.09V6.25c-1.09.53-2 1.84-2 3.25C6 11.31 7.55 13 9 13h4c1.45 0 3-1.69 3-3.5S14.5 6 13 6z\"\n  }))), `Error content`), mdx(\"ul\", null, mdx(\"li\", {\n    parentName: \"ul\"\n  }, `Describe what went wrong and what the the user needs to do.`), mdx(\"li\", {\n    parentName: \"ul\"\n  }, `Use the fewest words possible (i.e., don't use \"please\").`), mdx(\"li\", {\n    parentName: \"ul\"\n  }, `Body copy should end with a period.`), mdx(\"li\", {\n    parentName: \"ul\"\n  }, `Include some educational material or guidance on what action the user needs to take because they generally won’t read documentation but will read a message that helps them resolve an error.`), mdx(\"li\", {\n    parentName: \"ul\"\n  }, `Use active voice. It helps reduce the number of words needed to convey your message.`), mdx(\"li\", {\n    parentName: \"ul\"\n  }, `Use contractions where applicable (especially negative contractions like won't, don't, can't, shouldn't). People sometimes miss \"not\" in text so contractions help with clarity.`)), mdx(\"table\", {\n    className: \"ds-c-table ds-c-table--compact ds-c-md-table--stacked\",\n    role: \"table\",\n    width: \"100%\"\n  }, mdx(\"thead\", {\n    role: \"rowgroup\"\n  }, mdx(\"tr\", {\n    role: \"row\"\n  }, mdx(\"th\", {\n    className: \"ds-u-fill--success-lightest\",\n    role: \"columnheader\",\n    scope: \"col\"\n  }, \"Use\"), mdx(\"th\", {\n    className: \"ds-u-fill--error-lightest\",\n    role: \"columnheader\",\n    scope: \"col\"\n  }, \"Don't use\"))), mdx(\"tbody\", {\n    role: \"rowgroup\"\n  }, mdx(\"tr\", {\n    role: \"row\"\n  }, mdx(\"td\", {\n    role: \"cell\",\n    \"data-title\": \"Document title\",\n    width: \"50%\"\n  }, \"Use active voice: \\\"Access your application...\\\". Start with an action verb whenever possible.\"), mdx(\"td\", {\n    role: \"cell\",\n    \"data-title\": \"Description\",\n    width: \"50%\"\n  }, \"Use passive voice: \\\"Your application can be accessed by....\\\"\")), mdx(\"tr\", {\n    role: \"row\"\n  }, mdx(\"td\", {\n    role: \"cell\",\n    \"data-title\": \"Document title\",\n    width: \"50%\"\n  }, \"Contractions\"), mdx(\"td\", {\n    role: \"cell\",\n    \"data-title\": \"Description\",\n    width: \"50%\"\n  }, \"These specific contractions: \\\"it'll, that\\u2019ll, why\\u2019s, how\\u2019s, you\\u2019d\\\"\"))))), mdx(\"h2\", {\n    \"id\": \"learn-more\",\n    \"style\": {\n      \"position\": \"relative\"\n    }\n  }, mdx(\"a\", {\n    parentName: \"h2\",\n    \"href\": \"#learn-more\",\n    \"aria-label\": \"learn more permalink\",\n    \"className\": \"anchor before\"\n  }, mdx(\"svg\", {\n    parentName: \"a\",\n    \"aria-hidden\": \"true\",\n    \"focusable\": \"false\",\n    \"height\": \"16\",\n    \"version\": \"1.1\",\n    \"viewBox\": \"0 0 16 16\",\n    \"width\": \"16\"\n  }, mdx(\"path\", {\n    parentName: \"svg\",\n    \"fillRule\": \"evenodd\",\n    \"d\": \"M4 9h1v1H4c-1.5 0-3-1.69-3-3.5S2.55 3 4 3h4c1.45 0 3 1.69 3 3.5 0 1.41-.91 2.72-2 3.25V8.59c.58-.45 1-1.27 1-2.09C10 5.22 8.98 4 8 4H4c-.98 0-2 1.22-2 2.5S3 9 4 9zm9-3h-1v1h1c1 0 2 1.22 2 2.5S13.98 12 13 12H9c-.98 0-2-1.22-2-2.5 0-.83.42-1.64 1-2.09V6.25c-1.09.53-2 1.84-2 3.25C6 11.31 7.55 13 9 13h4c1.45 0 3-1.69 3-3.5S14.5 6 13 6z\"\n  }))), `Learn more`), mdx(\"ul\", null, mdx(\"li\", {\n    parentName: \"ul\"\n  }, mdx(\"a\", {\n    parentName: \"li\",\n    \"href\": \"https://content-guide.18f.gov/active-voice/\"\n  }, `18F Content Guide `, `-`, ` Active voice`))), mdx(\"h2\", {\n    \"id\": \"component-maturity\",\n    \"style\": {\n      \"position\": \"relative\"\n    }\n  }, mdx(\"a\", {\n    parentName: \"h2\",\n    \"href\": \"#component-maturity\",\n    \"aria-label\": \"component maturity permalink\",\n    \"className\": \"anchor before\"\n  }, mdx(\"svg\", {\n    parentName: \"a\",\n    \"aria-hidden\": \"true\",\n    \"focusable\": \"false\",\n    \"height\": \"16\",\n    \"version\": \"1.1\",\n    \"viewBox\": \"0 0 16 16\",\n    \"width\": \"16\"\n  }, mdx(\"path\", {\n    parentName: \"svg\",\n    \"fillRule\": \"evenodd\",\n    \"d\": \"M4 9h1v1H4c-1.5 0-3-1.69-3-3.5S2.55 3 4 3h4c1.45 0 3 1.69 3 3.5 0 1.41-.91 2.72-2 3.25V8.59c.58-.45 1-1.27 1-2.09C10 5.22 8.98 4 8 4H4c-.98 0-2 1.22-2 2.5S3 9 4 9zm9-3h-1v1h1c1 0 2 1.22 2 2.5S13.98 12 13 12H9c-.98 0-2-1.22-2-2.5 0-.83.42-1.64 1-2.09V6.25c-1.09.53-2 1.84-2 3.25C6 11.31 7.55 13 9 13h4c1.45 0 3-1.69 3-3.5S14.5 6 13 6z\"\n  }))), `Component maturity`), mdx(MaturityChecklist, {\n    a11yStandards: true,\n    color: true,\n    forcedColors: true,\n    screenReaders: true,\n    keyboardNavigable: null,\n    storybook: true,\n    responsive: true,\n    spanish: true,\n    completeUiKit: false,\n    responsiveUiKit: false,\n    tokensInCode: true,\n    tokensInSketch: true,\n    mdxType: \"MaturityChecklist\"\n  }), mdx(\"h2\", {\n    \"id\": \"code\",\n    \"style\": {\n      \"position\": \"relative\"\n    }\n  }, mdx(\"a\", {\n    parentName: \"h2\",\n    \"href\": \"#code\",\n    \"aria-label\": \"code permalink\",\n    \"className\": \"anchor before\"\n  }, mdx(\"svg\", {\n    parentName: \"a\",\n    \"aria-hidden\": \"true\",\n    \"focusable\": \"false\",\n    \"height\": \"16\",\n    \"version\": \"1.1\",\n    \"viewBox\": \"0 0 16 16\",\n    \"width\": \"16\"\n  }, mdx(\"path\", {\n    parentName: \"svg\",\n    \"fillRule\": \"evenodd\",\n    \"d\": \"M4 9h1v1H4c-1.5 0-3-1.69-3-3.5S2.55 3 4 3h4c1.45 0 3 1.69 3 3.5 0 1.41-.91 2.72-2 3.25V8.59c.58-.45 1-1.27 1-2.09C10 5.22 8.98 4 8 4H4c-.98 0-2 1.22-2 2.5S3 9 4 9zm9-3h-1v1h1c1 0 2 1.22 2 2.5S13.98 12 13 12H9c-.98 0-2-1.22-2-2.5 0-.83.42-1.64 1-2.09V6.25c-1.09.53-2 1.84-2 3.25C6 11.31 7.55 13 9 13h4c1.45 0 3-1.69 3-3.5S14.5 6 13 6z\"\n  }))), `Code`), mdx(\"h3\", {\n    \"id\": \"react\",\n    \"style\": {\n      \"position\": \"relative\"\n    }\n  }, mdx(\"a\", {\n    parentName: \"h3\",\n    \"href\": \"#react\",\n    \"aria-label\": \"react permalink\",\n    \"className\": \"anchor before\"\n  }, mdx(\"svg\", {\n    parentName: \"a\",\n    \"aria-hidden\": \"true\",\n    \"focusable\": \"false\",\n    \"height\": \"16\",\n    \"version\": \"1.1\",\n    \"viewBox\": \"0 0 16 16\",\n    \"width\": \"16\"\n  }, mdx(\"path\", {\n    parentName: \"svg\",\n    \"fillRule\": \"evenodd\",\n    \"d\": \"M4 9h1v1H4c-1.5 0-3-1.69-3-3.5S2.55 3 4 3h4c1.45 0 3 1.69 3 3.5 0 1.41-.91 2.72-2 3.25V8.59c.58-.45 1-1.27 1-2.09C10 5.22 8.98 4 8 4H4c-.98 0-2 1.22-2 2.5S3 9 4 9zm9-3h-1v1h1c1 0 2 1.22 2 2.5S13.98 12 13 12H9c-.98 0-2-1.22-2-2.5 0-.83.42-1.64 1-2.09V6.25c-1.09.53-2 1.84-2 3.25C6 11.31 7.55 13 9 13h4c1.45 0 3-1.69 3-3.5S14.5 6 13 6z\"\n  }))), `React`), mdx(SeeStorybookForGuidance, {\n    storyId: 'components-alert--docs',\n    mdxType: \"SeeStorybookForGuidance\"\n  }), mdx(\"h3\", {\n    \"id\": \"web-component\",\n    \"style\": {\n      \"position\": \"relative\"\n    }\n  }, mdx(\"a\", {\n    parentName: \"h3\",\n    \"href\": \"#web-component\",\n    \"aria-label\": \"web component permalink\",\n    \"className\": \"anchor before\"\n  }, mdx(\"svg\", {\n    parentName: \"a\",\n    \"aria-hidden\": \"true\",\n    \"focusable\": \"false\",\n    \"height\": \"16\",\n    \"version\": \"1.1\",\n    \"viewBox\": \"0 0 16 16\",\n    \"width\": \"16\"\n  }, mdx(\"path\", {\n    parentName: \"svg\",\n    \"fillRule\": \"evenodd\",\n    \"d\": \"M4 9h1v1H4c-1.5 0-3-1.69-3-3.5S2.55 3 4 3h4c1.45 0 3 1.69 3 3.5 0 1.41-.91 2.72-2 3.25V8.59c.58-.45 1-1.27 1-2.09C10 5.22 8.98 4 8 4H4c-.98 0-2 1.22-2 2.5S3 9 4 9zm9-3h-1v1h1c1 0 2 1.22 2 2.5S13.98 12 13 12H9c-.98 0-2-1.22-2-2.5 0-.83.42-1.64 1-2.09V6.25c-1.09.53-2 1.84-2 3.25C6 11.31 7.55 13 9 13h4c1.45 0 3-1.69 3-3.5S14.5 6 13 6z\"\n  }))), `Web Component`), mdx(SeeStorybookForGuidance, {\n    tech: \"wc\",\n    storyId: 'web-components-alert--docs',\n    mdxType: \"SeeStorybookForGuidance\"\n  }), mdx(\"h3\", {\n    \"id\": \"style-customization\",\n    \"style\": {\n      \"position\": \"relative\"\n    }\n  }, mdx(\"a\", {\n    parentName: \"h3\",\n    \"href\": \"#style-customization\",\n    \"aria-label\": \"style customization permalink\",\n    \"className\": \"anchor before\"\n  }, mdx(\"svg\", {\n    parentName: \"a\",\n    \"aria-hidden\": \"true\",\n    \"focusable\": \"false\",\n    \"height\": \"16\",\n    \"version\": \"1.1\",\n    \"viewBox\": \"0 0 16 16\",\n    \"width\": \"16\"\n  }, mdx(\"path\", {\n    parentName: \"svg\",\n    \"fillRule\": \"evenodd\",\n    \"d\": \"M4 9h1v1H4c-1.5 0-3-1.69-3-3.5S2.55 3 4 3h4c1.45 0 3 1.69 3 3.5 0 1.41-.91 2.72-2 3.25V8.59c.58-.45 1-1.27 1-2.09C10 5.22 8.98 4 8 4H4c-.98 0-2 1.22-2 2.5S3 9 4 9zm9-3h-1v1h1c1 0 2 1.22 2 2.5S13.98 12 13 12H9c-.98 0-2-1.22-2-2.5 0-.83.42-1.64 1-2.09V6.25c-1.09.53-2 1.84-2 3.25C6 11.31 7.55 13 9 13h4c1.45 0 3-1.69 3-3.5S14.5 6 13 6z\"\n  }))), `Style customization`), mdx(\"p\", null, `The following CSS variables can be overridden to customize Alert components:`), mdx(ComponentThemeOptions, {\n    componentname: \"alert\",\n    mdxType: \"ComponentThemeOptions\"\n  }), mdx(\"h3\", {\n    \"id\": \"analytics\",\n    \"style\": {\n      \"position\": \"relative\"\n    }\n  }, mdx(\"a\", {\n    parentName: \"h3\",\n    \"href\": \"#analytics\",\n    \"aria-label\": \"analytics permalink\",\n    \"className\": \"anchor before\"\n  }, mdx(\"svg\", {\n    parentName: \"a\",\n    \"aria-hidden\": \"true\",\n    \"focusable\": \"false\",\n    \"height\": \"16\",\n    \"version\": \"1.1\",\n    \"viewBox\": \"0 0 16 16\",\n    \"width\": \"16\"\n  }, mdx(\"path\", {\n    parentName: \"svg\",\n    \"fillRule\": \"evenodd\",\n    \"d\": \"M4 9h1v1H4c-1.5 0-3-1.69-3-3.5S2.55 3 4 3h4c1.45 0 3 1.69 3 3.5 0 1.41-.91 2.72-2 3.25V8.59c.58-.45 1-1.27 1-2.09C10 5.22 8.98 4 8 4H4c-.98 0-2 1.22-2 2.5S3 9 4 9zm9-3h-1v1h1c1 0 2 1.22 2 2.5S13.98 12 13 12H9c-.98 0-2-1.22-2-2.5 0-.83.42-1.64 1-2.09V6.25c-1.09.53-2 1.84-2 3.25C6 11.31 7.55 13 9 13h4c1.45 0 3-1.69 3-3.5S14.5 6 13 6z\"\n  }))), `Analytics`), mdx(\"p\", null, `This component has analytics tracking available. Please see our developer documentation about `, mdx(\"a\", {\n    parentName: \"p\",\n    \"href\": \"/design-system/branch/pwolfert/release-10.1-blog-post/getting-started/for-developers/#analytics\"\n  }, `using analytics in the design system`), `.`));\n}\n;\nMDXContent.isMDXComponent = true;","tableOfContents":{"items":[{"url":"#examples","title":"Examples","items":[{"url":"#informational-default","title":"Informational (Default)"},{"url":"#error","title":"Error"},{"url":"#warning","title":"Warning"},{"url":"#success","title":"Success"},{"url":"#note","title":"Note"},{"url":"#lightweight","title":"Lightweight"}]},{"url":"#guidance","title":"Guidance","items":[{"url":"#usage","title":"Usage"},{"url":"#when-to-use","title":"When to use"},{"url":"#dont-use","title":"Don't use"},{"url":"#when-to-consider-alternatives","title":"When to consider alternatives"},{"url":"#display--behavior","title":"Display & behavior"},{"url":"#design-guidelines","title":"Design guidelines"},{"url":"#accessibility","title":"Accessibility"},{"url":"#content","title":"Content"}]},{"url":"#learn-more","title":"Learn more"},{"url":"#component-maturity","title":"Component maturity"},{"url":"#code","title":"Code","items":[{"url":"#react","title":"React"},{"url":"#web-component","title":"Web Component"},{"url":"#style-customization","title":"Style customization"},{"url":"#analytics","title":"Analytics"}]}]}}},"pageContext":{"id":"c3d9140d-92fd-55a7-8324-7a1afed3d6a3"}},"staticQueryHashes":["3481578012"]}