{"componentChunkName":"component---src-components-page-templates-info-page-tsx","path":"/foundation/typography/headings/","result":{"data":{"mdx":{"id":"584cd4cc-56ca-58c4-aee4-d3087f7fd2c4","frontmatter":{"title":"Headings","intro":"Headings help to provide a quick, organized way to organize the main sections of a website.","status":null,"cmsgov":{"figmaNodeId":"6007-9078"},"core":{"figmaNodeId":"887-14614","githubLink":"design-system/src/styles/_base.scss","storybookLink":"foundations-typography-headings--all-headings"},"healthcare":{"figmaNodeId":"2070-49066","storybookLink":null,"githubLink":null},"medicare":{"figmaNodeId":"4052-37058","storybookLink":null,"githubLink":null}},"slug":"foundation/typography/headings","body":"const _excluded = [\"components\"];\nfunction _extends() { return _extends = Object.assign ? Object.assign.bind() : function (n) { for (var e = 1; e < arguments.length; e++) { var t = arguments[e]; for (var r in t) ({}).hasOwnProperty.call(t, r) && (n[r] = t[r]); } return n; }, _extends.apply(null, arguments); }\nfunction _objectWithoutProperties(e, t) { if (null == e) return {}; var o, r, i = _objectWithoutPropertiesLoose(e, t); if (Object.getOwnPropertySymbols) { var s = Object.getOwnPropertySymbols(e); for (r = 0; r < s.length; r++) o = s[r], t.includes(o) || {}.propertyIsEnumerable.call(e, o) && (i[o] = e[o]); } return i; }\nfunction _objectWithoutPropertiesLoose(r, e) { if (null == r) return {}; var t = {}; for (var n in r) if ({}.hasOwnProperty.call(r, n)) { if (e.includes(n)) continue; t[n] = r[n]; } return t; }\n/* @jsxRuntime classic */\n/* @jsx mdx */\n\nconst _frontmatter = {\n  \"title\": \"Headings\",\n  \"order\": 21,\n  \"intro\": \"Headings help to provide a quick, organized way to organize the main sections of a website.\",\n  \"cmsgov\": {\n    \"figmaNodeId\": \"6007-9078\"\n  },\n  \"core\": {\n    \"figmaNodeId\": \"887-14614\",\n    \"githubLink\": \"design-system/src/styles/_base.scss\",\n    \"storybookLink\": \"foundations-typography-headings--all-headings\"\n  },\n  \"healthcare\": {\n    \"figmaNodeId\": \"2070-49066\"\n  },\n  \"medicare\": {\n    \"figmaNodeId\": \"4052-37058\"\n  }\n};\nconst makeShortcode = name => function MDXDefaultShortcode(props) {\n  console.warn(\"Component \" + name + \" was not imported, exported, or provided by MDXProvider as global scope\");\n  return mdx(\"div\", props);\n};\nconst ThemeContent = makeShortcode(\"ThemeContent\");\nconst TypographyUsageTable = makeShortcode(\"TypographyUsageTable\");\nconst ResponsiveExample = makeShortcode(\"ResponsiveExample\");\nconst EmbeddedExample = makeShortcode(\"EmbeddedExample\");\nconst layoutProps = {\n  _frontmatter\n};\nconst MDXLayout = \"wrapper\";\nreturn function MDXContent(_ref) {\n  let {\n      components\n    } = _ref,\n    props = _objectWithoutProperties(_ref, _excluded);\n  return mdx(MDXLayout, _extends({}, layoutProps, props, {\n    components: components,\n    mdxType: \"MDXLayout\"\n  }), mdx(\"h2\", {\n    \"id\": \"heading-font-family\",\n    \"style\": {\n      \"position\": \"relative\"\n    }\n  }, mdx(\"a\", {\n    parentName: \"h2\",\n    \"href\": \"#heading-font-family\",\n    \"aria-label\": \"heading font family permalink\",\n    \"className\": \"anchor before\"\n  }, mdx(\"svg\", {\n    parentName: \"a\",\n    \"aria-hidden\": \"true\",\n    \"focusable\": \"false\",\n    \"height\": \"16\",\n    \"version\": \"1.1\",\n    \"viewBox\": \"0 0 16 16\",\n    \"width\": \"16\"\n  }, mdx(\"path\", {\n    parentName: \"svg\",\n    \"fillRule\": \"evenodd\",\n    \"d\": \"M4 9h1v1H4c-1.5 0-3-1.69-3-3.5S2.55 3 4 3h4c1.45 0 3 1.69 3 3.5 0 1.41-.91 2.72-2 3.25V8.59c.58-.45 1-1.27 1-2.09C10 5.22 8.98 4 8 4H4c-.98 0-2 1.22-2 2.5S3 9 4 9zm9-3h-1v1h1c1 0 2 1.22 2 2.5S13.98 12 13 12H9c-.98 0-2-1.22-2-2.5 0-.83.42-1.64 1-2.09V6.25c-1.09.53-2 1.84-2 3.25C6 11.31 7.55 13 9 13h4c1.45 0 3-1.69 3-3.5S14.5 6 13 6z\"\n  }))), `Heading font family`), mdx(ThemeContent, {\n    onlyThemes: ['core'],\n    mdxType: \"ThemeContent\"\n  }, \"Core uses Open Sans for all headings.\"), mdx(ThemeContent, {\n    onlyThemes: ['cmsgov'],\n    mdxType: \"ThemeContent\"\n  }, \"CMS.gov uses Lexend for all headings.\"), mdx(ThemeContent, {\n    onlyThemes: ['healthcare'],\n    mdxType: \"ThemeContent\"\n  }, \"Healthcare.gov uses Open Sans for all headings.\"), mdx(ThemeContent, {\n    onlyThemes: ['medicare'],\n    mdxType: \"ThemeContent\"\n  }, \"Medicare.gov uses Montserrat for all headings.\"), mdx(\"p\", null, `The design system doesn't style base HTML typography elements (like `, mdx(\"inlineCode\", {\n    parentName: \"p\"\n  }, `h1`), `, `, mdx(\"inlineCode\", {\n    parentName: \"p\"\n  }, `h2`), `, `, mdx(\"inlineCode\", {\n    parentName: \"p\"\n  }, `p`), `, etc.) unless they're inside an element with the `, mdx(\"a\", {\n    parentName: \"p\",\n    \"href\": \"/design-system/branch/tamara/WNMGDS-3349/add-status-to-frontmatter/foundation/typography/content\"\n  }, `ds-content class`), `. Instead, it provides heading classes (available on this page) corresponding to visual sizes. These classes can be applied to any heading elements, irrespective of their semantic heading level (`, mdx(\"inlineCode\", {\n    parentName: \"p\"\n  }, `h1`), ` to `, mdx(\"inlineCode\", {\n    parentName: \"p\"\n  }, `h6`), `). This approach allows teams to first choose the semantic heading level that make the most sense for the document and its accessibility and then choose a visual heading size class that fits the page's visual hierarchy.`), mdx(\"h2\", {\n    \"id\": \"responsive-typography\",\n    \"style\": {\n      \"position\": \"relative\"\n    }\n  }, mdx(\"a\", {\n    parentName: \"h2\",\n    \"href\": \"#responsive-typography\",\n    \"aria-label\": \"responsive typography permalink\",\n    \"className\": \"anchor before\"\n  }, mdx(\"svg\", {\n    parentName: \"a\",\n    \"aria-hidden\": \"true\",\n    \"focusable\": \"false\",\n    \"height\": \"16\",\n    \"version\": \"1.1\",\n    \"viewBox\": \"0 0 16 16\",\n    \"width\": \"16\"\n  }, mdx(\"path\", {\n    parentName: \"svg\",\n    \"fillRule\": \"evenodd\",\n    \"d\": \"M4 9h1v1H4c-1.5 0-3-1.69-3-3.5S2.55 3 4 3h4c1.45 0 3 1.69 3 3.5 0 1.41-.91 2.72-2 3.25V8.59c.58-.45 1-1.27 1-2.09C10 5.22 8.98 4 8 4H4c-.98 0-2 1.22-2 2.5S3 9 4 9zm9-3h-1v1h1c1 0 2 1.22 2 2.5S13.98 12 13 12H9c-.98 0-2-1.22-2-2.5 0-.83.42-1.64 1-2.09V6.25c-1.09.53-2 1.84-2 3.25C6 11.31 7.55 13 9 13h4c1.45 0 3-1.69 3-3.5S14.5 6 13 6z\"\n  }))), `Responsive typography`), mdx(\"p\", null, mdx(\"inlineCode\", {\n    parentName: \"p\"\n  }, `.ds-text-heading-5xl`), `, `, mdx(\"inlineCode\", {\n    parentName: \"p\"\n  }, `ds-text-heading-4xl`), `, and `, mdx(\"inlineCode\", {\n    parentName: \"p\"\n  }, `ds-text-heading-3xl`), ` classes are responsive by default.`), mdx(\"p\", null, `To apply responsive typography elsewhere, use the `, mdx(\"a\", {\n    parentName: \"p\",\n    \"href\": \"/design-system/branch/tamara/WNMGDS-3349/add-status-to-frontmatter/utilities/font/font-size/#responsive-font-sizes\"\n  }, `font size utility class`), `.\nSince the base typography margins and line height is measured in `, mdx(\"inlineCode\", {\n    parentName: \"p\"\n  }, `em`), ` units,\nthey'll automatically adjust as you change the font size.`), mdx(TypographyUsageTable, {\n    caption: \"All / Small breakpoints\",\n    headers: [{\n      dataKey: 'cssClass',\n      label: 'CSS class'\n    }, {\n      dataKey: 'figmaToken',\n      label: 'Figma token'\n    }, {\n      dataKey: 'example',\n      label: 'Example'\n    }, {\n      dataKey: 'usage',\n      label: 'Usage'\n    }],\n    data: [{\n      cssClass: 'ds-text-heading--sm',\n      figmaToken: 'Headings/Small'\n    }, {\n      cssClass: 'ds-text-heading--md',\n      figmaToken: 'Headings/Medium',\n      usage: {\n        cmsgov: 'Footer headings',\n        healthcare: 'H2 in megamenus',\n        medicare: 'Search headers'\n      }\n    }, {\n      cssClass: 'ds-text-heading--lg',\n      figmaToken: 'Headings/Large',\n      usage: {\n        healthcare: 'H4 - subsection headings',\n        medicare: 'Footer menu headers'\n      }\n    }, {\n      cssClass: 'ds-text-heading--xl',\n      figmaToken: 'Headings/XL',\n      usage: {\n        cmsgov: 'H3 headers in cards',\n        healthcare: 'H3 - subsection headings',\n        medicare: 'Card headers'\n      }\n    }, {\n      cssClass: 'ds-text-heading--2xl',\n      figmaToken: 'Headings/2xl/2xl',\n      usage: {\n        cmsgov: 'H3 headers',\n        healthcare: 'H2 - section headings',\n        medicare: 'Mobile menu drawer header'\n      }\n    }, {\n      cssClass: 'ds-text-heading--3xl',\n      figmaToken: 'Headings/3xl/3xl - MD-SM',\n      usage: {\n        cmsgov: 'Search prompt on homepage',\n        healthcare: 'H1 for homepage heroes, page headings',\n        medicare: 'Internal page headers'\n      }\n    }, {\n      cssClass: 'ds-text-heading--4xl',\n      figmaToken: 'Headings/4xl/4xl - MD-SM',\n      example: {\n        medicare: null\n      }\n    }, {\n      cssClass: 'ds-text-heading--5xl',\n      figmaToken: 'Headings/5xl/5xl - SM',\n      usage: {\n        cmsgov: 'H1 on homepage; internal page titles',\n        healthcare: 'H1 on Get Coverage; Keep Coverage',\n        medicare: 'Learn, Resources headers'\n      }\n    }],\n    mdxType: \"TypographyUsageTable\"\n  }), mdx(TypographyUsageTable, {\n    caption: \"Medium breakpoints\",\n    headers: [{\n      dataKey: 'cssClass',\n      label: 'CSS class'\n    }, {\n      dataKey: 'figmaToken',\n      label: 'Figma token'\n    }, {\n      dataKey: 'example',\n      label: 'Example'\n    }],\n    data: [{\n      cssClass: 'ds-text-heading--3xl',\n      figmaToken: 'Headings/3xl/3xl - MD-SM'\n    }, {\n      cssClass: 'ds-text-heading--4xl',\n      figmaToken: 'Headings/4xl/4xl - MD-SM',\n      example: {\n        medicare: null\n      }\n    }, {\n      cssClass: 'ds-text-heading--5xl',\n      figmaToken: 'Headings/5xl/5xl - MD'\n    }],\n    mdxType: \"TypographyUsageTable\"\n  }), mdx(TypographyUsageTable, {\n    caption: \"Large breakpoints and up\",\n    headers: [{\n      dataKey: 'cssClass',\n      label: 'CSS class'\n    }, {\n      dataKey: 'figmaToken',\n      label: 'Figma token'\n    }, {\n      dataKey: 'example',\n      label: 'Example'\n    }],\n    data: [{\n      cssClass: 'ds-text-heading--3xl',\n      figmaToken: 'Headings/3xl/3xl - LG'\n    }, {\n      cssClass: 'ds-text-heading--4xl',\n      figmaToken: 'Headings/4xl/4xl - LG',\n      example: {\n        medicare: null\n      }\n    }, {\n      cssClass: 'ds-text-heading--5xl',\n      figmaToken: 'Headings/5xl/5xl - LG'\n    }],\n    mdxType: \"TypographyUsageTable\"\n  }), mdx(\"table\", null, mdx(\"thead\", {\n    parentName: \"table\"\n  }, mdx(\"tr\", {\n    parentName: \"thead\"\n  }, mdx(\"th\", {\n    parentName: \"tr\",\n    \"align\": null\n  }, `CSS Class`), mdx(\"th\", {\n    parentName: \"tr\",\n    \"align\": null\n  }, `545px and below`), mdx(\"th\", {\n    parentName: \"tr\",\n    \"align\": null\n  }, `545px to 768px`), mdx(\"th\", {\n    parentName: \"tr\",\n    \"align\": null\n  }, `768px and above`))), mdx(\"tbody\", {\n    parentName: \"table\"\n  }, mdx(\"tr\", {\n    parentName: \"tbody\"\n  }, mdx(\"td\", {\n    parentName: \"tr\",\n    \"align\": null\n  }, mdx(\"inlineCode\", {\n    parentName: \"td\"\n  }, `.ds-text-heading-5xl`)), mdx(\"td\", {\n    parentName: \"tr\",\n    \"align\": null\n  }, `36px`), mdx(\"td\", {\n    parentName: \"tr\",\n    \"align\": null\n  }, `48px`), mdx(\"td\", {\n    parentName: \"tr\",\n    \"align\": null\n  }, `60px`)), mdx(\"tr\", {\n    parentName: \"tbody\"\n  }, mdx(\"td\", {\n    parentName: \"tr\",\n    \"align\": null\n  }, mdx(\"inlineCode\", {\n    parentName: \"td\"\n  }, `.ds-text-heading-4xl`)), mdx(\"td\", {\n    parentName: \"tr\",\n    \"align\": null\n  }, `36px`), mdx(\"td\", {\n    parentName: \"tr\",\n    \"align\": null\n  }, `36px`), mdx(\"td\", {\n    parentName: \"tr\",\n    \"align\": null\n  }, `48px`)), mdx(\"tr\", {\n    parentName: \"tbody\"\n  }, mdx(\"td\", {\n    parentName: \"tr\",\n    \"align\": null\n  }, mdx(\"inlineCode\", {\n    parentName: \"td\"\n  }, `.ds-text-heading-3xl`)), mdx(\"td\", {\n    parentName: \"tr\",\n    \"align\": null\n  }, `30px`), mdx(\"td\", {\n    parentName: \"tr\",\n    \"align\": null\n  }, `30px`), mdx(\"td\", {\n    parentName: \"tr\",\n    \"align\": null\n  }, `36px`)))), mdx(ResponsiveExample, {\n    storyId: \"foundations-typography-headings--responsive-headings\",\n    title: \"Responsive typography example\",\n    mdxType: \"ResponsiveExample\"\n  }), mdx(\"h2\", {\n    \"id\": \"headings-links\",\n    \"style\": {\n      \"position\": \"relative\"\n    }\n  }, mdx(\"a\", {\n    parentName: \"h2\",\n    \"href\": \"#headings-links\",\n    \"aria-label\": \"headings links permalink\",\n    \"className\": \"anchor before\"\n  }, mdx(\"svg\", {\n    parentName: \"a\",\n    \"aria-hidden\": \"true\",\n    \"focusable\": \"false\",\n    \"height\": \"16\",\n    \"version\": \"1.1\",\n    \"viewBox\": \"0 0 16 16\",\n    \"width\": \"16\"\n  }, mdx(\"path\", {\n    parentName: \"svg\",\n    \"fillRule\": \"evenodd\",\n    \"d\": \"M4 9h1v1H4c-1.5 0-3-1.69-3-3.5S2.55 3 4 3h4c1.45 0 3 1.69 3 3.5 0 1.41-.91 2.72-2 3.25V8.59c.58-.45 1-1.27 1-2.09C10 5.22 8.98 4 8 4H4c-.98 0-2 1.22-2 2.5S3 9 4 9zm9-3h-1v1h1c1 0 2 1.22 2 2.5S13.98 12 13 12H9c-.98 0-2-1.22-2-2.5 0-.83.42-1.64 1-2.09V6.25c-1.09.53-2 1.84-2 3.25C6 11.31 7.55 13 9 13h4c1.45 0 3-1.69 3-3.5S14.5 6 13 6z\"\n  }))), `Headings Links`), mdx(\"p\", null, `Links nested within elements styled with heading tags, or styled directly as headings, will render as links in the appropriate size and weight. There is no additional CSS class to apply, but Figma contains tokens specific to rendering links. Medium breakpoints are given as an example below.`), mdx(\"p\", null, `Please note that in Figma, the color token is separate from the font token and needs to be applied independently.`), mdx(TypographyUsageTable, {\n    caption: \"All / Small breakpoints as links\",\n    headers: [{\n      dataKey: 'cssClass',\n      label: 'CSS class'\n    }, {\n      dataKey: 'figmaToken',\n      label: 'Figma token'\n    }, {\n      dataKey: 'example',\n      label: 'Example'\n    }],\n    data: [{\n      cssClass: 'ds-text-heading--sm',\n      figmaToken: 'Links/Headings/Small',\n      example: 'example-link'\n    }, {\n      cssClass: 'ds-text-heading--md',\n      figmaToken: 'Links/Headings/Medium',\n      example: 'example-link'\n    }, {\n      cssClass: 'ds-text-heading--lg',\n      figmaToken: 'Links/Headings/Large',\n      example: 'example-link'\n    }, {\n      cssClass: 'ds-text-heading--xl',\n      figmaToken: 'Links/Headings/XL',\n      example: 'example-link'\n    }, {\n      cssClass: 'ds-text-heading--2xl',\n      figmaToken: 'Links/Headings/2xl/2xl',\n      example: 'example-link'\n    }, {\n      cssClass: 'ds-text-heading--3xl',\n      figmaToken: 'Links/Headings/3xl/3xl - MD-SM',\n      example: 'example-link'\n    }, {\n      cssClass: 'ds-text-heading--4xl',\n      figmaToken: 'Links/Headings/4xl/4xl - MD-SM',\n      example: 'example-link'\n    }, {\n      cssClass: 'ds-text-heading--5xl',\n      figmaToken: 'Links/Headings/5xl/5xl - SM',\n      example: 'example-link'\n    }],\n    mdxType: \"TypographyUsageTable\"\n  }), mdx(TypographyUsageTable, {\n    caption: \"Medium breakpoints as links\",\n    headers: [{\n      dataKey: 'cssClass',\n      label: 'CSS class'\n    }, {\n      dataKey: 'figmaToken',\n      label: 'Figma token'\n    }, {\n      dataKey: 'example',\n      label: 'Example'\n    }],\n    data: [{\n      cssClass: 'ds-text-heading--3xl',\n      figmaToken: 'Links/Headings/3xl/3xl - MD-SM',\n      example: 'example-link'\n    }, {\n      cssClass: 'ds-text-heading--4xl',\n      figmaToken: 'Links/Headings/4xl/4xl - MD-SM',\n      example: 'example-link'\n    }, {\n      cssClass: 'ds-text-heading--5xl',\n      figmaToken: 'Links/Headings/5xl/5xl - MD',\n      example: 'example-link'\n    }],\n    mdxType: \"TypographyUsageTable\"\n  }), mdx(TypographyUsageTable, {\n    caption: \"Large breakpoints and up as links\",\n    headers: [{\n      dataKey: 'cssClass',\n      label: 'CSS class'\n    }, {\n      dataKey: 'figmaToken',\n      label: 'Figma token'\n    }, {\n      dataKey: 'example',\n      label: 'Example'\n    }],\n    data: [{\n      cssClass: 'ds-text-heading--3xl',\n      figmaToken: 'Links/Headings/3xl/3xl - LG',\n      example: 'example-link'\n    }, {\n      cssClass: 'ds-text-heading--4xl',\n      figmaToken: 'Links/Headings/4xl/4xl - LG',\n      example: 'example-link'\n    }, {\n      cssClass: 'ds-text-heading--5xl',\n      figmaToken: 'Links/Headings/5xl/5xl - LG',\n      example: 'example-link'\n    }],\n    mdxType: \"TypographyUsageTable\"\n  }), mdx(\"h2\", {\n    \"id\": \"specific-examples\",\n    \"style\": {\n      \"position\": \"relative\"\n    }\n  }, mdx(\"a\", {\n    parentName: \"h2\",\n    \"href\": \"#specific-examples\",\n    \"aria-label\": \"specific examples permalink\",\n    \"className\": \"anchor before\"\n  }, mdx(\"svg\", {\n    parentName: \"a\",\n    \"aria-hidden\": \"true\",\n    \"focusable\": \"false\",\n    \"height\": \"16\",\n    \"version\": \"1.1\",\n    \"viewBox\": \"0 0 16 16\",\n    \"width\": \"16\"\n  }, mdx(\"path\", {\n    parentName: \"svg\",\n    \"fillRule\": \"evenodd\",\n    \"d\": \"M4 9h1v1H4c-1.5 0-3-1.69-3-3.5S2.55 3 4 3h4c1.45 0 3 1.69 3 3.5 0 1.41-.91 2.72-2 3.25V8.59c.58-.45 1-1.27 1-2.09C10 5.22 8.98 4 8 4H4c-.98 0-2 1.22-2 2.5S3 9 4 9zm9-3h-1v1h1c1 0 2 1.22 2 2.5S13.98 12 13 12H9c-.98 0-2-1.22-2-2.5 0-.83.42-1.64 1-2.09V6.25c-1.09.53-2 1.84-2 3.25C6 11.31 7.55 13 9 13h4c1.45 0 3-1.69 3-3.5S14.5 6 13 6z\"\n  }))), `Specific examples`), mdx(\"h3\", {\n    \"id\": \"on-dark-background\",\n    \"style\": {\n      \"position\": \"relative\"\n    }\n  }, mdx(\"a\", {\n    parentName: \"h3\",\n    \"href\": \"#on-dark-background\",\n    \"aria-label\": \"on dark background permalink\",\n    \"className\": \"anchor before\"\n  }, mdx(\"svg\", {\n    parentName: \"a\",\n    \"aria-hidden\": \"true\",\n    \"focusable\": \"false\",\n    \"height\": \"16\",\n    \"version\": \"1.1\",\n    \"viewBox\": \"0 0 16 16\",\n    \"width\": \"16\"\n  }, mdx(\"path\", {\n    parentName: \"svg\",\n    \"fillRule\": \"evenodd\",\n    \"d\": \"M4 9h1v1H4c-1.5 0-3-1.69-3-3.5S2.55 3 4 3h4c1.45 0 3 1.69 3 3.5 0 1.41-.91 2.72-2 3.25V8.59c.58-.45 1-1.27 1-2.09C10 5.22 8.98 4 8 4H4c-.98 0-2 1.22-2 2.5S3 9 4 9zm9-3h-1v1h1c1 0 2 1.22 2 2.5S13.98 12 13 12H9c-.98 0-2-1.22-2-2.5 0-.83.42-1.64 1-2.09V6.25c-1.09.53-2 1.84-2 3.25C6 11.31 7.55 13 9 13h4c1.45 0 3-1.69 3-3.5S14.5 6 13 6z\"\n  }))), `On dark background`), mdx(EmbeddedExample, {\n    mdxType: \"EmbeddedExample\"\n  }, mdx(\"div\", {\n    className: \"ds-base--inverse ds-u-padding--2\"\n  }, mdx(\"h3\", {\n    className: \"ds-text-heading--lg\"\n  }, \"Example heading on dark background\"), mdx(\"h3\", {\n    className: \"ds-text-heading--lg\"\n  }, mdx(\"a\", {\n    href: \"javascript:void(0);\"\n  }, \"Example link heading on dark background\")))), mdx(ThemeContent, {\n    onlyThemes: ['medicare'],\n    mdxType: \"ThemeContent\"\n  }, mdx(\"h3\", {\n    \"id\": \"custom-heading-styles\",\n    \"style\": {\n      \"position\": \"relative\"\n    }\n  }, mdx(\"a\", {\n    parentName: \"h3\",\n    \"href\": \"#custom-heading-styles\",\n    \"aria-label\": \"custom heading styles permalink\",\n    \"className\": \"anchor before\"\n  }, mdx(\"svg\", {\n    parentName: \"a\",\n    \"aria-hidden\": \"true\",\n    \"focusable\": \"false\",\n    \"height\": \"16\",\n    \"version\": \"1.1\",\n    \"viewBox\": \"0 0 16 16\",\n    \"width\": \"16\"\n  }, mdx(\"path\", {\n    parentName: \"svg\",\n    \"fillRule\": \"evenodd\",\n    \"d\": \"M4 9h1v1H4c-1.5 0-3-1.69-3-3.5S2.55 3 4 3h4c1.45 0 3 1.69 3 3.5 0 1.41-.91 2.72-2 3.25V8.59c.58-.45 1-1.27 1-2.09C10 5.22 8.98 4 8 4H4c-.98 0-2 1.22-2 2.5S3 9 4 9zm9-3h-1v1h1c1 0 2 1.22 2 2.5S13.98 12 13 12H9c-.98 0-2-1.22-2-2.5 0-.83.42-1.64 1-2.09V6.25c-1.09.53-2 1.84-2 3.25C6 11.31 7.55 13 9 13h4c1.45 0 3-1.69 3-3.5S14.5 6 13 6z\"\n  }))), `Custom heading styles`), mdx(\"h4\", {\n    \"id\": \"teal-heading\",\n    \"style\": {\n      \"position\": \"relative\"\n    }\n  }, mdx(\"a\", {\n    parentName: \"h4\",\n    \"href\": \"#teal-heading\",\n    \"aria-label\": \"teal heading permalink\",\n    \"className\": \"anchor before\"\n  }, mdx(\"svg\", {\n    parentName: \"a\",\n    \"aria-hidden\": \"true\",\n    \"focusable\": \"false\",\n    \"height\": \"16\",\n    \"version\": \"1.1\",\n    \"viewBox\": \"0 0 16 16\",\n    \"width\": \"16\"\n  }, mdx(\"path\", {\n    parentName: \"svg\",\n    \"fillRule\": \"evenodd\",\n    \"d\": \"M4 9h1v1H4c-1.5 0-3-1.69-3-3.5S2.55 3 4 3h4c1.45 0 3 1.69 3 3.5 0 1.41-.91 2.72-2 3.25V8.59c.58-.45 1-1.27 1-2.09C10 5.22 8.98 4 8 4H4c-.98 0-2 1.22-2 2.5S3 9 4 9zm9-3h-1v1h1c1 0 2 1.22 2 2.5S13.98 12 13 12H9c-.98 0-2-1.22-2-2.5 0-.83.42-1.64 1-2.09V6.25c-1.09.53-2 1.84-2 3.25C6 11.31 7.55 13 9 13h4c1.45 0 3-1.69 3-3.5S14.5 6 13 6z\"\n  }))), `Teal heading`), mdx(\"p\", null, `Only used for landing pages and marketing material to apply emphasis to words within a header.`), mdx(EmbeddedExample, {\n    mdxType: \"EmbeddedExample\"\n  }, mdx(\"h3\", {\n    className: \"ds-text-heading--lg ds-u-color--primary\"\n  }, \"Example teal heading\"))), mdx(\"h3\", {\n    \"id\": \"eyebroweyelash-header\",\n    \"style\": {\n      \"position\": \"relative\"\n    }\n  }, mdx(\"a\", {\n    parentName: \"h3\",\n    \"href\": \"#eyebroweyelash-header\",\n    \"aria-label\": \"eyebroweyelash header permalink\",\n    \"className\": \"anchor before\"\n  }, mdx(\"svg\", {\n    parentName: \"a\",\n    \"aria-hidden\": \"true\",\n    \"focusable\": \"false\",\n    \"height\": \"16\",\n    \"version\": \"1.1\",\n    \"viewBox\": \"0 0 16 16\",\n    \"width\": \"16\"\n  }, mdx(\"path\", {\n    parentName: \"svg\",\n    \"fillRule\": \"evenodd\",\n    \"d\": \"M4 9h1v1H4c-1.5 0-3-1.69-3-3.5S2.55 3 4 3h4c1.45 0 3 1.69 3 3.5 0 1.41-.91 2.72-2 3.25V8.59c.58-.45 1-1.27 1-2.09C10 5.22 8.98 4 8 4H4c-.98 0-2 1.22-2 2.5S3 9 4 9zm9-3h-1v1h1c1 0 2 1.22 2 2.5S13.98 12 13 12H9c-.98 0-2-1.22-2-2.5 0-.83.42-1.64 1-2.09V6.25c-1.09.53-2 1.84-2 3.25C6 11.31 7.55 13 9 13h4c1.45 0 3-1.69 3-3.5S14.5 6 13 6z\"\n  }))), `Eyebrow/Eyelash header`), mdx(\"p\", null, `In some cases, it is better to group header elements into a header component. This can be referred to as the Eyelash/Eyebrow header where you have the main header and an optional top header (eyebrow) or bottom header (eyelash) header.`), mdx(\"p\", null, `This is an optional header design.`), mdx(EmbeddedExample, {\n    mdxType: \"EmbeddedExample\"\n  }, mdx(\"h3\", {\n    className: \"ds-text-heading--md ds-u-margin-bottom--0\"\n  }, \"Example eyebrow header\"), mdx(\"h1\", {\n    className: \"ds-text-heading--3xl ds-u-margin--0\"\n  }, \"Example main header\"), mdx(\"p\", {\n    className: \"ds-text-body--md ds-u-margin-top--0\"\n  }, \"Example eyelash header\")), mdx(\"h2\", {\n    \"id\": \"code\",\n    \"style\": {\n      \"position\": \"relative\"\n    }\n  }, mdx(\"a\", {\n    parentName: \"h2\",\n    \"href\": \"#code\",\n    \"aria-label\": \"code permalink\",\n    \"className\": \"anchor before\"\n  }, mdx(\"svg\", {\n    parentName: \"a\",\n    \"aria-hidden\": \"true\",\n    \"focusable\": \"false\",\n    \"height\": \"16\",\n    \"version\": \"1.1\",\n    \"viewBox\": \"0 0 16 16\",\n    \"width\": \"16\"\n  }, mdx(\"path\", {\n    parentName: \"svg\",\n    \"fillRule\": \"evenodd\",\n    \"d\": \"M4 9h1v1H4c-1.5 0-3-1.69-3-3.5S2.55 3 4 3h4c1.45 0 3 1.69 3 3.5 0 1.41-.91 2.72-2 3.25V8.59c.58-.45 1-1.27 1-2.09C10 5.22 8.98 4 8 4H4c-.98 0-2 1.22-2 2.5S3 9 4 9zm9-3h-1v1h1c1 0 2 1.22 2 2.5S13.98 12 13 12H9c-.98 0-2-1.22-2-2.5 0-.83.42-1.64 1-2.09V6.25c-1.09.53-2 1.84-2 3.25C6 11.31 7.55 13 9 13h4c1.45 0 3-1.69 3-3.5S14.5 6 13 6z\"\n  }))), `Code`), mdx(Alert, {\n    variation: \"warn\",\n    heading: \"First and last children\",\n    mdxType: \"Alert\"\n  }, mdx(\"p\", null, `The design system heading styles have alternate margins for headings that are the first or last child of their parent element. Headings that are the first child have no top margin, and headings that are last children have no bottom margin. Some examples of what we mean:`), mdx(\"pre\", null, mdx(\"code\", {\n    parentName: \"pre\",\n    \"className\": \"language-html\"\n  }, `<main>\n  <h1>I'm the first child of my parent.</h1>\n  <h2>I'm not the first child of my parent</h2>\n  <div>\n    <h2>\n      I'm actually the first child of my parent even though I'm not the first heading on the page\n    </h2>\n    <h2>I'm the last child of my parent</h2>\n  </div>\n  <h2>I'm also the last child of my parent</h2>\n</main>\n`))), mdx(\"h3\", {\n    \"id\": \"style-customization\",\n    \"style\": {\n      \"position\": \"relative\"\n    }\n  }, mdx(\"a\", {\n    parentName: \"h3\",\n    \"href\": \"#style-customization\",\n    \"aria-label\": \"style customization permalink\",\n    \"className\": \"anchor before\"\n  }, mdx(\"svg\", {\n    parentName: \"a\",\n    \"aria-hidden\": \"true\",\n    \"focusable\": \"false\",\n    \"height\": \"16\",\n    \"version\": \"1.1\",\n    \"viewBox\": \"0 0 16 16\",\n    \"width\": \"16\"\n  }, mdx(\"path\", {\n    parentName: \"svg\",\n    \"fillRule\": \"evenodd\",\n    \"d\": \"M4 9h1v1H4c-1.5 0-3-1.69-3-3.5S2.55 3 4 3h4c1.45 0 3 1.69 3 3.5 0 1.41-.91 2.72-2 3.25V8.59c.58-.45 1-1.27 1-2.09C10 5.22 8.98 4 8 4H4c-.98 0-2 1.22-2 2.5S3 9 4 9zm9-3h-1v1h1c1 0 2 1.22 2 2.5S13.98 12 13 12H9c-.98 0-2-1.22-2-2.5 0-.83.42-1.64 1-2.09V6.25c-1.09.53-2 1.84-2 3.25C6 11.31 7.55 13 9 13h4c1.45 0 3-1.69 3-3.5S14.5 6 13 6z\"\n  }))), `Style customization`), mdx(\"p\", null, `The following CSS variables can be overridden to change the type sizes:`), mdx(\"ul\", null, mdx(\"li\", {\n    parentName: \"ul\"\n  }, mdx(\"inlineCode\", {\n    parentName: \"li\"\n  }, `--font-size-5xl`)), mdx(\"li\", {\n    parentName: \"ul\"\n  }, mdx(\"inlineCode\", {\n    parentName: \"li\"\n  }, `--font-size-4xl`)), mdx(\"li\", {\n    parentName: \"ul\"\n  }, mdx(\"inlineCode\", {\n    parentName: \"li\"\n  }, `--font-size-3xl`)), mdx(\"li\", {\n    parentName: \"ul\"\n  }, mdx(\"inlineCode\", {\n    parentName: \"li\"\n  }, `--font-size-2xl`)), mdx(\"li\", {\n    parentName: \"ul\"\n  }, mdx(\"inlineCode\", {\n    parentName: \"li\"\n  }, `--font-size-xl`)), mdx(\"li\", {\n    parentName: \"ul\"\n  }, mdx(\"inlineCode\", {\n    parentName: \"li\"\n  }, `--font-size-lg`)), mdx(\"li\", {\n    parentName: \"ul\"\n  }, mdx(\"inlineCode\", {\n    parentName: \"li\"\n  }, `--font-size-md`), `, uses `, mdx(\"inlineCode\", {\n    parentName: \"li\"\n  }, `--font-size-base`)), mdx(\"li\", {\n    parentName: \"ul\"\n  }, mdx(\"inlineCode\", {\n    parentName: \"li\"\n  }, `--font-size-sm`))), mdx(\"h2\", {\n    \"id\": \"guidance\",\n    \"style\": {\n      \"position\": \"relative\"\n    }\n  }, mdx(\"a\", {\n    parentName: \"h2\",\n    \"href\": \"#guidance\",\n    \"aria-label\": \"guidance permalink\",\n    \"className\": \"anchor before\"\n  }, mdx(\"svg\", {\n    parentName: \"a\",\n    \"aria-hidden\": \"true\",\n    \"focusable\": \"false\",\n    \"height\": \"16\",\n    \"version\": \"1.1\",\n    \"viewBox\": \"0 0 16 16\",\n    \"width\": \"16\"\n  }, mdx(\"path\", {\n    parentName: \"svg\",\n    \"fillRule\": \"evenodd\",\n    \"d\": \"M4 9h1v1H4c-1.5 0-3-1.69-3-3.5S2.55 3 4 3h4c1.45 0 3 1.69 3 3.5 0 1.41-.91 2.72-2 3.25V8.59c.58-.45 1-1.27 1-2.09C10 5.22 8.98 4 8 4H4c-.98 0-2 1.22-2 2.5S3 9 4 9zm9-3h-1v1h1c1 0 2 1.22 2 2.5S13.98 12 13 12H9c-.98 0-2-1.22-2-2.5 0-.83.42-1.64 1-2.09V6.25c-1.09.53-2 1.84-2 3.25C6 11.31 7.55 13 9 13h4c1.45 0 3-1.69 3-3.5S14.5 6 13 6z\"\n  }))), `Guidance`), mdx(\"h3\", {\n    \"id\": \"the-ds-content-class\",\n    \"style\": {\n      \"position\": \"relative\"\n    }\n  }, mdx(\"a\", {\n    parentName: \"h3\",\n    \"href\": \"#the-ds-content-class\",\n    \"aria-label\": \"the ds content class permalink\",\n    \"className\": \"anchor before\"\n  }, mdx(\"svg\", {\n    parentName: \"a\",\n    \"aria-hidden\": \"true\",\n    \"focusable\": \"false\",\n    \"height\": \"16\",\n    \"version\": \"1.1\",\n    \"viewBox\": \"0 0 16 16\",\n    \"width\": \"16\"\n  }, mdx(\"path\", {\n    parentName: \"svg\",\n    \"fillRule\": \"evenodd\",\n    \"d\": \"M4 9h1v1H4c-1.5 0-3-1.69-3-3.5S2.55 3 4 3h4c1.45 0 3 1.69 3 3.5 0 1.41-.91 2.72-2 3.25V8.59c.58-.45 1-1.27 1-2.09C10 5.22 8.98 4 8 4H4c-.98 0-2 1.22-2 2.5S3 9 4 9zm9-3h-1v1h1c1 0 2 1.22 2 2.5S13.98 12 13 12H9c-.98 0-2-1.22-2-2.5 0-.83.42-1.64 1-2.09V6.25c-1.09.53-2 1.84-2 3.25C6 11.31 7.55 13 9 13h4c1.45 0 3-1.69 3-3.5S14.5 6 13 6z\"\n  }))), `The `, mdx(\"inlineCode\", {\n    parentName: \"h3\"\n  }, `ds-content`), ` class`), mdx(\"p\", null, `For pages that are mainly about written content or places where you want to use a standard mapping of heading-level styles to semantic heading levels, consider using the `, mdx(\"a\", {\n    parentName: \"p\",\n    \"href\": \"/design-system/branch/tamara/WNMGDS-3349/add-status-to-frontmatter/foundation/typography/content/\"\n  }, mdx(\"inlineCode\", {\n    parentName: \"a\"\n  }, `ds-content`)), ` class.`), mdx(\"h3\", {\n    \"id\": \"layout-dos-and-donts\",\n    \"style\": {\n      \"position\": \"relative\"\n    }\n  }, mdx(\"a\", {\n    parentName: \"h3\",\n    \"href\": \"#layout-dos-and-donts\",\n    \"aria-label\": \"layout dos and donts permalink\",\n    \"className\": \"anchor before\"\n  }, mdx(\"svg\", {\n    parentName: \"a\",\n    \"aria-hidden\": \"true\",\n    \"focusable\": \"false\",\n    \"height\": \"16\",\n    \"version\": \"1.1\",\n    \"viewBox\": \"0 0 16 16\",\n    \"width\": \"16\"\n  }, mdx(\"path\", {\n    parentName: \"svg\",\n    \"fillRule\": \"evenodd\",\n    \"d\": \"M4 9h1v1H4c-1.5 0-3-1.69-3-3.5S2.55 3 4 3h4c1.45 0 3 1.69 3 3.5 0 1.41-.91 2.72-2 3.25V8.59c.58-.45 1-1.27 1-2.09C10 5.22 8.98 4 8 4H4c-.98 0-2 1.22-2 2.5S3 9 4 9zm9-3h-1v1h1c1 0 2 1.22 2 2.5S13.98 12 13 12H9c-.98 0-2-1.22-2-2.5 0-.83.42-1.64 1-2.09V6.25c-1.09.53-2 1.84-2 3.25C6 11.31 7.55 13 9 13h4c1.45 0 3-1.69 3-3.5S14.5 6 13 6z\"\n  }))), `Layout dos and don'ts`), mdx(\"p\", null, `There should always be a parent/child relationship between headers and content on the page. Every header should have a relationship to something else on the page. This can apply to many different relationships like a header and a form group or a header and list of links. Stray headers or content should be reevaluated.`), mdx(\"ul\", null, mdx(\"li\", {\n    parentName: \"ul\"\n  }, `Paragraph styles should never be used as a parent to another text element.`), mdx(\"li\", {\n    parentName: \"ul\"\n  }, `Header elements should never have equal or smaller font size than the paragraph element.`), mdx(\"li\", {\n    parentName: \"ul\"\n  }, `Not all paragraphs need a header, but all headers need children.`), mdx(\"li\", {\n    parentName: \"ul\"\n  }, `Every page should have one heading 1 (H1)`), mdx(\"li\", {\n    parentName: \"ul\"\n  }, `Headings style appearing under H1 should follow a logical order for information design and supporting various assistive technology devices/software.`), mdx(\"li\", {\n    parentName: \"ul\"\n  }, `Don't use a smaller header font size than the body font size`), mdx(\"li\", {\n    parentName: \"ul\"\n  }, `Don't use stray headers`)));\n}\n;\nMDXContent.isMDXComponent = true;","tableOfContents":{"items":[{"url":"#heading-font-family","title":"Heading font family"},{"url":"#responsive-typography","title":"Responsive typography"},{"url":"#headings-links","title":"Headings Links"},{"url":"#specific-examples","title":"Specific examples","items":[{"url":"#on-dark-background","title":"On dark background"},{"url":"#custom-heading-styles","title":"Custom heading styles"},{"url":"#eyebroweyelash-header","title":"Eyebrow/Eyelash header"}]},{"url":"#code","title":"Code","items":[{"url":"#style-customization","title":"Style customization"}]},{"url":"#guidance","title":"Guidance","items":[{"url":"#the-ds-content-class","title":"The ds-content class"},{"url":"#layout-dos-and-donts","title":"Layout dos and don'ts"}]}]}}},"pageContext":{"id":"584cd4cc-56ca-58c4-aee4-d3087f7fd2c4"}},"staticQueryHashes":["3481578012"]}