{"componentChunkName":"component---src-components-page-templates-info-page-tsx","path":"/components/month-picker/","result":{"data":{"mdx":{"id":"02ecc21d-7b62-553b-83ff-94533ca7eabc","frontmatter":{"title":"Month Picker","intro":null,"cmsgov":{"figmaNodeId":"6-94"},"core":{"figmaNodeId":"6-94","githubLink":"design-system/src/components/MonthPicker","storybookLink":"components-monthpicker--docs"},"healthcare":{"figmaNodeId":"6-94","storybookLink":null,"githubLink":null},"medicare":{"figmaNodeId":"6-94","storybookLink":null,"githubLink":null}},"slug":"components/month-picker","body":"const _excluded = [\"components\"];\nfunction _extends() { return _extends = Object.assign ? Object.assign.bind() : function (n) { for (var e = 1; e < arguments.length; e++) { var t = arguments[e]; for (var r in t) ({}).hasOwnProperty.call(t, r) && (n[r] = t[r]); } return n; }, _extends.apply(null, arguments); }\nfunction _objectWithoutProperties(e, t) { if (null == e) return {}; var o, r, i = _objectWithoutPropertiesLoose(e, t); if (Object.getOwnPropertySymbols) { var s = Object.getOwnPropertySymbols(e); for (r = 0; r < s.length; r++) o = s[r], t.includes(o) || {}.propertyIsEnumerable.call(e, o) && (i[o] = e[o]); } return i; }\nfunction _objectWithoutPropertiesLoose(r, e) { if (null == r) return {}; var t = {}; for (var n in r) if ({}.hasOwnProperty.call(r, n)) { if (e.includes(n)) continue; t[n] = r[n]; } return t; }\n/* @jsxRuntime classic */\n/* @jsx mdx */\n\nconst _frontmatter = {\n  \"title\": \"Month Picker\",\n  \"cmsgov\": {\n    \"figmaNodeId\": \"6-94\"\n  },\n  \"core\": {\n    \"figmaNodeId\": \"6-94\",\n    \"githubLink\": \"design-system/src/components/MonthPicker\",\n    \"storybookLink\": \"components-monthpicker--docs\"\n  },\n  \"healthcare\": {\n    \"figmaNodeId\": \"6-94\"\n  },\n  \"medicare\": {\n    \"figmaNodeId\": \"6-94\"\n  }\n};\nconst makeShortcode = name => function MDXDefaultShortcode(props) {\n  console.warn(\"Component \" + name + \" was not imported, exported, or provided by MDXProvider as global scope\");\n  return mdx(\"div\", props);\n};\nconst StorybookExample = makeShortcode(\"StorybookExample\");\nconst SeeStorybookForGuidance = makeShortcode(\"SeeStorybookForGuidance\");\nconst ComponentThemeOptions = makeShortcode(\"ComponentThemeOptions\");\nconst MaturityChecklist = makeShortcode(\"MaturityChecklist\");\nconst layoutProps = {\n  _frontmatter\n};\nconst MDXLayout = \"wrapper\";\nreturn function MDXContent(_ref) {\n  let {\n      components\n    } = _ref,\n    props = _objectWithoutProperties(_ref, _excluded);\n  return mdx(MDXLayout, _extends({}, layoutProps, props, {\n    components: components,\n    mdxType: \"MDXLayout\"\n  }), mdx(\"h2\", {\n    \"id\": \"examples\",\n    \"style\": {\n      \"position\": \"relative\"\n    }\n  }, mdx(\"a\", {\n    parentName: \"h2\",\n    \"href\": \"#examples\",\n    \"aria-label\": \"examples permalink\",\n    \"className\": \"anchor before\"\n  }, mdx(\"svg\", {\n    parentName: \"a\",\n    \"aria-hidden\": \"true\",\n    \"focusable\": \"false\",\n    \"height\": \"16\",\n    \"version\": \"1.1\",\n    \"viewBox\": \"0 0 16 16\",\n    \"width\": \"16\"\n  }, mdx(\"path\", {\n    parentName: \"svg\",\n    \"fillRule\": \"evenodd\",\n    \"d\": \"M4 9h1v1H4c-1.5 0-3-1.69-3-3.5S2.55 3 4 3h4c1.45 0 3 1.69 3 3.5 0 1.41-.91 2.72-2 3.25V8.59c.58-.45 1-1.27 1-2.09C10 5.22 8.98 4 8 4H4c-.98 0-2 1.22-2 2.5S3 9 4 9zm9-3h-1v1h1c1 0 2 1.22 2 2.5S13.98 12 13 12H9c-.98 0-2-1.22-2-2.5 0-.83.42-1.64 1-2.09V6.25c-1.09.53-2 1.84-2 3.25C6 11.31 7.55 13 9 13h4c1.45 0 3-1.69 3-3.5S14.5 6 13 6z\"\n  }))), `Examples`), mdx(\"p\", null, `The Month Picker component renders a grid of checkboxes with shortened month names as well as buttons for selecting or deselecting all. For internationalization one can pass a `, mdx(\"inlineCode\", {\n    parentName: \"p\"\n  }, `locale`), ` prop, and the month names will change to match the language of the locale. Full month names are also included as `, mdx(\"inlineCode\", {\n    parentName: \"p\"\n  }, `aria-label`), ` attributes.`), mdx(StorybookExample, {\n    componentName: \"monthPicker\",\n    storyId: \"components-monthpicker--default\",\n    mdxType: \"StorybookExample\"\n  }), mdx(\"h2\", {\n    \"id\": \"code\",\n    \"style\": {\n      \"position\": \"relative\"\n    }\n  }, mdx(\"a\", {\n    parentName: \"h2\",\n    \"href\": \"#code\",\n    \"aria-label\": \"code permalink\",\n    \"className\": \"anchor before\"\n  }, mdx(\"svg\", {\n    parentName: \"a\",\n    \"aria-hidden\": \"true\",\n    \"focusable\": \"false\",\n    \"height\": \"16\",\n    \"version\": \"1.1\",\n    \"viewBox\": \"0 0 16 16\",\n    \"width\": \"16\"\n  }, mdx(\"path\", {\n    parentName: \"svg\",\n    \"fillRule\": \"evenodd\",\n    \"d\": \"M4 9h1v1H4c-1.5 0-3-1.69-3-3.5S2.55 3 4 3h4c1.45 0 3 1.69 3 3.5 0 1.41-.91 2.72-2 3.25V8.59c.58-.45 1-1.27 1-2.09C10 5.22 8.98 4 8 4H4c-.98 0-2 1.22-2 2.5S3 9 4 9zm9-3h-1v1h1c1 0 2 1.22 2 2.5S13.98 12 13 12H9c-.98 0-2-1.22-2-2.5 0-.83.42-1.64 1-2.09V6.25c-1.09.53-2 1.84-2 3.25C6 11.31 7.55 13 9 13h4c1.45 0 3-1.69 3-3.5S14.5 6 13 6z\"\n  }))), `Code`), mdx(\"h3\", {\n    \"id\": \"react\",\n    \"style\": {\n      \"position\": \"relative\"\n    }\n  }, mdx(\"a\", {\n    parentName: \"h3\",\n    \"href\": \"#react\",\n    \"aria-label\": \"react permalink\",\n    \"className\": \"anchor before\"\n  }, mdx(\"svg\", {\n    parentName: \"a\",\n    \"aria-hidden\": \"true\",\n    \"focusable\": \"false\",\n    \"height\": \"16\",\n    \"version\": \"1.1\",\n    \"viewBox\": \"0 0 16 16\",\n    \"width\": \"16\"\n  }, mdx(\"path\", {\n    parentName: \"svg\",\n    \"fillRule\": \"evenodd\",\n    \"d\": \"M4 9h1v1H4c-1.5 0-3-1.69-3-3.5S2.55 3 4 3h4c1.45 0 3 1.69 3 3.5 0 1.41-.91 2.72-2 3.25V8.59c.58-.45 1-1.27 1-2.09C10 5.22 8.98 4 8 4H4c-.98 0-2 1.22-2 2.5S3 9 4 9zm9-3h-1v1h1c1 0 2 1.22 2 2.5S13.98 12 13 12H9c-.98 0-2-1.22-2-2.5 0-.83.42-1.64 1-2.09V6.25c-1.09.53-2 1.84-2 3.25C6 11.31 7.55 13 9 13h4c1.45 0 3-1.69 3-3.5S14.5 6 13 6z\"\n  }))), `React`), mdx(SeeStorybookForGuidance, {\n    storyId: 'components-monthpicker--docs',\n    mdxType: \"SeeStorybookForGuidance\"\n  }), mdx(\"h3\", {\n    \"id\": \"web-component\",\n    \"style\": {\n      \"position\": \"relative\"\n    }\n  }, mdx(\"a\", {\n    parentName: \"h3\",\n    \"href\": \"#web-component\",\n    \"aria-label\": \"web component permalink\",\n    \"className\": \"anchor before\"\n  }, mdx(\"svg\", {\n    parentName: \"a\",\n    \"aria-hidden\": \"true\",\n    \"focusable\": \"false\",\n    \"height\": \"16\",\n    \"version\": \"1.1\",\n    \"viewBox\": \"0 0 16 16\",\n    \"width\": \"16\"\n  }, mdx(\"path\", {\n    parentName: \"svg\",\n    \"fillRule\": \"evenodd\",\n    \"d\": \"M4 9h1v1H4c-1.5 0-3-1.69-3-3.5S2.55 3 4 3h4c1.45 0 3 1.69 3 3.5 0 1.41-.91 2.72-2 3.25V8.59c.58-.45 1-1.27 1-2.09C10 5.22 8.98 4 8 4H4c-.98 0-2 1.22-2 2.5S3 9 4 9zm9-3h-1v1h1c1 0 2 1.22 2 2.5S13.98 12 13 12H9c-.98 0-2-1.22-2-2.5 0-.83.42-1.64 1-2.09V6.25c-1.09.53-2 1.84-2 3.25C6 11.31 7.55 13 9 13h4c1.45 0 3-1.69 3-3.5S14.5 6 13 6z\"\n  }))), `Web Component`), mdx(SeeStorybookForGuidance, {\n    tech: \"wc\",\n    storyId: 'web-components-ds-month-picker--docs',\n    mdxType: \"SeeStorybookForGuidance\"\n  }), mdx(\"h3\", {\n    \"id\": \"style-customization\",\n    \"style\": {\n      \"position\": \"relative\"\n    }\n  }, mdx(\"a\", {\n    parentName: \"h3\",\n    \"href\": \"#style-customization\",\n    \"aria-label\": \"style customization permalink\",\n    \"className\": \"anchor before\"\n  }, mdx(\"svg\", {\n    parentName: \"a\",\n    \"aria-hidden\": \"true\",\n    \"focusable\": \"false\",\n    \"height\": \"16\",\n    \"version\": \"1.1\",\n    \"viewBox\": \"0 0 16 16\",\n    \"width\": \"16\"\n  }, mdx(\"path\", {\n    parentName: \"svg\",\n    \"fillRule\": \"evenodd\",\n    \"d\": \"M4 9h1v1H4c-1.5 0-3-1.69-3-3.5S2.55 3 4 3h4c1.45 0 3 1.69 3 3.5 0 1.41-.91 2.72-2 3.25V8.59c.58-.45 1-1.27 1-2.09C10 5.22 8.98 4 8 4H4c-.98 0-2 1.22-2 2.5S3 9 4 9zm9-3h-1v1h1c1 0 2 1.22 2 2.5S13.98 12 13 12H9c-.98 0-2-1.22-2-2.5 0-.83.42-1.64 1-2.09V6.25c-1.09.53-2 1.84-2 3.25C6 11.31 7.55 13 9 13h4c1.45 0 3-1.69 3-3.5S14.5 6 13 6z\"\n  }))), `Style customization`), mdx(\"p\", null, `The following CSS variables can be overridden to customize MonthPicker fields:`), mdx(ComponentThemeOptions, {\n    componentname: \"choice\",\n    mdxType: \"ComponentThemeOptions\"\n  }), mdx(\"h3\", {\n    \"id\": \"form-components\",\n    \"style\": {\n      \"position\": \"relative\"\n    }\n  }, mdx(\"a\", {\n    parentName: \"h3\",\n    \"href\": \"#form-components\",\n    \"aria-label\": \"form components permalink\",\n    \"className\": \"anchor before\"\n  }, mdx(\"svg\", {\n    parentName: \"a\",\n    \"aria-hidden\": \"true\",\n    \"focusable\": \"false\",\n    \"height\": \"16\",\n    \"version\": \"1.1\",\n    \"viewBox\": \"0 0 16 16\",\n    \"width\": \"16\"\n  }, mdx(\"path\", {\n    parentName: \"svg\",\n    \"fillRule\": \"evenodd\",\n    \"d\": \"M4 9h1v1H4c-1.5 0-3-1.69-3-3.5S2.55 3 4 3h4c1.45 0 3 1.69 3 3.5 0 1.41-.91 2.72-2 3.25V8.59c.58-.45 1-1.27 1-2.09C10 5.22 8.98 4 8 4H4c-.98 0-2 1.22-2 2.5S3 9 4 9zm9-3h-1v1h1c1 0 2 1.22 2 2.5S13.98 12 13 12H9c-.98 0-2-1.22-2-2.5 0-.83.42-1.64 1-2.09V6.25c-1.09.53-2 1.84-2 3.25C6 11.31 7.55 13 9 13h4c1.45 0 3-1.69 3-3.5S14.5 6 13 6z\"\n  }))), `Form components`), mdx(\"p\", null, `This component also makes use of form field styles, which can be customized by the following variables:`), mdx(ComponentThemeOptions, {\n    componentname: \"form\",\n    mdxType: \"ComponentThemeOptions\"\n  }), mdx(\"h2\", {\n    \"id\": \"component-maturity\",\n    \"style\": {\n      \"position\": \"relative\"\n    }\n  }, mdx(\"a\", {\n    parentName: \"h2\",\n    \"href\": \"#component-maturity\",\n    \"aria-label\": \"component maturity permalink\",\n    \"className\": \"anchor before\"\n  }, mdx(\"svg\", {\n    parentName: \"a\",\n    \"aria-hidden\": \"true\",\n    \"focusable\": \"false\",\n    \"height\": \"16\",\n    \"version\": \"1.1\",\n    \"viewBox\": \"0 0 16 16\",\n    \"width\": \"16\"\n  }, mdx(\"path\", {\n    parentName: \"svg\",\n    \"fillRule\": \"evenodd\",\n    \"d\": \"M4 9h1v1H4c-1.5 0-3-1.69-3-3.5S2.55 3 4 3h4c1.45 0 3 1.69 3 3.5 0 1.41-.91 2.72-2 3.25V8.59c.58-.45 1-1.27 1-2.09C10 5.22 8.98 4 8 4H4c-.98 0-2 1.22-2 2.5S3 9 4 9zm9-3h-1v1h1c1 0 2 1.22 2 2.5S13.98 12 13 12H9c-.98 0-2-1.22-2-2.5 0-.83.42-1.64 1-2.09V6.25c-1.09.53-2 1.84-2 3.25C6 11.31 7.55 13 9 13h4c1.45 0 3-1.69 3-3.5S14.5 6 13 6z\"\n  }))), `Component maturity`), mdx(MaturityChecklist, {\n    a11yStandards: true,\n    color: true,\n    forcedColors: true,\n    screenReaders: true,\n    keyboardNavigable: true,\n    storybook: true,\n    responsive: true,\n    spanish: true,\n    completeUiKit: false,\n    responsiveUiKit: false,\n    tokensInCode: true,\n    tokensInSketch: true,\n    mdxType: \"MaturityChecklist\"\n  }));\n}\n;\nMDXContent.isMDXComponent = true;","tableOfContents":{"items":[{"url":"#examples","title":"Examples"},{"url":"#code","title":"Code","items":[{"url":"#react","title":"React"},{"url":"#web-component","title":"Web Component"},{"url":"#style-customization","title":"Style customization"},{"url":"#form-components","title":"Form components"}]},{"url":"#component-maturity","title":"Component maturity"}]}}},"pageContext":{"id":"02ecc21d-7b62-553b-83ff-94533ca7eabc"}},"staticQueryHashes":["3481578012"]}