{"componentChunkName":"component---src-components-page-templates-info-page-tsx","path":"/components/icon/","result":{"data":{"mdx":{"id":"efb72159-5ab8-59f2-bfad-c9670cfed9e3","frontmatter":{"title":"Icon","intro":"Icons help communicate meaning, actions, status, or feedback.","cmsgov":{"figmaNodeId":"6-92"},"core":{"figmaNodeId":"6-92","githubLink":"design-system/src/components/Icons","storybookLink":"components-icons--docs"},"healthcare":{"figmaNodeId":"6-92","storybookLink":null,"githubLink":null},"medicare":{"figmaNodeId":"6-92","storybookLink":null,"githubLink":null}},"slug":"components/icon","body":"const _excluded = [\"components\"];\nfunction _extends() { return _extends = Object.assign ? Object.assign.bind() : function (n) { for (var e = 1; e < arguments.length; e++) { var t = arguments[e]; for (var r in t) ({}).hasOwnProperty.call(t, r) && (n[r] = t[r]); } return n; }, _extends.apply(null, arguments); }\nfunction _objectWithoutProperties(e, t) { if (null == e) return {}; var o, r, i = _objectWithoutPropertiesLoose(e, t); if (Object.getOwnPropertySymbols) { var s = Object.getOwnPropertySymbols(e); for (r = 0; r < s.length; r++) o = s[r], t.includes(o) || {}.propertyIsEnumerable.call(e, o) && (i[o] = e[o]); } return i; }\nfunction _objectWithoutPropertiesLoose(r, e) { if (null == r) return {}; var t = {}; for (var n in r) if ({}.hasOwnProperty.call(r, n)) { if (e.includes(n)) continue; t[n] = r[n]; } return t; }\n/* @jsxRuntime classic */\n/* @jsx mdx */\n\nconst _frontmatter = {\n  \"title\": \"Icon\",\n  \"intro\": \"Icons help communicate meaning, actions, status, or feedback.\",\n  \"cmsgov\": {\n    \"figmaNodeId\": \"6-92\"\n  },\n  \"core\": {\n    \"githubLink\": \"design-system/src/components/Icons\",\n    \"figmaNodeId\": \"6-92\",\n    \"storybookLink\": \"components-icons--docs\"\n  },\n  \"healthcare\": {\n    \"figmaNodeId\": \"6-92\"\n  },\n  \"medicare\": {\n    \"figmaNodeId\": \"6-92\"\n  }\n};\nconst makeShortcode = name => function MDXDefaultShortcode(props) {\n  console.warn(\"Component \" + name + \" was not imported, exported, or provided by MDXProvider as global scope\");\n  return mdx(\"div\", props);\n};\nconst ThemeContent = makeShortcode(\"ThemeContent\");\nconst StorybookExample = makeShortcode(\"StorybookExample\");\nconst EmbeddedExample = makeShortcode(\"EmbeddedExample\");\nconst SeeStorybookForGuidance = makeShortcode(\"SeeStorybookForGuidance\");\nconst MaturityChecklist = makeShortcode(\"MaturityChecklist\");\nconst layoutProps = {\n  _frontmatter\n};\nconst MDXLayout = \"wrapper\";\nreturn function MDXContent(_ref) {\n  let {\n      components\n    } = _ref,\n    props = _objectWithoutProperties(_ref, _excluded);\n  return mdx(MDXLayout, _extends({}, layoutProps, props, {\n    components: components,\n    mdxType: \"MDXLayout\"\n  }), mdx(ThemeContent, {\n    onlyThemes: ['healthcare'],\n    mdxType: \"ThemeContent\"\n  }, mdx(\"p\", null, `Icons are a key part of the user interface. They are language-independent and can help users efficiently navigate and perform desired tasks. They can describe an action better than words alone; communicating concepts faster and in less space than text, reducing cognitive load.`), mdx(\"p\", null, `They require a careful balance when applied. When used thoughtfully, icons help users understand your interface quickly and easily. When icons are overdone, they crowd the interface and add unnecessary complexity and confuse users instead of guiding them.`), mdx(\"h2\", {\n    \"id\": \"product-icons\",\n    \"style\": {\n      \"position\": \"relative\"\n    }\n  }, mdx(\"a\", {\n    parentName: \"h2\",\n    \"href\": \"#product-icons\",\n    \"aria-label\": \"product icons permalink\",\n    \"className\": \"anchor before\"\n  }, mdx(\"svg\", {\n    parentName: \"a\",\n    \"aria-hidden\": \"true\",\n    \"focusable\": \"false\",\n    \"height\": \"16\",\n    \"version\": \"1.1\",\n    \"viewBox\": \"0 0 16 16\",\n    \"width\": \"16\"\n  }, mdx(\"path\", {\n    parentName: \"svg\",\n    \"fillRule\": \"evenodd\",\n    \"d\": \"M4 9h1v1H4c-1.5 0-3-1.69-3-3.5S2.55 3 4 3h4c1.45 0 3 1.69 3 3.5 0 1.41-.91 2.72-2 3.25V8.59c.58-.45 1-1.27 1-2.09C10 5.22 8.98 4 8 4H4c-.98 0-2 1.22-2 2.5S3 9 4 9zm9-3h-1v1h1c1 0 2 1.22 2 2.5S13.98 12 13 12H9c-.98 0-2-1.22-2-2.5 0-.83.42-1.64 1-2.09V6.25c-1.09.53-2 1.84-2 3.25C6 11.31 7.55 13 9 13h4c1.45 0 3-1.69 3-3.5S14.5 6 13 6z\"\n  }))), `Product Icons`), mdx(\"p\", null, `Product icons not only serve a function in our products, but are also a visual expression of our brand. Each has visual distinction to ensure customers can easily tell them apart. Our product icons differ from system icons, which symbolize common actions. Our product icons include more flourish than other icon uses.`)), mdx(\"h2\", {\n    \"id\": \"examples\",\n    \"style\": {\n      \"position\": \"relative\"\n    }\n  }, mdx(\"a\", {\n    parentName: \"h2\",\n    \"href\": \"#examples\",\n    \"aria-label\": \"examples permalink\",\n    \"className\": \"anchor before\"\n  }, mdx(\"svg\", {\n    parentName: \"a\",\n    \"aria-hidden\": \"true\",\n    \"focusable\": \"false\",\n    \"height\": \"16\",\n    \"version\": \"1.1\",\n    \"viewBox\": \"0 0 16 16\",\n    \"width\": \"16\"\n  }, mdx(\"path\", {\n    parentName: \"svg\",\n    \"fillRule\": \"evenodd\",\n    \"d\": \"M4 9h1v1H4c-1.5 0-3-1.69-3-3.5S2.55 3 4 3h4c1.45 0 3 1.69 3 3.5 0 1.41-.91 2.72-2 3.25V8.59c.58-.45 1-1.27 1-2.09C10 5.22 8.98 4 8 4H4c-.98 0-2 1.22-2 2.5S3 9 4 9zm9-3h-1v1h1c1 0 2 1.22 2 2.5S13.98 12 13 12H9c-.98 0-2-1.22-2-2.5 0-.83.42-1.64 1-2.09V6.25c-1.09.53-2 1.84-2 3.25C6 11.31 7.55 13 9 13h4c1.45 0 3-1.69 3-3.5S14.5 6 13 6z\"\n  }))), `Examples`), mdx(\"p\", null, `The `, mdx(\"inlineCode\", {\n    parentName: \"p\"\n  }, `<SvgIcon>`), ` component is a re-usable component that wraps its children in an `, mdx(\"inlineCode\", {\n    parentName: \"p\"\n  }, `<svg>`), ` element.\nThis component is used by each individual icon component listed below.`), mdx(StorybookExample, {\n    componentName: \"icons\",\n    storyId: \"components-icons--available-icons\",\n    minHeight: 250,\n    mdxType: \"StorybookExample\"\n  }), mdx(ThemeContent, {\n    onlyThemes: ['medicare'],\n    mdxType: \"ThemeContent\"\n  }, mdx(\"h3\", {\n    id: \"medicare-specific-icons\"\n  }, \" Medicare-Specific Icons \"), mdx(StorybookExample, {\n    componentName: \"icons-medicare\",\n    storyId: \"medicare-icons--available-icons\",\n    minHeight: 250,\n    mdxType: \"StorybookExample\"\n  })), mdx(\"h3\", {\n    \"id\": \"changing-icon-color\",\n    \"style\": {\n      \"position\": \"relative\"\n    }\n  }, mdx(\"a\", {\n    parentName: \"h3\",\n    \"href\": \"#changing-icon-color\",\n    \"aria-label\": \"changing icon color permalink\",\n    \"className\": \"anchor before\"\n  }, mdx(\"svg\", {\n    parentName: \"a\",\n    \"aria-hidden\": \"true\",\n    \"focusable\": \"false\",\n    \"height\": \"16\",\n    \"version\": \"1.1\",\n    \"viewBox\": \"0 0 16 16\",\n    \"width\": \"16\"\n  }, mdx(\"path\", {\n    parentName: \"svg\",\n    \"fillRule\": \"evenodd\",\n    \"d\": \"M4 9h1v1H4c-1.5 0-3-1.69-3-3.5S2.55 3 4 3h4c1.45 0 3 1.69 3 3.5 0 1.41-.91 2.72-2 3.25V8.59c.58-.45 1-1.27 1-2.09C10 5.22 8.98 4 8 4H4c-.98 0-2 1.22-2 2.5S3 9 4 9zm9-3h-1v1h1c1 0 2 1.22 2 2.5S13.98 12 13 12H9c-.98 0-2-1.22-2-2.5 0-.83.42-1.64 1-2.09V6.25c-1.09.53-2 1.84-2 3.25C6 11.31 7.55 13 9 13h4c1.45 0 3-1.69 3-3.5S14.5 6 13 6z\"\n  }))), `Changing icon color`), mdx(\"p\", null, `Icon components support a few built-in color options that can be applied by using one of the following utility classes.`), mdx(\"p\", null, `If you need a different color for an icon, you can pass a custom class to an icon component through the `, mdx(\"inlineCode\", {\n    parentName: \"p\"\n  }, `class`), ` prop. Then, in your application CSS, set the `, mdx(\"inlineCode\", {\n    parentName: \"p\"\n  }, `color`), ` prop.`), mdx(\"table\", null, mdx(\"thead\", {\n    parentName: \"table\"\n  }, mdx(\"tr\", {\n    parentName: \"thead\"\n  }, mdx(\"th\", {\n    parentName: \"tr\",\n    \"align\": null\n  }, `Color`), mdx(\"th\", {\n    parentName: \"tr\",\n    \"align\": null\n  }, `CSS utility Class`), mdx(\"th\", {\n    parentName: \"tr\",\n    \"align\": null\n  }, `Example`))), mdx(\"tbody\", {\n    parentName: \"table\"\n  }, mdx(\"tr\", {\n    parentName: \"tbody\"\n  }, mdx(\"td\", {\n    parentName: \"tr\",\n    \"align\": null\n  }, `Primary`), mdx(\"td\", {\n    parentName: \"tr\",\n    \"align\": null\n  }, mdx(\"code\", null, `ds-c-icon-color--primary`)), mdx(\"td\", {\n    parentName: \"tr\",\n    \"align\": null\n  }, mdx(\"div\", {\n    className: \"ds-u-text-align--center\"\n  }, mdx(CloseIcon, {\n    className: \"ds-c-icon-color--primary\",\n    mdxType: \"CloseIcon\"\n  })))), mdx(\"tr\", {\n    parentName: \"tbody\"\n  }, mdx(\"td\", {\n    parentName: \"tr\",\n    \"align\": null\n  }, `Inverse`), mdx(\"td\", {\n    parentName: \"tr\",\n    \"align\": null\n  }, mdx(\"code\", null, `ds-c-icon-color--inverse`)), mdx(\"td\", {\n    parentName: \"tr\",\n    \"align\": null\n  }, mdx(\"div\", {\n    className: \"ds-base--inverse ds-u-padding--05 ds-u-text-align--center\"\n  }, mdx(CloseIcon, {\n    className: \"ds-c-icon-color--inverse\",\n    mdxType: \"CloseIcon\"\n  })))), mdx(\"tr\", {\n    parentName: \"tbody\"\n  }, mdx(\"td\", {\n    parentName: \"tr\",\n    \"align\": null\n  }, `Error`), mdx(\"td\", {\n    parentName: \"tr\",\n    \"align\": null\n  }, mdx(\"code\", null, `ds-c-icon-color--error`)), mdx(\"td\", {\n    parentName: \"tr\",\n    \"align\": null\n  }, mdx(\"div\", {\n    className: \"ds-u-text-align--center\"\n  }, mdx(CloseIcon, {\n    className: \"ds-c-icon-color--error\",\n    mdxType: \"CloseIcon\"\n  })))), mdx(\"tr\", {\n    parentName: \"tbody\"\n  }, mdx(\"td\", {\n    parentName: \"tr\",\n    \"align\": null\n  }, `Warn`), mdx(\"td\", {\n    parentName: \"tr\",\n    \"align\": null\n  }, mdx(\"code\", null, `ds-c-icon-color--warn`)), mdx(\"td\", {\n    parentName: \"tr\",\n    \"align\": null\n  }, mdx(\"div\", {\n    className: \"ds-u-text-align--center\"\n  }, mdx(CloseIcon, {\n    className: \"ds-c-icon-color--warn\",\n    mdxType: \"CloseIcon\"\n  })))), mdx(\"tr\", {\n    parentName: \"tbody\"\n  }, mdx(\"td\", {\n    parentName: \"tr\",\n    \"align\": null\n  }, `Success`), mdx(\"td\", {\n    parentName: \"tr\",\n    \"align\": null\n  }, mdx(\"code\", null, `ds-c-icon-color--success`)), mdx(\"td\", {\n    parentName: \"tr\",\n    \"align\": null\n  }, mdx(\"div\", {\n    className: \"ds-u-text-align--center\"\n  }, mdx(CloseIcon, {\n    className: \"ds-c-icon-color--success\",\n    mdxType: \"CloseIcon\"\n  }), ` `))))), mdx(\"h3\", {\n    \"id\": \"changing-icon-size\",\n    \"style\": {\n      \"position\": \"relative\"\n    }\n  }, mdx(\"a\", {\n    parentName: \"h3\",\n    \"href\": \"#changing-icon-size\",\n    \"aria-label\": \"changing icon size permalink\",\n    \"className\": \"anchor before\"\n  }, mdx(\"svg\", {\n    parentName: \"a\",\n    \"aria-hidden\": \"true\",\n    \"focusable\": \"false\",\n    \"height\": \"16\",\n    \"version\": \"1.1\",\n    \"viewBox\": \"0 0 16 16\",\n    \"width\": \"16\"\n  }, mdx(\"path\", {\n    parentName: \"svg\",\n    \"fillRule\": \"evenodd\",\n    \"d\": \"M4 9h1v1H4c-1.5 0-3-1.69-3-3.5S2.55 3 4 3h4c1.45 0 3 1.69 3 3.5 0 1.41-.91 2.72-2 3.25V8.59c.58-.45 1-1.27 1-2.09C10 5.22 8.98 4 8 4H4c-.98 0-2 1.22-2 2.5S3 9 4 9zm9-3h-1v1h1c1 0 2 1.22 2 2.5S13.98 12 13 12H9c-.98 0-2-1.22-2-2.5 0-.83.42-1.64 1-2.09V6.25c-1.09.53-2 1.84-2 3.25C6 11.31 7.55 13 9 13h4c1.45 0 3-1.69 3-3.5S14.5 6 13 6z\"\n  }))), `Changing icon size`), mdx(\"p\", null, `Icon components use `, mdx(\"inlineCode\", {\n    parentName: \"p\"\n  }, `ems`), ` for their height and width and can thereby be sized by changing the font-size of the SVG element.`), mdx(\"p\", null, `It is recommended that the `, mdx(\"a\", {\n    parentName: \"p\",\n    \"href\": \"/design-system/branch/tamara/WNMGDS-3219/add-usa-banner-a11y-guidance/utilities/font/font-size/\"\n  }, `font-size utilities`), ` be used.`), mdx(\"table\", null, mdx(\"thead\", {\n    parentName: \"table\"\n  }, mdx(\"tr\", {\n    parentName: \"thead\"\n  }, mdx(\"th\", {\n    parentName: \"tr\",\n    \"align\": null\n  }, `Size`), mdx(\"th\", {\n    parentName: \"tr\",\n    \"align\": null\n  }, `Example`))), mdx(\"tbody\", {\n    parentName: \"table\"\n  }, mdx(\"tr\", {\n    parentName: \"tbody\"\n  }, mdx(\"td\", {\n    parentName: \"tr\",\n    \"align\": null\n  }, `Small`), mdx(\"td\", {\n    parentName: \"tr\",\n    \"align\": null\n  }, mdx(CloseIcon, {\n    className: \"ds-u-font-size--sm\",\n    mdxType: \"CloseIcon\"\n  }))), mdx(\"tr\", {\n    parentName: \"tbody\"\n  }, mdx(\"td\", {\n    parentName: \"tr\",\n    \"align\": null\n  }, `Default`), mdx(\"td\", {\n    parentName: \"tr\",\n    \"align\": null\n  }, mdx(CloseIcon, {\n    mdxType: \"CloseIcon\"\n  }))), mdx(\"tr\", {\n    parentName: \"tbody\"\n  }, mdx(\"td\", {\n    parentName: \"tr\",\n    \"align\": null\n  }, `Large`), mdx(\"td\", {\n    parentName: \"tr\",\n    \"align\": null\n  }, mdx(CloseIcon, {\n    className: \"ds-u-font-size--lg\",\n    mdxType: \"CloseIcon\"\n  }))), mdx(\"tr\", {\n    parentName: \"tbody\"\n  }, mdx(\"td\", {\n    parentName: \"tr\",\n    \"align\": null\n  }, `Extra Large`), mdx(\"td\", {\n    parentName: \"tr\",\n    \"align\": null\n  }, mdx(CloseIcon, {\n    className: \"ds-u-font-size--xl\",\n    mdxType: \"CloseIcon\"\n  }))), mdx(\"tr\", {\n    parentName: \"tbody\"\n  }, mdx(\"td\", {\n    parentName: \"tr\",\n    \"align\": null\n  }, `2x Large`), mdx(\"td\", {\n    parentName: \"tr\",\n    \"align\": null\n  }, mdx(CloseIcon, {\n    className: \"ds-u-font-size--2xl\",\n    mdxType: \"CloseIcon\"\n  }))), mdx(\"tr\", {\n    parentName: \"tbody\"\n  }, mdx(\"td\", {\n    parentName: \"tr\",\n    \"align\": null\n  }, `3x Large`), mdx(\"td\", {\n    parentName: \"tr\",\n    \"align\": null\n  }, mdx(CloseIcon, {\n    className: \"ds-u-font-size--3xl\",\n    mdxType: \"CloseIcon\"\n  }))), mdx(\"tr\", {\n    parentName: \"tbody\"\n  }, mdx(\"td\", {\n    parentName: \"tr\",\n    \"align\": null\n  }, `4x Large`), mdx(\"td\", {\n    parentName: \"tr\",\n    \"align\": null\n  }, mdx(CloseIcon, {\n    className: \"ds-u-font-size--4xl\",\n    mdxType: \"CloseIcon\"\n  }))), mdx(\"tr\", {\n    parentName: \"tbody\"\n  }, mdx(\"td\", {\n    parentName: \"tr\",\n    \"align\": null\n  }, `5x Large`), mdx(\"td\", {\n    parentName: \"tr\",\n    \"align\": null\n  }, mdx(CloseIcon, {\n    className: \"ds-u-font-size--5xl\",\n    mdxType: \"CloseIcon\"\n  }))))), mdx(\"h3\", {\n    \"id\": \"creating-custom-icons\",\n    \"style\": {\n      \"position\": \"relative\"\n    }\n  }, mdx(\"a\", {\n    parentName: \"h3\",\n    \"href\": \"#creating-custom-icons\",\n    \"aria-label\": \"creating custom icons permalink\",\n    \"className\": \"anchor before\"\n  }, mdx(\"svg\", {\n    parentName: \"a\",\n    \"aria-hidden\": \"true\",\n    \"focusable\": \"false\",\n    \"height\": \"16\",\n    \"version\": \"1.1\",\n    \"viewBox\": \"0 0 16 16\",\n    \"width\": \"16\"\n  }, mdx(\"path\", {\n    parentName: \"svg\",\n    \"fillRule\": \"evenodd\",\n    \"d\": \"M4 9h1v1H4c-1.5 0-3-1.69-3-3.5S2.55 3 4 3h4c1.45 0 3 1.69 3 3.5 0 1.41-.91 2.72-2 3.25V8.59c.58-.45 1-1.27 1-2.09C10 5.22 8.98 4 8 4H4c-.98 0-2 1.22-2 2.5S3 9 4 9zm9-3h-1v1h1c1 0 2 1.22 2 2.5S13.98 12 13 12H9c-.98 0-2-1.22-2-2.5 0-.83.42-1.64 1-2.09V6.25c-1.09.53-2 1.84-2 3.25C6 11.31 7.55 13 9 13h4c1.45 0 3-1.69 3-3.5S14.5 6 13 6z\"\n  }))), `Creating custom icons`), mdx(\"p\", null, `The `, mdx(\"inlineCode\", {\n    parentName: \"p\"\n  }, `<SvgIcon>`), ` component can be used for other custom icons. It allows you to pass in the SVG child elements. This component is recommended if you want built-in accessibility features and standard icon styles.`), mdx(\"p\", null, `In the example below, the `, mdx(\"inlineCode\", {\n    parentName: \"p\"\n  }, `<SvgIcon>`), ` component is used with a custom path.`), mdx(EmbeddedExample, {\n    mdxType: \"EmbeddedExample\"\n  }, mdx(SvgIcon, {\n    title: \"Smiley face\",\n    viewBox: \"0 0 496 512\",\n    mdxType: \"SvgIcon\"\n  }, mdx(\"path\", {\n    d: \"M248 8C111 8 0 119 0 256s111 248 248 248 248-111 248-248S385 8 248 8zm0 448c-110.3 0-200-89.7-200-200S137.7 56 248 56s200 89.7 200 200-89.7 200-200 200zm-80-216c17.7 0 32-14.3 32-32s-14.3-32-32-32-32 14.3-32 32 14.3 32 32 32zm160 0c17.7 0 32-14.3 32-32s-14.3-32-32-32-32 14.3-32 32 14.3 32 32 32zm4 72.6c-20.8 25-51.5 39.4-84 39.4s-63.2-14.3-84-39.4c-8.5-10.2-23.7-11.5-33.8-3.1-10.2 8.5-11.5 23.6-3.1 33.8 30 36 74.1 56.6 120.9 56.6s90.9-20.6 120.9-56.6c8.5-10.2 7.1-25.3-3.1-33.8-10.1-8.4-25.3-7.1-33.8 3.1z\"\n  }))), mdx(\"h2\", {\n    \"id\": \"code\",\n    \"style\": {\n      \"position\": \"relative\"\n    }\n  }, mdx(\"a\", {\n    parentName: \"h2\",\n    \"href\": \"#code\",\n    \"aria-label\": \"code permalink\",\n    \"className\": \"anchor before\"\n  }, mdx(\"svg\", {\n    parentName: \"a\",\n    \"aria-hidden\": \"true\",\n    \"focusable\": \"false\",\n    \"height\": \"16\",\n    \"version\": \"1.1\",\n    \"viewBox\": \"0 0 16 16\",\n    \"width\": \"16\"\n  }, mdx(\"path\", {\n    parentName: \"svg\",\n    \"fillRule\": \"evenodd\",\n    \"d\": \"M4 9h1v1H4c-1.5 0-3-1.69-3-3.5S2.55 3 4 3h4c1.45 0 3 1.69 3 3.5 0 1.41-.91 2.72-2 3.25V8.59c.58-.45 1-1.27 1-2.09C10 5.22 8.98 4 8 4H4c-.98 0-2 1.22-2 2.5S3 9 4 9zm9-3h-1v1h1c1 0 2 1.22 2 2.5S13.98 12 13 12H9c-.98 0-2-1.22-2-2.5 0-.83.42-1.64 1-2.09V6.25c-1.09.53-2 1.84-2 3.25C6 11.31 7.55 13 9 13h4c1.45 0 3-1.69 3-3.5S14.5 6 13 6z\"\n  }))), `Code`), mdx(\"h3\", {\n    \"id\": \"react\",\n    \"style\": {\n      \"position\": \"relative\"\n    }\n  }, mdx(\"a\", {\n    parentName: \"h3\",\n    \"href\": \"#react\",\n    \"aria-label\": \"react permalink\",\n    \"className\": \"anchor before\"\n  }, mdx(\"svg\", {\n    parentName: \"a\",\n    \"aria-hidden\": \"true\",\n    \"focusable\": \"false\",\n    \"height\": \"16\",\n    \"version\": \"1.1\",\n    \"viewBox\": \"0 0 16 16\",\n    \"width\": \"16\"\n  }, mdx(\"path\", {\n    parentName: \"svg\",\n    \"fillRule\": \"evenodd\",\n    \"d\": \"M4 9h1v1H4c-1.5 0-3-1.69-3-3.5S2.55 3 4 3h4c1.45 0 3 1.69 3 3.5 0 1.41-.91 2.72-2 3.25V8.59c.58-.45 1-1.27 1-2.09C10 5.22 8.98 4 8 4H4c-.98 0-2 1.22-2 2.5S3 9 4 9zm9-3h-1v1h1c1 0 2 1.22 2 2.5S13.98 12 13 12H9c-.98 0-2-1.22-2-2.5 0-.83.42-1.64 1-2.09V6.25c-1.09.53-2 1.84-2 3.25C6 11.31 7.55 13 9 13h4c1.45 0 3-1.69 3-3.5S14.5 6 13 6z\"\n  }))), `React`), mdx(SeeStorybookForGuidance, {\n    storyId: 'components-icons--docs',\n    mdxType: \"SeeStorybookForGuidance\"\n  }), mdx(\"h2\", {\n    \"id\": \"guidance\",\n    \"style\": {\n      \"position\": \"relative\"\n    }\n  }, mdx(\"a\", {\n    parentName: \"h2\",\n    \"href\": \"#guidance\",\n    \"aria-label\": \"guidance permalink\",\n    \"className\": \"anchor before\"\n  }, mdx(\"svg\", {\n    parentName: \"a\",\n    \"aria-hidden\": \"true\",\n    \"focusable\": \"false\",\n    \"height\": \"16\",\n    \"version\": \"1.1\",\n    \"viewBox\": \"0 0 16 16\",\n    \"width\": \"16\"\n  }, mdx(\"path\", {\n    parentName: \"svg\",\n    \"fillRule\": \"evenodd\",\n    \"d\": \"M4 9h1v1H4c-1.5 0-3-1.69-3-3.5S2.55 3 4 3h4c1.45 0 3 1.69 3 3.5 0 1.41-.91 2.72-2 3.25V8.59c.58-.45 1-1.27 1-2.09C10 5.22 8.98 4 8 4H4c-.98 0-2 1.22-2 2.5S3 9 4 9zm9-3h-1v1h1c1 0 2 1.22 2 2.5S13.98 12 13 12H9c-.98 0-2-1.22-2-2.5 0-.83.42-1.64 1-2.09V6.25c-1.09.53-2 1.84-2 3.25C6 11.31 7.55 13 9 13h4c1.45 0 3-1.69 3-3.5S14.5 6 13 6z\"\n  }))), `Guidance`), mdx(ThemeContent, {\n    onlyThemes: ['medicare'],\n    mdxType: \"ThemeContent\"\n  }, mdx(\"h2\", {\n    \"id\": \"guidance-1\",\n    \"style\": {\n      \"position\": \"relative\"\n    }\n  }, mdx(\"a\", {\n    parentName: \"h2\",\n    \"href\": \"#guidance-1\",\n    \"aria-label\": \"guidance 1 permalink\",\n    \"className\": \"anchor before\"\n  }, mdx(\"svg\", {\n    parentName: \"a\",\n    \"aria-hidden\": \"true\",\n    \"focusable\": \"false\",\n    \"height\": \"16\",\n    \"version\": \"1.1\",\n    \"viewBox\": \"0 0 16 16\",\n    \"width\": \"16\"\n  }, mdx(\"path\", {\n    parentName: \"svg\",\n    \"fillRule\": \"evenodd\",\n    \"d\": \"M4 9h1v1H4c-1.5 0-3-1.69-3-3.5S2.55 3 4 3h4c1.45 0 3 1.69 3 3.5 0 1.41-.91 2.72-2 3.25V8.59c.58-.45 1-1.27 1-2.09C10 5.22 8.98 4 8 4H4c-.98 0-2 1.22-2 2.5S3 9 4 9zm9-3h-1v1h1c1 0 2 1.22 2 2.5S13.98 12 13 12H9c-.98 0-2-1.22-2-2.5 0-.83.42-1.64 1-2.09V6.25c-1.09.53-2 1.84-2 3.25C6 11.31 7.55 13 9 13h4c1.45 0 3-1.69 3-3.5S14.5 6 13 6z\"\n  }))), `Guidance`), mdx(\"ul\", null, mdx(\"li\", {\n    parentName: \"ul\"\n  }, mdx(\"b\", null, \"Use icons sparingly\"), \" - Only use if they add value/meaning for the user. Too many icons = users stop paying attention.\"), mdx(\"li\", {\n    parentName: \"ul\"\n  }, mdx(\"b\", null, \"Use the approved icon for similar actions/purpose\"), \" - Consistency across the entire site is key for user recognition and trust.\", ' '), mdx(\"li\", {\n    parentName: \"ul\"\n  }, mdx(\"b\", null, \"Include a text label with most icons\"), \" - Users need text to overcome ambiguity.\"), mdx(\"li\", {\n    parentName: \"ul\"\n  }, mdx(\"b\", null, \"Any new icons or changes in use case need prior approval\"), \" - Contact the internal CMS Design Guild early in your design process. (See \\\"Foundations\\\" page for process.) -- Specialty icons for similar use cases are rare. Requests will be considered on a case-by-case basis. In reviewing requests, we'll consider use case, similar icons already approved, and impact to users (UX, consistency, Medicare brand, purpose, and accompanying message impact - like immediate & severe bene harm).\"), mdx(\"li\", {\n    parentName: \"ul\"\n  }, mdx(\"b\", null, \"Icons can be teal, navy, or black (following approved M.gov DS color swatches) unless stated in the use case notes below.\")))), mdx(\"h3\", {\n    \"id\": \"accessibility\",\n    \"style\": {\n      \"position\": \"relative\"\n    }\n  }, mdx(\"a\", {\n    parentName: \"h3\",\n    \"href\": \"#accessibility\",\n    \"aria-label\": \"accessibility permalink\",\n    \"className\": \"anchor before\"\n  }, mdx(\"svg\", {\n    parentName: \"a\",\n    \"aria-hidden\": \"true\",\n    \"focusable\": \"false\",\n    \"height\": \"16\",\n    \"version\": \"1.1\",\n    \"viewBox\": \"0 0 16 16\",\n    \"width\": \"16\"\n  }, mdx(\"path\", {\n    parentName: \"svg\",\n    \"fillRule\": \"evenodd\",\n    \"d\": \"M4 9h1v1H4c-1.5 0-3-1.69-3-3.5S2.55 3 4 3h4c1.45 0 3 1.69 3 3.5 0 1.41-.91 2.72-2 3.25V8.59c.58-.45 1-1.27 1-2.09C10 5.22 8.98 4 8 4H4c-.98 0-2 1.22-2 2.5S3 9 4 9zm9-3h-1v1h1c1 0 2 1.22 2 2.5S13.98 12 13 12H9c-.98 0-2-1.22-2-2.5 0-.83.42-1.64 1-2.09V6.25c-1.09.53-2 1.84-2 3.25C6 11.31 7.55 13 9 13h4c1.45 0 3-1.69 3-3.5S14.5 6 13 6z\"\n  }))), `Accessibility`), mdx(\"p\", null, `The `, mdx(\"inlineCode\", {\n    parentName: \"p\"\n  }, `<SvgIcon>`), ` component has built-in accessibility features including:`), mdx(\"ul\", null, mdx(\"li\", {\n    parentName: \"ul\"\n  }, `a built-in `, mdx(\"inlineCode\", {\n    parentName: \"li\"\n  }, `title`), ` attribute. For any specific exported icon, the `, mdx(\"inlineCode\", {\n    parentName: \"li\"\n  }, `title`), ` attribute is defaulted, but can be overwritten.`), mdx(\"li\", {\n    parentName: \"ul\"\n  }, mdx(\"inlineCode\", {\n    parentName: \"li\"\n  }, `focusable=\"false\"`), ` which prevents the icon from being focusable`), mdx(\"li\", {\n    parentName: \"ul\"\n  }, mdx(\"inlineCode\", {\n    parentName: \"li\"\n  }, `role=\"img\"`), ` which tells assistive technologies that the icon's purpose is as an image`), mdx(\"li\", {\n    parentName: \"ul\"\n  }, `optional `, mdx(\"inlineCode\", {\n    parentName: \"li\"\n  }, `description`), ` attribute which can be used for a more detailed explanation of the icon's contents. Meant to be used to provide more detail than just the `, mdx(\"inlineCode\", {\n    parentName: \"li\"\n  }, `title`)), mdx(\"li\", {\n    parentName: \"ul\"\n  }, `an available`, mdx(\"inlineCode\", {\n    parentName: \"li\"\n  }, `ariaHidden`), ` attribute which can be used if the icon's context is described elsewhere. For example, if the icon is part of a button with text, the text may provide the text description instead of the icon component.`)), mdx(\"h2\", {\n    \"id\": \"component-maturity\",\n    \"style\": {\n      \"position\": \"relative\"\n    }\n  }, mdx(\"a\", {\n    parentName: \"h2\",\n    \"href\": \"#component-maturity\",\n    \"aria-label\": \"component maturity permalink\",\n    \"className\": \"anchor before\"\n  }, mdx(\"svg\", {\n    parentName: \"a\",\n    \"aria-hidden\": \"true\",\n    \"focusable\": \"false\",\n    \"height\": \"16\",\n    \"version\": \"1.1\",\n    \"viewBox\": \"0 0 16 16\",\n    \"width\": \"16\"\n  }, mdx(\"path\", {\n    parentName: \"svg\",\n    \"fillRule\": \"evenodd\",\n    \"d\": \"M4 9h1v1H4c-1.5 0-3-1.69-3-3.5S2.55 3 4 3h4c1.45 0 3 1.69 3 3.5 0 1.41-.91 2.72-2 3.25V8.59c.58-.45 1-1.27 1-2.09C10 5.22 8.98 4 8 4H4c-.98 0-2 1.22-2 2.5S3 9 4 9zm9-3h-1v1h1c1 0 2 1.22 2 2.5S13.98 12 13 12H9c-.98 0-2-1.22-2-2.5 0-.83.42-1.64 1-2.09V6.25c-1.09.53-2 1.84-2 3.25C6 11.31 7.55 13 9 13h4c1.45 0 3-1.69 3-3.5S14.5 6 13 6z\"\n  }))), `Component maturity`), mdx(MaturityChecklist, {\n    a11yStandards: true,\n    color: true,\n    forcedColors: true,\n    screenReaders: true,\n    keyboardNavigable: null,\n    storybook: true,\n    responsive: true,\n    spanish: true,\n    completeUiKit: false,\n    responsiveUiKit: false,\n    tokensInCode: true,\n    tokensInSketch: true,\n    mdxType: \"MaturityChecklist\"\n  }));\n}\n;\nMDXContent.isMDXComponent = true;","tableOfContents":{"items":[{"url":"#product-icons","title":"Product Icons"},{"url":"#examples","title":"Examples","items":[{"url":"#changing-icon-color","title":"Changing icon color"},{"url":"#changing-icon-size","title":"Changing icon size"},{"url":"#creating-custom-icons","title":"Creating custom icons"}]},{"url":"#code","title":"Code","items":[{"url":"#react","title":"React"}]},{"url":"#guidance","title":"Guidance"},{"url":"#guidance-1","title":"Guidance","items":[{"url":"#accessibility","title":"Accessibility"}]},{"url":"#component-maturity","title":"Component maturity"}]}}},"pageContext":{"id":"efb72159-5ab8-59f2-bfad-c9670cfed9e3"}},"staticQueryHashes":["3481578012"]}