{"componentChunkName":"component---src-components-page-templates-info-page-tsx","path":"/components/autocomplete/","result":{"data":{"mdx":{"id":"e86b6d0f-66a7-52d4-a091-aadcdd91f64a","frontmatter":{"title":"Autocomplete","intro":"Autocompletes allow users to enter any combination of letters, numbers, or symbols of their choosing (unless otherwise restricted), and receive one or more suggested matches in a list below the input.","cmsgov":{"figmaNodeId":"6-81"},"core":{"figmaNodeId":"6-81","githubLink":"design-system/src/components/Autocomplete","storybookLink":"components-autocomplete--docs"},"healthcare":{"figmaNodeId":"6-81","storybookLink":null,"githubLink":null},"medicare":{"figmaNodeId":"6-81","storybookLink":null,"githubLink":null}},"slug":"components/autocomplete","body":"const _excluded = [\"components\"];\nfunction _extends() { _extends = Object.assign ? Object.assign.bind() : function (target) { for (var i = 1; i < arguments.length; i++) { var source = arguments[i]; for (var key in source) { if (Object.prototype.hasOwnProperty.call(source, key)) { target[key] = source[key]; } } } return target; }; return _extends.apply(this, arguments); }\nfunction _objectWithoutProperties(source, excluded) { if (source == null) return {}; var target = _objectWithoutPropertiesLoose(source, excluded); var key, i; if (Object.getOwnPropertySymbols) { var sourceSymbolKeys = Object.getOwnPropertySymbols(source); for (i = 0; i < sourceSymbolKeys.length; i++) { key = sourceSymbolKeys[i]; if (excluded.indexOf(key) >= 0) continue; if (!Object.prototype.propertyIsEnumerable.call(source, key)) continue; target[key] = source[key]; } } return target; }\nfunction _objectWithoutPropertiesLoose(source, excluded) { if (source == null) return {}; var target = {}; var sourceKeys = Object.keys(source); var key, i; for (i = 0; i < sourceKeys.length; i++) { key = sourceKeys[i]; if (excluded.indexOf(key) >= 0) continue; target[key] = source[key]; } return target; }\n/* @jsxRuntime classic */\n/* @jsx mdx */\n\nconst _frontmatter = {\n  \"title\": \"Autocomplete\",\n  \"intro\": \"Autocompletes allow users to enter any combination of letters, numbers, or symbols of their choosing (unless otherwise restricted), and receive one or more suggested matches in a list below the input.\",\n  \"cmsgov\": {\n    \"figmaNodeId\": \"6-81\"\n  },\n  \"core\": {\n    \"figmaNodeId\": \"6-81\",\n    \"githubLink\": \"design-system/src/components/Autocomplete\",\n    \"storybookLink\": \"components-autocomplete--docs\"\n  },\n  \"healthcare\": {\n    \"figmaNodeId\": \"6-81\"\n  },\n  \"medicare\": {\n    \"figmaNodeId\": \"6-81\"\n  }\n};\nconst makeShortcode = name => function MDXDefaultShortcode(props) {\n  console.warn(\"Component \" + name + \" was not imported, exported, or provided by MDXProvider as global scope\");\n  return mdx(\"div\", props);\n};\nconst StorybookExample = makeShortcode(\"StorybookExample\");\nconst SeeStorybookForGuidance = makeShortcode(\"SeeStorybookForGuidance\");\nconst ComponentThemeOptions = makeShortcode(\"ComponentThemeOptions\");\nconst MaturityChecklist = makeShortcode(\"MaturityChecklist\");\nconst layoutProps = {\n  _frontmatter\n};\nconst MDXLayout = \"wrapper\";\nreturn function MDXContent(_ref) {\n  let {\n      components\n    } = _ref,\n    props = _objectWithoutProperties(_ref, _excluded);\n  return mdx(MDXLayout, _extends({}, layoutProps, props, {\n    components: components,\n    mdxType: \"MDXLayout\"\n  }), mdx(\"h2\", {\n    \"id\": \"examples\",\n    \"style\": {\n      \"position\": \"relative\"\n    }\n  }, mdx(\"a\", {\n    parentName: \"h2\",\n    \"href\": \"#examples\",\n    \"aria-label\": \"examples permalink\",\n    \"className\": \"anchor before\"\n  }, mdx(\"svg\", {\n    parentName: \"a\",\n    \"aria-hidden\": \"true\",\n    \"focusable\": \"false\",\n    \"height\": \"16\",\n    \"version\": \"1.1\",\n    \"viewBox\": \"0 0 16 16\",\n    \"width\": \"16\"\n  }, mdx(\"path\", {\n    parentName: \"svg\",\n    \"fillRule\": \"evenodd\",\n    \"d\": \"M4 9h1v1H4c-1.5 0-3-1.69-3-3.5S2.55 3 4 3h4c1.45 0 3 1.69 3 3.5 0 1.41-.91 2.72-2 3.25V8.59c.58-.45 1-1.27 1-2.09C10 5.22 8.98 4 8 4H4c-.98 0-2 1.22-2 2.5S3 9 4 9zm9-3h-1v1h1c1 0 2 1.22 2 2.5S13.98 12 13 12H9c-.98 0-2-1.22-2-2.5 0-.83.42-1.64 1-2.09V6.25c-1.09.53-2 1.84-2 3.25C6 11.31 7.55 13 9 13h4c1.45 0 3-1.69 3-3.5S14.5 6 13 6z\"\n  }))), `Examples`), mdx(\"p\", null, `The `, mdx(\"inlineCode\", {\n    parentName: \"p\"\n  }, `Autocomplete`), ` component is a parent component that adds autocomplete functionality to a `, mdx(\"inlineCode\", {\n    parentName: \"p\"\n  }, `TextField`), ` component.`), mdx(StorybookExample, {\n    componentName: \"autocomplete\",\n    storyId: \"components-autocomplete--default\",\n    minHeight: 500,\n    mdxType: \"StorybookExample\"\n  }), mdx(\"h2\", {\n    \"id\": \"code\",\n    \"style\": {\n      \"position\": \"relative\"\n    }\n  }, mdx(\"a\", {\n    parentName: \"h2\",\n    \"href\": \"#code\",\n    \"aria-label\": \"code permalink\",\n    \"className\": \"anchor before\"\n  }, mdx(\"svg\", {\n    parentName: \"a\",\n    \"aria-hidden\": \"true\",\n    \"focusable\": \"false\",\n    \"height\": \"16\",\n    \"version\": \"1.1\",\n    \"viewBox\": \"0 0 16 16\",\n    \"width\": \"16\"\n  }, mdx(\"path\", {\n    parentName: \"svg\",\n    \"fillRule\": \"evenodd\",\n    \"d\": \"M4 9h1v1H4c-1.5 0-3-1.69-3-3.5S2.55 3 4 3h4c1.45 0 3 1.69 3 3.5 0 1.41-.91 2.72-2 3.25V8.59c.58-.45 1-1.27 1-2.09C10 5.22 8.98 4 8 4H4c-.98 0-2 1.22-2 2.5S3 9 4 9zm9-3h-1v1h1c1 0 2 1.22 2 2.5S13.98 12 13 12H9c-.98 0-2-1.22-2-2.5 0-.83.42-1.64 1-2.09V6.25c-1.09.53-2 1.84-2 3.25C6 11.31 7.55 13 9 13h4c1.45 0 3-1.69 3-3.5S14.5 6 13 6z\"\n  }))), `Code`), mdx(\"h3\", {\n    \"id\": \"react\",\n    \"style\": {\n      \"position\": \"relative\"\n    }\n  }, mdx(\"a\", {\n    parentName: \"h3\",\n    \"href\": \"#react\",\n    \"aria-label\": \"react permalink\",\n    \"className\": \"anchor before\"\n  }, mdx(\"svg\", {\n    parentName: \"a\",\n    \"aria-hidden\": \"true\",\n    \"focusable\": \"false\",\n    \"height\": \"16\",\n    \"version\": \"1.1\",\n    \"viewBox\": \"0 0 16 16\",\n    \"width\": \"16\"\n  }, mdx(\"path\", {\n    parentName: \"svg\",\n    \"fillRule\": \"evenodd\",\n    \"d\": \"M4 9h1v1H4c-1.5 0-3-1.69-3-3.5S2.55 3 4 3h4c1.45 0 3 1.69 3 3.5 0 1.41-.91 2.72-2 3.25V8.59c.58-.45 1-1.27 1-2.09C10 5.22 8.98 4 8 4H4c-.98 0-2 1.22-2 2.5S3 9 4 9zm9-3h-1v1h1c1 0 2 1.22 2 2.5S13.98 12 13 12H9c-.98 0-2-1.22-2-2.5 0-.83.42-1.64 1-2.09V6.25c-1.09.53-2 1.84-2 3.25C6 11.31 7.55 13 9 13h4c1.45 0 3-1.69 3-3.5S14.5 6 13 6z\"\n  }))), `React`), mdx(SeeStorybookForGuidance, {\n    storyId: 'components-autocomplete--docs',\n    mdxType: \"SeeStorybookForGuidance\"\n  }), mdx(\"h3\", {\n    \"id\": \"web-component\",\n    \"style\": {\n      \"position\": \"relative\"\n    }\n  }, mdx(\"a\", {\n    parentName: \"h3\",\n    \"href\": \"#web-component\",\n    \"aria-label\": \"web component permalink\",\n    \"className\": \"anchor before\"\n  }, mdx(\"svg\", {\n    parentName: \"a\",\n    \"aria-hidden\": \"true\",\n    \"focusable\": \"false\",\n    \"height\": \"16\",\n    \"version\": \"1.1\",\n    \"viewBox\": \"0 0 16 16\",\n    \"width\": \"16\"\n  }, mdx(\"path\", {\n    parentName: \"svg\",\n    \"fillRule\": \"evenodd\",\n    \"d\": \"M4 9h1v1H4c-1.5 0-3-1.69-3-3.5S2.55 3 4 3h4c1.45 0 3 1.69 3 3.5 0 1.41-.91 2.72-2 3.25V8.59c.58-.45 1-1.27 1-2.09C10 5.22 8.98 4 8 4H4c-.98 0-2 1.22-2 2.5S3 9 4 9zm9-3h-1v1h1c1 0 2 1.22 2 2.5S13.98 12 13 12H9c-.98 0-2-1.22-2-2.5 0-.83.42-1.64 1-2.09V6.25c-1.09.53-2 1.84-2 3.25C6 11.31 7.55 13 9 13h4c1.45 0 3-1.69 3-3.5S14.5 6 13 6z\"\n  }))), `Web Component`), mdx(SeeStorybookForGuidance, {\n    tech: \"wc\",\n    storyId: 'web-components-ds-autocomplete--docs',\n    mdxType: \"SeeStorybookForGuidance\"\n  }), mdx(\"h4\", {\n    \"id\": \"autocomplete-items\",\n    \"style\": {\n      \"position\": \"relative\"\n    }\n  }, mdx(\"a\", {\n    parentName: \"h4\",\n    \"href\": \"#autocomplete-items\",\n    \"aria-label\": \"autocomplete items permalink\",\n    \"className\": \"anchor before\"\n  }, mdx(\"svg\", {\n    parentName: \"a\",\n    \"aria-hidden\": \"true\",\n    \"focusable\": \"false\",\n    \"height\": \"16\",\n    \"version\": \"1.1\",\n    \"viewBox\": \"0 0 16 16\",\n    \"width\": \"16\"\n  }, mdx(\"path\", {\n    parentName: \"svg\",\n    \"fillRule\": \"evenodd\",\n    \"d\": \"M4 9h1v1H4c-1.5 0-3-1.69-3-3.5S2.55 3 4 3h4c1.45 0 3 1.69 3 3.5 0 1.41-.91 2.72-2 3.25V8.59c.58-.45 1-1.27 1-2.09C10 5.22 8.98 4 8 4H4c-.98 0-2 1.22-2 2.5S3 9 4 9zm9-3h-1v1h1c1 0 2 1.22 2 2.5S13.98 12 13 12H9c-.98 0-2-1.22-2-2.5 0-.83.42-1.64 1-2.09V6.25c-1.09.53-2 1.84-2 3.25C6 11.31 7.55 13 9 13h4c1.45 0 3-1.69 3-3.5S14.5 6 13 6z\"\n  }))), `Autocomplete items`), mdx(\"p\", null, `An `, mdx(\"inlineCode\", {\n    parentName: \"p\"\n  }, `<Autocomplete>`), ` component accepts a list of items (JavaScript objects) that conform to the shape described by the table below.`), mdx(\"table\", null, mdx(\"thead\", {\n    parentName: \"table\"\n  }, mdx(\"tr\", {\n    parentName: \"thead\"\n  }, mdx(\"th\", {\n    parentName: \"tr\",\n    \"align\": null\n  }, `Name`), mdx(\"th\", {\n    parentName: \"tr\",\n    \"align\": null\n  }, `Type`), mdx(\"th\", {\n    parentName: \"tr\",\n    \"align\": null\n  }, `Description`))), mdx(\"tbody\", {\n    parentName: \"table\"\n  }, mdx(\"tr\", {\n    parentName: \"tbody\"\n  }, mdx(\"td\", {\n    parentName: \"tr\",\n    \"align\": null\n  }, mdx(\"code\", {\n    className: \"ds-u-font-weight--bold\"\n  }, `id`)), mdx(\"td\", {\n    parentName: \"tr\",\n    \"align\": null\n  }, mdx(\"code\", null, `string`)), mdx(\"td\", {\n    parentName: \"tr\",\n    \"align\": null\n  }, `Unique identifier for this item`)), mdx(\"tr\", {\n    parentName: \"tbody\"\n  }, mdx(\"td\", {\n    parentName: \"tr\",\n    \"align\": null\n  }, mdx(\"code\", {\n    className: \"ds-u-font-weight--bold\"\n  }, `name`)), mdx(\"td\", {\n    parentName: \"tr\",\n    \"align\": null\n  }, mdx(\"code\", null, `string`)), mdx(\"td\", {\n    parentName: \"tr\",\n    \"align\": null\n  }, `Displayed value of the item. May alternatively provide a `, mdx(\"code\", null, `children`), ` value`)), mdx(\"tr\", {\n    parentName: \"tbody\"\n  }, mdx(\"td\", {\n    parentName: \"tr\",\n    \"align\": null\n  }, mdx(\"code\", {\n    className: \"ds-u-font-weight--bold\"\n  }, `children`)), mdx(\"td\", {\n    parentName: \"tr\",\n    \"align\": null\n  }, mdx(\"code\", null, `React.ReactNode`)), mdx(\"td\", {\n    parentName: \"tr\",\n    \"align\": null\n  }, `Custom React node as an alternative to a string-only `, mdx(\"inlineCode\", {\n    parentName: \"td\"\n  }, `name`))), mdx(\"tr\", {\n    parentName: \"tbody\"\n  }, mdx(\"td\", {\n    parentName: \"tr\",\n    \"align\": null\n  }, mdx(\"code\", {\n    className: \"ds-u-font-weight--bold\"\n  }, `className`)), mdx(\"td\", {\n    parentName: \"tr\",\n    \"align\": null\n  }, mdx(\"code\", null, `string`)), mdx(\"td\", {\n    parentName: \"tr\",\n    \"align\": null\n  }, `Additional classes to be added to the root element. Useful for adding utility classes.`)), mdx(\"tr\", {\n    parentName: \"tbody\"\n  }, mdx(\"td\", {\n    parentName: \"tr\",\n    \"align\": null\n  }, mdx(\"code\", {\n    className: \"ds-u-font-weight--bold\"\n  }, `isResult`)), mdx(\"td\", {\n    parentName: \"tr\",\n    \"align\": null\n  }, mdx(\"code\", null, `boolean`)), mdx(\"td\", {\n    parentName: \"tr\",\n    \"align\": null\n  }, `Whether this item should be counted as one of the results for the purpose of announcing the result count to screen readers`)))), mdx(\"h3\", {\n    \"id\": \"style-customization\",\n    \"style\": {\n      \"position\": \"relative\"\n    }\n  }, mdx(\"a\", {\n    parentName: \"h3\",\n    \"href\": \"#style-customization\",\n    \"aria-label\": \"style customization permalink\",\n    \"className\": \"anchor before\"\n  }, mdx(\"svg\", {\n    parentName: \"a\",\n    \"aria-hidden\": \"true\",\n    \"focusable\": \"false\",\n    \"height\": \"16\",\n    \"version\": \"1.1\",\n    \"viewBox\": \"0 0 16 16\",\n    \"width\": \"16\"\n  }, mdx(\"path\", {\n    parentName: \"svg\",\n    \"fillRule\": \"evenodd\",\n    \"d\": \"M4 9h1v1H4c-1.5 0-3-1.69-3-3.5S2.55 3 4 3h4c1.45 0 3 1.69 3 3.5 0 1.41-.91 2.72-2 3.25V8.59c.58-.45 1-1.27 1-2.09C10 5.22 8.98 4 8 4H4c-.98 0-2 1.22-2 2.5S3 9 4 9zm9-3h-1v1h1c1 0 2 1.22 2 2.5S13.98 12 13 12H9c-.98 0-2-1.22-2-2.5 0-.83.42-1.64 1-2.09V6.25c-1.09.53-2 1.84-2 3.25C6 11.31 7.55 13 9 13h4c1.45 0 3-1.69 3-3.5S14.5 6 13 6z\"\n  }))), `Style customization`), mdx(\"p\", null, `The following CSS variables can be overridden to customize Autocomplete components:`), mdx(ComponentThemeOptions, {\n    componentname: \"text-input\",\n    mdxType: \"ComponentThemeOptions\"\n  }), mdx(\"h2\", {\n    \"id\": \"guidance\",\n    \"style\": {\n      \"position\": \"relative\"\n    }\n  }, mdx(\"a\", {\n    parentName: \"h2\",\n    \"href\": \"#guidance\",\n    \"aria-label\": \"guidance permalink\",\n    \"className\": \"anchor before\"\n  }, mdx(\"svg\", {\n    parentName: \"a\",\n    \"aria-hidden\": \"true\",\n    \"focusable\": \"false\",\n    \"height\": \"16\",\n    \"version\": \"1.1\",\n    \"viewBox\": \"0 0 16 16\",\n    \"width\": \"16\"\n  }, mdx(\"path\", {\n    parentName: \"svg\",\n    \"fillRule\": \"evenodd\",\n    \"d\": \"M4 9h1v1H4c-1.5 0-3-1.69-3-3.5S2.55 3 4 3h4c1.45 0 3 1.69 3 3.5 0 1.41-.91 2.72-2 3.25V8.59c.58-.45 1-1.27 1-2.09C10 5.22 8.98 4 8 4H4c-.98 0-2 1.22-2 2.5S3 9 4 9zm9-3h-1v1h1c1 0 2 1.22 2 2.5S13.98 12 13 12H9c-.98 0-2-1.22-2-2.5 0-.83.42-1.64 1-2.09V6.25c-1.09.53-2 1.84-2 3.25C6 11.31 7.55 13 9 13h4c1.45 0 3-1.69 3-3.5S14.5 6 13 6z\"\n  }))), `Guidance`), mdx(\"h3\", {\n    \"id\": \"when-to-use\",\n    \"style\": {\n      \"position\": \"relative\"\n    }\n  }, mdx(\"a\", {\n    parentName: \"h3\",\n    \"href\": \"#when-to-use\",\n    \"aria-label\": \"when to use permalink\",\n    \"className\": \"anchor before\"\n  }, mdx(\"svg\", {\n    parentName: \"a\",\n    \"aria-hidden\": \"true\",\n    \"focusable\": \"false\",\n    \"height\": \"16\",\n    \"version\": \"1.1\",\n    \"viewBox\": \"0 0 16 16\",\n    \"width\": \"16\"\n  }, mdx(\"path\", {\n    parentName: \"svg\",\n    \"fillRule\": \"evenodd\",\n    \"d\": \"M4 9h1v1H4c-1.5 0-3-1.69-3-3.5S2.55 3 4 3h4c1.45 0 3 1.69 3 3.5 0 1.41-.91 2.72-2 3.25V8.59c.58-.45 1-1.27 1-2.09C10 5.22 8.98 4 8 4H4c-.98 0-2 1.22-2 2.5S3 9 4 9zm9-3h-1v1h1c1 0 2 1.22 2 2.5S13.98 12 13 12H9c-.98 0-2-1.22-2-2.5 0-.83.42-1.64 1-2.09V6.25c-1.09.53-2 1.84-2 3.25C6 11.31 7.55 13 9 13h4c1.45 0 3-1.69 3-3.5S14.5 6 13 6z\"\n  }))), `When to use`), mdx(\"ul\", null, mdx(\"li\", {\n    parentName: \"ul\"\n  }, `If you are returning results from a known domain like a database of zip codes or a taxonomy of keywords`), mdx(\"li\", {\n    parentName: \"ul\"\n  }, `If you have a list of options that would cause a `, mdx(\"a\", {\n    parentName: \"li\",\n    \"href\": \"/design-system/branch/kcn/3160/update-color-guidance/components/dropdown/\"\n  }, `dropdown`), ` to be unusually long`)), mdx(\"h3\", {\n    \"id\": \"when-to-consider-alternatives\",\n    \"style\": {\n      \"position\": \"relative\"\n    }\n  }, mdx(\"a\", {\n    parentName: \"h3\",\n    \"href\": \"#when-to-consider-alternatives\",\n    \"aria-label\": \"when to consider alternatives permalink\",\n    \"className\": \"anchor before\"\n  }, mdx(\"svg\", {\n    parentName: \"a\",\n    \"aria-hidden\": \"true\",\n    \"focusable\": \"false\",\n    \"height\": \"16\",\n    \"version\": \"1.1\",\n    \"viewBox\": \"0 0 16 16\",\n    \"width\": \"16\"\n  }, mdx(\"path\", {\n    parentName: \"svg\",\n    \"fillRule\": \"evenodd\",\n    \"d\": \"M4 9h1v1H4c-1.5 0-3-1.69-3-3.5S2.55 3 4 3h4c1.45 0 3 1.69 3 3.5 0 1.41-.91 2.72-2 3.25V8.59c.58-.45 1-1.27 1-2.09C10 5.22 8.98 4 8 4H4c-.98 0-2 1.22-2 2.5S3 9 4 9zm9-3h-1v1h1c1 0 2 1.22 2 2.5S13.98 12 13 12H9c-.98 0-2-1.22-2-2.5 0-.83.42-1.64 1-2.09V6.25c-1.09.53-2 1.84-2 3.25C6 11.31 7.55 13 9 13h4c1.45 0 3-1.69 3-3.5S14.5 6 13 6z\"\n  }))), `When to consider alternatives`), mdx(\"ul\", null, mdx(\"li\", {\n    parentName: \"ul\"\n  }, `When users are choosing from a specific set of options. Consider `, mdx(\"a\", {\n    parentName: \"li\",\n    \"href\": \"/design-system/branch/kcn/3160/update-color-guidance/components/checkbox\"\n  }, `checkboxes`), `, `, mdx(\"a\", {\n    parentName: \"li\",\n    \"href\": \"/design-system/branch/kcn/3160/update-color-guidance/components/radio/\"\n  }, `radio buttons`), `, or a `, mdx(\"a\", {\n    parentName: \"li\",\n    \"href\": \"/design-system/branch/kcn/3160/update-color-guidance/components/dropdown/\"\n  }, `dropdown`), ` in these cases.`)), mdx(\"h3\", {\n    \"id\": \"usage\",\n    \"style\": {\n      \"position\": \"relative\"\n    }\n  }, mdx(\"a\", {\n    parentName: \"h3\",\n    \"href\": \"#usage\",\n    \"aria-label\": \"usage permalink\",\n    \"className\": \"anchor before\"\n  }, mdx(\"svg\", {\n    parentName: \"a\",\n    \"aria-hidden\": \"true\",\n    \"focusable\": \"false\",\n    \"height\": \"16\",\n    \"version\": \"1.1\",\n    \"viewBox\": \"0 0 16 16\",\n    \"width\": \"16\"\n  }, mdx(\"path\", {\n    parentName: \"svg\",\n    \"fillRule\": \"evenodd\",\n    \"d\": \"M4 9h1v1H4c-1.5 0-3-1.69-3-3.5S2.55 3 4 3h4c1.45 0 3 1.69 3 3.5 0 1.41-.91 2.72-2 3.25V8.59c.58-.45 1-1.27 1-2.09C10 5.22 8.98 4 8 4H4c-.98 0-2 1.22-2 2.5S3 9 4 9zm9-3h-1v1h1c1 0 2 1.22 2 2.5S13.98 12 13 12H9c-.98 0-2-1.22-2-2.5 0-.83.42-1.64 1-2.09V6.25c-1.09.53-2 1.84-2 3.25C6 11.31 7.55 13 9 13h4c1.45 0 3-1.69 3-3.5S14.5 6 13 6z\"\n  }))), `Usage`), mdx(\"ul\", null, mdx(\"li\", {\n    parentName: \"ul\"\n  }, `Don't use placeholder text in autocomplete fields. Try to write a descriptive label that identifies what the user is searching for. People who have cognitive or visual disabilities have additional problems with placeholder text.`), mdx(\"li\", {\n    parentName: \"ul\"\n  }, `The length of the text field provides a hint to users as to how much text to write. Do not ask users to write paragraphs of text in this component; use a `, mdx(\"inlineCode\", {\n    parentName: \"li\"\n  }, `textarea`), ` instead.`)), mdx(\"p\", null, mdx(\"strong\", {\n    parentName: \"p\"\n  }, mdx(\"a\", {\n    parentName: \"strong\",\n    \"href\": \"/design-system/branch/kcn/3160/update-color-guidance/patterns/Forms/forms/\"\n  }, `View the \"Forms\" guidelines for additional guidance and best practices.`))), mdx(\"h3\", {\n    \"id\": \"accessibility\",\n    \"style\": {\n      \"position\": \"relative\"\n    }\n  }, mdx(\"a\", {\n    parentName: \"h3\",\n    \"href\": \"#accessibility\",\n    \"aria-label\": \"accessibility permalink\",\n    \"className\": \"anchor before\"\n  }, mdx(\"svg\", {\n    parentName: \"a\",\n    \"aria-hidden\": \"true\",\n    \"focusable\": \"false\",\n    \"height\": \"16\",\n    \"version\": \"1.1\",\n    \"viewBox\": \"0 0 16 16\",\n    \"width\": \"16\"\n  }, mdx(\"path\", {\n    parentName: \"svg\",\n    \"fillRule\": \"evenodd\",\n    \"d\": \"M4 9h1v1H4c-1.5 0-3-1.69-3-3.5S2.55 3 4 3h4c1.45 0 3 1.69 3 3.5 0 1.41-.91 2.72-2 3.25V8.59c.58-.45 1-1.27 1-2.09C10 5.22 8.98 4 8 4H4c-.98 0-2 1.22-2 2.5S3 9 4 9zm9-3h-1v1h1c1 0 2 1.22 2 2.5S13.98 12 13 12H9c-.98 0-2-1.22-2-2.5 0-.83.42-1.64 1-2.09V6.25c-1.09.53-2 1.84-2 3.25C6 11.31 7.55 13 9 13h4c1.45 0 3-1.69 3-3.5S14.5 6 13 6z\"\n  }))), `Accessibility`), mdx(\"ul\", null, mdx(\"li\", {\n    parentName: \"ul\"\n  }, `The `, mdx(\"inlineCode\", {\n    parentName: \"li\"\n  }, `<Autocomplete>`), ` component has taken special care to ensure accessibility for screenreader devices. It announces the number of results based on `, mdx(\"inlineCode\", {\n    parentName: \"li\"\n  }, `items`), ` matches with the `, mdx(\"inlineCode\", {\n    parentName: \"li\"\n  }, `inputValue`), ` string. The component also reads out the name of each list item when users arrow up or down.`), mdx(\"li\", {\n    parentName: \"ul\"\n  }, mdx(\"inlineCode\", {\n    parentName: \"li\"\n  }, `<Autocomplete>`), ` allows developers to add hint text in the `, mdx(\"inlineCode\", {\n    parentName: \"li\"\n  }, `<label>`), ` element. This hint `, mdx(\"inlineCode\", {\n    parentName: \"li\"\n  }, `<span>`), ` is added to the markup by passing a `, mdx(\"inlineCode\", {\n    parentName: \"li\"\n  }, `String`), ` into the `, mdx(\"inlineCode\", {\n    parentName: \"li\"\n  }, `hint`), ` prop.`), mdx(\"li\", {\n    parentName: \"ul\"\n  }, mdx(\"inlineCode\", {\n    parentName: \"li\"\n  }, `<Autocomplete>`), ` has a button (styled visually as a link) to clear the search, and refocus the `, mdx(\"inlineCode\", {\n    parentName: \"li\"\n  }, `<input>`), ` element. This resets the local state `, mdx(\"inlineCode\", {\n    parentName: \"li\"\n  }, `selectedItem`), ` to `, mdx(\"inlineCode\", {\n    parentName: \"li\"\n  }, `null`), `, and will re-read the label and screenreader hint text.`)), mdx(\"h2\", {\n    \"id\": \"component-maturity\",\n    \"style\": {\n      \"position\": \"relative\"\n    }\n  }, mdx(\"a\", {\n    parentName: \"h2\",\n    \"href\": \"#component-maturity\",\n    \"aria-label\": \"component maturity permalink\",\n    \"className\": \"anchor before\"\n  }, mdx(\"svg\", {\n    parentName: \"a\",\n    \"aria-hidden\": \"true\",\n    \"focusable\": \"false\",\n    \"height\": \"16\",\n    \"version\": \"1.1\",\n    \"viewBox\": \"0 0 16 16\",\n    \"width\": \"16\"\n  }, mdx(\"path\", {\n    parentName: \"svg\",\n    \"fillRule\": \"evenodd\",\n    \"d\": \"M4 9h1v1H4c-1.5 0-3-1.69-3-3.5S2.55 3 4 3h4c1.45 0 3 1.69 3 3.5 0 1.41-.91 2.72-2 3.25V8.59c.58-.45 1-1.27 1-2.09C10 5.22 8.98 4 8 4H4c-.98 0-2 1.22-2 2.5S3 9 4 9zm9-3h-1v1h1c1 0 2 1.22 2 2.5S13.98 12 13 12H9c-.98 0-2-1.22-2-2.5 0-.83.42-1.64 1-2.09V6.25c-1.09.53-2 1.84-2 3.25C6 11.31 7.55 13 9 13h4c1.45 0 3-1.69 3-3.5S14.5 6 13 6z\"\n  }))), `Component maturity`), mdx(MaturityChecklist, {\n    a11yStandards: true,\n    color: true,\n    forcedColors: true,\n    screenReaders: true,\n    keyboardNavigable: true,\n    storybook: true,\n    responsive: true,\n    spanish: true,\n    completeUiKit: false,\n    responsiveUiKit: false,\n    tokensInCode: true,\n    tokensInSketch: true,\n    mdxType: \"MaturityChecklist\"\n  }));\n}\n;\nMDXContent.isMDXComponent = true;","tableOfContents":{"items":[{"url":"#examples","title":"Examples"},{"url":"#code","title":"Code","items":[{"url":"#react","title":"React"},{"url":"#web-component","title":"Web Component"},{"url":"#style-customization","title":"Style customization"}]},{"url":"#guidance","title":"Guidance","items":[{"url":"#when-to-use","title":"When to use"},{"url":"#when-to-consider-alternatives","title":"When to consider alternatives"},{"url":"#usage","title":"Usage"},{"url":"#accessibility","title":"Accessibility"}]},{"url":"#component-maturity","title":"Component maturity"}]}}},"pageContext":{"id":"e86b6d0f-66a7-52d4-a091-aadcdd91f64a"}},"staticQueryHashes":["3481578012"]}