{
    "componentChunkName": "component---src-components-info-page-tsx",
    "path": "/components/alert",
    "result": {"data":{"mdx":{"id":"d4bc6830-afd0-5e93-8188-3a9b833f7c49","frontmatter":{"title":"Alert","status":null,"intro":"Alerts keep users informed of important and sometimes time-sensitive changes.","core":{"githubLink":"design-system/src/components/Alert","sketchLink":"9P3rvwn","storybookLink":"components-alert--default"},"healthcare":{"sketchLink":"nRKbw3z","storybookLink":null,"githubLink":null},"medicare":{"sketchLink":"1K9gg0y"}},"body":"var _excluded = [\"components\"];\n\nfunction _extends() { _extends = Object.assign || function (target) { for (var i = 1; i < arguments.length; i++) { var source = arguments[i]; for (var key in source) { if (Object.prototype.hasOwnProperty.call(source, key)) { target[key] = source[key]; } } } return target; }; return _extends.apply(this, arguments); }\n\nfunction _objectWithoutProperties(source, excluded) { if (source == null) return {}; var target = _objectWithoutPropertiesLoose(source, excluded); var key, i; if (Object.getOwnPropertySymbols) { var sourceSymbolKeys = Object.getOwnPropertySymbols(source); for (i = 0; i < sourceSymbolKeys.length; i++) { key = sourceSymbolKeys[i]; if (excluded.indexOf(key) >= 0) continue; if (!Object.prototype.propertyIsEnumerable.call(source, key)) continue; target[key] = source[key]; } } return target; }\n\nfunction _objectWithoutPropertiesLoose(source, excluded) { if (source == null) return {}; var target = {}; var sourceKeys = Object.keys(source); var key, i; for (i = 0; i < sourceKeys.length; i++) { key = sourceKeys[i]; if (excluded.indexOf(key) >= 0) continue; target[key] = source[key]; } return target; }\n\n/* @jsxRuntime classic */\n\n/* @jsx mdx */\nvar _frontmatter = {\n  \"title\": \"Alert\",\n  \"intro\": \"Alerts keep users informed of important and sometimes time-sensitive changes.\",\n  \"core\": {\n    \"githubLink\": \"design-system/src/components/Alert\",\n    \"sketchLink\": \"9P3rvwn\",\n    \"storybookLink\": \"components-alert--default\"\n  },\n  \"healthcare\": {\n    \"sketchLink\": \"nRKbw3z\"\n  },\n  \"medicare\": {\n    \"sketchLink\": \"1K9gg0y\"\n  }\n};\n\nvar makeShortcode = function makeShortcode(name) {\n  return function MDXDefaultShortcode(props) {\n    console.warn(\"Component \" + name + \" was not imported, exported, or provided by MDXProvider as global scope\");\n    return mdx(\"div\", props);\n  };\n};\n\nvar StorybookExample = makeShortcode(\"StorybookExample\");\nvar PropTable = makeShortcode(\"PropTable\");\nvar ComponentThemeOptions = makeShortcode(\"ComponentThemeOptions\");\nvar layoutProps = {\n  _frontmatter: _frontmatter\n};\nvar MDXLayout = \"wrapper\";\nreturn function MDXContent(_ref) {\n  var components = _ref.components,\n      props = _objectWithoutProperties(_ref, _excluded);\n\n  return mdx(MDXLayout, _extends({}, layoutProps, props, {\n    components: components,\n    mdxType: \"MDXLayout\"\n  }), mdx(\"h2\", null, mdx(\"inlineCode\", {\n    parentName: \"h2\"\n  }, \"<Alert>\")), mdx(\"h3\", null, \"Default\"), mdx(StorybookExample, {\n    componentName: \"alert\",\n    storyId: \"components-alert--default\",\n    mdxType: \"StorybookExample\"\n  }), mdx(\"h3\", null, \"Error\"), mdx(StorybookExample, {\n    componentName: \"error alert\",\n    storyId: \"components-alert--error-alert\",\n    mdxType: \"StorybookExample\"\n  }), mdx(\"h3\", null, \"Warning\"), mdx(StorybookExample, {\n    componentName: \"warning alert\",\n    storyId: \"components-alert--warning-alert\",\n    mdxType: \"StorybookExample\"\n  }), mdx(\"h3\", null, \"Success\"), mdx(StorybookExample, {\n    componentName: \"success alert\",\n    storyId: \"components-alert--success-alert\",\n    mdxType: \"StorybookExample\"\n  }), mdx(\"h3\", null, \"Lightweight\"), mdx(StorybookExample, {\n    componentName: \"lightweight alert\",\n    storyId: \"components-alert--light-weight\",\n    mdxType: \"StorybookExample\"\n  }), mdx(\"h3\", null, \"Props\"), mdx(PropTable, {\n    componentName: \"Alert\",\n    mdxType: \"PropTable\"\n  }), mdx(\"h2\", null, \"Guidance\"), mdx(\"h3\", null, \"When to use\"), mdx(\"ul\", null, mdx(\"li\", {\n    parentName: \"ul\"\n  }, \"As a validation message that alerts someone that they just did something that needs to be corrected or as confirmation that a task was completed successfully.\"), mdx(\"li\", {\n    parentName: \"ul\"\n  }, \"As a callout or notification for important or timely information. This includes errors, warnings, and general information.\")), mdx(\"h3\", null, \"When to consider alternatives\"), mdx(\"ul\", null, mdx(\"li\", {\n    parentName: \"ul\"\n  }, \"On long forms, always include in-line validation in addition to any error messages that appear at the top of the form. When possible, simplify forms by rewriting and where possible, splitting long forms across multiple pages\"), mdx(\"li\", {\n    parentName: \"ul\"\n  }, \"If an action will result in destroying a user\\u2019s work (for example, deleting an application) use a more intrusive pattern, such as a confirmation modal dialogue, to allow the user to confirm that this is what they want.\")), mdx(\"h3\", null, \"Usage\"), mdx(\"ul\", null, mdx(\"li\", {\n    parentName: \"ul\"\n  }, \"Don\\u2019t overdo it \\u2014 too many notifications will either overwhelm or annoy the user and are likely to be ignored.\"), mdx(\"li\", {\n    parentName: \"ul\"\n  }, \"Write the message in concise, human readable language; avoid jargon and computer code.\"), mdx(\"li\", {\n    parentName: \"ul\"\n  }, \"Don\\u2019t include notifications that aren\\u2019t related to the user\\u2019s current goal.\"), mdx(\"li\", {\n    parentName: \"ul\"\n  }, \"When the user is required to do something in response to an alert, let them know what they need to do and make that task as easy as possible.\")), mdx(\"p\", null, mdx(\"strong\", {\n    parentName: \"p\"\n  }, \"When the alert is for an error:\")), mdx(\"ul\", null, mdx(\"li\", {\n    parentName: \"ul\"\n  }, \"Be polite in error messages \\u2014 don\\u2019t place blame on the user.\"), mdx(\"li\", {\n    parentName: \"ul\"\n  }, \"Users generally won\\u2019t read documentation but will read a message that helps them resolve an error; include some educational material in your error message.\"), mdx(\"li\", {\n    parentName: \"ul\"\n  }, \"If the error relates to specific text fields, give these fields an error state as well.\")), mdx(\"h3\", null, \"Learn more\"), mdx(\"ul\", null, mdx(\"li\", {\n    parentName: \"ul\"\n  }, mdx(\"a\", {\n    parentName: \"li\",\n    \"href\": \"https://content-guide.18f.gov/active-voice/\"\n  }, \"18F Content Guide \", \"-\", \" Active voice\"))), mdx(\"h3\", null, \"Accessibility\"), mdx(\"ul\", null, mdx(\"li\", {\n    parentName: \"ul\"\n  }, \"Use the ARIA \", mdx(\"inlineCode\", {\n    parentName: \"li\"\n  }, \"role=\\\"alert\\\"\"), \" to inform assistive technologies of a time-sensitive and important message that is not interactive. If the message is interactive, use the \", mdx(\"inlineCode\", {\n    parentName: \"li\"\n  }, \"role=\\\"alertdialog\\\"\"), \" instead.\"), mdx(\"li\", {\n    parentName: \"ul\"\n  }, \"Consider putting the alert inside a div with \", mdx(\"inlineCode\", {\n    parentName: \"li\"\n  }, \"aria-live=\\\"polite\\\"\"), \" and \", mdx(\"inlineCode\", {\n    parentName: \"li\"\n  }, \"aria-relevant=\\\"additions removals\\\"\"), \". These \", mdx(\"abbr\", {\n    title: \"Accessible rich internet applications\"\n  }, \"ARIA\"), \" attributes ensure screen readers will announce alerts that have been added or updated dynamically.\"), mdx(\"li\", {\n    parentName: \"ul\"\n  }, \"If you choose to shift focus to the Alert, be mindful that using other techniques like \", mdx(\"inlineCode\", {\n    parentName: \"li\"\n  }, \"role=\\\"alert\\\"\"), \", and \", mdx(\"inlineCode\", {\n    parentName: \"li\"\n  }, \"aria-live=\\\"polite\\\"\"), \" will cause some browser and screen reader combinations to read out the content more than once. Typically, shifting focus alone will be enough to alert screen readers of the content.\"), mdx(\"li\", {\n    parentName: \"ul\"\n  }, \"Do not visually hide alert messages on the page and then make them visible when they are needed. Users of older assistive technologies may still be able to perceive the alert messages even if they are not currently applicable.\"), mdx(\"li\", {\n    parentName: \"ul\"\n  }, \"Alerts should give users adequate time to review and comprehend the provided information. Avoid hiding alerts using a timer.\"), mdx(\"li\", {\n    parentName: \"ul\"\n  }, \"Include a mechanism like a button to dismiss alerts where appropriate.\")), mdx(\"h2\", null, \"Customization\"), mdx(\"p\", null, \"The following Sass variables can be overridden to customize Alert components:\"), mdx(ComponentThemeOptions, {\n    componentname: \"alert\",\n    mdxType: \"ComponentThemeOptions\"\n  }), mdx(\"h2\", null, \"Google Analytics\"), mdx(\"p\", null, mdx(\"strong\", {\n    parentName: \"p\"\n  }, \"Analytics event tracking is disabled by default.\")), mdx(\"h3\", null, \"Enable event tracking\"), mdx(\"p\", null, \"Import and set the \", mdx(\"inlineCode\", {\n    parentName: \"p\"\n  }, \"setAlertSendsAnalytics\"), \" feature flag to \", mdx(\"inlineCode\", {\n    parentName: \"p\"\n  }, \"true\"), \" in your application's entry file:\"), mdx(\"pre\", null, mdx(\"code\", {\n    parentName: \"pre\",\n    \"className\": \"language-js\"\n  }, \"import { setAlertSendsAnalytics } from '@cmsgov/<design-system-package>';\\nsetAlertSendsAnalytics(true);\\n\")), mdx(\"p\", null, \"On applications where the page has \", mdx(\"inlineCode\", {\n    parentName: \"p\"\n  }, \"utag\"), \" loaded, the data goes to Tealium which allows it to route to Google Analytics or the currently approved data analytics tools.\"), mdx(\"h3\", null, \"Disable event tracking\"), mdx(\"p\", null, \"For the \", mdx(\"inlineCode\", {\n    parentName: \"p\"\n  }, \"analytics\"), \" prop, pass the value \", mdx(\"inlineCode\", {\n    parentName: \"p\"\n  }, \"false\"), \" to the component to disable analytics tracking for a singular component instance\"), mdx(\"pre\", null, mdx(\"code\", {\n    parentName: \"pre\",\n    \"className\": \"language-js\"\n  }, \"analytics={false}\\n\")), mdx(\"h3\", null, \"Override event tracking\"), mdx(\"p\", null, \"A custom heading value can be sent for an analytics event by using the prop \", mdx(\"inlineCode\", {\n    parentName: \"p\"\n  }, \"analyticsLabelOverride\"), \". It is recommended that this value be used to prevent sensitive personal information from being passed to analytics trackers.\"));\n}\n;\nMDXContent.isMDXComponent = true;","tableOfContents":{"items":[{"url":"#alert","title":"<Alert>"},{"url":"#guidance","title":"Guidance"},{"url":"#customization","title":"Customization"},{"url":"#google-analytics","title":"Google Analytics"}]}}},"pageContext":{"id":"d4bc6830-afd0-5e93-8188-3a9b833f7c49"}},
    "staticQueryHashes": ["1050346478","3750824424"]}