{"componentChunkName":"component---src-components-page-templates-info-page-tsx","path":"/components/drawer/","result":{"data":{"mdx":{"id":"a109b99c-8a4e-55a3-a92c-70e67c0e4e9b","frontmatter":{"title":"Drawer & Help Drawer","intro":"A drawer provides a space for medium to long-form help content — content that's too long or not common enough to warrant being on the page by default.","cmsgov":{"figmaNodeId":"6-91"},"core":{"figmaNodeId":"6-91","githubLink":"design-system/src/components/Drawer","storybookLink":"components-drawer--docs"},"healthcare":{"figmaNodeId":"6-91","storybookLink":null,"githubLink":null},"medicare":{"figmaNodeId":"6-91","storybookLink":"medicare-helpdrawer--help-drawer-toggle-with-drawer","githubLink":null}},"slug":"components/drawer","body":"const _excluded = [\"components\"];\nfunction _extends() { _extends = Object.assign ? Object.assign.bind() : function (target) { for (var i = 1; i < arguments.length; i++) { var source = arguments[i]; for (var key in source) { if (Object.prototype.hasOwnProperty.call(source, key)) { target[key] = source[key]; } } } return target; }; return _extends.apply(this, arguments); }\nfunction _objectWithoutProperties(source, excluded) { if (source == null) return {}; var target = _objectWithoutPropertiesLoose(source, excluded); var key, i; if (Object.getOwnPropertySymbols) { var sourceSymbolKeys = Object.getOwnPropertySymbols(source); for (i = 0; i < sourceSymbolKeys.length; i++) { key = sourceSymbolKeys[i]; if (excluded.indexOf(key) >= 0) continue; if (!Object.prototype.propertyIsEnumerable.call(source, key)) continue; target[key] = source[key]; } } return target; }\nfunction _objectWithoutPropertiesLoose(source, excluded) { if (source == null) return {}; var target = {}; var sourceKeys = Object.keys(source); var key, i; for (i = 0; i < sourceKeys.length; i++) { key = sourceKeys[i]; if (excluded.indexOf(key) >= 0) continue; target[key] = source[key]; } return target; }\n/* @jsxRuntime classic */\n/* @jsx mdx */\n\nconst _frontmatter = {\n  \"title\": \"Drawer & Help Drawer\",\n  \"intro\": \"A drawer provides a space for medium to long-form help content — content that's too long or not common enough to warrant being on the page by default.\",\n  \"cmsgov\": {\n    \"figmaNodeId\": \"6-91\"\n  },\n  \"core\": {\n    \"figmaNodeId\": \"6-91\",\n    \"githubLink\": \"design-system/src/components/Drawer\",\n    \"storybookLink\": \"components-drawer--docs\"\n  },\n  \"healthcare\": {\n    \"figmaNodeId\": \"6-91\"\n  },\n  \"medicare\": {\n    \"storybookLink\": \"medicare-helpdrawer--help-drawer-toggle-with-drawer\",\n    \"figmaNodeId\": \"6-91\"\n  }\n};\nconst makeShortcode = name => function MDXDefaultShortcode(props) {\n  console.warn(\"Component \" + name + \" was not imported, exported, or provided by MDXProvider as global scope\");\n  return mdx(\"div\", props);\n};\nconst ThemeContent = makeShortcode(\"ThemeContent\");\nconst StorybookExample = makeShortcode(\"StorybookExample\");\nconst ReactDocsLinks = makeShortcode(\"ReactDocsLinks\");\nconst ReactDocsLink = makeShortcode(\"ReactDocsLink\");\nconst ComponentThemeOptions = makeShortcode(\"ComponentThemeOptions\");\nconst MaturityChecklist = makeShortcode(\"MaturityChecklist\");\nconst layoutProps = {\n  _frontmatter\n};\nconst MDXLayout = \"wrapper\";\nreturn function MDXContent(_ref) {\n  let {\n      components\n    } = _ref,\n    props = _objectWithoutProperties(_ref, _excluded);\n  return mdx(MDXLayout, _extends({}, layoutProps, props, {\n    components: components,\n    mdxType: \"MDXLayout\"\n  }), mdx(\"p\", null, `A `, mdx(\"inlineCode\", {\n    parentName: \"p\"\n  }, `Drawer`), ` is a component that provides a space for displaying medium to long-form content. It is designed to present information that may be too lengthy or too specific to be included on the page by default. The content can include a mix of text, HTML elements, or other components, allowing for flexibility in displaying information such as forms, images, links, or lists.`), mdx(\"p\", null, `The `, mdx(\"inlineCode\", {\n    parentName: \"p\"\n  }, `HelpDrawer`), ` extends the `, mdx(\"inlineCode\", {\n    parentName: \"p\"\n  }, `Drawer`), ` by adding analytics capabilities, which can help track user interactions, making it a great choice for situations where gathering insights on how users engage with help content is important.`), mdx(\"h2\", {\n    \"id\": \"examples\",\n    \"style\": {\n      \"position\": \"relative\"\n    }\n  }, mdx(\"a\", {\n    parentName: \"h2\",\n    \"href\": \"#examples\",\n    \"aria-label\": \"examples permalink\",\n    \"className\": \"anchor before\"\n  }, mdx(\"svg\", {\n    parentName: \"a\",\n    \"aria-hidden\": \"true\",\n    \"focusable\": \"false\",\n    \"height\": \"16\",\n    \"version\": \"1.1\",\n    \"viewBox\": \"0 0 16 16\",\n    \"width\": \"16\"\n  }, mdx(\"path\", {\n    parentName: \"svg\",\n    \"fillRule\": \"evenodd\",\n    \"d\": \"M4 9h1v1H4c-1.5 0-3-1.69-3-3.5S2.55 3 4 3h4c1.45 0 3 1.69 3 3.5 0 1.41-.91 2.72-2 3.25V8.59c.58-.45 1-1.27 1-2.09C10 5.22 8.98 4 8 4H4c-.98 0-2 1.22-2 2.5S3 9 4 9zm9-3h-1v1h1c1 0 2 1.22 2 2.5S13.98 12 13 12H9c-.98 0-2-1.22-2-2.5 0-.83.42-1.64 1-2.09V6.25c-1.09.53-2 1.84-2 3.25C6 11.31 7.55 13 9 13h4c1.45 0 3-1.69 3-3.5S14.5 6 13 6z\"\n  }))), `Examples`), mdx(ThemeContent, {\n    neverThemes: ['medicare'],\n    mdxType: \"ThemeContent\"\n  }, mdx(StorybookExample, {\n    componentName: \"drawer\",\n    storyId: \"components-drawer--default\",\n    minHeight: 500,\n    mdxType: \"StorybookExample\"\n  })), mdx(ThemeContent, {\n    onlyThemes: ['medicare'],\n    mdxType: \"ThemeContent\"\n  }, mdx(StorybookExample, {\n    componentName: \"drawer\",\n    storyId: \"medicare-helpdrawer--help-drawer-toggle-with-drawer\",\n    minHeight: 500,\n    mdxType: \"StorybookExample\"\n  })), mdx(\"h3\", {\n    \"id\": \"layout-alternatives\",\n    \"style\": {\n      \"position\": \"relative\"\n    }\n  }, mdx(\"a\", {\n    parentName: \"h3\",\n    \"href\": \"#layout-alternatives\",\n    \"aria-label\": \"layout alternatives permalink\",\n    \"className\": \"anchor before\"\n  }, mdx(\"svg\", {\n    parentName: \"a\",\n    \"aria-hidden\": \"true\",\n    \"focusable\": \"false\",\n    \"height\": \"16\",\n    \"version\": \"1.1\",\n    \"viewBox\": \"0 0 16 16\",\n    \"width\": \"16\"\n  }, mdx(\"path\", {\n    parentName: \"svg\",\n    \"fillRule\": \"evenodd\",\n    \"d\": \"M4 9h1v1H4c-1.5 0-3-1.69-3-3.5S2.55 3 4 3h4c1.45 0 3 1.69 3 3.5 0 1.41-.91 2.72-2 3.25V8.59c.58-.45 1-1.27 1-2.09C10 5.22 8.98 4 8 4H4c-.98 0-2 1.22-2 2.5S3 9 4 9zm9-3h-1v1h1c1 0 2 1.22 2 2.5S13.98 12 13 12H9c-.98 0-2-1.22-2-2.5 0-.83.42-1.64 1-2.09V6.25c-1.09.53-2 1.84-2 3.25C6 11.31 7.55 13 9 13h4c1.45 0 3-1.69 3-3.5S14.5 6 13 6z\"\n  }))), `Layout Alternatives`), mdx(\"p\", null, `A header and/or footer can have a \"sticky\" position if the following properties are applied to their respective elements:`), mdx(\"ul\", null, mdx(\"li\", {\n    parentName: \"ul\"\n  }, mdx(\"inlineCode\", {\n    parentName: \"li\"\n  }, `isHeaderSticky`)), mdx(\"li\", {\n    parentName: \"ul\"\n  }, mdx(\"inlineCode\", {\n    parentName: \"li\"\n  }, `isFooterSticky`))), mdx(StorybookExample, {\n    componentName: \"sticky-drawer\",\n    storyId: \"components-drawer--default\",\n    minHeight: 300,\n    controls: \"isHeaderSticky:!true\",\n    mdxType: \"StorybookExample\"\n  }), mdx(\"h3\", {\n    \"id\": \"managing-multiple-drawers\",\n    \"style\": {\n      \"position\": \"relative\"\n    }\n  }, mdx(\"a\", {\n    parentName: \"h3\",\n    \"href\": \"#managing-multiple-drawers\",\n    \"aria-label\": \"managing multiple drawers permalink\",\n    \"className\": \"anchor before\"\n  }, mdx(\"svg\", {\n    parentName: \"a\",\n    \"aria-hidden\": \"true\",\n    \"focusable\": \"false\",\n    \"height\": \"16\",\n    \"version\": \"1.1\",\n    \"viewBox\": \"0 0 16 16\",\n    \"width\": \"16\"\n  }, mdx(\"path\", {\n    parentName: \"svg\",\n    \"fillRule\": \"evenodd\",\n    \"d\": \"M4 9h1v1H4c-1.5 0-3-1.69-3-3.5S2.55 3 4 3h4c1.45 0 3 1.69 3 3.5 0 1.41-.91 2.72-2 3.25V8.59c.58-.45 1-1.27 1-2.09C10 5.22 8.98 4 8 4H4c-.98 0-2 1.22-2 2.5S3 9 4 9zm9-3h-1v1h1c1 0 2 1.22 2 2.5S13.98 12 13 12H9c-.98 0-2-1.22-2-2.5 0-.83.42-1.64 1-2.09V6.25c-1.09.53-2 1.84-2 3.25C6 11.31 7.55 13 9 13h4c1.45 0 3-1.69 3-3.5S14.5 6 13 6z\"\n  }))), `Managing multiple drawers`), mdx(\"p\", null, `What do you do when there are multiple drawers on a page? The simplest behavior—which may not be appropriate for all use cases—is that when one drawer opens, any open drawers get closes. While this logic can be written into your application, `, mdx(\"a\", {\n    parentName: \"p\",\n    \"href\": \"/design-system/branch/jryan/wnmgds-2984-add-in-new-pagination-styling/storybook/?path=/docs/components-drawermanager--docs\"\n  }, `we have a React component to manage simple drawer behavior`), `.`), mdx(\"h2\", {\n    \"id\": \"code\",\n    \"style\": {\n      \"position\": \"relative\"\n    }\n  }, mdx(\"a\", {\n    parentName: \"h2\",\n    \"href\": \"#code\",\n    \"aria-label\": \"code permalink\",\n    \"className\": \"anchor before\"\n  }, mdx(\"svg\", {\n    parentName: \"a\",\n    \"aria-hidden\": \"true\",\n    \"focusable\": \"false\",\n    \"height\": \"16\",\n    \"version\": \"1.1\",\n    \"viewBox\": \"0 0 16 16\",\n    \"width\": \"16\"\n  }, mdx(\"path\", {\n    parentName: \"svg\",\n    \"fillRule\": \"evenodd\",\n    \"d\": \"M4 9h1v1H4c-1.5 0-3-1.69-3-3.5S2.55 3 4 3h4c1.45 0 3 1.69 3 3.5 0 1.41-.91 2.72-2 3.25V8.59c.58-.45 1-1.27 1-2.09C10 5.22 8.98 4 8 4H4c-.98 0-2 1.22-2 2.5S3 9 4 9zm9-3h-1v1h1c1 0 2 1.22 2 2.5S13.98 12 13 12H9c-.98 0-2-1.22-2-2.5 0-.83.42-1.64 1-2.09V6.25c-1.09.53-2 1.84-2 3.25C6 11.31 7.55 13 9 13h4c1.45 0 3-1.69 3-3.5S14.5 6 13 6z\"\n  }))), `Code`), mdx(\"h3\", {\n    \"id\": \"react\",\n    \"style\": {\n      \"position\": \"relative\"\n    }\n  }, mdx(\"a\", {\n    parentName: \"h3\",\n    \"href\": \"#react\",\n    \"aria-label\": \"react permalink\",\n    \"className\": \"anchor before\"\n  }, mdx(\"svg\", {\n    parentName: \"a\",\n    \"aria-hidden\": \"true\",\n    \"focusable\": \"false\",\n    \"height\": \"16\",\n    \"version\": \"1.1\",\n    \"viewBox\": \"0 0 16 16\",\n    \"width\": \"16\"\n  }, mdx(\"path\", {\n    parentName: \"svg\",\n    \"fillRule\": \"evenodd\",\n    \"d\": \"M4 9h1v1H4c-1.5 0-3-1.69-3-3.5S2.55 3 4 3h4c1.45 0 3 1.69 3 3.5 0 1.41-.91 2.72-2 3.25V8.59c.58-.45 1-1.27 1-2.09C10 5.22 8.98 4 8 4H4c-.98 0-2 1.22-2 2.5S3 9 4 9zm9-3h-1v1h1c1 0 2 1.22 2 2.5S13.98 12 13 12H9c-.98 0-2-1.22-2-2.5 0-.83.42-1.64 1-2.09V6.25c-1.09.53-2 1.84-2 3.25C6 11.31 7.55 13 9 13h4c1.45 0 3-1.69 3-3.5S14.5 6 13 6z\"\n  }))), `React`), mdx(ReactDocsLinks, {\n    mdxType: \"ReactDocsLinks\"\n  }, mdx(ReactDocsLink, {\n    storyId: \"components-drawer--docs\",\n    mdxType: \"ReactDocsLink\"\n  }, \"Drawer\"), mdx(ReactDocsLink, {\n    storyId: \"components-helpdawer--docs\",\n    mdxType: \"ReactDocsLink\"\n  }, \"Help Drawer\")), mdx(\"h3\", {\n    \"id\": \"style-customization\",\n    \"style\": {\n      \"position\": \"relative\"\n    }\n  }, mdx(\"a\", {\n    parentName: \"h3\",\n    \"href\": \"#style-customization\",\n    \"aria-label\": \"style customization permalink\",\n    \"className\": \"anchor before\"\n  }, mdx(\"svg\", {\n    parentName: \"a\",\n    \"aria-hidden\": \"true\",\n    \"focusable\": \"false\",\n    \"height\": \"16\",\n    \"version\": \"1.1\",\n    \"viewBox\": \"0 0 16 16\",\n    \"width\": \"16\"\n  }, mdx(\"path\", {\n    parentName: \"svg\",\n    \"fillRule\": \"evenodd\",\n    \"d\": \"M4 9h1v1H4c-1.5 0-3-1.69-3-3.5S2.55 3 4 3h4c1.45 0 3 1.69 3 3.5 0 1.41-.91 2.72-2 3.25V8.59c.58-.45 1-1.27 1-2.09C10 5.22 8.98 4 8 4H4c-.98 0-2 1.22-2 2.5S3 9 4 9zm9-3h-1v1h1c1 0 2 1.22 2 2.5S13.98 12 13 12H9c-.98 0-2-1.22-2-2.5 0-.83.42-1.64 1-2.09V6.25c-1.09.53-2 1.84-2 3.25C6 11.31 7.55 13 9 13h4c1.45 0 3-1.69 3-3.5S14.5 6 13 6z\"\n  }))), `Style customization`), mdx(\"p\", null, `The following CSS variables can be overridden to customize Drawer components:`), mdx(ComponentThemeOptions, {\n    componentname: \"drawer\",\n    mdxType: \"ComponentThemeOptions\"\n  }), mdx(\"h3\", {\n    \"id\": \"analytics\",\n    \"style\": {\n      \"position\": \"relative\"\n    }\n  }, mdx(\"a\", {\n    parentName: \"h3\",\n    \"href\": \"#analytics\",\n    \"aria-label\": \"analytics permalink\",\n    \"className\": \"anchor before\"\n  }, mdx(\"svg\", {\n    parentName: \"a\",\n    \"aria-hidden\": \"true\",\n    \"focusable\": \"false\",\n    \"height\": \"16\",\n    \"version\": \"1.1\",\n    \"viewBox\": \"0 0 16 16\",\n    \"width\": \"16\"\n  }, mdx(\"path\", {\n    parentName: \"svg\",\n    \"fillRule\": \"evenodd\",\n    \"d\": \"M4 9h1v1H4c-1.5 0-3-1.69-3-3.5S2.55 3 4 3h4c1.45 0 3 1.69 3 3.5 0 1.41-.91 2.72-2 3.25V8.59c.58-.45 1-1.27 1-2.09C10 5.22 8.98 4 8 4H4c-.98 0-2 1.22-2 2.5S3 9 4 9zm9-3h-1v1h1c1 0 2 1.22 2 2.5S13.98 12 13 12H9c-.98 0-2-1.22-2-2.5 0-.83.42-1.64 1-2.09V6.25c-1.09.53-2 1.84-2 3.25C6 11.31 7.55 13 9 13h4c1.45 0 3-1.69 3-3.5S14.5 6 13 6z\"\n  }))), `Analytics`), mdx(\"p\", null, `This component has analytics tracking available. Please see our developer documentation about `, mdx(\"a\", {\n    parentName: \"p\",\n    \"href\": \"/design-system/branch/jryan/wnmgds-2984-add-in-new-pagination-styling/getting-started/for-developers/#analytics\"\n  }, `using analytics in the design system`), `.`), mdx(\"h2\", {\n    \"id\": \"guidance\",\n    \"style\": {\n      \"position\": \"relative\"\n    }\n  }, mdx(\"a\", {\n    parentName: \"h2\",\n    \"href\": \"#guidance\",\n    \"aria-label\": \"guidance permalink\",\n    \"className\": \"anchor before\"\n  }, mdx(\"svg\", {\n    parentName: \"a\",\n    \"aria-hidden\": \"true\",\n    \"focusable\": \"false\",\n    \"height\": \"16\",\n    \"version\": \"1.1\",\n    \"viewBox\": \"0 0 16 16\",\n    \"width\": \"16\"\n  }, mdx(\"path\", {\n    parentName: \"svg\",\n    \"fillRule\": \"evenodd\",\n    \"d\": \"M4 9h1v1H4c-1.5 0-3-1.69-3-3.5S2.55 3 4 3h4c1.45 0 3 1.69 3 3.5 0 1.41-.91 2.72-2 3.25V8.59c.58-.45 1-1.27 1-2.09C10 5.22 8.98 4 8 4H4c-.98 0-2 1.22-2 2.5S3 9 4 9zm9-3h-1v1h1c1 0 2 1.22 2 2.5S13.98 12 13 12H9c-.98 0-2-1.22-2-2.5 0-.83.42-1.64 1-2.09V6.25c-1.09.53-2 1.84-2 3.25C6 11.31 7.55 13 9 13h4c1.45 0 3-1.69 3-3.5S14.5 6 13 6z\"\n  }))), `Guidance`), mdx(ThemeContent, {\n    onlyThemes: ['medicare'],\n    mdxType: \"ThemeContent\"\n  }, mdx(\"ul\", null, mdx(\"li\", {\n    parentName: \"ul\"\n  }, `All help drawer links will include a help icon with the link to indicate the link is a help option.`))), mdx(\"h3\", {\n    \"id\": \"when-to-use\",\n    \"style\": {\n      \"position\": \"relative\"\n    }\n  }, mdx(\"a\", {\n    parentName: \"h3\",\n    \"href\": \"#when-to-use\",\n    \"aria-label\": \"when to use permalink\",\n    \"className\": \"anchor before\"\n  }, mdx(\"svg\", {\n    parentName: \"a\",\n    \"aria-hidden\": \"true\",\n    \"focusable\": \"false\",\n    \"height\": \"16\",\n    \"version\": \"1.1\",\n    \"viewBox\": \"0 0 16 16\",\n    \"width\": \"16\"\n  }, mdx(\"path\", {\n    parentName: \"svg\",\n    \"fillRule\": \"evenodd\",\n    \"d\": \"M4 9h1v1H4c-1.5 0-3-1.69-3-3.5S2.55 3 4 3h4c1.45 0 3 1.69 3 3.5 0 1.41-.91 2.72-2 3.25V8.59c.58-.45 1-1.27 1-2.09C10 5.22 8.98 4 8 4H4c-.98 0-2 1.22-2 2.5S3 9 4 9zm9-3h-1v1h1c1 0 2 1.22 2 2.5S13.98 12 13 12H9c-.98 0-2-1.22-2-2.5 0-.83.42-1.64 1-2.09V6.25c-1.09.53-2 1.84-2 3.25C6 11.31 7.55 13 9 13h4c1.45 0 3-1.69 3-3.5S14.5 6 13 6z\"\n  }))), `When to use`), mdx(\"p\", null, mdx(\"inlineCode\", {\n    parentName: \"p\"\n  }, `Drawer`)), mdx(\"ul\", null, mdx(\"li\", {\n    parentName: \"ul\"\n  }, `When users need additional information that should remain viewable while they interact with the main page, such as detailed explanations, guidelines, or interactive elements like forms.`), mdx(\"li\", {\n    parentName: \"ul\"\n  }, `When supplementary, non-time-sensitive information is helpful at a specific point in the user’s journey but does not need to be displayed on the main page. This allows users to access helpful context or additional details at their discretion without interrupting the flow of the main task.`), mdx(\"li\", {\n    parentName: \"ul\"\n  }, `When optional information is needed to complete a task without overwhelming the primary content on the page.`)), mdx(\"p\", null, mdx(\"inlineCode\", {\n    parentName: \"p\"\n  }, `HelpDrawer`)), mdx(\"ul\", null, mdx(\"li\", {\n    parentName: \"ul\"\n  }, `When you need to track how users interact with the content, such as monitoring how often the drawer is opened or engaged with.`)), mdx(\"h3\", {\n    \"id\": \"when-to-consider-alternatives\",\n    \"style\": {\n      \"position\": \"relative\"\n    }\n  }, mdx(\"a\", {\n    parentName: \"h3\",\n    \"href\": \"#when-to-consider-alternatives\",\n    \"aria-label\": \"when to consider alternatives permalink\",\n    \"className\": \"anchor before\"\n  }, mdx(\"svg\", {\n    parentName: \"a\",\n    \"aria-hidden\": \"true\",\n    \"focusable\": \"false\",\n    \"height\": \"16\",\n    \"version\": \"1.1\",\n    \"viewBox\": \"0 0 16 16\",\n    \"width\": \"16\"\n  }, mdx(\"path\", {\n    parentName: \"svg\",\n    \"fillRule\": \"evenodd\",\n    \"d\": \"M4 9h1v1H4c-1.5 0-3-1.69-3-3.5S2.55 3 4 3h4c1.45 0 3 1.69 3 3.5 0 1.41-.91 2.72-2 3.25V8.59c.58-.45 1-1.27 1-2.09C10 5.22 8.98 4 8 4H4c-.98 0-2 1.22-2 2.5S3 9 4 9zm9-3h-1v1h1c1 0 2 1.22 2 2.5S13.98 12 13 12H9c-.98 0-2-1.22-2-2.5 0-.83.42-1.64 1-2.09V6.25c-1.09.53-2 1.84-2 3.25C6 11.31 7.55 13 9 13h4c1.45 0 3-1.69 3-3.5S14.5 6 13 6z\"\n  }))), `When to Consider Alternatives`), mdx(\"ul\", null, mdx(\"li\", {\n    parentName: \"ul\"\n  }, `When the information is timely, urgent, or critical to the action being taken. Drawers are intended for supplementary details that users can access at their discretion. For time-sensitive or essential information, consider using more prominent inline elements to ensure users don’t miss it.`), mdx(\"li\", {\n    parentName: \"ul\"\n  }, `When the information needs to be immediately visible to clarify or support a primary task. Since `, mdx(\"inlineCode\", {\n    parentName: \"li\"\n  }, `Drawers`), ` require an extra step to open, they are not ideal for essential information that users must see to complete a task or understand other content.`), mdx(\"li\", {\n    parentName: \"ul\"\n  }, `When the information must be displayed automatically without user initiation. `, mdx(\"inlineCode\", {\n    parentName: \"li\"\n  }, `Drawers`), ` rely on users selecting a link or button to open them. If content needs to appear automatically, such as onboarding tips or error messages, consider inline options that don’t require user action.`)), mdx(\"h3\", {\n    \"id\": \"usage\",\n    \"style\": {\n      \"position\": \"relative\"\n    }\n  }, mdx(\"a\", {\n    parentName: \"h3\",\n    \"href\": \"#usage\",\n    \"aria-label\": \"usage permalink\",\n    \"className\": \"anchor before\"\n  }, mdx(\"svg\", {\n    parentName: \"a\",\n    \"aria-hidden\": \"true\",\n    \"focusable\": \"false\",\n    \"height\": \"16\",\n    \"version\": \"1.1\",\n    \"viewBox\": \"0 0 16 16\",\n    \"width\": \"16\"\n  }, mdx(\"path\", {\n    parentName: \"svg\",\n    \"fillRule\": \"evenodd\",\n    \"d\": \"M4 9h1v1H4c-1.5 0-3-1.69-3-3.5S2.55 3 4 3h4c1.45 0 3 1.69 3 3.5 0 1.41-.91 2.72-2 3.25V8.59c.58-.45 1-1.27 1-2.09C10 5.22 8.98 4 8 4H4c-.98 0-2 1.22-2 2.5S3 9 4 9zm9-3h-1v1h1c1 0 2 1.22 2 2.5S13.98 12 13 12H9c-.98 0-2-1.22-2-2.5 0-.83.42-1.64 1-2.09V6.25c-1.09.53-2 1.84-2 3.25C6 11.31 7.55 13 9 13h4c1.45 0 3-1.69 3-3.5S14.5 6 13 6z\"\n  }))), `Usage`), mdx(\"ul\", null, mdx(\"li\", {\n    parentName: \"ul\"\n  }, `Link text used to trigger the `, mdx(\"inlineCode\", {\n    parentName: \"li\"\n  }, `Drawer`), ` should be specific and descriptive.`, mdx(\"ul\", {\n    parentName: \"li\"\n  }, mdx(\"li\", {\n    parentName: \"ul\"\n  }, `Avoid using only \"Learn more\" to link to help `, mdx(\"inlineCode\", {\n    parentName: \"li\"\n  }, `Drawer`), ` content.`), mdx(\"li\", {\n    parentName: \"ul\"\n  }, `Limit the amount of link text.`))), mdx(\"li\", {\n    parentName: \"ul\"\n  }, mdx(\"inlineCode\", {\n    parentName: \"li\"\n  }, `Drawer`), ` content area should include a close button clearly at the top.`), mdx(\"li\", {\n    parentName: \"ul\"\n  }, `On larger screens, the `, mdx(\"inlineCode\", {\n    parentName: \"li\"\n  }, `Drawer`), ` is fixed to the side of the screen, whereas on smaller screens, it overlays the entire screen.`)), mdx(\"h3\", {\n    \"id\": \"accessibility\",\n    \"style\": {\n      \"position\": \"relative\"\n    }\n  }, mdx(\"a\", {\n    parentName: \"h3\",\n    \"href\": \"#accessibility\",\n    \"aria-label\": \"accessibility permalink\",\n    \"className\": \"anchor before\"\n  }, mdx(\"svg\", {\n    parentName: \"a\",\n    \"aria-hidden\": \"true\",\n    \"focusable\": \"false\",\n    \"height\": \"16\",\n    \"version\": \"1.1\",\n    \"viewBox\": \"0 0 16 16\",\n    \"width\": \"16\"\n  }, mdx(\"path\", {\n    parentName: \"svg\",\n    \"fillRule\": \"evenodd\",\n    \"d\": \"M4 9h1v1H4c-1.5 0-3-1.69-3-3.5S2.55 3 4 3h4c1.45 0 3 1.69 3 3.5 0 1.41-.91 2.72-2 3.25V8.59c.58-.45 1-1.27 1-2.09C10 5.22 8.98 4 8 4H4c-.98 0-2 1.22-2 2.5S3 9 4 9zm9-3h-1v1h1c1 0 2 1.22 2 2.5S13.98 12 13 12H9c-.98 0-2-1.22-2-2.5 0-.83.42-1.64 1-2.09V6.25c-1.09.53-2 1.84-2 3.25C6 11.31 7.55 13 9 13h4c1.45 0 3-1.69 3-3.5S14.5 6 13 6z\"\n  }))), `Accessibility`), mdx(\"ul\", null, mdx(\"li\", {\n    parentName: \"ul\"\n  }, `The `, mdx(\"inlineCode\", {\n    parentName: \"li\"\n  }, `Drawer`), ` should have an `, mdx(\"inlineCode\", {\n    parentName: \"li\"\n  }, `aria-labelledby`), ` attribute that references the `, mdx(\"inlineCode\", {\n    parentName: \"li\"\n  }, `id`), ` of the heading in the `, mdx(\"inlineCode\", {\n    parentName: \"li\"\n  }, `Drawer`), `.`), mdx(\"li\", {\n    parentName: \"ul\"\n  }, `The `, mdx(\"inlineCode\", {\n    parentName: \"li\"\n  }, `Drawer`), ` markup should be placed after the toggle element that triggers it in the HTML structure. This keeps the markup semantically sound and improves accessibility for screen readers.`), mdx(\"li\", {\n    parentName: \"ul\"\n  }, `The heading level used within the `, mdx(\"inlineCode\", {\n    parentName: \"li\"\n  }, `Drawer`), ` should fit semantically with the heading levels of the rest of the page. For instance, if the heading level before the `, mdx(\"inlineCode\", {\n    parentName: \"li\"\n  }, `Drawer`), ` toggle link is an `, mdx(\"inlineCode\", {\n    parentName: \"li\"\n  }, `<h2>`), `, the heading level of the `, mdx(\"inlineCode\", {\n    parentName: \"li\"\n  }, `Drawer`), ` would most likely be an `, mdx(\"inlineCode\", {\n    parentName: \"li\"\n  }, `<h3>`), `.`)), mdx(\"h4\", {\n    \"id\": \"focus-management\",\n    \"style\": {\n      \"position\": \"relative\"\n    }\n  }, mdx(\"a\", {\n    parentName: \"h4\",\n    \"href\": \"#focus-management\",\n    \"aria-label\": \"focus management permalink\",\n    \"className\": \"anchor before\"\n  }, mdx(\"svg\", {\n    parentName: \"a\",\n    \"aria-hidden\": \"true\",\n    \"focusable\": \"false\",\n    \"height\": \"16\",\n    \"version\": \"1.1\",\n    \"viewBox\": \"0 0 16 16\",\n    \"width\": \"16\"\n  }, mdx(\"path\", {\n    parentName: \"svg\",\n    \"fillRule\": \"evenodd\",\n    \"d\": \"M4 9h1v1H4c-1.5 0-3-1.69-3-3.5S2.55 3 4 3h4c1.45 0 3 1.69 3 3.5 0 1.41-.91 2.72-2 3.25V8.59c.58-.45 1-1.27 1-2.09C10 5.22 8.98 4 8 4H4c-.98 0-2 1.22-2 2.5S3 9 4 9zm9-3h-1v1h1c1 0 2 1.22 2 2.5S13.98 12 13 12H9c-.98 0-2-1.22-2-2.5 0-.83.42-1.64 1-2.09V6.25c-1.09.53-2 1.84-2 3.25C6 11.31 7.55 13 9 13h4c1.45 0 3-1.69 3-3.5S14.5 6 13 6z\"\n  }))), `Focus Management`), mdx(\"ul\", null, mdx(\"li\", {\n    parentName: \"ul\"\n  }, `Focus should move to the content in the Drawer after the user has opened it.`), mdx(\"li\", {\n    parentName: \"ul\"\n  }, `The property `, mdx(\"inlineCode\", {\n    parentName: \"li\"\n  }, `hasFocusTrap`), ` is an available option that will prevent keyboard focus from leaving the confines of the Drawer when enabled.`)), mdx(\"p\", null, `When `, mdx(\"inlineCode\", {\n    parentName: \"p\"\n  }, `hasFocusTrap`), ` is enabled...`), mdx(\"ul\", null, mdx(\"li\", {\n    parentName: \"ul\"\n  }, `Keyboard focus is trapped within the Drawer component.`), mdx(\"li\", {\n    parentName: \"ul\"\n  }, `Pressing `, mdx(\"kbd\", null, `Escape`), ` will close the Drawer.`)), mdx(\"p\", null, `A focus trap should `, mdx(\"em\", {\n    parentName: \"p\"\n  }, `not`), ` be used when it's anticipated that the user will rely on the Drawer as a reference resource for doing something outside of the Drawer. For instance, if the user is completing a form, Drawer may contain a reference guide defining specific requirements on the page.However, there are times when it makes sense to trap focus within the Drawer. One occasion where it can benefit the user is when the Drawer is anticipated to fill the viewport of a screen, e.g., in a mobile layout.`), mdx(\"h4\", {\n    \"id\": \"accessibility-testing\",\n    \"style\": {\n      \"position\": \"relative\"\n    }\n  }, mdx(\"a\", {\n    parentName: \"h4\",\n    \"href\": \"#accessibility-testing\",\n    \"aria-label\": \"accessibility testing permalink\",\n    \"className\": \"anchor before\"\n  }, mdx(\"svg\", {\n    parentName: \"a\",\n    \"aria-hidden\": \"true\",\n    \"focusable\": \"false\",\n    \"height\": \"16\",\n    \"version\": \"1.1\",\n    \"viewBox\": \"0 0 16 16\",\n    \"width\": \"16\"\n  }, mdx(\"path\", {\n    parentName: \"svg\",\n    \"fillRule\": \"evenodd\",\n    \"d\": \"M4 9h1v1H4c-1.5 0-3-1.69-3-3.5S2.55 3 4 3h4c1.45 0 3 1.69 3 3.5 0 1.41-.91 2.72-2 3.25V8.59c.58-.45 1-1.27 1-2.09C10 5.22 8.98 4 8 4H4c-.98 0-2 1.22-2 2.5S3 9 4 9zm9-3h-1v1h1c1 0 2 1.22 2 2.5S13.98 12 13 12H9c-.98 0-2-1.22-2-2.5 0-.83.42-1.64 1-2.09V6.25c-1.09.53-2 1.84-2 3.25C6 11.31 7.55 13 9 13h4c1.45 0 3-1.69 3-3.5S14.5 6 13 6z\"\n  }))), `Accessibility testing`), mdx(\"h5\", {\n    \"id\": \"keyboard\",\n    \"style\": {\n      \"position\": \"relative\"\n    }\n  }, mdx(\"a\", {\n    parentName: \"h5\",\n    \"href\": \"#keyboard\",\n    \"aria-label\": \"keyboard permalink\",\n    \"className\": \"anchor before\"\n  }, mdx(\"svg\", {\n    parentName: \"a\",\n    \"aria-hidden\": \"true\",\n    \"focusable\": \"false\",\n    \"height\": \"16\",\n    \"version\": \"1.1\",\n    \"viewBox\": \"0 0 16 16\",\n    \"width\": \"16\"\n  }, mdx(\"path\", {\n    parentName: \"svg\",\n    \"fillRule\": \"evenodd\",\n    \"d\": \"M4 9h1v1H4c-1.5 0-3-1.69-3-3.5S2.55 3 4 3h4c1.45 0 3 1.69 3 3.5 0 1.41-.91 2.72-2 3.25V8.59c.58-.45 1-1.27 1-2.09C10 5.22 8.98 4 8 4H4c-.98 0-2 1.22-2 2.5S3 9 4 9zm9-3h-1v1h1c1 0 2 1.22 2 2.5S13.98 12 13 12H9c-.98 0-2-1.22-2-2.5 0-.83.42-1.64 1-2.09V6.25c-1.09.53-2 1.84-2 3.25C6 11.31 7.55 13 9 13h4c1.45 0 3-1.69 3-3.5S14.5 6 13 6z\"\n  }))), `Keyboard`), mdx(\"ul\", null, mdx(\"li\", {\n    parentName: \"ul\"\n  }, `I can use `, mdx(\"kbd\", null, `Tab`), ` to move focus to the Drawer toggle button.`), mdx(\"li\", {\n    parentName: \"ul\"\n  }, `I can use `, mdx(\"kbd\", null, `Enter`), ` or `, mdx(\"kbd\", null, `Space`), ` to toggle the Drawer open or closed.`), mdx(\"li\", {\n    parentName: \"ul\"\n  }, `When the Drawer is open, I can use `, mdx(\"kbd\", null, `Tab`), ` to move focus to the close button, then sequentially through the list of focusable items.`), mdx(\"li\", {\n    parentName: \"ul\"\n  }, `There's a visible focus ring as I move through interactive content in the Drawer, first to the close button, then sequentially through the list of focusable items.`), mdx(\"li\", {\n    parentName: \"ul\"\n  }, `If `, mdx(\"inlineCode\", {\n    parentName: \"li\"\n  }, `hasFocusTrap`), ` is enabled, then...`, mdx(\"ul\", {\n    parentName: \"li\"\n  }, mdx(\"li\", {\n    parentName: \"ul\"\n  }, `...pressing `, mdx(\"kbd\", null, `Escape`), ` will close the Drawer.`), mdx(\"li\", {\n    parentName: \"ul\"\n  }, `...I can't move focus outside of the Drawer.`))), mdx(\"li\", {\n    parentName: \"ul\"\n  }, `If `, mdx(\"inlineCode\", {\n    parentName: \"li\"\n  }, `hasFocusTrap`), ` is not set, then...`, mdx(\"ul\", {\n    parentName: \"li\"\n  }, mdx(\"li\", {\n    parentName: \"ul\"\n  }, `...I can move focus outside of the Drawer.`)))), mdx(\"h5\", {\n    \"id\": \"screen-reader\",\n    \"style\": {\n      \"position\": \"relative\"\n    }\n  }, mdx(\"a\", {\n    parentName: \"h5\",\n    \"href\": \"#screen-reader\",\n    \"aria-label\": \"screen reader permalink\",\n    \"className\": \"anchor before\"\n  }, mdx(\"svg\", {\n    parentName: \"a\",\n    \"aria-hidden\": \"true\",\n    \"focusable\": \"false\",\n    \"height\": \"16\",\n    \"version\": \"1.1\",\n    \"viewBox\": \"0 0 16 16\",\n    \"width\": \"16\"\n  }, mdx(\"path\", {\n    parentName: \"svg\",\n    \"fillRule\": \"evenodd\",\n    \"d\": \"M4 9h1v1H4c-1.5 0-3-1.69-3-3.5S2.55 3 4 3h4c1.45 0 3 1.69 3 3.5 0 1.41-.91 2.72-2 3.25V8.59c.58-.45 1-1.27 1-2.09C10 5.22 8.98 4 8 4H4c-.98 0-2 1.22-2 2.5S3 9 4 9zm9-3h-1v1h1c1 0 2 1.22 2 2.5S13.98 12 13 12H9c-.98 0-2-1.22-2-2.5 0-.83.42-1.64 1-2.09V6.25c-1.09.53-2 1.84-2 3.25C6 11.31 7.55 13 9 13h4c1.45 0 3-1.69 3-3.5S14.5 6 13 6z\"\n  }))), `Screen reader`), mdx(\"ul\", null, mdx(\"li\", {\n    parentName: \"ul\"\n  }, `The Drawer toggle indicates the purpose of the Drawer and mirrors the first heading inside the Drawer.`), mdx(\"li\", {\n    parentName: \"ul\"\n  }, `When the Drawer is open:`, mdx(\"ul\", {\n    parentName: \"li\"\n  }, mdx(\"li\", {\n    parentName: \"ul\"\n  }, `Focus is sent to the Drawer.`), mdx(\"li\", {\n    parentName: \"ul\"\n  }, `The Drawer's role of `, mdx(\"inlineCode\", {\n    parentName: \"li\"\n  }, `dialog`), ` is read.`), mdx(\"li\", {\n    parentName: \"ul\"\n  }, `The Drawer's first heading element is announced.`)))), mdx(\"h6\", {\n    \"id\": \"mobile\",\n    \"style\": {\n      \"position\": \"relative\"\n    }\n  }, mdx(\"a\", {\n    parentName: \"h6\",\n    \"href\": \"#mobile\",\n    \"aria-label\": \"mobile permalink\",\n    \"className\": \"anchor before\"\n  }, mdx(\"svg\", {\n    parentName: \"a\",\n    \"aria-hidden\": \"true\",\n    \"focusable\": \"false\",\n    \"height\": \"16\",\n    \"version\": \"1.1\",\n    \"viewBox\": \"0 0 16 16\",\n    \"width\": \"16\"\n  }, mdx(\"path\", {\n    parentName: \"svg\",\n    \"fillRule\": \"evenodd\",\n    \"d\": \"M4 9h1v1H4c-1.5 0-3-1.69-3-3.5S2.55 3 4 3h4c1.45 0 3 1.69 3 3.5 0 1.41-.91 2.72-2 3.25V8.59c.58-.45 1-1.27 1-2.09C10 5.22 8.98 4 8 4H4c-.98 0-2 1.22-2 2.5S3 9 4 9zm9-3h-1v1h1c1 0 2 1.22 2 2.5S13.98 12 13 12H9c-.98 0-2-1.22-2-2.5 0-.83.42-1.64 1-2.09V6.25c-1.09.53-2 1.84-2 3.25C6 11.31 7.55 13 9 13h4c1.45 0 3-1.69 3-3.5S14.5 6 13 6z\"\n  }))), `Mobile`), mdx(\"ul\", null, mdx(\"li\", {\n    parentName: \"ul\"\n  }, `Double-tapping the Drawer toggle...`, mdx(\"ul\", {\n    parentName: \"li\"\n  }, mdx(\"li\", {\n    parentName: \"ul\"\n  }, `...sends focus to the Drawer.`), mdx(\"li\", {\n    parentName: \"ul\"\n  }, `...reads the Drawer's role of `, mdx(\"inlineCode\", {\n    parentName: \"li\"\n  }, `dialog`), `.`), mdx(\"li\", {\n    parentName: \"ul\"\n  }, `...announces the Drawer's first heading element.`))), mdx(\"li\", {\n    parentName: \"ul\"\n  }, `Double-tapping the Drawer's close button sends focus back to the Drawer toggle and the toggle label is read.`)), mdx(\"h2\", {\n    \"id\": \"component-maturity\",\n    \"style\": {\n      \"position\": \"relative\"\n    }\n  }, mdx(\"a\", {\n    parentName: \"h2\",\n    \"href\": \"#component-maturity\",\n    \"aria-label\": \"component maturity permalink\",\n    \"className\": \"anchor before\"\n  }, mdx(\"svg\", {\n    parentName: \"a\",\n    \"aria-hidden\": \"true\",\n    \"focusable\": \"false\",\n    \"height\": \"16\",\n    \"version\": \"1.1\",\n    \"viewBox\": \"0 0 16 16\",\n    \"width\": \"16\"\n  }, mdx(\"path\", {\n    parentName: \"svg\",\n    \"fillRule\": \"evenodd\",\n    \"d\": \"M4 9h1v1H4c-1.5 0-3-1.69-3-3.5S2.55 3 4 3h4c1.45 0 3 1.69 3 3.5 0 1.41-.91 2.72-2 3.25V8.59c.58-.45 1-1.27 1-2.09C10 5.22 8.98 4 8 4H4c-.98 0-2 1.22-2 2.5S3 9 4 9zm9-3h-1v1h1c1 0 2 1.22 2 2.5S13.98 12 13 12H9c-.98 0-2-1.22-2-2.5 0-.83.42-1.64 1-2.09V6.25c-1.09.53-2 1.84-2 3.25C6 11.31 7.55 13 9 13h4c1.45 0 3-1.69 3-3.5S14.5 6 13 6z\"\n  }))), `Component maturity`), mdx(MaturityChecklist, {\n    a11yStandards: true,\n    color: true,\n    forcedColors: true,\n    screenReaders: true,\n    keyboardNavigable: true,\n    storybook: true,\n    responsive: true,\n    spanish: true,\n    completeUiKit: false,\n    responsiveUiKit: false,\n    tokensInCode: true,\n    tokensInSketch: true,\n    mdxType: \"MaturityChecklist\"\n  }));\n}\n;\nMDXContent.isMDXComponent = true;","tableOfContents":{"items":[{"url":"#examples","title":"Examples","items":[{"url":"#layout-alternatives","title":"Layout Alternatives"},{"url":"#managing-multiple-drawers","title":"Managing multiple drawers"}]},{"url":"#code","title":"Code","items":[{"url":"#react","title":"React"},{"url":"#style-customization","title":"Style customization"},{"url":"#analytics","title":"Analytics"}]},{"url":"#guidance","title":"Guidance","items":[{"url":"#when-to-use","title":"When to use"},{"url":"#when-to-consider-alternatives","title":"When to Consider Alternatives"},{"url":"#usage","title":"Usage"},{"url":"#accessibility","title":"Accessibility"}]},{"url":"#component-maturity","title":"Component maturity"}]}}},"pageContext":{"id":"a109b99c-8a4e-55a3-a92c-70e67c0e4e9b"}},"staticQueryHashes":["3481578012"]}