{
    "componentChunkName": "component---src-components-page-templates-info-page-tsx",
    "path": "/components/step-list/",
    "result": {"data":{"mdx":{"id":"2fcb4b0e-0f8d-5089-826b-d33073c496c3","frontmatter":{"title":"Step List","intro":"A step list represents a user's progression through an application or multi-page form. It serves as a table of contents and a way to quickly see where they are and what they should be working on next.","core":{"githubLink":"design-system/src/components/StepList","sketchLink":"Kv3oKlr","storybookLink":"patterns-step-list--step-list-example"},"healthcare":{"sketchLink":"3OL0DZa","storybookLink":null,"githubLink":null},"medicare":null},"slug":"components/step-list","body":"var _excluded = [\"components\"];\n\nfunction _extends() { _extends = Object.assign || function (target) { for (var i = 1; i < arguments.length; i++) { var source = arguments[i]; for (var key in source) { if (Object.prototype.hasOwnProperty.call(source, key)) { target[key] = source[key]; } } } return target; }; return _extends.apply(this, arguments); }\n\nfunction _objectWithoutProperties(source, excluded) { if (source == null) return {}; var target = _objectWithoutPropertiesLoose(source, excluded); var key, i; if (Object.getOwnPropertySymbols) { var sourceSymbolKeys = Object.getOwnPropertySymbols(source); for (i = 0; i < sourceSymbolKeys.length; i++) { key = sourceSymbolKeys[i]; if (excluded.indexOf(key) >= 0) continue; if (!Object.prototype.propertyIsEnumerable.call(source, key)) continue; target[key] = source[key]; } } return target; }\n\nfunction _objectWithoutPropertiesLoose(source, excluded) { if (source == null) return {}; var target = {}; var sourceKeys = Object.keys(source); var key, i; for (i = 0; i < sourceKeys.length; i++) { key = sourceKeys[i]; if (excluded.indexOf(key) >= 0) continue; target[key] = source[key]; } return target; }\n\n/* @jsxRuntime classic */\n\n/* @jsx mdx */\nvar _frontmatter = {\n  \"title\": \"Step List\",\n  \"intro\": \"A step list represents a user's progression through an application or multi-page form. It serves as a table of contents and a way to quickly see where they are and what they should be working on next.\",\n  \"core\": {\n    \"githubLink\": \"design-system/src/components/StepList\",\n    \"sketchLink\": \"Kv3oKlr\",\n    \"storybookLink\": \"patterns-step-list--step-list-example\"\n  },\n  \"healthcare\": {\n    \"sketchLink\": \"3OL0DZa\"\n  }\n};\n\nvar makeShortcode = function makeShortcode(name) {\n  return function MDXDefaultShortcode(props) {\n    console.warn(\"Component \" + name + \" was not imported, exported, or provided by MDXProvider as global scope\");\n    return mdx(\"div\", props);\n  };\n};\n\nvar StorybookExample = makeShortcode(\"StorybookExample\");\nvar PropTable = makeShortcode(\"PropTable\");\nvar ComponentThemeOptions = makeShortcode(\"ComponentThemeOptions\");\nvar MaturityChecklist = makeShortcode(\"MaturityChecklist\");\nvar layoutProps = {\n  _frontmatter: _frontmatter\n};\nvar MDXLayout = \"wrapper\";\nreturn function MDXContent(_ref) {\n  var components = _ref.components,\n      props = _objectWithoutProperties(_ref, _excluded);\n\n  return mdx(MDXLayout, _extends({}, layoutProps, props, {\n    components: components,\n    mdxType: \"MDXLayout\"\n  }), mdx(\"h2\", {\n    \"id\": \"examples\",\n    \"style\": {\n      \"position\": \"relative\"\n    }\n  }, mdx(\"a\", {\n    parentName: \"h2\",\n    \"href\": \"#examples\",\n    \"aria-label\": \"examples permalink\",\n    \"className\": \"anchor before\"\n  }, mdx(\"svg\", {\n    parentName: \"a\",\n    \"aria-hidden\": \"true\",\n    \"focusable\": \"false\",\n    \"height\": \"16\",\n    \"version\": \"1.1\",\n    \"viewBox\": \"0 0 16 16\",\n    \"width\": \"16\"\n  }, mdx(\"path\", {\n    parentName: \"svg\",\n    \"fillRule\": \"evenodd\",\n    \"d\": \"M4 9h1v1H4c-1.5 0-3-1.69-3-3.5S2.55 3 4 3h4c1.45 0 3 1.69 3 3.5 0 1.41-.91 2.72-2 3.25V8.59c.58-.45 1-1.27 1-2.09C10 5.22 8.98 4 8 4H4c-.98 0-2 1.22-2 2.5S3 9 4 9zm9-3h-1v1h1c1 0 2 1.22 2 2.5S13.98 12 13 12H9c-.98 0-2-1.22-2-2.5 0-.83.42-1.64 1-2.09V6.25c-1.09.53-2 1.84-2 3.25C6 11.31 7.55 13 9 13h4c1.45 0 3-1.69 3-3.5S14.5 6 13 6z\"\n  }))), \"Examples\"), mdx(\"p\", null, \"The \", mdx(\"inlineCode\", {\n    parentName: \"p\"\n  }, \"StepList\"), \" component is the preferred method for building a step list, since it handles all the state logic necessary to produce its markup. A step is represented by an object with text, progress, and routing information and can optionally include an array of substeps as well as a description.\"), mdx(StorybookExample, {\n    componentName: \"step-list\",\n    storyId: \"patterns-step-list--step-list-example\",\n    mdxType: \"StorybookExample\"\n  }), mdx(\"h2\", {\n    \"id\": \"code\",\n    \"style\": {\n      \"position\": \"relative\"\n    }\n  }, mdx(\"a\", {\n    parentName: \"h2\",\n    \"href\": \"#code\",\n    \"aria-label\": \"code permalink\",\n    \"className\": \"anchor before\"\n  }, mdx(\"svg\", {\n    parentName: \"a\",\n    \"aria-hidden\": \"true\",\n    \"focusable\": \"false\",\n    \"height\": \"16\",\n    \"version\": \"1.1\",\n    \"viewBox\": \"0 0 16 16\",\n    \"width\": \"16\"\n  }, mdx(\"path\", {\n    parentName: \"svg\",\n    \"fillRule\": \"evenodd\",\n    \"d\": \"M4 9h1v1H4c-1.5 0-3-1.69-3-3.5S2.55 3 4 3h4c1.45 0 3 1.69 3 3.5 0 1.41-.91 2.72-2 3.25V8.59c.58-.45 1-1.27 1-2.09C10 5.22 8.98 4 8 4H4c-.98 0-2 1.22-2 2.5S3 9 4 9zm9-3h-1v1h1c1 0 2 1.22 2 2.5S13.98 12 13 12H9c-.98 0-2-1.22-2-2.5 0-.83.42-1.64 1-2.09V6.25c-1.09.53-2 1.84-2 3.25C6 11.31 7.55 13 9 13h4c1.45 0 3-1.69 3-3.5S14.5 6 13 6z\"\n  }))), \"Code\"), mdx(\"h3\", {\n    \"id\": \"react\",\n    \"style\": {\n      \"position\": \"relative\"\n    }\n  }, mdx(\"a\", {\n    parentName: \"h3\",\n    \"href\": \"#react\",\n    \"aria-label\": \"react permalink\",\n    \"className\": \"anchor before\"\n  }, mdx(\"svg\", {\n    parentName: \"a\",\n    \"aria-hidden\": \"true\",\n    \"focusable\": \"false\",\n    \"height\": \"16\",\n    \"version\": \"1.1\",\n    \"viewBox\": \"0 0 16 16\",\n    \"width\": \"16\"\n  }, mdx(\"path\", {\n    parentName: \"svg\",\n    \"fillRule\": \"evenodd\",\n    \"d\": \"M4 9h1v1H4c-1.5 0-3-1.69-3-3.5S2.55 3 4 3h4c1.45 0 3 1.69 3 3.5 0 1.41-.91 2.72-2 3.25V8.59c.58-.45 1-1.27 1-2.09C10 5.22 8.98 4 8 4H4c-.98 0-2 1.22-2 2.5S3 9 4 9zm9-3h-1v1h1c1 0 2 1.22 2 2.5S13.98 12 13 12H9c-.98 0-2-1.22-2-2.5 0-.83.42-1.64 1-2.09V6.25c-1.09.53-2 1.84-2 3.25C6 11.31 7.55 13 9 13h4c1.45 0 3-1.69 3-3.5S14.5 6 13 6z\"\n  }))), \"React\"), mdx(\"h4\", {\n    \"id\": \"steplist-component\",\n    \"style\": {\n      \"position\": \"relative\"\n    }\n  }, mdx(\"a\", {\n    parentName: \"h4\",\n    \"href\": \"#steplist-component\",\n    \"aria-label\": \"steplist component permalink\",\n    \"className\": \"anchor before\"\n  }, mdx(\"svg\", {\n    parentName: \"a\",\n    \"aria-hidden\": \"true\",\n    \"focusable\": \"false\",\n    \"height\": \"16\",\n    \"version\": \"1.1\",\n    \"viewBox\": \"0 0 16 16\",\n    \"width\": \"16\"\n  }, mdx(\"path\", {\n    parentName: \"svg\",\n    \"fillRule\": \"evenodd\",\n    \"d\": \"M4 9h1v1H4c-1.5 0-3-1.69-3-3.5S2.55 3 4 3h4c1.45 0 3 1.69 3 3.5 0 1.41-.91 2.72-2 3.25V8.59c.58-.45 1-1.27 1-2.09C10 5.22 8.98 4 8 4H4c-.98 0-2 1.22-2 2.5S3 9 4 9zm9-3h-1v1h1c1 0 2 1.22 2 2.5S13.98 12 13 12H9c-.98 0-2-1.22-2-2.5 0-.83.42-1.64 1-2.09V6.25c-1.09.53-2 1.84-2 3.25C6 11.31 7.55 13 9 13h4c1.45 0 3-1.69 3-3.5S14.5 6 13 6z\"\n  }))), mdx(\"inlineCode\", {\n    parentName: \"h4\"\n  }, \"<StepList>\"), \" component\"), mdx(PropTable, {\n    componentName: \"StepList\",\n    mdxType: \"PropTable\"\n  }), mdx(\"h4\", {\n    \"id\": \"step-component\",\n    \"style\": {\n      \"position\": \"relative\"\n    }\n  }, mdx(\"a\", {\n    parentName: \"h4\",\n    \"href\": \"#step-component\",\n    \"aria-label\": \"step component permalink\",\n    \"className\": \"anchor before\"\n  }, mdx(\"svg\", {\n    parentName: \"a\",\n    \"aria-hidden\": \"true\",\n    \"focusable\": \"false\",\n    \"height\": \"16\",\n    \"version\": \"1.1\",\n    \"viewBox\": \"0 0 16 16\",\n    \"width\": \"16\"\n  }, mdx(\"path\", {\n    parentName: \"svg\",\n    \"fillRule\": \"evenodd\",\n    \"d\": \"M4 9h1v1H4c-1.5 0-3-1.69-3-3.5S2.55 3 4 3h4c1.45 0 3 1.69 3 3.5 0 1.41-.91 2.72-2 3.25V8.59c.58-.45 1-1.27 1-2.09C10 5.22 8.98 4 8 4H4c-.98 0-2 1.22-2 2.5S3 9 4 9zm9-3h-1v1h1c1 0 2 1.22 2 2.5S13.98 12 13 12H9c-.98 0-2-1.22-2-2.5 0-.83.42-1.64 1-2.09V6.25c-1.09.53-2 1.84-2 3.25C6 11.31 7.55 13 9 13h4c1.45 0 3-1.69 3-3.5S14.5 6 13 6z\"\n  }))), mdx(\"inlineCode\", {\n    parentName: \"h4\"\n  }, \"<Step>\"), \" component\"), mdx(\"h3\", {\n    \"id\": \"styles\",\n    \"style\": {\n      \"position\": \"relative\"\n    }\n  }, mdx(\"a\", {\n    parentName: \"h3\",\n    \"href\": \"#styles\",\n    \"aria-label\": \"styles permalink\",\n    \"className\": \"anchor before\"\n  }, mdx(\"svg\", {\n    parentName: \"a\",\n    \"aria-hidden\": \"true\",\n    \"focusable\": \"false\",\n    \"height\": \"16\",\n    \"version\": \"1.1\",\n    \"viewBox\": \"0 0 16 16\",\n    \"width\": \"16\"\n  }, mdx(\"path\", {\n    parentName: \"svg\",\n    \"fillRule\": \"evenodd\",\n    \"d\": \"M4 9h1v1H4c-1.5 0-3-1.69-3-3.5S2.55 3 4 3h4c1.45 0 3 1.69 3 3.5 0 1.41-.91 2.72-2 3.25V8.59c.58-.45 1-1.27 1-2.09C10 5.22 8.98 4 8 4H4c-.98 0-2 1.22-2 2.5S3 9 4 9zm9-3h-1v1h1c1 0 2 1.22 2 2.5S13.98 12 13 12H9c-.98 0-2-1.22-2-2.5 0-.83.42-1.64 1-2.09V6.25c-1.09.53-2 1.84-2 3.25C6 11.31 7.55 13 9 13h4c1.45 0 3-1.69 3-3.5S14.5 6 13 6z\"\n  }))), \"Styles\"), mdx(\"p\", null, \"The following CSS variables can be overridden to customize StepList patterns:\"), mdx(ComponentThemeOptions, {\n    componentname: \"steplist\",\n    mdxType: \"ComponentThemeOptions\"\n  }), mdx(\"h4\", {\n    \"id\": \"step-object\",\n    \"style\": {\n      \"position\": \"relative\"\n    }\n  }, mdx(\"a\", {\n    parentName: \"h4\",\n    \"href\": \"#step-object\",\n    \"aria-label\": \"step object permalink\",\n    \"className\": \"anchor before\"\n  }, mdx(\"svg\", {\n    parentName: \"a\",\n    \"aria-hidden\": \"true\",\n    \"focusable\": \"false\",\n    \"height\": \"16\",\n    \"version\": \"1.1\",\n    \"viewBox\": \"0 0 16 16\",\n    \"width\": \"16\"\n  }, mdx(\"path\", {\n    parentName: \"svg\",\n    \"fillRule\": \"evenodd\",\n    \"d\": \"M4 9h1v1H4c-1.5 0-3-1.69-3-3.5S2.55 3 4 3h4c1.45 0 3 1.69 3 3.5 0 1.41-.91 2.72-2 3.25V8.59c.58-.45 1-1.27 1-2.09C10 5.22 8.98 4 8 4H4c-.98 0-2 1.22-2 2.5S3 9 4 9zm9-3h-1v1h1c1 0 2 1.22 2 2.5S13.98 12 13 12H9c-.98 0-2-1.22-2-2.5 0-.83.42-1.64 1-2.09V6.25c-1.09.53-2 1.84-2 3.25C6 11.31 7.55 13 9 13h4c1.45 0 3-1.69 3-3.5S14.5 6 13 6z\"\n  }))), \"Step Object\"), mdx(\"table\", null, mdx(\"thead\", {\n    parentName: \"table\"\n  }, mdx(\"tr\", {\n    parentName: \"thead\"\n  }, mdx(\"th\", {\n    parentName: \"tr\",\n    \"align\": null\n  }, \"Name\"), mdx(\"th\", {\n    parentName: \"tr\",\n    \"align\": null\n  }, \"Type\"), mdx(\"th\", {\n    parentName: \"tr\",\n    \"align\": null\n  }, \"Description\"))), mdx(\"tbody\", {\n    parentName: \"table\"\n  }, mdx(\"tr\", {\n    parentName: \"tbody\"\n  }, mdx(\"td\", {\n    parentName: \"tr\",\n    \"align\": null\n  }, mdx(\"inlineCode\", {\n    parentName: \"td\"\n  }, \"completed\")), mdx(\"td\", {\n    parentName: \"tr\",\n    \"align\": null\n  }, mdx(\"inlineCode\", {\n    parentName: \"td\"\n  }, \"bool\")), mdx(\"td\", {\n    parentName: \"tr\",\n    \"align\": null\n  }, \"Whether the step has been completed\")), mdx(\"tr\", {\n    parentName: \"tbody\"\n  }, mdx(\"td\", {\n    parentName: \"tr\",\n    \"align\": null\n  }, mdx(\"inlineCode\", {\n    parentName: \"td\"\n  }, \"component\")), mdx(\"td\", {\n    parentName: \"tr\",\n    \"align\": null\n  }, mdx(\"inlineCode\", {\n    parentName: \"td\"\n  }, \"element, func\")), mdx(\"td\", {\n    parentName: \"tr\",\n    \"align\": null\n  }, \"When provided, this will render the passed in component for link elements in this Step. This is useful when integrating with React Router's \", mdx(\"inlineCode\", {\n    parentName: \"td\"\n  }, \"<Link>\"), \" or using your own custom component.\")), mdx(\"tr\", {\n    parentName: \"tbody\"\n  }, mdx(\"td\", {\n    parentName: \"tr\",\n    \"align\": null\n  }, mdx(\"inlineCode\", {\n    parentName: \"td\"\n  }, \"description\")), mdx(\"td\", {\n    parentName: \"tr\",\n    \"align\": null\n  }, mdx(\"inlineCode\", {\n    parentName: \"td\"\n  }, \"string\")), mdx(\"td\", {\n    parentName: \"tr\",\n    \"align\": null\n  }, \"Additional text to dsiplay under (only rendered for top-level steps)\")), mdx(\"tr\", {\n    parentName: \"tbody\"\n  }, mdx(\"td\", {\n    parentName: \"tr\",\n    \"align\": null\n  }, mdx(\"inlineCode\", {\n    parentName: \"td\"\n  }, \"heading\"), \" \", mdx(Badge, {\n    mdxType: \"Badge\"\n  }, \"Required\")), mdx(\"td\", {\n    parentName: \"tr\",\n    \"align\": null\n  }, mdx(\"inlineCode\", {\n    parentName: \"td\"\n  }, \"string\")), mdx(\"td\", {\n    parentName: \"tr\",\n    \"align\": null\n  }, \"Text to display as the step heading\")), mdx(\"tr\", {\n    parentName: \"tbody\"\n  }, mdx(\"td\", {\n    parentName: \"tr\",\n    \"align\": null\n  }, mdx(\"inlineCode\", {\n    parentName: \"td\"\n  }, \"headingLevel\")), mdx(\"td\", {\n    parentName: \"tr\",\n    \"align\": null\n  }, mdx(\"inlineCode\", {\n    parentName: \"td\"\n  }, \"'1', '2', '3', '4', '5'\")), mdx(\"td\", {\n    parentName: \"tr\",\n    \"align\": null\n  }, \"Heading type to override default \", mdx(\"inlineCode\", {\n    parentName: \"td\"\n  }, \"<h2>\"), \".\")), mdx(\"tr\", {\n    parentName: \"tbody\"\n  }, mdx(\"td\", {\n    parentName: \"tr\",\n    \"align\": null\n  }, mdx(\"inlineCode\", {\n    parentName: \"td\"\n  }, \"href\"), \" \", mdx(Badge, {\n    mdxType: \"Badge\"\n  }, \"Required\")), mdx(\"td\", {\n    parentName: \"tr\",\n    \"align\": null\n  }, mdx(\"inlineCode\", {\n    parentName: \"td\"\n  }, \"string\")), mdx(\"td\", {\n    parentName: \"tr\",\n    \"align\": null\n  }, \"URL or partial URL that routes to the step. Will be passed to \", mdx(\"inlineCode\", {\n    parentName: \"td\"\n  }, \"onStepLinkClick\"), \" as first parameter\")), mdx(\"tr\", {\n    parentName: \"tbody\"\n  }, mdx(\"td\", {\n    parentName: \"tr\",\n    \"align\": null\n  }, mdx(\"inlineCode\", {\n    parentName: \"td\"\n  }, \"id\")), mdx(\"td\", {\n    parentName: \"tr\",\n    \"align\": null\n  }, mdx(\"inlineCode\", {\n    parentName: \"td\"\n  }, \"string\")), mdx(\"td\", {\n    parentName: \"tr\",\n    \"align\": null\n  }, \"Unique string representing the step. WIll be passed to \", mdx(\"inlineCode\", {\n    parentName: \"td\"\n  }, \"onStepLinkClick\"), \" as second parameter\")), mdx(\"tr\", {\n    parentName: \"tbody\"\n  }, mdx(\"td\", {\n    parentName: \"tr\",\n    \"align\": null\n  }, mdx(\"inlineCode\", {\n    parentName: \"td\"\n  }, \"isNextStep\")), mdx(\"td\", {\n    parentName: \"tr\",\n    \"align\": null\n  }, mdx(\"inlineCode\", {\n    parentName: \"td\"\n  }, \"bool\")), mdx(\"td\", {\n    parentName: \"tr\",\n    \"align\": null\n  }, \"Whether this is the next unstarted step\")), mdx(\"tr\", {\n    parentName: \"tbody\"\n  }, mdx(\"td\", {\n    parentName: \"tr\",\n    \"align\": null\n  }, mdx(\"inlineCode\", {\n    parentName: \"td\"\n  }, \"linkText\")), mdx(\"td\", {\n    parentName: \"tr\",\n    \"align\": null\n  }, mdx(\"inlineCode\", {\n    parentName: \"td\"\n  }, \"string\")), mdx(\"td\", {\n    parentName: \"tr\",\n    \"align\": null\n  }, \"Alternative text for the link or button for this step. Will override the defaults\")), mdx(\"tr\", {\n    parentName: \"tbody\"\n  }, mdx(\"td\", {\n    parentName: \"tr\",\n    \"align\": null\n  }, mdx(\"inlineCode\", {\n    parentName: \"td\"\n  }, \"onClick\")), mdx(\"td\", {\n    parentName: \"tr\",\n    \"align\": null\n  }, mdx(\"inlineCode\", {\n    parentName: \"td\"\n  }, \"func\")), mdx(\"td\", {\n    parentName: \"tr\",\n    \"align\": null\n  }, mdx(\"inlineCode\", {\n    parentName: \"td\"\n  }, \"onClick\"), \" handler for this specific step's link/button\")), mdx(\"tr\", {\n    parentName: \"tbody\"\n  }, mdx(\"td\", {\n    parentName: \"tr\",\n    \"align\": null\n  }, mdx(\"inlineCode\", {\n    parentName: \"td\"\n  }, \"started\")), mdx(\"td\", {\n    parentName: \"tr\",\n    \"align\": null\n  }, mdx(\"inlineCode\", {\n    parentName: \"td\"\n  }, \"bool\")), mdx(\"td\", {\n    parentName: \"tr\",\n    \"align\": null\n  }, \"Whether the step has been started\")), mdx(\"tr\", {\n    parentName: \"tbody\"\n  }, mdx(\"td\", {\n    parentName: \"tr\",\n    \"align\": null\n  }, mdx(\"inlineCode\", {\n    parentName: \"td\"\n  }, \"steps\")), mdx(\"td\", {\n    parentName: \"tr\",\n    \"align\": null\n  }, mdx(\"inlineCode\", {\n    parentName: \"td\"\n  }, \"StepObject[]\")), mdx(\"td\", {\n    parentName: \"tr\",\n    \"align\": null\n  }, \"Array of substeps\")))), mdx(\"h2\", {\n    \"id\": \"guidance\",\n    \"style\": {\n      \"position\": \"relative\"\n    }\n  }, mdx(\"a\", {\n    parentName: \"h2\",\n    \"href\": \"#guidance\",\n    \"aria-label\": \"guidance permalink\",\n    \"className\": \"anchor before\"\n  }, mdx(\"svg\", {\n    parentName: \"a\",\n    \"aria-hidden\": \"true\",\n    \"focusable\": \"false\",\n    \"height\": \"16\",\n    \"version\": \"1.1\",\n    \"viewBox\": \"0 0 16 16\",\n    \"width\": \"16\"\n  }, mdx(\"path\", {\n    parentName: \"svg\",\n    \"fillRule\": \"evenodd\",\n    \"d\": \"M4 9h1v1H4c-1.5 0-3-1.69-3-3.5S2.55 3 4 3h4c1.45 0 3 1.69 3 3.5 0 1.41-.91 2.72-2 3.25V8.59c.58-.45 1-1.27 1-2.09C10 5.22 8.98 4 8 4H4c-.98 0-2 1.22-2 2.5S3 9 4 9zm9-3h-1v1h1c1 0 2 1.22 2 2.5S13.98 12 13 12H9c-.98 0-2-1.22-2-2.5 0-.83.42-1.64 1-2.09V6.25c-1.09.53-2 1.84-2 3.25C6 11.31 7.55 13 9 13h4c1.45 0 3-1.69 3-3.5S14.5 6 13 6z\"\n  }))), \"Guidance\"), mdx(\"h3\", {\n    \"id\": \"start-resume-and-edit-links\",\n    \"style\": {\n      \"position\": \"relative\"\n    }\n  }, mdx(\"a\", {\n    parentName: \"h3\",\n    \"href\": \"#start-resume-and-edit-links\",\n    \"aria-label\": \"start resume and edit links permalink\",\n    \"className\": \"anchor before\"\n  }, mdx(\"svg\", {\n    parentName: \"a\",\n    \"aria-hidden\": \"true\",\n    \"focusable\": \"false\",\n    \"height\": \"16\",\n    \"version\": \"1.1\",\n    \"viewBox\": \"0 0 16 16\",\n    \"width\": \"16\"\n  }, mdx(\"path\", {\n    parentName: \"svg\",\n    \"fillRule\": \"evenodd\",\n    \"d\": \"M4 9h1v1H4c-1.5 0-3-1.69-3-3.5S2.55 3 4 3h4c1.45 0 3 1.69 3 3.5 0 1.41-.91 2.72-2 3.25V8.59c.58-.45 1-1.27 1-2.09C10 5.22 8.98 4 8 4H4c-.98 0-2 1.22-2 2.5S3 9 4 9zm9-3h-1v1h1c1 0 2 1.22 2 2.5S13.98 12 13 12H9c-.98 0-2-1.22-2-2.5 0-.83.42-1.64 1-2.09V6.25c-1.09.53-2 1.84-2 3.25C6 11.31 7.55 13 9 13h4c1.45 0 3-1.69 3-3.5S14.5 6 13 6z\"\n  }))), \"Start, Resume, and Edit links\"), mdx(\"p\", null, \"A user interacts with the steps through \\\"Start\\\", \\\"Resume\\\", and \\\"Edit\\\"\\nlinks.\"), mdx(\"p\", null, \"In the React component, the links' \", mdx(\"inlineCode\", {\n    parentName: \"p\"\n  }, \"href\"), \" properties are determined by the\\n\", mdx(\"inlineCode\", {\n    parentName: \"p\"\n  }, \"step\"), \" object's \", mdx(\"inlineCode\", {\n    parentName: \"p\"\n  }, \"href\"), \" property. One can also optionally pass an\\n\", mdx(\"inlineCode\", {\n    parentName: \"p\"\n  }, \"onStepLinkClick\"), \" function that will cancel the default link behavior and call\\n\", mdx(\"inlineCode\", {\n    parentName: \"p\"\n  }, \"onStepLinkClick\"), \" with \", mdx(\"inlineCode\", {\n    parentName: \"p\"\n  }, \"href\"), \" as a parameter for apps that handle routing with\\nJavaScript.\"), mdx(\"p\", null, \"When a step has substeps and is incomplete, the \", mdx(\"inlineCode\", {\n    parentName: \"p\"\n  }, \"href\"), \" property should be set to\\nmatch the \", mdx(\"inlineCode\", {\n    parentName: \"p\"\n  }, \"href\"), \" of the current substep\\u2014that is, the first incomplete substep.\\nThe \\\"Edit\\\" button will only appear on substeps that have been completed.\"), mdx(\"h3\", {\n    \"id\": \"managing-list-state\",\n    \"style\": {\n      \"position\": \"relative\"\n    }\n  }, mdx(\"a\", {\n    parentName: \"h3\",\n    \"href\": \"#managing-list-state\",\n    \"aria-label\": \"managing list state permalink\",\n    \"className\": \"anchor before\"\n  }, mdx(\"svg\", {\n    parentName: \"a\",\n    \"aria-hidden\": \"true\",\n    \"focusable\": \"false\",\n    \"height\": \"16\",\n    \"version\": \"1.1\",\n    \"viewBox\": \"0 0 16 16\",\n    \"width\": \"16\"\n  }, mdx(\"path\", {\n    parentName: \"svg\",\n    \"fillRule\": \"evenodd\",\n    \"d\": \"M4 9h1v1H4c-1.5 0-3-1.69-3-3.5S2.55 3 4 3h4c1.45 0 3 1.69 3 3.5 0 1.41-.91 2.72-2 3.25V8.59c.58-.45 1-1.27 1-2.09C10 5.22 8.98 4 8 4H4c-.98 0-2 1.22-2 2.5S3 9 4 9zm9-3h-1v1h1c1 0 2 1.22 2 2.5S13.98 12 13 12H9c-.98 0-2-1.22-2-2.5 0-.83.42-1.64 1-2.09V6.25c-1.09.53-2 1.84-2 3.25C6 11.31 7.55 13 9 13h4c1.45 0 3-1.69 3-3.5S14.5 6 13 6z\"\n  }))), \"Managing list state\"), mdx(\"h4\", {\n    \"id\": \"substeps\",\n    \"style\": {\n      \"position\": \"relative\"\n    }\n  }, mdx(\"a\", {\n    parentName: \"h4\",\n    \"href\": \"#substeps\",\n    \"aria-label\": \"substeps permalink\",\n    \"className\": \"anchor before\"\n  }, mdx(\"svg\", {\n    parentName: \"a\",\n    \"aria-hidden\": \"true\",\n    \"focusable\": \"false\",\n    \"height\": \"16\",\n    \"version\": \"1.1\",\n    \"viewBox\": \"0 0 16 16\",\n    \"width\": \"16\"\n  }, mdx(\"path\", {\n    parentName: \"svg\",\n    \"fillRule\": \"evenodd\",\n    \"d\": \"M4 9h1v1H4c-1.5 0-3-1.69-3-3.5S2.55 3 4 3h4c1.45 0 3 1.69 3 3.5 0 1.41-.91 2.72-2 3.25V8.59c.58-.45 1-1.27 1-2.09C10 5.22 8.98 4 8 4H4c-.98 0-2 1.22-2 2.5S3 9 4 9zm9-3h-1v1h1c1 0 2 1.22 2 2.5S13.98 12 13 12H9c-.98 0-2-1.22-2-2.5 0-.83.42-1.64 1-2.09V6.25c-1.09.53-2 1.84-2 3.25C6 11.31 7.55 13 9 13h4c1.45 0 3-1.69 3-3.5S14.5 6 13 6z\"\n  }))), \"Substeps\"), mdx(\"p\", null, \"The \", mdx(\"inlineCode\", {\n    parentName: \"p\"\n  }, \"<StepList>\"), \" component takes an array of step objects. From there steps can\\nbe broken down infinitely into sub-steps. This allows us to have unique URLs for\\neach part of a step; however, by default we only display two levels of this tree\\n\\u2014the \", mdx(\"em\", {\n    parentName: \"p\"\n  }, \"step\"), \" and \", mdx(\"em\", {\n    parentName: \"p\"\n  }, \"substep\"), \". This default behavior should remain unchanged except\\nfor special circumstances. It is better not to overwhelm the user with showing\\nall the substeps and giving them names.\"), mdx(\"p\", null, \"We do, nonetheless, encourage the use of sub-substeps that are not visible where\\nthese substeps span multiple pages and have their own unique URLs. If, for\\nexample, the user completes the first page of the \", mdx(\"inlineCode\", {\n    parentName: \"p\"\n  }, \"household > overall\"), \" substep\\nwhere they list the household members but has not completed the second page\\nwhere they define those members' relationships to each other, we want the\\n\\\"Resume\\\" button to take them back to the relationships page and not the first\\npage where they entered their names. This, of course, requires an extra\\nsteps-building process to update a top-level steps' \", mdx(\"inlineCode\", {\n    parentName: \"p\"\n  }, \"href\"), \" property by\\ntraversing the substep tree to find the first incomplete step. See the\\n\", mdx(\"a\", {\n    parentName: \"p\",\n    \"href\": \"#completed-started-and-isnextstep\"\n  }, \"Completed, started, and isNextStep\"), \" section\\nbelow for an example JavaScript function that can change the \", mdx(\"inlineCode\", {\n    parentName: \"p\"\n  }, \"href\"), \" of steps\\nbased on their substeps.\"), mdx(\"h4\", {\n    \"id\": \"completed-started-and-isnextstep\",\n    \"style\": {\n      \"position\": \"relative\"\n    }\n  }, mdx(\"a\", {\n    parentName: \"h4\",\n    \"href\": \"#completed-started-and-isnextstep\",\n    \"aria-label\": \"completed started and isnextstep permalink\",\n    \"className\": \"anchor before\"\n  }, mdx(\"svg\", {\n    parentName: \"a\",\n    \"aria-hidden\": \"true\",\n    \"focusable\": \"false\",\n    \"height\": \"16\",\n    \"version\": \"1.1\",\n    \"viewBox\": \"0 0 16 16\",\n    \"width\": \"16\"\n  }, mdx(\"path\", {\n    parentName: \"svg\",\n    \"fillRule\": \"evenodd\",\n    \"d\": \"M4 9h1v1H4c-1.5 0-3-1.69-3-3.5S2.55 3 4 3h4c1.45 0 3 1.69 3 3.5 0 1.41-.91 2.72-2 3.25V8.59c.58-.45 1-1.27 1-2.09C10 5.22 8.98 4 8 4H4c-.98 0-2 1.22-2 2.5S3 9 4 9zm9-3h-1v1h1c1 0 2 1.22 2 2.5S13.98 12 13 12H9c-.98 0-2-1.22-2-2.5 0-.83.42-1.64 1-2.09V6.25c-1.09.53-2 1.84-2 3.25C6 11.31 7.55 13 9 13h4c1.45 0 3-1.69 3-3.5S14.5 6 13 6z\"\n  }))), \"Completed, started, and isNextStep\"), mdx(\"p\", null, \"The \", mdx(\"em\", {\n    parentName: \"p\"\n  }, \"state\"), \" of a step object will be defined for these purposes as the values\\nof its \", mdx(\"inlineCode\", {\n    parentName: \"p\"\n  }, \"completed\"), \", \", mdx(\"inlineCode\", {\n    parentName: \"p\"\n  }, \"started\"), \", and \", mdx(\"inlineCode\", {\n    parentName: \"p\"\n  }, \"isNextStep\"), \" properties. These correspond to\\ndifferent visual states when rendered by the \", mdx(\"inlineCode\", {\n    parentName: \"p\"\n  }, \"<StepList>\"), \", showing \\\"Completed\\\",\\n\\\"Resume\\\", or \\\"Start\\\" respectively. For steps with substeps, the state should be\\nrepresentative of the collective states of its substeps. For example, if a step\\nhas substeps that have \", mdx(\"inlineCode\", {\n    parentName: \"p\"\n  }, \"completed: false\"), \", that step should not have\\n\", mdx(\"inlineCode\", {\n    parentName: \"p\"\n  }, \"completed: true\"), \" because not all of its substeps have been completed. Similarly\\na step can only be \", mdx(\"inlineCode\", {\n    parentName: \"p\"\n  }, \"started\"), \" if at least one of its substeps has been \", mdx(\"inlineCode\", {\n    parentName: \"p\"\n  }, \"started\"), \".\\nThis should be true for each of the substep's substeps and so on. Below is an\\nexample function that can propagate this state information up from the smallest\\nsubstep to the largest step before passing the steps array to the \", mdx(\"inlineCode\", {\n    parentName: \"p\"\n  }, \"<StepList>\"), \"\\ncomponent.\"), mdx(\"pre\", null, mdx(\"code\", {\n    parentName: \"pre\",\n    \"className\": \"language-js\"\n  }, \"function propagateSubstepState(step) {\\n  if (step.steps) {\\n    const steps = step.steps.map(propagateSubstepState);\\n    const newStep = {\\n      ...step,\\n      steps,\\n      started: steps.some((s) => s.started),\\n      completed: steps.every((s) => s.completed),\\n    };\\n    if (!newStep.completed) {\\n      const nextStep = steps.find((s) => !s.completed);\\n      newStep.href = nextStep.href;\\n    }\\n    return newStep;\\n  } else {\\n    return step;\\n  }\\n}\\n\\n// ...\\n//\\n// Render function:\\n\\nconst steps = rawSteps.map(propagateSubstepState);\\nreturn <StepList steps={steps} />;\\n\")), mdx(\"h2\", {\n    \"id\": \"component-maturity\",\n    \"style\": {\n      \"position\": \"relative\"\n    }\n  }, mdx(\"a\", {\n    parentName: \"h2\",\n    \"href\": \"#component-maturity\",\n    \"aria-label\": \"component maturity permalink\",\n    \"className\": \"anchor before\"\n  }, mdx(\"svg\", {\n    parentName: \"a\",\n    \"aria-hidden\": \"true\",\n    \"focusable\": \"false\",\n    \"height\": \"16\",\n    \"version\": \"1.1\",\n    \"viewBox\": \"0 0 16 16\",\n    \"width\": \"16\"\n  }, mdx(\"path\", {\n    parentName: \"svg\",\n    \"fillRule\": \"evenodd\",\n    \"d\": \"M4 9h1v1H4c-1.5 0-3-1.69-3-3.5S2.55 3 4 3h4c1.45 0 3 1.69 3 3.5 0 1.41-.91 2.72-2 3.25V8.59c.58-.45 1-1.27 1-2.09C10 5.22 8.98 4 8 4H4c-.98 0-2 1.22-2 2.5S3 9 4 9zm9-3h-1v1h1c1 0 2 1.22 2 2.5S13.98 12 13 12H9c-.98 0-2-1.22-2-2.5 0-.83.42-1.64 1-2.09V6.25c-1.09.53-2 1.84-2 3.25C6 11.31 7.55 13 9 13h4c1.45 0 3-1.69 3-3.5S14.5 6 13 6z\"\n  }))), \"Component maturity\"), mdx(MaturityChecklist, {\n    a11yStandards: false,\n    color: true,\n    forcedColors: true,\n    screenReaders: true,\n    keyboardNavigable: false,\n    storybook: true,\n    responsive: true,\n    spanish: false,\n    completeUiKit: false,\n    responsiveUiKit: false,\n    tokensInCode: true,\n    tokensInSketch: true,\n    mdxType: \"MaturityChecklist\"\n  }));\n}\n;\nMDXContent.isMDXComponent = true;","tableOfContents":{"items":[{"url":"#examples","title":"Examples"},{"url":"#code","title":"Code","items":[{"url":"#react","title":"React"},{"url":"#styles","title":"Styles"}]},{"url":"#guidance","title":"Guidance","items":[{"url":"#start-resume-and-edit-links","title":"Start, Resume, and Edit links"},{"url":"#managing-list-state","title":"Managing list state"}]},{"url":"#component-maturity","title":"Component maturity"}]}}},"pageContext":{"id":"2fcb4b0e-0f8d-5089-826b-d33073c496c3"}},
    "staticQueryHashes": ["3481578012"]}