{"componentChunkName":"component---src-components-page-templates-info-page-tsx","path":"/components/button/","result":{"data":{"mdx":{"id":"1026dcd8-e735-5a82-ad19-cd6cab2f9e73","frontmatter":{"title":"Button","intro":"Buttons allow users to take actions from a current state to a future state.","cmsgov":{"figmaNodeId":"6-83"},"core":{"figmaNodeId":"6-83","githubLink":"design-system/src/components/Button","storybookLink":"components-button--docs"},"healthcare":{"figmaNodeId":"6-83","storybookLink":null,"githubLink":null},"medicare":{"figmaNodeId":"6-83","storybookLink":null,"githubLink":null}},"slug":"components/button","body":"const _excluded = [\"components\"];\nfunction _extends() { return _extends = Object.assign ? Object.assign.bind() : function (n) { for (var e = 1; e < arguments.length; e++) { var t = arguments[e]; for (var r in t) ({}).hasOwnProperty.call(t, r) && (n[r] = t[r]); } return n; }, _extends.apply(null, arguments); }\nfunction _objectWithoutProperties(e, t) { if (null == e) return {}; var o, r, i = _objectWithoutPropertiesLoose(e, t); if (Object.getOwnPropertySymbols) { var s = Object.getOwnPropertySymbols(e); for (r = 0; r < s.length; r++) o = s[r], t.includes(o) || {}.propertyIsEnumerable.call(e, o) && (i[o] = e[o]); } return i; }\nfunction _objectWithoutPropertiesLoose(r, e) { if (null == r) return {}; var t = {}; for (var n in r) if ({}.hasOwnProperty.call(r, n)) { if (e.includes(n)) continue; t[n] = r[n]; } return t; }\n/* @jsxRuntime classic */\n/* @jsx mdx */\n\nconst _frontmatter = {\n  \"title\": \"Button\",\n  \"intro\": \"Buttons allow users to take actions from a current state to a future state.\",\n  \"cmsgov\": {\n    \"figmaNodeId\": \"6-83\"\n  },\n  \"core\": {\n    \"figmaNodeId\": \"6-83\",\n    \"githubLink\": \"design-system/src/components/Button\",\n    \"storybookLink\": \"components-button--docs\"\n  },\n  \"healthcare\": {\n    \"figmaNodeId\": \"6-83\"\n  },\n  \"medicare\": {\n    \"figmaNodeId\": \"6-83\"\n  }\n};\nconst makeShortcode = name => function MDXDefaultShortcode(props) {\n  console.warn(\"Component \" + name + \" was not imported, exported, or provided by MDXProvider as global scope\");\n  return mdx(\"div\", props);\n};\nconst ButtonVariationsTable = makeShortcode(\"ButtonVariationsTable\");\nconst ThemeContent = makeShortcode(\"ThemeContent\");\nconst StorybookExample = makeShortcode(\"StorybookExample\");\nconst EmbeddedExample = makeShortcode(\"EmbeddedExample\");\nconst SeeStorybookForGuidance = makeShortcode(\"SeeStorybookForGuidance\");\nconst ComponentThemeOptions = makeShortcode(\"ComponentThemeOptions\");\nconst MaturityChecklist = makeShortcode(\"MaturityChecklist\");\nconst layoutProps = {\n  _frontmatter\n};\nconst MDXLayout = \"wrapper\";\nreturn function MDXContent(_ref) {\n  let {\n      components\n    } = _ref,\n    props = _objectWithoutProperties(_ref, _excluded);\n  return mdx(MDXLayout, _extends({}, layoutProps, props, {\n    components: components,\n    mdxType: \"MDXLayout\"\n  }), mdx(Alert, {\n    heading: \"Are you upgrading to v4 (healthcare v8, medicare v6)?\",\n    mdxType: \"Alert\"\n  }, mdx(\"p\", null, mdx(\"a\", {\n    parentName: \"p\",\n    \"href\": \"/design-system/branch/jryan/WNMGDS-3191-box-content/getting-started/migrating-to-new-buttons\"\n  }, `Take a look at our v4 buttons migration guide`), ` to get started.`)), mdx(\"h2\", {\n    \"id\": \"examples\",\n    \"style\": {\n      \"position\": \"relative\"\n    }\n  }, mdx(\"a\", {\n    parentName: \"h2\",\n    \"href\": \"#examples\",\n    \"aria-label\": \"examples permalink\",\n    \"className\": \"anchor before\"\n  }, mdx(\"svg\", {\n    parentName: \"a\",\n    \"aria-hidden\": \"true\",\n    \"focusable\": \"false\",\n    \"height\": \"16\",\n    \"version\": \"1.1\",\n    \"viewBox\": \"0 0 16 16\",\n    \"width\": \"16\"\n  }, mdx(\"path\", {\n    parentName: \"svg\",\n    \"fillRule\": \"evenodd\",\n    \"d\": \"M4 9h1v1H4c-1.5 0-3-1.69-3-3.5S2.55 3 4 3h4c1.45 0 3 1.69 3 3.5 0 1.41-.91 2.72-2 3.25V8.59c.58-.45 1-1.27 1-2.09C10 5.22 8.98 4 8 4H4c-.98 0-2 1.22-2 2.5S3 9 4 9zm9-3h-1v1h1c1 0 2 1.22 2 2.5S13.98 12 13 12H9c-.98 0-2-1.22-2-2.5 0-.83.42-1.64 1-2.09V6.25c-1.09.53-2 1.84-2 3.25C6 11.31 7.55 13 9 13h4c1.45 0 3-1.69 3-3.5S14.5 6 13 6z\"\n  }))), `Examples`), mdx(\"p\", null, `The following tables give an overview of the different available button styles in the selected design system. Each button has three controllable traits that can be used in various combinations. They are:`), mdx(\"ol\", null, mdx(\"li\", {\n    parentName: \"ol\"\n  }, mdx(\"em\", {\n    parentName: \"li\"\n  }, `Variation`), `: which affects the border and background styles`), mdx(\"li\", {\n    parentName: \"ol\"\n  }, `Color: defined as either `, mdx(\"em\", {\n    parentName: \"li\"\n  }, `main`), ` or `, mdx(\"em\", {\n    parentName: \"li\"\n  }, `alternate`)), mdx(\"li\", {\n    parentName: \"ol\"\n  }, `Context: specified as either `, mdx(\"em\", {\n    parentName: \"li\"\n  }, `on-light`), ` or `, mdx(\"em\", {\n    parentName: \"li\"\n  }, `on-dark`))), mdx(\"p\", null, `See the examples in the following sections to learn how they can be applied.`), mdx(ButtonVariationsTable, {\n    mdxType: \"ButtonVariationsTable\"\n  }), mdx(\"h3\", {\n    \"id\": \"main-buttons\",\n    \"style\": {\n      \"position\": \"relative\"\n    }\n  }, mdx(\"a\", {\n    parentName: \"h3\",\n    \"href\": \"#main-buttons\",\n    \"aria-label\": \"main buttons permalink\",\n    \"className\": \"anchor before\"\n  }, mdx(\"svg\", {\n    parentName: \"a\",\n    \"aria-hidden\": \"true\",\n    \"focusable\": \"false\",\n    \"height\": \"16\",\n    \"version\": \"1.1\",\n    \"viewBox\": \"0 0 16 16\",\n    \"width\": \"16\"\n  }, mdx(\"path\", {\n    parentName: \"svg\",\n    \"fillRule\": \"evenodd\",\n    \"d\": \"M4 9h1v1H4c-1.5 0-3-1.69-3-3.5S2.55 3 4 3h4c1.45 0 3 1.69 3 3.5 0 1.41-.91 2.72-2 3.25V8.59c.58-.45 1-1.27 1-2.09C10 5.22 8.98 4 8 4H4c-.98 0-2 1.22-2 2.5S3 9 4 9zm9-3h-1v1h1c1 0 2 1.22 2 2.5S13.98 12 13 12H9c-.98 0-2-1.22-2-2.5 0-.83.42-1.64 1-2.09V6.25c-1.09.53-2 1.84-2 3.25C6 11.31 7.55 13 9 13h4c1.45 0 3-1.69 3-3.5S14.5 6 13 6z\"\n  }))), `Main buttons`), mdx(\"h4\", {\n    \"id\": \"solid-button\",\n    \"style\": {\n      \"position\": \"relative\"\n    }\n  }, mdx(\"a\", {\n    parentName: \"h4\",\n    \"href\": \"#solid-button\",\n    \"aria-label\": \"solid button permalink\",\n    \"className\": \"anchor before\"\n  }, mdx(\"svg\", {\n    parentName: \"a\",\n    \"aria-hidden\": \"true\",\n    \"focusable\": \"false\",\n    \"height\": \"16\",\n    \"version\": \"1.1\",\n    \"viewBox\": \"0 0 16 16\",\n    \"width\": \"16\"\n  }, mdx(\"path\", {\n    parentName: \"svg\",\n    \"fillRule\": \"evenodd\",\n    \"d\": \"M4 9h1v1H4c-1.5 0-3-1.69-3-3.5S2.55 3 4 3h4c1.45 0 3 1.69 3 3.5 0 1.41-.91 2.72-2 3.25V8.59c.58-.45 1-1.27 1-2.09C10 5.22 8.98 4 8 4H4c-.98 0-2 1.22-2 2.5S3 9 4 9zm9-3h-1v1h1c1 0 2 1.22 2 2.5S13.98 12 13 12H9c-.98 0-2-1.22-2-2.5 0-.83.42-1.64 1-2.09V6.25c-1.09.53-2 1.84-2 3.25C6 11.31 7.55 13 9 13h4c1.45 0 3-1.69 3-3.5S14.5 6 13 6z\"\n  }))), `Solid button`), mdx(ThemeContent, {\n    onlyThemes: ['healthcare'],\n    mdxType: \"ThemeContent\"\n  }, mdx(\"p\", null, `Use solid buttons for the primary actions we want users to take. These actions are required for the user to move to the next step in the user flow (example: Enroll) or to highlight the main/key action.`)), mdx(StorybookExample, {\n    componentName: \"solid-button\",\n    sourceFilePath: \"components/Button/Button.tsx\",\n    storyId: \"components-button--default&args=children:Solid;variation:solid\",\n    mdxType: \"StorybookExample\"\n  }), mdx(\"h4\", {\n    \"id\": \"outline-button\",\n    \"style\": {\n      \"position\": \"relative\"\n    }\n  }, mdx(\"a\", {\n    parentName: \"h4\",\n    \"href\": \"#outline-button\",\n    \"aria-label\": \"outline button permalink\",\n    \"className\": \"anchor before\"\n  }, mdx(\"svg\", {\n    parentName: \"a\",\n    \"aria-hidden\": \"true\",\n    \"focusable\": \"false\",\n    \"height\": \"16\",\n    \"version\": \"1.1\",\n    \"viewBox\": \"0 0 16 16\",\n    \"width\": \"16\"\n  }, mdx(\"path\", {\n    parentName: \"svg\",\n    \"fillRule\": \"evenodd\",\n    \"d\": \"M4 9h1v1H4c-1.5 0-3-1.69-3-3.5S2.55 3 4 3h4c1.45 0 3 1.69 3 3.5 0 1.41-.91 2.72-2 3.25V8.59c.58-.45 1-1.27 1-2.09C10 5.22 8.98 4 8 4H4c-.98 0-2 1.22-2 2.5S3 9 4 9zm9-3h-1v1h1c1 0 2 1.22 2 2.5S13.98 12 13 12H9c-.98 0-2-1.22-2-2.5 0-.83.42-1.64 1-2.09V6.25c-1.09.53-2 1.84-2 3.25C6 11.31 7.55 13 9 13h4c1.45 0 3-1.69 3-3.5S14.5 6 13 6z\"\n  }))), `Outline button`), mdx(ThemeContent, {\n    onlyThemes: ['healthcare'],\n    mdxType: \"ThemeContent\"\n  }, mdx(\"p\", null, `Use outline buttons for actions available but not the primary action we want users to take (example: Plan details). There doesn't have to be a primary button on the page to use the secondary button.`)), mdx(StorybookExample, {\n    componentName: \"outline-button\",\n    sourceFilePath: \"components/Button/Button.tsx\",\n    storyId: \"components-button--default&args=children:Outline\",\n    mdxType: \"StorybookExample\"\n  }), mdx(\"h4\", {\n    \"id\": \"ghost-button\",\n    \"style\": {\n      \"position\": \"relative\"\n    }\n  }, mdx(\"a\", {\n    parentName: \"h4\",\n    \"href\": \"#ghost-button\",\n    \"aria-label\": \"ghost button permalink\",\n    \"className\": \"anchor before\"\n  }, mdx(\"svg\", {\n    parentName: \"a\",\n    \"aria-hidden\": \"true\",\n    \"focusable\": \"false\",\n    \"height\": \"16\",\n    \"version\": \"1.1\",\n    \"viewBox\": \"0 0 16 16\",\n    \"width\": \"16\"\n  }, mdx(\"path\", {\n    parentName: \"svg\",\n    \"fillRule\": \"evenodd\",\n    \"d\": \"M4 9h1v1H4c-1.5 0-3-1.69-3-3.5S2.55 3 4 3h4c1.45 0 3 1.69 3 3.5 0 1.41-.91 2.72-2 3.25V8.59c.58-.45 1-1.27 1-2.09C10 5.22 8.98 4 8 4H4c-.98 0-2 1.22-2 2.5S3 9 4 9zm9-3h-1v1h1c1 0 2 1.22 2 2.5S13.98 12 13 12H9c-.98 0-2-1.22-2-2.5 0-.83.42-1.64 1-2.09V6.25c-1.09.53-2 1.84-2 3.25C6 11.31 7.55 13 9 13h4c1.45 0 3-1.69 3-3.5S14.5 6 13 6z\"\n  }))), `Ghost button`), mdx(ThemeContent, {\n    onlyThemes: ['healthcare'],\n    mdxType: \"ThemeContent\"\n  }, mdx(\"p\", null, `Use ghost buttons for actions available but do not take priority over a primary or secondary CTAs (example: Cancel).`)), mdx(StorybookExample, {\n    componentName: \"ghost-button\",\n    sourceFilePath: \"components/Button/Button.tsx\",\n    storyId: \"components-button--default&args=children:Ghost;variation:ghost\",\n    mdxType: \"StorybookExample\"\n  }), mdx(\"h3\", {\n    \"id\": \"alternate-buttons\",\n    \"style\": {\n      \"position\": \"relative\"\n    }\n  }, mdx(\"a\", {\n    parentName: \"h3\",\n    \"href\": \"#alternate-buttons\",\n    \"aria-label\": \"alternate buttons permalink\",\n    \"className\": \"anchor before\"\n  }, mdx(\"svg\", {\n    parentName: \"a\",\n    \"aria-hidden\": \"true\",\n    \"focusable\": \"false\",\n    \"height\": \"16\",\n    \"version\": \"1.1\",\n    \"viewBox\": \"0 0 16 16\",\n    \"width\": \"16\"\n  }, mdx(\"path\", {\n    parentName: \"svg\",\n    \"fillRule\": \"evenodd\",\n    \"d\": \"M4 9h1v1H4c-1.5 0-3-1.69-3-3.5S2.55 3 4 3h4c1.45 0 3 1.69 3 3.5 0 1.41-.91 2.72-2 3.25V8.59c.58-.45 1-1.27 1-2.09C10 5.22 8.98 4 8 4H4c-.98 0-2 1.22-2 2.5S3 9 4 9zm9-3h-1v1h1c1 0 2 1.22 2 2.5S13.98 12 13 12H9c-.98 0-2-1.22-2-2.5 0-.83.42-1.64 1-2.09V6.25c-1.09.53-2 1.84-2 3.25C6 11.31 7.55 13 9 13h4c1.45 0 3-1.69 3-3.5S14.5 6 13 6z\"\n  }))), `Alternate buttons`), mdx(ThemeContent, {\n    onlyThemes: ['healthcare'],\n    mdxType: \"ThemeContent\"\n  }, mdx(Badge, {\n    variation: \"alert\",\n    mdxType: \"Badge\"\n  }, mdx(CloseIconThin, {\n    mdxType: \"CloseIconThin\"\n  }), \" Unused by Healthcare.\")), mdx(\"p\", null, `Each button variation (outline, solid, ghost) has an alternate option. Alternate buttons can be styled differently than the main buttons.`), mdx(ThemeContent, {\n    neverThemes: ['healthcare'],\n    mdxType: \"ThemeContent\"\n  }, mdx(\"h4\", {\n    \"id\": \"alternate-solid-button\",\n    \"style\": {\n      \"position\": \"relative\"\n    }\n  }, mdx(\"a\", {\n    parentName: \"h4\",\n    \"href\": \"#alternate-solid-button\",\n    \"aria-label\": \"alternate solid button permalink\",\n    \"className\": \"anchor before\"\n  }, mdx(\"svg\", {\n    parentName: \"a\",\n    \"aria-hidden\": \"true\",\n    \"focusable\": \"false\",\n    \"height\": \"16\",\n    \"version\": \"1.1\",\n    \"viewBox\": \"0 0 16 16\",\n    \"width\": \"16\"\n  }, mdx(\"path\", {\n    parentName: \"svg\",\n    \"fillRule\": \"evenodd\",\n    \"d\": \"M4 9h1v1H4c-1.5 0-3-1.69-3-3.5S2.55 3 4 3h4c1.45 0 3 1.69 3 3.5 0 1.41-.91 2.72-2 3.25V8.59c.58-.45 1-1.27 1-2.09C10 5.22 8.98 4 8 4H4c-.98 0-2 1.22-2 2.5S3 9 4 9zm9-3h-1v1h1c1 0 2 1.22 2 2.5S13.98 12 13 12H9c-.98 0-2-1.22-2-2.5 0-.83.42-1.64 1-2.09V6.25c-1.09.53-2 1.84-2 3.25C6 11.31 7.55 13 9 13h4c1.45 0 3-1.69 3-3.5S14.5 6 13 6z\"\n  }))), `Alternate solid button`), mdx(StorybookExample, {\n    componentName: \"solid-alt-button\",\n    sourceFilePath: \"components/Button/Button.tsx\",\n    storyId: \"components-button--default&args=children:Solid;variation:solid;isAlternate:true\",\n    mdxType: \"StorybookExample\"\n  })), mdx(ThemeContent, {\n    neverThemes: ['healthcare'],\n    mdxType: \"ThemeContent\"\n  }, mdx(\"h4\", {\n    \"id\": \"alternate-outline-button\",\n    \"style\": {\n      \"position\": \"relative\"\n    }\n  }, mdx(\"a\", {\n    parentName: \"h4\",\n    \"href\": \"#alternate-outline-button\",\n    \"aria-label\": \"alternate outline button permalink\",\n    \"className\": \"anchor before\"\n  }, mdx(\"svg\", {\n    parentName: \"a\",\n    \"aria-hidden\": \"true\",\n    \"focusable\": \"false\",\n    \"height\": \"16\",\n    \"version\": \"1.1\",\n    \"viewBox\": \"0 0 16 16\",\n    \"width\": \"16\"\n  }, mdx(\"path\", {\n    parentName: \"svg\",\n    \"fillRule\": \"evenodd\",\n    \"d\": \"M4 9h1v1H4c-1.5 0-3-1.69-3-3.5S2.55 3 4 3h4c1.45 0 3 1.69 3 3.5 0 1.41-.91 2.72-2 3.25V8.59c.58-.45 1-1.27 1-2.09C10 5.22 8.98 4 8 4H4c-.98 0-2 1.22-2 2.5S3 9 4 9zm9-3h-1v1h1c1 0 2 1.22 2 2.5S13.98 12 13 12H9c-.98 0-2-1.22-2-2.5 0-.83.42-1.64 1-2.09V6.25c-1.09.53-2 1.84-2 3.25C6 11.31 7.55 13 9 13h4c1.45 0 3-1.69 3-3.5S14.5 6 13 6z\"\n  }))), `Alternate outline button`)), mdx(ThemeContent, {\n    onlyThemes: ['medicare'],\n    mdxType: \"ThemeContent\"\n  }, mdx(Badge, {\n    variation: \"alert\",\n    mdxType: \"Badge\"\n  }, mdx(CloseIconThin, {\n    mdxType: \"CloseIconThin\"\n  }), \" Unused by Medicare.\")), mdx(ThemeContent, {\n    neverThemes: ['healthcare', 'medicare'],\n    mdxType: \"ThemeContent\"\n  }, mdx(StorybookExample, {\n    componentName: \"outline-alt-button\",\n    sourceFilePath: \"components/Button/Button.tsx\",\n    storyId: \"components-button--default&args=children:Outline;isAlternate:true\",\n    mdxType: \"StorybookExample\"\n  })), mdx(ThemeContent, {\n    neverThemes: ['healthcare'],\n    mdxType: \"ThemeContent\"\n  }, mdx(\"h4\", {\n    \"id\": \"alternate-ghost-button\",\n    \"style\": {\n      \"position\": \"relative\"\n    }\n  }, mdx(\"a\", {\n    parentName: \"h4\",\n    \"href\": \"#alternate-ghost-button\",\n    \"aria-label\": \"alternate ghost button permalink\",\n    \"className\": \"anchor before\"\n  }, mdx(\"svg\", {\n    parentName: \"a\",\n    \"aria-hidden\": \"true\",\n    \"focusable\": \"false\",\n    \"height\": \"16\",\n    \"version\": \"1.1\",\n    \"viewBox\": \"0 0 16 16\",\n    \"width\": \"16\"\n  }, mdx(\"path\", {\n    parentName: \"svg\",\n    \"fillRule\": \"evenodd\",\n    \"d\": \"M4 9h1v1H4c-1.5 0-3-1.69-3-3.5S2.55 3 4 3h4c1.45 0 3 1.69 3 3.5 0 1.41-.91 2.72-2 3.25V8.59c.58-.45 1-1.27 1-2.09C10 5.22 8.98 4 8 4H4c-.98 0-2 1.22-2 2.5S3 9 4 9zm9-3h-1v1h1c1 0 2 1.22 2 2.5S13.98 12 13 12H9c-.98 0-2-1.22-2-2.5 0-.83.42-1.64 1-2.09V6.25c-1.09.53-2 1.84-2 3.25C6 11.31 7.55 13 9 13h4c1.45 0 3-1.69 3-3.5S14.5 6 13 6z\"\n  }))), `Alternate ghost button`)), mdx(ThemeContent, {\n    onlyThemes: ['medicare'],\n    mdxType: \"ThemeContent\"\n  }, mdx(Badge, {\n    variation: \"alert\",\n    mdxType: \"Badge\"\n  }, mdx(CloseIconThin, {\n    mdxType: \"CloseIconThin\"\n  }), \" Unused by Medicare.\")), mdx(ThemeContent, {\n    neverThemes: ['healthcare', 'medicare'],\n    mdxType: \"ThemeContent\"\n  }, mdx(StorybookExample, {\n    componentName: \"ghost-alt-button\",\n    sourceFilePath: \"components/Button/Button.tsx\",\n    storyId: \"components-button--default&args=children:Ghost;variation:ghost;isAlternate:true\",\n    mdxType: \"StorybookExample\"\n  })), mdx(\"h3\", {\n    \"id\": \"on-dark-background\",\n    \"style\": {\n      \"position\": \"relative\"\n    }\n  }, mdx(\"a\", {\n    parentName: \"h3\",\n    \"href\": \"#on-dark-background\",\n    \"aria-label\": \"on dark background permalink\",\n    \"className\": \"anchor before\"\n  }, mdx(\"svg\", {\n    parentName: \"a\",\n    \"aria-hidden\": \"true\",\n    \"focusable\": \"false\",\n    \"height\": \"16\",\n    \"version\": \"1.1\",\n    \"viewBox\": \"0 0 16 16\",\n    \"width\": \"16\"\n  }, mdx(\"path\", {\n    parentName: \"svg\",\n    \"fillRule\": \"evenodd\",\n    \"d\": \"M4 9h1v1H4c-1.5 0-3-1.69-3-3.5S2.55 3 4 3h4c1.45 0 3 1.69 3 3.5 0 1.41-.91 2.72-2 3.25V8.59c.58-.45 1-1.27 1-2.09C10 5.22 8.98 4 8 4H4c-.98 0-2 1.22-2 2.5S3 9 4 9zm9-3h-1v1h1c1 0 2 1.22 2 2.5S13.98 12 13 12H9c-.98 0-2-1.22-2-2.5 0-.83.42-1.64 1-2.09V6.25c-1.09.53-2 1.84-2 3.25C6 11.31 7.55 13 9 13h4c1.45 0 3-1.69 3-3.5S14.5 6 13 6z\"\n  }))), `On dark background`), mdx(ThemeContent, {\n    onlyThemes: ['healthcare'],\n    mdxType: \"ThemeContent\"\n  }, mdx(Badge, {\n    variation: \"alert\",\n    mdxType: \"Badge\"\n  }, mdx(CloseIconThin, {\n    mdxType: \"CloseIconThin\"\n  }), \" Unused by Healthcare.\")), mdx(ThemeContent, {\n    neverThemes: ['healthcare'],\n    mdxType: \"ThemeContent\"\n  }, mdx(StorybookExample, {\n    componentName: \"on-dark-buttons\",\n    sourceFilePath: \"components/Button/Button.tsx\",\n    storyId: \"components-button--variations-on-dark\",\n    mdxType: \"StorybookExample\"\n  })), mdx(\"h3\", {\n    \"id\": \"button-sizes\",\n    \"style\": {\n      \"position\": \"relative\"\n    }\n  }, mdx(\"a\", {\n    parentName: \"h3\",\n    \"href\": \"#button-sizes\",\n    \"aria-label\": \"button sizes permalink\",\n    \"className\": \"anchor before\"\n  }, mdx(\"svg\", {\n    parentName: \"a\",\n    \"aria-hidden\": \"true\",\n    \"focusable\": \"false\",\n    \"height\": \"16\",\n    \"version\": \"1.1\",\n    \"viewBox\": \"0 0 16 16\",\n    \"width\": \"16\"\n  }, mdx(\"path\", {\n    parentName: \"svg\",\n    \"fillRule\": \"evenodd\",\n    \"d\": \"M4 9h1v1H4c-1.5 0-3-1.69-3-3.5S2.55 3 4 3h4c1.45 0 3 1.69 3 3.5 0 1.41-.91 2.72-2 3.25V8.59c.58-.45 1-1.27 1-2.09C10 5.22 8.98 4 8 4H4c-.98 0-2 1.22-2 2.5S3 9 4 9zm9-3h-1v1h1c1 0 2 1.22 2 2.5S13.98 12 13 12H9c-.98 0-2-1.22-2-2.5 0-.83.42-1.64 1-2.09V6.25c-1.09.53-2 1.84-2 3.25C6 11.31 7.55 13 9 13h4c1.45 0 3-1.69 3-3.5S14.5 6 13 6z\"\n  }))), `Button sizes`), mdx(\"p\", null, `Buttons can exist in two sizes other than default: \"big\" or \"small\".`), mdx(\"h4\", {\n    \"id\": \"big-button\",\n    \"style\": {\n      \"position\": \"relative\"\n    }\n  }, mdx(\"a\", {\n    parentName: \"h4\",\n    \"href\": \"#big-button\",\n    \"aria-label\": \"big button permalink\",\n    \"className\": \"anchor before\"\n  }, mdx(\"svg\", {\n    parentName: \"a\",\n    \"aria-hidden\": \"true\",\n    \"focusable\": \"false\",\n    \"height\": \"16\",\n    \"version\": \"1.1\",\n    \"viewBox\": \"0 0 16 16\",\n    \"width\": \"16\"\n  }, mdx(\"path\", {\n    parentName: \"svg\",\n    \"fillRule\": \"evenodd\",\n    \"d\": \"M4 9h1v1H4c-1.5 0-3-1.69-3-3.5S2.55 3 4 3h4c1.45 0 3 1.69 3 3.5 0 1.41-.91 2.72-2 3.25V8.59c.58-.45 1-1.27 1-2.09C10 5.22 8.98 4 8 4H4c-.98 0-2 1.22-2 2.5S3 9 4 9zm9-3h-1v1h1c1 0 2 1.22 2 2.5S13.98 12 13 12H9c-.98 0-2-1.22-2-2.5 0-.83.42-1.64 1-2.09V6.25c-1.09.53-2 1.84-2 3.25C6 11.31 7.55 13 9 13h4c1.45 0 3-1.69 3-3.5S14.5 6 13 6z\"\n  }))), `Big button`), mdx(ThemeContent, {\n    onlyThemes: ['healthcare'],\n    mdxType: \"ThemeContent\"\n  }, mdx(Badge, {\n    variation: \"alert\",\n    mdxType: \"Badge\"\n  }, mdx(CloseIconThin, {\n    mdxType: \"CloseIconThin\"\n  }), \" Unused by Healthcare.\")), mdx(ThemeContent, {\n    onlyThemes: ['core', 'medicare'],\n    mdxType: \"ThemeContent\"\n  }, mdx(EmbeddedExample, {\n    mdxType: \"EmbeddedExample\"\n  }, mdx(\"div\", null, mdx(Button, {\n    size: \"big\",\n    mdxType: \"Button\"\n  }, \"Big\")))), mdx(\"h4\", {\n    \"id\": \"small-button\",\n    \"style\": {\n      \"position\": \"relative\"\n    }\n  }, mdx(\"a\", {\n    parentName: \"h4\",\n    \"href\": \"#small-button\",\n    \"aria-label\": \"small button permalink\",\n    \"className\": \"anchor before\"\n  }, mdx(\"svg\", {\n    parentName: \"a\",\n    \"aria-hidden\": \"true\",\n    \"focusable\": \"false\",\n    \"height\": \"16\",\n    \"version\": \"1.1\",\n    \"viewBox\": \"0 0 16 16\",\n    \"width\": \"16\"\n  }, mdx(\"path\", {\n    parentName: \"svg\",\n    \"fillRule\": \"evenodd\",\n    \"d\": \"M4 9h1v1H4c-1.5 0-3-1.69-3-3.5S2.55 3 4 3h4c1.45 0 3 1.69 3 3.5 0 1.41-.91 2.72-2 3.25V8.59c.58-.45 1-1.27 1-2.09C10 5.22 8.98 4 8 4H4c-.98 0-2 1.22-2 2.5S3 9 4 9zm9-3h-1v1h1c1 0 2 1.22 2 2.5S13.98 12 13 12H9c-.98 0-2-1.22-2-2.5 0-.83.42-1.64 1-2.09V6.25c-1.09.53-2 1.84-2 3.25C6 11.31 7.55 13 9 13h4c1.45 0 3-1.69 3-3.5S14.5 6 13 6z\"\n  }))), `Small button`), mdx(ThemeContent, {\n    onlyThemes: ['healthcare'],\n    mdxType: \"ThemeContent\"\n  }, mdx(\"p\", null, `Small outline buttons are used for utility buttons on a page with other primary and secondary actions (example: Edit, Remove, Add another `, `[something]`, `).`)), mdx(EmbeddedExample, {\n    mdxType: \"EmbeddedExample\"\n  }, mdx(\"div\", null, mdx(Button, {\n    size: \"small\",\n    mdxType: \"Button\"\n  }, \"Small\"))), mdx(\"h3\", {\n    \"id\": \"adding-icons\",\n    \"style\": {\n      \"position\": \"relative\"\n    }\n  }, mdx(\"a\", {\n    parentName: \"h3\",\n    \"href\": \"#adding-icons\",\n    \"aria-label\": \"adding icons permalink\",\n    \"className\": \"anchor before\"\n  }, mdx(\"svg\", {\n    parentName: \"a\",\n    \"aria-hidden\": \"true\",\n    \"focusable\": \"false\",\n    \"height\": \"16\",\n    \"version\": \"1.1\",\n    \"viewBox\": \"0 0 16 16\",\n    \"width\": \"16\"\n  }, mdx(\"path\", {\n    parentName: \"svg\",\n    \"fillRule\": \"evenodd\",\n    \"d\": \"M4 9h1v1H4c-1.5 0-3-1.69-3-3.5S2.55 3 4 3h4c1.45 0 3 1.69 3 3.5 0 1.41-.91 2.72-2 3.25V8.59c.58-.45 1-1.27 1-2.09C10 5.22 8.98 4 8 4H4c-.98 0-2 1.22-2 2.5S3 9 4 9zm9-3h-1v1h1c1 0 2 1.22 2 2.5S13.98 12 13 12H9c-.98 0-2-1.22-2-2.5 0-.83.42-1.64 1-2.09V6.25c-1.09.53-2 1.84-2 3.25C6 11.31 7.55 13 9 13h4c1.45 0 3-1.69 3-3.5S14.5 6 13 6z\"\n  }))), `Adding icons`), mdx(\"ul\", null, mdx(\"li\", {\n    parentName: \"ul\"\n  }, `Add an inline SVG icon and it will become the same color as the button text. For the crispest icon rendering, ensure the icon has a square `, mdx(\"inlineCode\", {\n    parentName: \"li\"\n  }, `viewBox`), ` with values that are multiples of `, mdx(\"inlineCode\", {\n    parentName: \"li\"\n  }, `8`), ` (ie. `, mdx(\"inlineCode\", {\n    parentName: \"li\"\n  }, `24x24`), `).`), mdx(\"li\", {\n    parentName: \"ul\"\n  }, `Use the margin utility class to add spacing between the icon and button text.`)), mdx(EmbeddedExample, {\n    mdxType: \"EmbeddedExample\"\n  }, mdx(\"div\", null, mdx(Button, {\n    className: \"ds-u-margin-right--1\",\n    mdxType: \"Button\"\n  }, mdx(ArrowIcon, {\n    direction: \"left\",\n    className: \"ds-u-margin-right--05\",\n    mdxType: \"ArrowIcon\"\n  }), \"Left Icon\"), mdx(Button, {\n    className: \"ds-u-margin-right--1\",\n    mdxType: \"Button\"\n  }, \"Right Icon\", mdx(ArrowIcon, {\n    direction: \"right\",\n    className: \"ds-u-margin-left--05\",\n    mdxType: \"ArrowIcon\"\n  })))), mdx(\"h2\", {\n    \"id\": \"code\",\n    \"style\": {\n      \"position\": \"relative\"\n    }\n  }, mdx(\"a\", {\n    parentName: \"h2\",\n    \"href\": \"#code\",\n    \"aria-label\": \"code permalink\",\n    \"className\": \"anchor before\"\n  }, mdx(\"svg\", {\n    parentName: \"a\",\n    \"aria-hidden\": \"true\",\n    \"focusable\": \"false\",\n    \"height\": \"16\",\n    \"version\": \"1.1\",\n    \"viewBox\": \"0 0 16 16\",\n    \"width\": \"16\"\n  }, mdx(\"path\", {\n    parentName: \"svg\",\n    \"fillRule\": \"evenodd\",\n    \"d\": \"M4 9h1v1H4c-1.5 0-3-1.69-3-3.5S2.55 3 4 3h4c1.45 0 3 1.69 3 3.5 0 1.41-.91 2.72-2 3.25V8.59c.58-.45 1-1.27 1-2.09C10 5.22 8.98 4 8 4H4c-.98 0-2 1.22-2 2.5S3 9 4 9zm9-3h-1v1h1c1 0 2 1.22 2 2.5S13.98 12 13 12H9c-.98 0-2-1.22-2-2.5 0-.83.42-1.64 1-2.09V6.25c-1.09.53-2 1.84-2 3.25C6 11.31 7.55 13 9 13h4c1.45 0 3-1.69 3-3.5S14.5 6 13 6z\"\n  }))), `Code`), mdx(\"h3\", {\n    \"id\": \"react\",\n    \"style\": {\n      \"position\": \"relative\"\n    }\n  }, mdx(\"a\", {\n    parentName: \"h3\",\n    \"href\": \"#react\",\n    \"aria-label\": \"react permalink\",\n    \"className\": \"anchor before\"\n  }, mdx(\"svg\", {\n    parentName: \"a\",\n    \"aria-hidden\": \"true\",\n    \"focusable\": \"false\",\n    \"height\": \"16\",\n    \"version\": \"1.1\",\n    \"viewBox\": \"0 0 16 16\",\n    \"width\": \"16\"\n  }, mdx(\"path\", {\n    parentName: \"svg\",\n    \"fillRule\": \"evenodd\",\n    \"d\": \"M4 9h1v1H4c-1.5 0-3-1.69-3-3.5S2.55 3 4 3h4c1.45 0 3 1.69 3 3.5 0 1.41-.91 2.72-2 3.25V8.59c.58-.45 1-1.27 1-2.09C10 5.22 8.98 4 8 4H4c-.98 0-2 1.22-2 2.5S3 9 4 9zm9-3h-1v1h1c1 0 2 1.22 2 2.5S13.98 12 13 12H9c-.98 0-2-1.22-2-2.5 0-.83.42-1.64 1-2.09V6.25c-1.09.53-2 1.84-2 3.25C6 11.31 7.55 13 9 13h4c1.45 0 3-1.69 3-3.5S14.5 6 13 6z\"\n  }))), `React`), mdx(\"p\", null, `The `, mdx(\"inlineCode\", {\n    parentName: \"p\"\n  }, `Button`), ` component accepts its text as children (AKA inner HTML), which\nmeans you can also pass in HTML or custom components. This gives you a lot of\nflexibility and supports a variety of advanced use cases. The most common use\ncase would be passing in an SVG icon along with the text.`), mdx(\"p\", null, `In addition to the supported props listed, you can also pass in additional\nprops, which will be passed to the rendered root component. For example,\nyou could pass in a `, mdx(\"inlineCode\", {\n    parentName: \"p\"\n  }, `target`), ` prop to pass to the rendered anchor element.`), mdx(SeeStorybookForGuidance, {\n    storyId: 'components-button--docs',\n    mdxType: \"SeeStorybookForGuidance\"\n  }), mdx(\"h3\", {\n    \"id\": \"web-component\",\n    \"style\": {\n      \"position\": \"relative\"\n    }\n  }, mdx(\"a\", {\n    parentName: \"h3\",\n    \"href\": \"#web-component\",\n    \"aria-label\": \"web component permalink\",\n    \"className\": \"anchor before\"\n  }, mdx(\"svg\", {\n    parentName: \"a\",\n    \"aria-hidden\": \"true\",\n    \"focusable\": \"false\",\n    \"height\": \"16\",\n    \"version\": \"1.1\",\n    \"viewBox\": \"0 0 16 16\",\n    \"width\": \"16\"\n  }, mdx(\"path\", {\n    parentName: \"svg\",\n    \"fillRule\": \"evenodd\",\n    \"d\": \"M4 9h1v1H4c-1.5 0-3-1.69-3-3.5S2.55 3 4 3h4c1.45 0 3 1.69 3 3.5 0 1.41-.91 2.72-2 3.25V8.59c.58-.45 1-1.27 1-2.09C10 5.22 8.98 4 8 4H4c-.98 0-2 1.22-2 2.5S3 9 4 9zm9-3h-1v1h1c1 0 2 1.22 2 2.5S13.98 12 13 12H9c-.98 0-2-1.22-2-2.5 0-.83.42-1.64 1-2.09V6.25c-1.09.53-2 1.84-2 3.25C6 11.31 7.55 13 9 13h4c1.45 0 3-1.69 3-3.5S14.5 6 13 6z\"\n  }))), `Web Component`), mdx(SeeStorybookForGuidance, {\n    tech: \"wc\",\n    storyId: 'web-components-button--docs',\n    mdxType: \"SeeStorybookForGuidance\"\n  }), mdx(\"h3\", {\n    \"id\": \"style-customization\",\n    \"style\": {\n      \"position\": \"relative\"\n    }\n  }, mdx(\"a\", {\n    parentName: \"h3\",\n    \"href\": \"#style-customization\",\n    \"aria-label\": \"style customization permalink\",\n    \"className\": \"anchor before\"\n  }, mdx(\"svg\", {\n    parentName: \"a\",\n    \"aria-hidden\": \"true\",\n    \"focusable\": \"false\",\n    \"height\": \"16\",\n    \"version\": \"1.1\",\n    \"viewBox\": \"0 0 16 16\",\n    \"width\": \"16\"\n  }, mdx(\"path\", {\n    parentName: \"svg\",\n    \"fillRule\": \"evenodd\",\n    \"d\": \"M4 9h1v1H4c-1.5 0-3-1.69-3-3.5S2.55 3 4 3h4c1.45 0 3 1.69 3 3.5 0 1.41-.91 2.72-2 3.25V8.59c.58-.45 1-1.27 1-2.09C10 5.22 8.98 4 8 4H4c-.98 0-2 1.22-2 2.5S3 9 4 9zm9-3h-1v1h1c1 0 2 1.22 2 2.5S13.98 12 13 12H9c-.98 0-2-1.22-2-2.5 0-.83.42-1.64 1-2.09V6.25c-1.09.53-2 1.84-2 3.25C6 11.31 7.55 13 9 13h4c1.45 0 3-1.69 3-3.5S14.5 6 13 6z\"\n  }))), `Style customization`), mdx(\"p\", null, `The following CSS variables can be overridden to customize Button components:`), mdx(ComponentThemeOptions, {\n    componentname: \"button\",\n    mdxType: \"ComponentThemeOptions\"\n  }), mdx(\"h3\", {\n    \"id\": \"analytics\",\n    \"style\": {\n      \"position\": \"relative\"\n    }\n  }, mdx(\"a\", {\n    parentName: \"h3\",\n    \"href\": \"#analytics\",\n    \"aria-label\": \"analytics permalink\",\n    \"className\": \"anchor before\"\n  }, mdx(\"svg\", {\n    parentName: \"a\",\n    \"aria-hidden\": \"true\",\n    \"focusable\": \"false\",\n    \"height\": \"16\",\n    \"version\": \"1.1\",\n    \"viewBox\": \"0 0 16 16\",\n    \"width\": \"16\"\n  }, mdx(\"path\", {\n    parentName: \"svg\",\n    \"fillRule\": \"evenodd\",\n    \"d\": \"M4 9h1v1H4c-1.5 0-3-1.69-3-3.5S2.55 3 4 3h4c1.45 0 3 1.69 3 3.5 0 1.41-.91 2.72-2 3.25V8.59c.58-.45 1-1.27 1-2.09C10 5.22 8.98 4 8 4H4c-.98 0-2 1.22-2 2.5S3 9 4 9zm9-3h-1v1h1c1 0 2 1.22 2 2.5S13.98 12 13 12H9c-.98 0-2-1.22-2-2.5 0-.83.42-1.64 1-2.09V6.25c-1.09.53-2 1.84-2 3.25C6 11.31 7.55 13 9 13h4c1.45 0 3-1.69 3-3.5S14.5 6 13 6z\"\n  }))), `Analytics`), mdx(\"p\", null, `This component has analytics tracking available. Please see our developer documentation about `, mdx(\"a\", {\n    parentName: \"p\",\n    \"href\": \"/design-system/branch/jryan/WNMGDS-3191-box-content/getting-started/for-developers/#analytics\"\n  }, `using analytics in the design system`), `.`), mdx(\"h2\", {\n    \"id\": \"guidance\",\n    \"style\": {\n      \"position\": \"relative\"\n    }\n  }, mdx(\"a\", {\n    parentName: \"h2\",\n    \"href\": \"#guidance\",\n    \"aria-label\": \"guidance permalink\",\n    \"className\": \"anchor before\"\n  }, mdx(\"svg\", {\n    parentName: \"a\",\n    \"aria-hidden\": \"true\",\n    \"focusable\": \"false\",\n    \"height\": \"16\",\n    \"version\": \"1.1\",\n    \"viewBox\": \"0 0 16 16\",\n    \"width\": \"16\"\n  }, mdx(\"path\", {\n    parentName: \"svg\",\n    \"fillRule\": \"evenodd\",\n    \"d\": \"M4 9h1v1H4c-1.5 0-3-1.69-3-3.5S2.55 3 4 3h4c1.45 0 3 1.69 3 3.5 0 1.41-.91 2.72-2 3.25V8.59c.58-.45 1-1.27 1-2.09C10 5.22 8.98 4 8 4H4c-.98 0-2 1.22-2 2.5S3 9 4 9zm9-3h-1v1h1c1 0 2 1.22 2 2.5S13.98 12 13 12H9c-.98 0-2-1.22-2-2.5 0-.83.42-1.64 1-2.09V6.25c-1.09.53-2 1.84-2 3.25C6 11.31 7.55 13 9 13h4c1.45 0 3-1.69 3-3.5S14.5 6 13 6z\"\n  }))), `Guidance`), mdx(\"p\", null, `Buttons are promises to the user; they must deliver the promise they offer by doing what the button says it will do.`), mdx(ThemeContent, {\n    onlyThemes: ['medicare'],\n    mdxType: \"ThemeContent\"\n  }, mdx(\"ul\", null, mdx(\"li\", {\n    parentName: \"ul\"\n  }, `Action buttons do NOT include icons.`, mdx(\"br\", null), \" \", mdx(\"i\", null, \"Exception:\"), \" Can include icons in buttons in mobile for CTAs outlining functionality.\", mdx(\"br\", null), \" Examples: Filter, Sort, Map, and Menu.\", ' '), mdx(\"li\", {\n    parentName: \"ul\"\n  }, `Buttons use title case. Example: Join Plan or Find Doctors.`)), mdx(\"p\", null, `When pairing 2 CTAs:`), mdx(\"ul\", null, mdx(\"li\", {\n    parentName: \"ul\"\n  }, `In forms/decision trees: Have the preferred action be on the right. Example: Back/Next or Cancel/Submit.`), mdx(\"li\", {\n    parentName: \"ul\"\n  }, `All other cases: Have the preferred action be on the left. Example: Create Account/Return to Home or Change My Account/Stop Easy Pay.`))), mdx(\"h3\", {\n    \"id\": \"when-to-use\",\n    \"style\": {\n      \"position\": \"relative\"\n    }\n  }, mdx(\"a\", {\n    parentName: \"h3\",\n    \"href\": \"#when-to-use\",\n    \"aria-label\": \"when to use permalink\",\n    \"className\": \"anchor before\"\n  }, mdx(\"svg\", {\n    parentName: \"a\",\n    \"aria-hidden\": \"true\",\n    \"focusable\": \"false\",\n    \"height\": \"16\",\n    \"version\": \"1.1\",\n    \"viewBox\": \"0 0 16 16\",\n    \"width\": \"16\"\n  }, mdx(\"path\", {\n    parentName: \"svg\",\n    \"fillRule\": \"evenodd\",\n    \"d\": \"M4 9h1v1H4c-1.5 0-3-1.69-3-3.5S2.55 3 4 3h4c1.45 0 3 1.69 3 3.5 0 1.41-.91 2.72-2 3.25V8.59c.58-.45 1-1.27 1-2.09C10 5.22 8.98 4 8 4H4c-.98 0-2 1.22-2 2.5S3 9 4 9zm9-3h-1v1h1c1 0 2 1.22 2 2.5S13.98 12 13 12H9c-.98 0-2-1.22-2-2.5 0-.83.42-1.64 1-2.09V6.25c-1.09.53-2 1.84-2 3.25C6 11.31 7.55 13 9 13h4c1.45 0 3-1.69 3-3.5S14.5 6 13 6z\"\n  }))), `When to use`), mdx(\"ul\", null, mdx(\"li\", {\n    parentName: \"ul\"\n  }, `Use buttons for the most important actions you want users to take on your site, such as \"Download,\" \"Sign up,\" or \"Apply.\"`)), mdx(\"h3\", {\n    \"id\": \"when-to-consider-alternatives\",\n    \"style\": {\n      \"position\": \"relative\"\n    }\n  }, mdx(\"a\", {\n    parentName: \"h3\",\n    \"href\": \"#when-to-consider-alternatives\",\n    \"aria-label\": \"when to consider alternatives permalink\",\n    \"className\": \"anchor before\"\n  }, mdx(\"svg\", {\n    parentName: \"a\",\n    \"aria-hidden\": \"true\",\n    \"focusable\": \"false\",\n    \"height\": \"16\",\n    \"version\": \"1.1\",\n    \"viewBox\": \"0 0 16 16\",\n    \"width\": \"16\"\n  }, mdx(\"path\", {\n    parentName: \"svg\",\n    \"fillRule\": \"evenodd\",\n    \"d\": \"M4 9h1v1H4c-1.5 0-3-1.69-3-3.5S2.55 3 4 3h4c1.45 0 3 1.69 3 3.5 0 1.41-.91 2.72-2 3.25V8.59c.58-.45 1-1.27 1-2.09C10 5.22 8.98 4 8 4H4c-.98 0-2 1.22-2 2.5S3 9 4 9zm9-3h-1v1h1c1 0 2 1.22 2 2.5S13.98 12 13 12H9c-.98 0-2-1.22-2-2.5 0-.83.42-1.64 1-2.09V6.25c-1.09.53-2 1.84-2 3.25C6 11.31 7.55 13 9 13h4c1.45 0 3-1.69 3-3.5S14.5 6 13 6z\"\n  }))), `When to consider alternatives`), mdx(\"ul\", null, mdx(\"li\", {\n    parentName: \"ul\"\n  }, `Less popular or less important actions may be visually styled as links.`), mdx(\"li\", {\n    parentName: \"ul\"\n  }, `Buttons are for performing actions, not making choices. If you need your users to make a choice, use something else like radio buttons. Alternatively, if one choice is much less important then try styling it as a link instead.`)), mdx(\"h3\", {\n    \"id\": \"usage\",\n    \"style\": {\n      \"position\": \"relative\"\n    }\n  }, mdx(\"a\", {\n    parentName: \"h3\",\n    \"href\": \"#usage\",\n    \"aria-label\": \"usage permalink\",\n    \"className\": \"anchor before\"\n  }, mdx(\"svg\", {\n    parentName: \"a\",\n    \"aria-hidden\": \"true\",\n    \"focusable\": \"false\",\n    \"height\": \"16\",\n    \"version\": \"1.1\",\n    \"viewBox\": \"0 0 16 16\",\n    \"width\": \"16\"\n  }, mdx(\"path\", {\n    parentName: \"svg\",\n    \"fillRule\": \"evenodd\",\n    \"d\": \"M4 9h1v1H4c-1.5 0-3-1.69-3-3.5S2.55 3 4 3h4c1.45 0 3 1.69 3 3.5 0 1.41-.91 2.72-2 3.25V8.59c.58-.45 1-1.27 1-2.09C10 5.22 8.98 4 8 4H4c-.98 0-2 1.22-2 2.5S3 9 4 9zm9-3h-1v1h1c1 0 2 1.22 2 2.5S13.98 12 13 12H9c-.98 0-2-1.22-2-2.5 0-.83.42-1.64 1-2.09V6.25c-1.09.53-2 1.84-2 3.25C6 11.31 7.55 13 9 13h4c1.45 0 3-1.69 3-3.5S14.5 6 13 6z\"\n  }))), `Usage`), mdx(\"ul\", null, mdx(\"li\", {\n    parentName: \"ul\"\n  }, `Avoid using too many buttons on a page. Aim to use only one button per page.`), mdx(\"li\", {\n    parentName: \"ul\"\n  }, `Avoid similar styles elsewhere on the page that could be confused for buttons.`), mdx(\"li\", {\n    parentName: \"ul\"\n  }, `Use buttons for the primary action and links for secondary actions.`)), mdx(ThemeContent, {\n    onlyThemes: ['healthcare'],\n    mdxType: \"ThemeContent\"\n  }, mdx(\"h4\", {\n    \"id\": \"dont\",\n    \"style\": {\n      \"position\": \"relative\"\n    }\n  }, mdx(\"a\", {\n    parentName: \"h4\",\n    \"href\": \"#dont\",\n    \"aria-label\": \"dont permalink\",\n    \"className\": \"anchor before\"\n  }, mdx(\"svg\", {\n    parentName: \"a\",\n    \"aria-hidden\": \"true\",\n    \"focusable\": \"false\",\n    \"height\": \"16\",\n    \"version\": \"1.1\",\n    \"viewBox\": \"0 0 16 16\",\n    \"width\": \"16\"\n  }, mdx(\"path\", {\n    parentName: \"svg\",\n    \"fillRule\": \"evenodd\",\n    \"d\": \"M4 9h1v1H4c-1.5 0-3-1.69-3-3.5S2.55 3 4 3h4c1.45 0 3 1.69 3 3.5 0 1.41-.91 2.72-2 3.25V8.59c.58-.45 1-1.27 1-2.09C10 5.22 8.98 4 8 4H4c-.98 0-2 1.22-2 2.5S3 9 4 9zm9-3h-1v1h1c1 0 2 1.22 2 2.5S13.98 12 13 12H9c-.98 0-2-1.22-2-2.5 0-.83.42-1.64 1-2.09V6.25c-1.09.53-2 1.84-2 3.25C6 11.31 7.55 13 9 13h4c1.45 0 3-1.69 3-3.5S14.5 6 13 6z\"\n  }))), `Don't`), mdx(\"ul\", null, mdx(\"li\", {\n    parentName: \"ul\"\n  }, `Use buttons for navigational elements like going to a new page.`))), mdx(\"p\", null, mdx(\"strong\", {\n    parentName: \"p\"\n  }, `Label text`)), mdx(\"ul\", null, mdx(\"li\", {\n    parentName: \"ul\"\n  }, `Use sentence case for button labels.`), mdx(\"li\", {\n    parentName: \"ul\"\n  }, `Button labels should be as short as possible with “trigger words” that your users will recognize to clearly explain what will happen when the button is clicked (for example, “Save and continue,” “Download” or “Sign up”).`), mdx(\"li\", {\n    parentName: \"ul\"\n  }, `Make the first word of the button’s label a verb. For example, instead of “Complaint Filing”, label the button “File a complaint.”`), mdx(\"li\", {\n    parentName: \"ul\"\n  }, `If a button has an icon, it should still have accompanying text describing the action.`)), mdx(\"p\", null, mdx(\"strong\", {\n    parentName: \"p\"\n  }, `Destructive buttons`)), mdx(\"ul\", null, mdx(\"li\", {\n    parentName: \"ul\"\n  }, `Confirm the user meant to trigger a destructive action before following through with the action.`), mdx(\"li\", {\n    parentName: \"ul\"\n  }, `Provide a method for a user to undo a destructive action.`)), mdx(ThemeContent, {\n    onlyThemes: ['healthcare'],\n    mdxType: \"ThemeContent\"\n  }, mdx(\"h3\", {\n    \"id\": \"design-guidelines\",\n    \"style\": {\n      \"position\": \"relative\"\n    }\n  }, mdx(\"a\", {\n    parentName: \"h3\",\n    \"href\": \"#design-guidelines\",\n    \"aria-label\": \"design guidelines permalink\",\n    \"className\": \"anchor before\"\n  }, mdx(\"svg\", {\n    parentName: \"a\",\n    \"aria-hidden\": \"true\",\n    \"focusable\": \"false\",\n    \"height\": \"16\",\n    \"version\": \"1.1\",\n    \"viewBox\": \"0 0 16 16\",\n    \"width\": \"16\"\n  }, mdx(\"path\", {\n    parentName: \"svg\",\n    \"fillRule\": \"evenodd\",\n    \"d\": \"M4 9h1v1H4c-1.5 0-3-1.69-3-3.5S2.55 3 4 3h4c1.45 0 3 1.69 3 3.5 0 1.41-.91 2.72-2 3.25V8.59c.58-.45 1-1.27 1-2.09C10 5.22 8.98 4 8 4H4c-.98 0-2 1.22-2 2.5S3 9 4 9zm9-3h-1v1h1c1 0 2 1.22 2 2.5S13.98 12 13 12H9c-.98 0-2-1.22-2-2.5 0-.83.42-1.64 1-2.09V6.25c-1.09.53-2 1.84-2 3.25C6 11.31 7.55 13 9 13h4c1.45 0 3-1.69 3-3.5S14.5 6 13 6z\"\n  }))), `Design guidelines`), mdx(\"ul\", null, mdx(\"li\", {\n    parentName: \"ul\"\n  }, `Buttons are used for actions; links are used for navigation`), mdx(\"li\", {\n    parentName: \"ul\"\n  }, `Buttons do NOT include icons.`, mdx(\"ul\", {\n    parentName: \"li\"\n  }, mdx(\"li\", {\n    parentName: \"ul\"\n  }, `Exception: Can include icons in buttons for utility actions like print and save and branded buttons like Facebook, Twitter, and YouTube used in the Footer`))), mdx(\"li\", {\n    parentName: \"ul\"\n  }, `When pairing 2 buttons the preferred/main action is placed on the left.`), mdx(\"li\", {\n    parentName: \"ul\"\n  }, `Ghost buttons are typically used when paired with a Solid or Outline button or to indicate lower priority actions.`))), mdx(\"h3\", {\n    \"id\": \"accessibility\",\n    \"style\": {\n      \"position\": \"relative\"\n    }\n  }, mdx(\"a\", {\n    parentName: \"h3\",\n    \"href\": \"#accessibility\",\n    \"aria-label\": \"accessibility permalink\",\n    \"className\": \"anchor before\"\n  }, mdx(\"svg\", {\n    parentName: \"a\",\n    \"aria-hidden\": \"true\",\n    \"focusable\": \"false\",\n    \"height\": \"16\",\n    \"version\": \"1.1\",\n    \"viewBox\": \"0 0 16 16\",\n    \"width\": \"16\"\n  }, mdx(\"path\", {\n    parentName: \"svg\",\n    \"fillRule\": \"evenodd\",\n    \"d\": \"M4 9h1v1H4c-1.5 0-3-1.69-3-3.5S2.55 3 4 3h4c1.45 0 3 1.69 3 3.5 0 1.41-.91 2.72-2 3.25V8.59c.58-.45 1-1.27 1-2.09C10 5.22 8.98 4 8 4H4c-.98 0-2 1.22-2 2.5S3 9 4 9zm9-3h-1v1h1c1 0 2 1.22 2 2.5S13.98 12 13 12H9c-.98 0-2-1.22-2-2.5 0-.83.42-1.64 1-2.09V6.25c-1.09.53-2 1.84-2 3.25C6 11.31 7.55 13 9 13h4c1.45 0 3-1.69 3-3.5S14.5 6 13 6z\"\n  }))), `Accessibility`), mdx(\"ul\", null, mdx(\"li\", {\n    parentName: \"ul\"\n  }, `Make sure the `, mdx(\"inlineCode\", {\n    parentName: \"li\"\n  }, `type`), ` attribute has the correct value. By default, this is set to `, mdx(\"inlineCode\", {\n    parentName: \"li\"\n  }, `submit`), ` but in most you’ll need to set this to `, mdx(\"inlineCode\", {\n    parentName: \"li\"\n  }, `button`), ` to prevent unwanted behavior when pressed.`)), mdx(\"h4\", {\n    \"id\": \"links-vs-buttons\",\n    \"style\": {\n      \"position\": \"relative\"\n    }\n  }, mdx(\"a\", {\n    parentName: \"h4\",\n    \"href\": \"#links-vs-buttons\",\n    \"aria-label\": \"links vs buttons permalink\",\n    \"className\": \"anchor before\"\n  }, mdx(\"svg\", {\n    parentName: \"a\",\n    \"aria-hidden\": \"true\",\n    \"focusable\": \"false\",\n    \"height\": \"16\",\n    \"version\": \"1.1\",\n    \"viewBox\": \"0 0 16 16\",\n    \"width\": \"16\"\n  }, mdx(\"path\", {\n    parentName: \"svg\",\n    \"fillRule\": \"evenodd\",\n    \"d\": \"M4 9h1v1H4c-1.5 0-3-1.69-3-3.5S2.55 3 4 3h4c1.45 0 3 1.69 3 3.5 0 1.41-.91 2.72-2 3.25V8.59c.58-.45 1-1.27 1-2.09C10 5.22 8.98 4 8 4H4c-.98 0-2 1.22-2 2.5S3 9 4 9zm9-3h-1v1h1c1 0 2 1.22 2 2.5S13.98 12 13 12H9c-.98 0-2-1.22-2-2.5 0-.83.42-1.64 1-2.09V6.25c-1.09.53-2 1.84-2 3.25C6 11.31 7.55 13 9 13h4c1.45 0 3-1.69 3-3.5S14.5 6 13 6z\"\n  }))), `Links vs. buttons`), mdx(\"p\", null, `Links and buttons are read differently when using a screen reader. In its most basic form, the rules are:`), mdx(\"ul\", null, mdx(\"li\", {\n    parentName: \"ul\"\n  }, `If it goes somewhere, use a link in the form of `, mdx(\"inlineCode\", {\n    parentName: \"li\"\n  }, `<a>`), `.`), mdx(\"li\", {\n    parentName: \"ul\"\n  }, `If it does something on the page such as submitting a form, opening a dialog, canceling an action, or deleting an item, then use a button in the form of `, mdx(\"inlineCode\", {\n    parentName: \"li\"\n  }, `<button>`), `.`)), mdx(\"h5\", {\n    \"id\": \"navigating-with-a-screen-reader\",\n    \"style\": {\n      \"position\": \"relative\"\n    }\n  }, mdx(\"a\", {\n    parentName: \"h5\",\n    \"href\": \"#navigating-with-a-screen-reader\",\n    \"aria-label\": \"navigating with a screen reader permalink\",\n    \"className\": \"anchor before\"\n  }, mdx(\"svg\", {\n    parentName: \"a\",\n    \"aria-hidden\": \"true\",\n    \"focusable\": \"false\",\n    \"height\": \"16\",\n    \"version\": \"1.1\",\n    \"viewBox\": \"0 0 16 16\",\n    \"width\": \"16\"\n  }, mdx(\"path\", {\n    parentName: \"svg\",\n    \"fillRule\": \"evenodd\",\n    \"d\": \"M4 9h1v1H4c-1.5 0-3-1.69-3-3.5S2.55 3 4 3h4c1.45 0 3 1.69 3 3.5 0 1.41-.91 2.72-2 3.25V8.59c.58-.45 1-1.27 1-2.09C10 5.22 8.98 4 8 4H4c-.98 0-2 1.22-2 2.5S3 9 4 9zm9-3h-1v1h1c1 0 2 1.22 2 2.5S13.98 12 13 12H9c-.98 0-2-1.22-2-2.5 0-.83.42-1.64 1-2.09V6.25c-1.09.53-2 1.84-2 3.25C6 11.31 7.55 13 9 13h4c1.45 0 3-1.69 3-3.5S14.5 6 13 6z\"\n  }))), `Navigating with a screen reader`), mdx(\"p\", null, `Web browsers and assistive technology aid users by providing lists of common elements like headings, buttons, links, and images, and let you navigate directly to the element of your choosing. This allows screen reader users to speed up their comprehension of the page.`), mdx(\"p\", null, `One example of this collection of lists in a screen reader is the `, mdx(\"a\", {\n    parentName: \"p\",\n    \"href\": \"https://support.apple.com/guide/voiceover/with-the-voiceover-rotor-mchlp2719/mac\"\n  }, `VoiceOver rotor`), ` on a Mac. To turn on VoiceOver’s rotor, use the keyboard shortcut: `, mdx(\"strong\", {\n    parentName: \"p\"\n  }, `control + alt + U`), `.`), mdx(\"p\", null, `If elements are not coded semantically (a link as a button or a button as a link), then users won't be able to navigate a page as easily.`), mdx(\"h5\", {\n    \"id\": \"navigating-with-a-keyboard\",\n    \"style\": {\n      \"position\": \"relative\"\n    }\n  }, mdx(\"a\", {\n    parentName: \"h5\",\n    \"href\": \"#navigating-with-a-keyboard\",\n    \"aria-label\": \"navigating with a keyboard permalink\",\n    \"className\": \"anchor before\"\n  }, mdx(\"svg\", {\n    parentName: \"a\",\n    \"aria-hidden\": \"true\",\n    \"focusable\": \"false\",\n    \"height\": \"16\",\n    \"version\": \"1.1\",\n    \"viewBox\": \"0 0 16 16\",\n    \"width\": \"16\"\n  }, mdx(\"path\", {\n    parentName: \"svg\",\n    \"fillRule\": \"evenodd\",\n    \"d\": \"M4 9h1v1H4c-1.5 0-3-1.69-3-3.5S2.55 3 4 3h4c1.45 0 3 1.69 3 3.5 0 1.41-.91 2.72-2 3.25V8.59c.58-.45 1-1.27 1-2.09C10 5.22 8.98 4 8 4H4c-.98 0-2 1.22-2 2.5S3 9 4 9zm9-3h-1v1h1c1 0 2 1.22 2 2.5S13.98 12 13 12H9c-.98 0-2-1.22-2-2.5 0-.83.42-1.64 1-2.09V6.25c-1.09.53-2 1.84-2 3.25C6 11.31 7.55 13 9 13h4c1.45 0 3-1.69 3-3.5S14.5 6 13 6z\"\n  }))), `Navigating with a keyboard`), mdx(\"p\", null, `For users who navigate pages with keyboards instead of a mouse, buttons can be triggered by pressing the space bar or the enter key while links are only triggered by the enter key. This makes a difference to a screen reader user's flow.`), mdx(\"h4\", {\n    \"id\": \"icon-buttons\",\n    \"style\": {\n      \"position\": \"relative\"\n    }\n  }, mdx(\"a\", {\n    parentName: \"h4\",\n    \"href\": \"#icon-buttons\",\n    \"aria-label\": \"icon buttons permalink\",\n    \"className\": \"anchor before\"\n  }, mdx(\"svg\", {\n    parentName: \"a\",\n    \"aria-hidden\": \"true\",\n    \"focusable\": \"false\",\n    \"height\": \"16\",\n    \"version\": \"1.1\",\n    \"viewBox\": \"0 0 16 16\",\n    \"width\": \"16\"\n  }, mdx(\"path\", {\n    parentName: \"svg\",\n    \"fillRule\": \"evenodd\",\n    \"d\": \"M4 9h1v1H4c-1.5 0-3-1.69-3-3.5S2.55 3 4 3h4c1.45 0 3 1.69 3 3.5 0 1.41-.91 2.72-2 3.25V8.59c.58-.45 1-1.27 1-2.09C10 5.22 8.98 4 8 4H4c-.98 0-2 1.22-2 2.5S3 9 4 9zm9-3h-1v1h1c1 0 2 1.22 2 2.5S13.98 12 13 12H9c-.98 0-2-1.22-2-2.5 0-.83.42-1.64 1-2.09V6.25c-1.09.53-2 1.84-2 3.25C6 11.31 7.55 13 9 13h4c1.45 0 3-1.69 3-3.5S14.5 6 13 6z\"\n  }))), `Icon buttons`), mdx(\"p\", null, `An element's name, or accessible name, is how it is identified by browsers and the `, mdx(\"a\", {\n    parentName: \"p\",\n    \"href\": \"https://developer.mozilla.org/en-US/docs/Glossary/Accessibility_tree\"\n  }, `accessibility tree`), `. Accessible names provide information for assistive technology, such as screen readers, and so icon buttons must include an accessible name`, mdx(\"em\", {\n    parentName: \"p\"\n  }, `.`), ` If there is no text beside the icon then an `, mdx(\"inlineCode\", {\n    parentName: \"p\"\n  }, `aria-label`), ` or `, mdx(\"inlineCode\", {\n    parentName: \"p\"\n  }, `aria-labelledby`), ` attribute can be used to give the button its accessible name.`), mdx(\"h4\", {\n    \"id\": \"size\",\n    \"style\": {\n      \"position\": \"relative\"\n    }\n  }, mdx(\"a\", {\n    parentName: \"h4\",\n    \"href\": \"#size\",\n    \"aria-label\": \"size permalink\",\n    \"className\": \"anchor before\"\n  }, mdx(\"svg\", {\n    parentName: \"a\",\n    \"aria-hidden\": \"true\",\n    \"focusable\": \"false\",\n    \"height\": \"16\",\n    \"version\": \"1.1\",\n    \"viewBox\": \"0 0 16 16\",\n    \"width\": \"16\"\n  }, mdx(\"path\", {\n    parentName: \"svg\",\n    \"fillRule\": \"evenodd\",\n    \"d\": \"M4 9h1v1H4c-1.5 0-3-1.69-3-3.5S2.55 3 4 3h4c1.45 0 3 1.69 3 3.5 0 1.41-.91 2.72-2 3.25V8.59c.58-.45 1-1.27 1-2.09C10 5.22 8.98 4 8 4H4c-.98 0-2 1.22-2 2.5S3 9 4 9zm9-3h-1v1h1c1 0 2 1.22 2 2.5S13.98 12 13 12H9c-.98 0-2-1.22-2-2.5 0-.83.42-1.64 1-2.09V6.25c-1.09.53-2 1.84-2 3.25C6 11.31 7.55 13 9 13h4c1.45 0 3-1.69 3-3.5S14.5 6 13 6z\"\n  }))), `Size`), mdx(\"p\", null, `The click/tap target area must be no smaller than 44x44px.`), mdx(\"h4\", {\n    \"id\": \"avoid-using-disabled-buttons\",\n    \"style\": {\n      \"position\": \"relative\"\n    }\n  }, mdx(\"a\", {\n    parentName: \"h4\",\n    \"href\": \"#avoid-using-disabled-buttons\",\n    \"aria-label\": \"avoid using disabled buttons permalink\",\n    \"className\": \"anchor before\"\n  }, mdx(\"svg\", {\n    parentName: \"a\",\n    \"aria-hidden\": \"true\",\n    \"focusable\": \"false\",\n    \"height\": \"16\",\n    \"version\": \"1.1\",\n    \"viewBox\": \"0 0 16 16\",\n    \"width\": \"16\"\n  }, mdx(\"path\", {\n    parentName: \"svg\",\n    \"fillRule\": \"evenodd\",\n    \"d\": \"M4 9h1v1H4c-1.5 0-3-1.69-3-3.5S2.55 3 4 3h4c1.45 0 3 1.69 3 3.5 0 1.41-.91 2.72-2 3.25V8.59c.58-.45 1-1.27 1-2.09C10 5.22 8.98 4 8 4H4c-.98 0-2 1.22-2 2.5S3 9 4 9zm9-3h-1v1h1c1 0 2 1.22 2 2.5S13.98 12 13 12H9c-.98 0-2-1.22-2-2.5 0-.83.42-1.64 1-2.09V6.25c-1.09.53-2 1.84-2 3.25C6 11.31 7.55 13 9 13h4c1.45 0 3-1.69 3-3.5S14.5 6 13 6z\"\n  }))), `Avoid using disabled buttons`), mdx(\"p\", null, `Disabling or making a \"button\" unavailable until a form or input field is complete can confuse some users.`), mdx(\"p\", null, `Why it's a problem:`), mdx(\"ul\", null, mdx(\"li\", {\n    parentName: \"ul\"\n  }, `They don’t provide feedback and tell the user why they're disabled. They communicate that something isn’t right, but very often that is not enough information.`), mdx(\"li\", {\n    parentName: \"ul\"\n  }, `Buttons should have call-to-action text that matches what users want to do, so people try to interact with them yet they aren’t able to be interacted with.`), mdx(\"li\", {\n    parentName: \"ul\"\n  }, `They typically have terrible color contrast.`), mdx(\"li\", {\n    parentName: \"ul\"\n  }, `Assistive technologies like `, mdx(\"a\", {\n    parentName: \"li\",\n    \"href\": \"https://www.nngroup.com/articles/touchscreen-screen-readers/\"\n  }, `screen readers`), ` and `, mdx(\"a\", {\n    parentName: \"li\",\n    \"href\": \"https://en.wikipedia.org/wiki/Switch_access\"\n  }, `switches`), ` are usually not able to navigate to disabled buttons.`)), mdx(\"p\", null, `For these reasons, disabled buttons can be frustrating for all users but especially to those with cognitive disabilities and those who use assistive technologies.`), mdx(\"p\", null, `If you have a use case where you `, mdx(\"strong\", {\n    parentName: \"p\"\n  }, `must`), ` use a disabled button, take note:`), mdx(\"ul\", null, mdx(\"li\", {\n    parentName: \"ul\"\n  }, `If using the `, mdx(\"inlineCode\", {\n    parentName: \"li\"\n  }, `<a>`), ` tag`, mdx(\"ul\", {\n    parentName: \"li\"\n  }, mdx(\"li\", {\n    parentName: \"ul\"\n  }, `Add `, mdx(\"inlineCode\", {\n    parentName: \"li\"\n  }, `aria-disabled`), ` attribute set to true as this helps to describe the disabled state to screen reader users.`), mdx(\"li\", {\n    parentName: \"ul\"\n  }, `Remove its `, mdx(\"inlineCode\", {\n    parentName: \"li\"\n  }, `href`), ` attribute. When a link has no `, mdx(\"inlineCode\", {\n    parentName: \"li\"\n  }, `href`), `, it has no role, no focusability, and no keyboard events.`), mdx(\"li\", {\n    parentName: \"ul\"\n  }, `Do not use the disabled attribute as it is not a valid attribute for `, mdx(\"inlineCode\", {\n    parentName: \"li\"\n  }, `<a>`), `.`)))), mdx(\"p\", null, `Unavailable buttons using the `, mdx(\"inlineCode\", {\n    parentName: \"p\"\n  }, `<button>`), ` tag should have the `, mdx(\"inlineCode\", {\n    parentName: \"p\"\n  }, `disabled`), ` attribute applied. This removes native click and keypress events from the button. It also prevents automated scanners from logging a low contrast error. Finally, it announces the button as \"dimmed\" or \"disabled\" to screen readers, offering users additional context.`), mdx(\"h4\", {\n    \"id\": \"state\",\n    \"style\": {\n      \"position\": \"relative\"\n    }\n  }, mdx(\"a\", {\n    parentName: \"h4\",\n    \"href\": \"#state\",\n    \"aria-label\": \"state permalink\",\n    \"className\": \"anchor before\"\n  }, mdx(\"svg\", {\n    parentName: \"a\",\n    \"aria-hidden\": \"true\",\n    \"focusable\": \"false\",\n    \"height\": \"16\",\n    \"version\": \"1.1\",\n    \"viewBox\": \"0 0 16 16\",\n    \"width\": \"16\"\n  }, mdx(\"path\", {\n    parentName: \"svg\",\n    \"fillRule\": \"evenodd\",\n    \"d\": \"M4 9h1v1H4c-1.5 0-3-1.69-3-3.5S2.55 3 4 3h4c1.45 0 3 1.69 3 3.5 0 1.41-.91 2.72-2 3.25V8.59c.58-.45 1-1.27 1-2.09C10 5.22 8.98 4 8 4H4c-.98 0-2 1.22-2 2.5S3 9 4 9zm9-3h-1v1h1c1 0 2 1.22 2 2.5S13.98 12 13 12H9c-.98 0-2-1.22-2-2.5 0-.83.42-1.64 1-2.09V6.25c-1.09.53-2 1.84-2 3.25C6 11.31 7.55 13 9 13h4c1.45 0 3-1.69 3-3.5S14.5 6 13 6z\"\n  }))), `State`), mdx(\"p\", null, `If a toggle-able button is needed, add `, mdx(\"inlineCode\", {\n    parentName: \"p\"\n  }, `aria-pressed`), ` to the button. Examples of this use case could be: buttons to change settings, buttons to sort with, etc.`), mdx(\"h4\", {\n    \"id\": \"accessibility-testing\",\n    \"style\": {\n      \"position\": \"relative\"\n    }\n  }, mdx(\"a\", {\n    parentName: \"h4\",\n    \"href\": \"#accessibility-testing\",\n    \"aria-label\": \"accessibility testing permalink\",\n    \"className\": \"anchor before\"\n  }, mdx(\"svg\", {\n    parentName: \"a\",\n    \"aria-hidden\": \"true\",\n    \"focusable\": \"false\",\n    \"height\": \"16\",\n    \"version\": \"1.1\",\n    \"viewBox\": \"0 0 16 16\",\n    \"width\": \"16\"\n  }, mdx(\"path\", {\n    parentName: \"svg\",\n    \"fillRule\": \"evenodd\",\n    \"d\": \"M4 9h1v1H4c-1.5 0-3-1.69-3-3.5S2.55 3 4 3h4c1.45 0 3 1.69 3 3.5 0 1.41-.91 2.72-2 3.25V8.59c.58-.45 1-1.27 1-2.09C10 5.22 8.98 4 8 4H4c-.98 0-2 1.22-2 2.5S3 9 4 9zm9-3h-1v1h1c1 0 2 1.22 2 2.5S13.98 12 13 12H9c-.98 0-2-1.22-2-2.5 0-.83.42-1.64 1-2.09V6.25c-1.09.53-2 1.84-2 3.25C6 11.31 7.55 13 9 13h4c1.45 0 3-1.69 3-3.5S14.5 6 13 6z\"\n  }))), `Accessibility testing`), mdx(\"h5\", {\n    \"id\": \"general\",\n    \"style\": {\n      \"position\": \"relative\"\n    }\n  }, mdx(\"a\", {\n    parentName: \"h5\",\n    \"href\": \"#general\",\n    \"aria-label\": \"general permalink\",\n    \"className\": \"anchor before\"\n  }, mdx(\"svg\", {\n    parentName: \"a\",\n    \"aria-hidden\": \"true\",\n    \"focusable\": \"false\",\n    \"height\": \"16\",\n    \"version\": \"1.1\",\n    \"viewBox\": \"0 0 16 16\",\n    \"width\": \"16\"\n  }, mdx(\"path\", {\n    parentName: \"svg\",\n    \"fillRule\": \"evenodd\",\n    \"d\": \"M4 9h1v1H4c-1.5 0-3-1.69-3-3.5S2.55 3 4 3h4c1.45 0 3 1.69 3 3.5 0 1.41-.91 2.72-2 3.25V8.59c.58-.45 1-1.27 1-2.09C10 5.22 8.98 4 8 4H4c-.98 0-2 1.22-2 2.5S3 9 4 9zm9-3h-1v1h1c1 0 2 1.22 2 2.5S13.98 12 13 12H9c-.98 0-2-1.22-2-2.5 0-.83.42-1.64 1-2.09V6.25c-1.09.53-2 1.84-2 3.25C6 11.31 7.55 13 9 13h4c1.45 0 3-1.69 3-3.5S14.5 6 13 6z\"\n  }))), `General`), mdx(\"ul\", null, mdx(\"li\", {\n    parentName: \"ul\"\n  }, `The click/tap target area is no smaller than 44x44px.`), mdx(\"li\", {\n    parentName: \"ul\"\n  }, `There is a visible focus state.`)), mdx(\"h5\", {\n    \"id\": \"keyboard\",\n    \"style\": {\n      \"position\": \"relative\"\n    }\n  }, mdx(\"a\", {\n    parentName: \"h5\",\n    \"href\": \"#keyboard\",\n    \"aria-label\": \"keyboard permalink\",\n    \"className\": \"anchor before\"\n  }, mdx(\"svg\", {\n    parentName: \"a\",\n    \"aria-hidden\": \"true\",\n    \"focusable\": \"false\",\n    \"height\": \"16\",\n    \"version\": \"1.1\",\n    \"viewBox\": \"0 0 16 16\",\n    \"width\": \"16\"\n  }, mdx(\"path\", {\n    parentName: \"svg\",\n    \"fillRule\": \"evenodd\",\n    \"d\": \"M4 9h1v1H4c-1.5 0-3-1.69-3-3.5S2.55 3 4 3h4c1.45 0 3 1.69 3 3.5 0 1.41-.91 2.72-2 3.25V8.59c.58-.45 1-1.27 1-2.09C10 5.22 8.98 4 8 4H4c-.98 0-2 1.22-2 2.5S3 9 4 9zm9-3h-1v1h1c1 0 2 1.22 2 2.5S13.98 12 13 12H9c-.98 0-2-1.22-2-2.5 0-.83.42-1.64 1-2.09V6.25c-1.09.53-2 1.84-2 3.25C6 11.31 7.55 13 9 13h4c1.45 0 3-1.69 3-3.5S14.5 6 13 6z\"\n  }))), `Keyboard`), mdx(\"ul\", null, mdx(\"li\", {\n    parentName: \"ul\"\n  }, `The spacebar and/or enter key are used to activate the button.`), mdx(\"li\", {\n    parentName: \"ul\"\n  }, `Buttons should display a visible focus state when users tab to them.`)), mdx(\"h5\", {\n    \"id\": \"screen-reader\",\n    \"style\": {\n      \"position\": \"relative\"\n    }\n  }, mdx(\"a\", {\n    parentName: \"h5\",\n    \"href\": \"#screen-reader\",\n    \"aria-label\": \"screen reader permalink\",\n    \"className\": \"anchor before\"\n  }, mdx(\"svg\", {\n    parentName: \"a\",\n    \"aria-hidden\": \"true\",\n    \"focusable\": \"false\",\n    \"height\": \"16\",\n    \"version\": \"1.1\",\n    \"viewBox\": \"0 0 16 16\",\n    \"width\": \"16\"\n  }, mdx(\"path\", {\n    parentName: \"svg\",\n    \"fillRule\": \"evenodd\",\n    \"d\": \"M4 9h1v1H4c-1.5 0-3-1.69-3-3.5S2.55 3 4 3h4c1.45 0 3 1.69 3 3.5 0 1.41-.91 2.72-2 3.25V8.59c.58-.45 1-1.27 1-2.09C10 5.22 8.98 4 8 4H4c-.98 0-2 1.22-2 2.5S3 9 4 9zm9-3h-1v1h1c1 0 2 1.22 2 2.5S13.98 12 13 12H9c-.98 0-2-1.22-2-2.5 0-.83.42-1.64 1-2.09V6.25c-1.09.53-2 1.84-2 3.25C6 11.31 7.55 13 9 13h4c1.45 0 3-1.69 3-3.5S14.5 6 13 6z\"\n  }))), `Screen reader`), mdx(\"h6\", {\n    \"id\": \"desktop\",\n    \"style\": {\n      \"position\": \"relative\"\n    }\n  }, mdx(\"a\", {\n    parentName: \"h6\",\n    \"href\": \"#desktop\",\n    \"aria-label\": \"desktop permalink\",\n    \"className\": \"anchor before\"\n  }, mdx(\"svg\", {\n    parentName: \"a\",\n    \"aria-hidden\": \"true\",\n    \"focusable\": \"false\",\n    \"height\": \"16\",\n    \"version\": \"1.1\",\n    \"viewBox\": \"0 0 16 16\",\n    \"width\": \"16\"\n  }, mdx(\"path\", {\n    parentName: \"svg\",\n    \"fillRule\": \"evenodd\",\n    \"d\": \"M4 9h1v1H4c-1.5 0-3-1.69-3-3.5S2.55 3 4 3h4c1.45 0 3 1.69 3 3.5 0 1.41-.91 2.72-2 3.25V8.59c.58-.45 1-1.27 1-2.09C10 5.22 8.98 4 8 4H4c-.98 0-2 1.22-2 2.5S3 9 4 9zm9-3h-1v1h1c1 0 2 1.22 2 2.5S13.98 12 13 12H9c-.98 0-2-1.22-2-2.5 0-.83.42-1.64 1-2.09V6.25c-1.09.53-2 1.84-2 3.25C6 11.31 7.55 13 9 13h4c1.45 0 3-1.69 3-3.5S14.5 6 13 6z\"\n  }))), `Desktop`), mdx(\"p\", null, `When I navigate to the button:`), mdx(\"ul\", null, mdx(\"li\", {\n    parentName: \"ul\"\n  }, `Its purpose and/or resulting action is read.`), mdx(\"li\", {\n    parentName: \"ul\"\n  }, `The text content within the button is clear as to what it does.`), mdx(\"li\", {\n    parentName: \"ul\"\n  }, `If applicable, the state (for example: pressed, expanded, etc.) is is read.`)), mdx(\"h6\", {\n    \"id\": \"mobile\",\n    \"style\": {\n      \"position\": \"relative\"\n    }\n  }, mdx(\"a\", {\n    parentName: \"h6\",\n    \"href\": \"#mobile\",\n    \"aria-label\": \"mobile permalink\",\n    \"className\": \"anchor before\"\n  }, mdx(\"svg\", {\n    parentName: \"a\",\n    \"aria-hidden\": \"true\",\n    \"focusable\": \"false\",\n    \"height\": \"16\",\n    \"version\": \"1.1\",\n    \"viewBox\": \"0 0 16 16\",\n    \"width\": \"16\"\n  }, mdx(\"path\", {\n    parentName: \"svg\",\n    \"fillRule\": \"evenodd\",\n    \"d\": \"M4 9h1v1H4c-1.5 0-3-1.69-3-3.5S2.55 3 4 3h4c1.45 0 3 1.69 3 3.5 0 1.41-.91 2.72-2 3.25V8.59c.58-.45 1-1.27 1-2.09C10 5.22 8.98 4 8 4H4c-.98 0-2 1.22-2 2.5S3 9 4 9zm9-3h-1v1h1c1 0 2 1.22 2 2.5S13.98 12 13 12H9c-.98 0-2-1.22-2-2.5 0-.83.42-1.64 1-2.09V6.25c-1.09.53-2 1.84-2 3.25C6 11.31 7.55 13 9 13h4c1.45 0 3-1.69 3-3.5S14.5 6 13 6z\"\n  }))), `Mobile`), mdx(\"p\", null, `When I swipe to focus on a button:`), mdx(\"ul\", null, mdx(\"li\", {\n    parentName: \"ul\"\n  }, `Its purpose and/or resulting action is read.`), mdx(\"li\", {\n    parentName: \"ul\"\n  }, `The text content within the button is clear as to what it does.`), mdx(\"li\", {\n    parentName: \"ul\"\n  }, `If applicable, the state (for example: pressed, expanded, etc.) is is read.`)), mdx(ThemeContent, {\n    onlyThemes: ['medicare'],\n    mdxType: \"ThemeContent\"\n  }, mdx(\"h4\", {\n    \"id\": \"dos\",\n    \"style\": {\n      \"position\": \"relative\"\n    }\n  }, mdx(\"a\", {\n    parentName: \"h4\",\n    \"href\": \"#dos\",\n    \"aria-label\": \"dos permalink\",\n    \"className\": \"anchor before\"\n  }, mdx(\"svg\", {\n    parentName: \"a\",\n    \"aria-hidden\": \"true\",\n    \"focusable\": \"false\",\n    \"height\": \"16\",\n    \"version\": \"1.1\",\n    \"viewBox\": \"0 0 16 16\",\n    \"width\": \"16\"\n  }, mdx(\"path\", {\n    parentName: \"svg\",\n    \"fillRule\": \"evenodd\",\n    \"d\": \"M4 9h1v1H4c-1.5 0-3-1.69-3-3.5S2.55 3 4 3h4c1.45 0 3 1.69 3 3.5 0 1.41-.91 2.72-2 3.25V8.59c.58-.45 1-1.27 1-2.09C10 5.22 8.98 4 8 4H4c-.98 0-2 1.22-2 2.5S3 9 4 9zm9-3h-1v1h1c1 0 2 1.22 2 2.5S13.98 12 13 12H9c-.98 0-2-1.22-2-2.5 0-.83.42-1.64 1-2.09V6.25c-1.09.53-2 1.84-2 3.25C6 11.31 7.55 13 9 13h4c1.45 0 3-1.69 3-3.5S14.5 6 13 6z\"\n  }))), `Do's`), mdx(\"ul\", null, mdx(\"li\", {\n    parentName: \"ul\"\n  }, `Use buttons for clickable actions like \"Log in\" or \"Create an account\"`), mdx(\"li\", {\n    parentName: \"ul\"\n  }, `Use buttons for javascript triggers that have a clickable element tied to javascript functionality.`), mdx(\"li\", {\n    parentName: \"ul\"\n  }, `Use links for navigational elements. `, mdx(\"inlineCode\", {\n    parentName: \"li\"\n  }, `<a>`), ` tags are reserved for navigation.`)), mdx(\"h4\", {\n    \"id\": \"dont-1\",\n    \"style\": {\n      \"position\": \"relative\"\n    }\n  }, mdx(\"a\", {\n    parentName: \"h4\",\n    \"href\": \"#dont-1\",\n    \"aria-label\": \"dont 1 permalink\",\n    \"className\": \"anchor before\"\n  }, mdx(\"svg\", {\n    parentName: \"a\",\n    \"aria-hidden\": \"true\",\n    \"focusable\": \"false\",\n    \"height\": \"16\",\n    \"version\": \"1.1\",\n    \"viewBox\": \"0 0 16 16\",\n    \"width\": \"16\"\n  }, mdx(\"path\", {\n    parentName: \"svg\",\n    \"fillRule\": \"evenodd\",\n    \"d\": \"M4 9h1v1H4c-1.5 0-3-1.69-3-3.5S2.55 3 4 3h4c1.45 0 3 1.69 3 3.5 0 1.41-.91 2.72-2 3.25V8.59c.58-.45 1-1.27 1-2.09C10 5.22 8.98 4 8 4H4c-.98 0-2 1.22-2 2.5S3 9 4 9zm9-3h-1v1h1c1 0 2 1.22 2 2.5S13.98 12 13 12H9c-.98 0-2-1.22-2-2.5 0-.83.42-1.64 1-2.09V6.25c-1.09.53-2 1.84-2 3.25C6 11.31 7.55 13 9 13h4c1.45 0 3-1.69 3-3.5S14.5 6 13 6z\"\n  }))), `Don't`), mdx(\"ul\", null, mdx(\"li\", {\n    parentName: \"ul\"\n  }, `Use buttons for navigational elements like going to a new page.`))), mdx(\"h3\", {\n    \"id\": \"content\",\n    \"style\": {\n      \"position\": \"relative\"\n    }\n  }, mdx(\"a\", {\n    parentName: \"h3\",\n    \"href\": \"#content\",\n    \"aria-label\": \"content permalink\",\n    \"className\": \"anchor before\"\n  }, mdx(\"svg\", {\n    parentName: \"a\",\n    \"aria-hidden\": \"true\",\n    \"focusable\": \"false\",\n    \"height\": \"16\",\n    \"version\": \"1.1\",\n    \"viewBox\": \"0 0 16 16\",\n    \"width\": \"16\"\n  }, mdx(\"path\", {\n    parentName: \"svg\",\n    \"fillRule\": \"evenodd\",\n    \"d\": \"M4 9h1v1H4c-1.5 0-3-1.69-3-3.5S2.55 3 4 3h4c1.45 0 3 1.69 3 3.5 0 1.41-.91 2.72-2 3.25V8.59c.58-.45 1-1.27 1-2.09C10 5.22 8.98 4 8 4H4c-.98 0-2 1.22-2 2.5S3 9 4 9zm9-3h-1v1h1c1 0 2 1.22 2 2.5S13.98 12 13 12H9c-.98 0-2-1.22-2-2.5 0-.83.42-1.64 1-2.09V6.25c-1.09.53-2 1.84-2 3.25C6 11.31 7.55 13 9 13h4c1.45 0 3-1.69 3-3.5S14.5 6 13 6z\"\n  }))), `Content`), mdx(\"ul\", null, mdx(\"li\", {\n    parentName: \"ul\"\n  }, `Describe what will happen, not the current state.`), mdx(\"li\", {\n    parentName: \"ul\"\n  }, `Buttons always start with an action word describing the main thing users will do once selected.`, mdx(\"ul\", {\n    parentName: \"li\"\n  }, mdx(\"li\", {\n    parentName: \"ul\"\n  }, `Pair it with a noun to help it be clearer. Example: Get tips.`), mdx(\"li\", {\n    parentName: \"ul\"\n  }, `If in a form, it can be just the action word if it's navigating between steps. Example: Cancel, Back, Next.`))), mdx(\"li\", {\n    parentName: \"ul\"\n  }, `Use the least amount of words possible (no more than 6 with 2-4 being ideal).`)), mdx(ThemeContent, {\n    onlyThemes: ['healthcare'],\n    mdxType: \"ThemeContent\"\n  }, mdx(\"ul\", null, mdx(\"li\", {\n    parentName: \"ul\"\n  }, `Use sentence case for buttons. This conveys a friendlier tone. Note: Some tools and the homepage are using ALL CAPS. There are also a few examples of Title Case. We should change to sentence case for consistency across the site.`))), mdx(ThemeContent, {\n    onlyThemes: ['medicare'],\n    mdxType: \"ThemeContent\"\n  }, mdx(\"ul\", null, mdx(\"li\", {\n    parentName: \"ul\"\n  }, `Use title case for CTA buttons.`))), mdx(ThemeContent, {\n    onlyThemes: ['healthcare', 'medicare'],\n    mdxType: \"ThemeContent\"\n  }, mdx(\"h4\", {\n    \"id\": \"writing-content\",\n    \"style\": {\n      \"position\": \"relative\"\n    }\n  }, mdx(\"a\", {\n    parentName: \"h4\",\n    \"href\": \"#writing-content\",\n    \"aria-label\": \"writing content permalink\",\n    \"className\": \"anchor before\"\n  }, mdx(\"svg\", {\n    parentName: \"a\",\n    \"aria-hidden\": \"true\",\n    \"focusable\": \"false\",\n    \"height\": \"16\",\n    \"version\": \"1.1\",\n    \"viewBox\": \"0 0 16 16\",\n    \"width\": \"16\"\n  }, mdx(\"path\", {\n    parentName: \"svg\",\n    \"fillRule\": \"evenodd\",\n    \"d\": \"M4 9h1v1H4c-1.5 0-3-1.69-3-3.5S2.55 3 4 3h4c1.45 0 3 1.69 3 3.5 0 1.41-.91 2.72-2 3.25V8.59c.58-.45 1-1.27 1-2.09C10 5.22 8.98 4 8 4H4c-.98 0-2 1.22-2 2.5S3 9 4 9zm9-3h-1v1h1c1 0 2 1.22 2 2.5S13.98 12 13 12H9c-.98 0-2-1.22-2-2.5 0-.83.42-1.64 1-2.09V6.25c-1.09.53-2 1.84-2 3.25C6 11.31 7.55 13 9 13h4c1.45 0 3-1.69 3-3.5S14.5 6 13 6z\"\n  }))), `Writing content`), mdx(\"ul\", null, mdx(\"li\", {\n    parentName: \"ul\"\n  }, `Remove articles and use '&' instead of 'and'`), mdx(\"li\", {\n    parentName: \"ul\"\n  }, `Do not capitalize articles.`), mdx(\"li\", {\n    parentName: \"ul\"\n  }, `Avoid all caps unless the word is an acronym, like ZIP.`), mdx(\"li\", {\n    parentName: \"ul\"\n  }, `Avoid pronouns unless the future state provides the user with customized information. Example: \"Get my results\"`), mdx(\"li\", {\n    parentName: \"ul\"\n  }, `Limit branded terms, like tool names. As a general rule, we don't use tool names in web content or flow. Rather, content should outline what the user will get/can do when they click the button.`)), mdx(\"h4\", {\n    \"id\": \"online-forms--steps\",\n    \"style\": {\n      \"position\": \"relative\"\n    }\n  }, mdx(\"a\", {\n    parentName: \"h4\",\n    \"href\": \"#online-forms--steps\",\n    \"aria-label\": \"online forms  steps permalink\",\n    \"className\": \"anchor before\"\n  }, mdx(\"svg\", {\n    parentName: \"a\",\n    \"aria-hidden\": \"true\",\n    \"focusable\": \"false\",\n    \"height\": \"16\",\n    \"version\": \"1.1\",\n    \"viewBox\": \"0 0 16 16\",\n    \"width\": \"16\"\n  }, mdx(\"path\", {\n    parentName: \"svg\",\n    \"fillRule\": \"evenodd\",\n    \"d\": \"M4 9h1v1H4c-1.5 0-3-1.69-3-3.5S2.55 3 4 3h4c1.45 0 3 1.69 3 3.5 0 1.41-.91 2.72-2 3.25V8.59c.58-.45 1-1.27 1-2.09C10 5.22 8.98 4 8 4H4c-.98 0-2 1.22-2 2.5S3 9 4 9zm9-3h-1v1h1c1 0 2 1.22 2 2.5S13.98 12 13 12H9c-.98 0-2-1.22-2-2.5 0-.83.42-1.64 1-2.09V6.25c-1.09.53-2 1.84-2 3.25C6 11.31 7.55 13 9 13h4c1.45 0 3-1.69 3-3.5S14.5 6 13 6z\"\n  }))), `Online forms & steps`), mdx(\"h5\", {\n    \"id\": \"starting-a-process-or-sequential-steps\",\n    \"style\": {\n      \"position\": \"relative\"\n    }\n  }, mdx(\"a\", {\n    parentName: \"h5\",\n    \"href\": \"#starting-a-process-or-sequential-steps\",\n    \"aria-label\": \"starting a process or sequential steps permalink\",\n    \"className\": \"anchor before\"\n  }, mdx(\"svg\", {\n    parentName: \"a\",\n    \"aria-hidden\": \"true\",\n    \"focusable\": \"false\",\n    \"height\": \"16\",\n    \"version\": \"1.1\",\n    \"viewBox\": \"0 0 16 16\",\n    \"width\": \"16\"\n  }, mdx(\"path\", {\n    parentName: \"svg\",\n    \"fillRule\": \"evenodd\",\n    \"d\": \"M4 9h1v1H4c-1.5 0-3-1.69-3-3.5S2.55 3 4 3h4c1.45 0 3 1.69 3 3.5 0 1.41-.91 2.72-2 3.25V8.59c.58-.45 1-1.27 1-2.09C10 5.22 8.98 4 8 4H4c-.98 0-2 1.22-2 2.5S3 9 4 9zm9-3h-1v1h1c1 0 2 1.22 2 2.5S13.98 12 13 12H9c-.98 0-2-1.22-2-2.5 0-.83.42-1.64 1-2.09V6.25c-1.09.53-2 1.84-2 3.25C6 11.31 7.55 13 9 13h4c1.45 0 3-1.69 3-3.5S14.5 6 13 6z\"\n  }))), `Starting a process or sequential steps`), mdx(\"p\", null, `Generally better to use specific verbs to confirm what the user is starting. For example, \"Create Account.\"`), mdx(\"table\", {\n    className: \"ds-c-table ds-c-table--compact ds-c-md-table--stacked\",\n    role: \"table\",\n    width: \"100%\"\n  }, mdx(\"thead\", {\n    role: \"rowgroup\"\n  }, mdx(\"tr\", {\n    role: \"row\"\n  }, mdx(\"th\", {\n    className: \"ds-u-fill--success-lightest\",\n    role: \"columnheader\",\n    scope: \"col\"\n  }, \"Use\"), mdx(\"th\", {\n    className: \"ds-u-fill--error-lightest\",\n    role: \"columnheader\",\n    scope: \"col\"\n  }, \"Don't use\"))), mdx(\"tbody\", {\n    role: \"rowgroup\"\n  }, mdx(\"tr\", {\n    role: \"row\"\n  }, mdx(\"td\", {\n    role: \"cell\",\n    \"data-title\": \"Document title\",\n    width: \"50%\"\n  }, \"Start\"), mdx(\"td\", {\n    role: \"cell\",\n    \"data-title\": \"Description\",\n    width: \"50%\"\n  }, \"Begin, Go, Enter, or Submit\"))))), mdx(\"h5\", {\n    \"id\": \"moving-through-a-process-or-sequential-steps-after-starting\",\n    \"style\": {\n      \"position\": \"relative\"\n    }\n  }, mdx(\"a\", {\n    parentName: \"h5\",\n    \"href\": \"#moving-through-a-process-or-sequential-steps-after-starting\",\n    \"aria-label\": \"moving through a process or sequential steps after starting permalink\",\n    \"className\": \"anchor before\"\n  }, mdx(\"svg\", {\n    parentName: \"a\",\n    \"aria-hidden\": \"true\",\n    \"focusable\": \"false\",\n    \"height\": \"16\",\n    \"version\": \"1.1\",\n    \"viewBox\": \"0 0 16 16\",\n    \"width\": \"16\"\n  }, mdx(\"path\", {\n    parentName: \"svg\",\n    \"fillRule\": \"evenodd\",\n    \"d\": \"M4 9h1v1H4c-1.5 0-3-1.69-3-3.5S2.55 3 4 3h4c1.45 0 3 1.69 3 3.5 0 1.41-.91 2.72-2 3.25V8.59c.58-.45 1-1.27 1-2.09C10 5.22 8.98 4 8 4H4c-.98 0-2 1.22-2 2.5S3 9 4 9zm9-3h-1v1h1c1 0 2 1.22 2 2.5S13.98 12 13 12H9c-.98 0-2-1.22-2-2.5 0-.83.42-1.64 1-2.09V6.25c-1.09.53-2 1.84-2 3.25C6 11.31 7.55 13 9 13h4c1.45 0 3-1.69 3-3.5S14.5 6 13 6z\"\n  }))), `Moving through a process or sequential steps after starting`), mdx(\"p\", null, `For forward movement to the next page or step.`), mdx(ThemeContent, {\n    onlyThemes: ['healthcare'],\n    mdxType: \"ThemeContent\"\n  }, mdx(\"table\", {\n    className: \"ds-c-table ds-c-table--compact ds-c-md-table--stacked\",\n    role: \"table\",\n    width: \"100%\"\n  }, mdx(\"thead\", {\n    role: \"rowgroup\"\n  }, mdx(\"tr\", {\n    role: \"row\"\n  }, mdx(\"th\", {\n    className: \"ds-u-fill--success-lightest\",\n    role: \"columnheader\",\n    scope: \"col\"\n  }, \"Use\"), mdx(\"th\", {\n    className: \"ds-u-fill--error-lightest\",\n    role: \"columnheader\",\n    scope: \"col\"\n  }, \"Don't use\"))), mdx(\"tbody\", {\n    role: \"rowgroup\"\n  }, mdx(\"tr\", {\n    role: \"row\"\n  }, mdx(\"td\", {\n    role: \"cell\",\n    \"data-title\": \"Document title\",\n    width: \"50%\"\n  }, \"Continue\"), mdx(\"td\", {\n    role: \"cell\",\n    \"data-title\": \"Description\",\n    width: \"50%\"\n  }, \"Next\"))))), mdx(ThemeContent, {\n    onlyThemes: ['medicare'],\n    mdxType: \"ThemeContent\"\n  }, mdx(\"table\", {\n    className: \"ds-c-table ds-c-table--compact ds-c-md-table--stacked\",\n    role: \"table\",\n    width: \"100%\"\n  }, mdx(\"thead\", {\n    role: \"rowgroup\"\n  }, mdx(\"tr\", {\n    role: \"row\"\n  }, mdx(\"th\", {\n    className: \"ds-u-fill--success-lightest\",\n    role: \"columnheader\",\n    scope: \"col\"\n  }, \"Use\"), mdx(\"th\", {\n    className: \"ds-u-fill--error-lightest\",\n    role: \"columnheader\",\n    scope: \"col\"\n  }, \"Don't use\"))), mdx(\"tbody\", {\n    role: \"rowgroup\"\n  }, mdx(\"tr\", {\n    role: \"row\"\n  }, mdx(\"td\", {\n    role: \"cell\",\n    \"data-title\": \"Document title\",\n    width: \"50%\"\n  }, \"Next\"), mdx(\"td\", {\n    role: \"cell\",\n    \"data-title\": \"Description\",\n    width: \"50%\"\n  }, \"Continue\"))))), mdx(ThemeContent, {\n    onlyThemes: ['healthcare', 'medicare'],\n    mdxType: \"ThemeContent\"\n  }, mdx(\"p\", null, `For backward movement to the previous step in the process.`), mdx(\"table\", {\n    className: \"ds-c-table ds-c-table--compact ds-c-md-table--stacked\",\n    role: \"table\",\n    width: \"100%\"\n  }, mdx(\"thead\", {\n    role: \"rowgroup\"\n  }, mdx(\"tr\", {\n    role: \"row\"\n  }, mdx(\"th\", {\n    className: \"ds-u-fill--success-lightest\",\n    role: \"columnheader\",\n    scope: \"col\"\n  }, \"Use\"), mdx(\"th\", {\n    className: \"ds-u-fill--error-lightest\",\n    role: \"columnheader\",\n    scope: \"col\"\n  }, \"Don't use\"))), mdx(\"tbody\", {\n    role: \"rowgroup\"\n  }, mdx(\"tr\", {\n    role: \"row\"\n  }, mdx(\"td\", {\n    role: \"cell\",\n    \"data-title\": \"Document title\",\n    width: \"50%\"\n  }, \"Back or Go Back\"), mdx(\"td\", {\n    role: \"cell\",\n    \"data-title\": \"Description\",\n    width: \"50%\"\n  }, \"Undo or Cancel\")))), mdx(\"h5\", {\n    \"id\": \"stopping-a-process-or-translation-and-return-to-beginning\",\n    \"style\": {\n      \"position\": \"relative\"\n    }\n  }, mdx(\"a\", {\n    parentName: \"h5\",\n    \"href\": \"#stopping-a-process-or-translation-and-return-to-beginning\",\n    \"aria-label\": \"stopping a process or translation and return to beginning permalink\",\n    \"className\": \"anchor before\"\n  }, mdx(\"svg\", {\n    parentName: \"a\",\n    \"aria-hidden\": \"true\",\n    \"focusable\": \"false\",\n    \"height\": \"16\",\n    \"version\": \"1.1\",\n    \"viewBox\": \"0 0 16 16\",\n    \"width\": \"16\"\n  }, mdx(\"path\", {\n    parentName: \"svg\",\n    \"fillRule\": \"evenodd\",\n    \"d\": \"M4 9h1v1H4c-1.5 0-3-1.69-3-3.5S2.55 3 4 3h4c1.45 0 3 1.69 3 3.5 0 1.41-.91 2.72-2 3.25V8.59c.58-.45 1-1.27 1-2.09C10 5.22 8.98 4 8 4H4c-.98 0-2 1.22-2 2.5S3 9 4 9zm9-3h-1v1h1c1 0 2 1.22 2 2.5S13.98 12 13 12H9c-.98 0-2-1.22-2-2.5 0-.83.42-1.64 1-2.09V6.25c-1.09.53-2 1.84-2 3.25C6 11.31 7.55 13 9 13h4c1.45 0 3-1.69 3-3.5S14.5 6 13 6z\"\n  }))), `Stopping a process or translation and return to beginning`), mdx(\"table\", {\n    className: \"ds-c-table ds-c-table--compact ds-c-md-table--stacked\",\n    role: \"table\",\n    width: \"100%\"\n  }, mdx(\"thead\", {\n    role: \"rowgroup\"\n  }, mdx(\"tr\", {\n    role: \"row\"\n  }, mdx(\"th\", {\n    className: \"ds-u-fill--success-lightest\",\n    role: \"columnheader\",\n    scope: \"col\"\n  }, \"Use\"), mdx(\"th\", {\n    className: \"ds-u-fill--error-lightest\",\n    role: \"columnheader\",\n    scope: \"col\"\n  }, \"Don't use\"))), mdx(\"tbody\", {\n    role: \"rowgroup\"\n  }, mdx(\"tr\", {\n    role: \"row\"\n  }, mdx(\"td\", {\n    role: \"cell\",\n    \"data-title\": \"Document title\",\n    width: \"50%\"\n  }, \"Cancel\"), mdx(\"td\", {\n    role: \"cell\",\n    \"data-title\": \"Description\",\n    width: \"50%\"\n  }, \"X\")))), mdx(\"h5\", {\n    \"id\": \"submiting-information-or-completing-a-process\",\n    \"style\": {\n      \"position\": \"relative\"\n    }\n  }, mdx(\"a\", {\n    parentName: \"h5\",\n    \"href\": \"#submiting-information-or-completing-a-process\",\n    \"aria-label\": \"submiting information or completing a process permalink\",\n    \"className\": \"anchor before\"\n  }, mdx(\"svg\", {\n    parentName: \"a\",\n    \"aria-hidden\": \"true\",\n    \"focusable\": \"false\",\n    \"height\": \"16\",\n    \"version\": \"1.1\",\n    \"viewBox\": \"0 0 16 16\",\n    \"width\": \"16\"\n  }, mdx(\"path\", {\n    parentName: \"svg\",\n    \"fillRule\": \"evenodd\",\n    \"d\": \"M4 9h1v1H4c-1.5 0-3-1.69-3-3.5S2.55 3 4 3h4c1.45 0 3 1.69 3 3.5 0 1.41-.91 2.72-2 3.25V8.59c.58-.45 1-1.27 1-2.09C10 5.22 8.98 4 8 4H4c-.98 0-2 1.22-2 2.5S3 9 4 9zm9-3h-1v1h1c1 0 2 1.22 2 2.5S13.98 12 13 12H9c-.98 0-2-1.22-2-2.5 0-.83.42-1.64 1-2.09V6.25c-1.09.53-2 1.84-2 3.25C6 11.31 7.55 13 9 13h4c1.45 0 3-1.69 3-3.5S14.5 6 13 6z\"\n  }))), `Submiting information or completing a process`), mdx(\"p\", null, `Generally better to use specific verbs if appropriate to confirm an action.`), mdx(\"table\", {\n    className: \"ds-c-table ds-c-table--compact ds-c-md-table--stacked\",\n    role: \"table\",\n    width: \"100%\"\n  }, mdx(\"thead\", {\n    role: \"rowgroup\"\n  }, mdx(\"tr\", {\n    role: \"row\"\n  }, mdx(\"th\", {\n    className: \"ds-u-fill--success-lightest\",\n    role: \"columnheader\",\n    scope: \"col\"\n  }, \"Use\"), mdx(\"th\", {\n    className: \"ds-u-fill--error-lightest\",\n    role: \"columnheader\",\n    scope: \"col\"\n  }, \"Don't use\"))), mdx(\"tbody\", {\n    role: \"rowgroup\"\n  }, mdx(\"tr\", {\n    role: \"row\"\n  }, mdx(\"td\", {\n    role: \"cell\",\n    \"data-title\": \"Document title\",\n    width: \"50%\"\n  }, \"Enter, Go, or Submit\"), mdx(\"td\", {\n    role: \"cell\",\n    \"data-title\": \"Description\",\n    width: \"50%\"\n  }, \"Fill in, Tell us, Done, or Select\")))), mdx(\"h4\", {\n    \"id\": \"logging-in-and-logging-out\",\n    \"style\": {\n      \"position\": \"relative\"\n    }\n  }, mdx(\"a\", {\n    parentName: \"h4\",\n    \"href\": \"#logging-in-and-logging-out\",\n    \"aria-label\": \"logging in and logging out permalink\",\n    \"className\": \"anchor before\"\n  }, mdx(\"svg\", {\n    parentName: \"a\",\n    \"aria-hidden\": \"true\",\n    \"focusable\": \"false\",\n    \"height\": \"16\",\n    \"version\": \"1.1\",\n    \"viewBox\": \"0 0 16 16\",\n    \"width\": \"16\"\n  }, mdx(\"path\", {\n    parentName: \"svg\",\n    \"fillRule\": \"evenodd\",\n    \"d\": \"M4 9h1v1H4c-1.5 0-3-1.69-3-3.5S2.55 3 4 3h4c1.45 0 3 1.69 3 3.5 0 1.41-.91 2.72-2 3.25V8.59c.58-.45 1-1.27 1-2.09C10 5.22 8.98 4 8 4H4c-.98 0-2 1.22-2 2.5S3 9 4 9zm9-3h-1v1h1c1 0 2 1.22 2 2.5S13.98 12 13 12H9c-.98 0-2-1.22-2-2.5 0-.83.42-1.64 1-2.09V6.25c-1.09.53-2 1.84-2 3.25C6 11.31 7.55 13 9 13h4c1.45 0 3-1.69 3-3.5S14.5 6 13 6z\"\n  }))), `Logging in and logging out`), mdx(\"table\", {\n    className: \"ds-c-table ds-c-table--compact ds-c-md-table--stacked\",\n    role: \"table\",\n    width: \"100%\"\n  }, mdx(\"thead\", {\n    role: \"rowgroup\"\n  }, mdx(\"tr\", {\n    role: \"row\"\n  }, mdx(\"th\", {\n    className: \"ds-u-fill--success-lightest\",\n    role: \"columnheader\",\n    scope: \"col\"\n  }, \"Use\"), mdx(\"th\", {\n    className: \"ds-u-fill--error-lightest\",\n    role: \"columnheader\",\n    scope: \"col\"\n  }, \"Don't use\"))), mdx(\"tbody\", {\n    role: \"rowgroup\"\n  }, mdx(\"tr\", {\n    role: \"row\"\n  }, mdx(\"td\", {\n    role: \"cell\",\n    \"data-title\": \"Document title\",\n    width: \"50%\"\n  }, mdx(\"ul\", null, mdx(\"li\", null, \"Log in - MUST be 2 words and \\\"in\\\" is lowercase when it's an action.\"), mdx(\"li\", null, \"Login - Used as 1 word when it's a noun or adjective.\"))), mdx(\"td\", {\n    role: \"cell\",\n    \"data-title\": \"Description\",\n    width: \"50%\"\n  }, \"Sign in, or Signin\")), mdx(\"tr\", {\n    role: \"row\"\n  }, mdx(\"td\", {\n    role: \"cell\",\n    \"data-title\": \"Document title\",\n    width: \"50%\"\n  }, mdx(\"ul\", null, mdx(\"li\", null, \"Log out - MUST be 2 words and \\\"out\\\" is lowercase when it's an action.\"), mdx(\"li\", null, \"Logout - Used as 1 word when it's a noun or adjective.\"))), mdx(\"td\", {\n    role: \"cell\",\n    \"data-title\": \"Description\",\n    width: \"50%\"\n  }, \"Logoff, Log off, Signout, or Sign out\")), mdx(\"tr\", {\n    role: \"row\"\n  }, mdx(\"td\", {\n    role: \"cell\",\n    \"data-title\": \"Document title\",\n    width: \"50%\"\n  }, \"Username - MUST be 1 word.\"), mdx(\"td\", {\n    role: \"cell\",\n    \"data-title\": \"Description\",\n    width: \"50%\"\n  }, \"User name\"))))), mdx(\"h2\", {\n    \"id\": \"learn-more\",\n    \"style\": {\n      \"position\": \"relative\"\n    }\n  }, mdx(\"a\", {\n    parentName: \"h2\",\n    \"href\": \"#learn-more\",\n    \"aria-label\": \"learn more permalink\",\n    \"className\": \"anchor before\"\n  }, mdx(\"svg\", {\n    parentName: \"a\",\n    \"aria-hidden\": \"true\",\n    \"focusable\": \"false\",\n    \"height\": \"16\",\n    \"version\": \"1.1\",\n    \"viewBox\": \"0 0 16 16\",\n    \"width\": \"16\"\n  }, mdx(\"path\", {\n    parentName: \"svg\",\n    \"fillRule\": \"evenodd\",\n    \"d\": \"M4 9h1v1H4c-1.5 0-3-1.69-3-3.5S2.55 3 4 3h4c1.45 0 3 1.69 3 3.5 0 1.41-.91 2.72-2 3.25V8.59c.58-.45 1-1.27 1-2.09C10 5.22 8.98 4 8 4H4c-.98 0-2 1.22-2 2.5S3 9 4 9zm9-3h-1v1h1c1 0 2 1.22 2 2.5S13.98 12 13 12H9c-.98 0-2-1.22-2-2.5 0-.83.42-1.64 1-2.09V6.25c-1.09.53-2 1.84-2 3.25C6 11.31 7.55 13 9 13h4c1.45 0 3-1.69 3-3.5S14.5 6 13 6z\"\n  }))), `Learn more`), mdx(\"ul\", null, mdx(\"li\", {\n    parentName: \"ul\"\n  }, mdx(\"a\", {\n    parentName: \"li\",\n    \"href\": \"https://www.nngroup.com/articles/clickable-elements/\"\n  }, `Beyond Blue Links: Making Clickable Elements Recognizable`)), mdx(\"li\", {\n    parentName: \"ul\"\n  }, mdx(\"a\", {\n    parentName: \"li\",\n    \"href\": \"http://www.uxmatters.com/mt/archives/2012/05/7-basic-best-practices-for-buttons.php\"\n  }, `7 Basic Best Practices for Buttons`)), mdx(\"li\", {\n    parentName: \"ul\"\n  }, mdx(\"a\", {\n    parentName: \"li\",\n    \"href\": \"http://www.uxbooth.com/articles/the-grammar-of-interactivity/\"\n  }, `The Grammar of Interactivity`)), mdx(\"li\", {\n    parentName: \"ul\"\n  }, mdx(\"a\", {\n    parentName: \"li\",\n    \"href\": \"https://paper.dropbox.com/doc/Navigation-buttons-continue-next-previous-ghLqL5a9Ostxxb3rvBhyO\"\n  }, `GOV.UK navigation buttons discussion`))), mdx(\"p\", null, mdx(\"strong\", {\n    parentName: \"p\"\n  }, `Button alignment`)), mdx(\"ul\", null, mdx(\"li\", {\n    parentName: \"ul\"\n  }, mdx(\"a\", {\n    parentName: \"li\",\n    \"href\": \"http://www.slideshare.net/cjforms/buttons-on-forms-and-surveys-a-look-at-some-research-2012\"\n  }, `Buttons on forms and surveys: a look at some research`)), mdx(\"li\", {\n    parentName: \"ul\"\n  }, mdx(\"a\", {\n    parentName: \"li\",\n    \"href\": \"https://www.lukew.com/ff/entry.asp?730=\"\n  }, `Previous and Next Actions in Web Forms`))), mdx(\"p\", null, mdx(\"strong\", {\n    parentName: \"p\"\n  }, `ARIA`)), mdx(\"ul\", null, mdx(\"li\", {\n    parentName: \"ul\"\n  }, mdx(\"a\", {\n    parentName: \"li\",\n    \"href\": \"https://developer.mozilla.org/en-US/docs/Web/Accessibility/ARIA/ARIA_Techniques/Using_the_button_role\"\n  }, `Using the button role`)), mdx(\"li\", {\n    parentName: \"ul\"\n  }, mdx(\"a\", {\n    parentName: \"li\",\n    \"href\": \"https://www.deque.com/blog/accessible-aria-buttons\"\n  }, `Building Accessible Buttons with ARIA`))), mdx(\"h3\", {\n    \"id\": \"related-components\",\n    \"style\": {\n      \"position\": \"relative\"\n    }\n  }, mdx(\"a\", {\n    parentName: \"h3\",\n    \"href\": \"#related-components\",\n    \"aria-label\": \"related components permalink\",\n    \"className\": \"anchor before\"\n  }, mdx(\"svg\", {\n    parentName: \"a\",\n    \"aria-hidden\": \"true\",\n    \"focusable\": \"false\",\n    \"height\": \"16\",\n    \"version\": \"1.1\",\n    \"viewBox\": \"0 0 16 16\",\n    \"width\": \"16\"\n  }, mdx(\"path\", {\n    parentName: \"svg\",\n    \"fillRule\": \"evenodd\",\n    \"d\": \"M4 9h1v1H4c-1.5 0-3-1.69-3-3.5S2.55 3 4 3h4c1.45 0 3 1.69 3 3.5 0 1.41-.91 2.72-2 3.25V8.59c.58-.45 1-1.27 1-2.09C10 5.22 8.98 4 8 4H4c-.98 0-2 1.22-2 2.5S3 9 4 9zm9-3h-1v1h1c1 0 2 1.22 2 2.5S13.98 12 13 12H9c-.98 0-2-1.22-2-2.5 0-.83.42-1.64 1-2.09V6.25c-1.09.53-2 1.84-2 3.25C6 11.31 7.55 13 9 13h4c1.45 0 3-1.69 3-3.5S14.5 6 13 6z\"\n  }))), `Related components`), mdx(\"ul\", null, mdx(\"li\", {\n    parentName: \"ul\"\n  }, mdx(\"a\", {\n    parentName: \"li\",\n    \"href\": \"/design-system/branch/jryan/WNMGDS-3191-box-content/components/third-party-external-link/\"\n  }, `Third party external link`))), mdx(\"h2\", {\n    \"id\": \"component-maturity\",\n    \"style\": {\n      \"position\": \"relative\"\n    }\n  }, mdx(\"a\", {\n    parentName: \"h2\",\n    \"href\": \"#component-maturity\",\n    \"aria-label\": \"component maturity permalink\",\n    \"className\": \"anchor before\"\n  }, mdx(\"svg\", {\n    parentName: \"a\",\n    \"aria-hidden\": \"true\",\n    \"focusable\": \"false\",\n    \"height\": \"16\",\n    \"version\": \"1.1\",\n    \"viewBox\": \"0 0 16 16\",\n    \"width\": \"16\"\n  }, mdx(\"path\", {\n    parentName: \"svg\",\n    \"fillRule\": \"evenodd\",\n    \"d\": \"M4 9h1v1H4c-1.5 0-3-1.69-3-3.5S2.55 3 4 3h4c1.45 0 3 1.69 3 3.5 0 1.41-.91 2.72-2 3.25V8.59c.58-.45 1-1.27 1-2.09C10 5.22 8.98 4 8 4H4c-.98 0-2 1.22-2 2.5S3 9 4 9zm9-3h-1v1h1c1 0 2 1.22 2 2.5S13.98 12 13 12H9c-.98 0-2-1.22-2-2.5 0-.83.42-1.64 1-2.09V6.25c-1.09.53-2 1.84-2 3.25C6 11.31 7.55 13 9 13h4c1.45 0 3-1.69 3-3.5S14.5 6 13 6z\"\n  }))), `Component maturity`), mdx(MaturityChecklist, {\n    a11yStandards: true,\n    color: true,\n    forcedColors: true,\n    screenReaders: true,\n    keyboardNavigable: true,\n    storybook: true,\n    responsive: true,\n    spanish: null,\n    completeUiKit: false,\n    responsiveUiKit: false,\n    tokensInCode: true,\n    tokensInSketch: true,\n    mdxType: \"MaturityChecklist\"\n  }));\n}\n;\nMDXContent.isMDXComponent = true;","tableOfContents":{"items":[{"url":"#examples","title":"Examples","items":[{"url":"#main-buttons","title":"Main buttons"},{"url":"#alternate-buttons","title":"Alternate buttons"},{"url":"#on-dark-background","title":"On dark background"},{"url":"#button-sizes","title":"Button sizes"},{"url":"#adding-icons","title":"Adding icons"}]},{"url":"#code","title":"Code","items":[{"url":"#react","title":"React"},{"url":"#web-component","title":"Web Component"},{"url":"#style-customization","title":"Style customization"},{"url":"#analytics","title":"Analytics"}]},{"url":"#guidance","title":"Guidance","items":[{"url":"#when-to-use","title":"When to use"},{"url":"#when-to-consider-alternatives","title":"When to consider alternatives"},{"url":"#usage","title":"Usage"},{"url":"#design-guidelines","title":"Design guidelines"},{"url":"#accessibility","title":"Accessibility"},{"url":"#content","title":"Content"}]},{"url":"#learn-more","title":"Learn more","items":[{"url":"#related-components","title":"Related components"}]},{"url":"#component-maturity","title":"Component maturity"}]}}},"pageContext":{"id":"1026dcd8-e735-5a82-ad19-cd6cab2f9e73"}},"staticQueryHashes":["3481578012"]}