{"componentChunkName":"component---src-components-page-templates-info-page-tsx","path":"/components/checkbox/","result":{"data":{"mdx":{"id":"44d7876e-0b39-5cea-bbc2-d918f7be40f9","frontmatter":{"title":"Checkbox","intro":"Checkboxes allow users to select one or more options from a list.","cmsgov":{"figmaNodeId":"6-84"},"core":{"figmaNodeId":"6-84","githubLink":"design-system/src/components/ChoiceList","storybookLink":"components-choicelist--docs"},"healthcare":{"figmaNodeId":"6-84","storybookLink":null,"githubLink":null},"medicare":{"figmaNodeId":"6-84","storybookLink":null,"githubLink":null}},"slug":"components/checkbox","body":"const _excluded = [\"components\"];\nfunction _extends() { _extends = Object.assign ? Object.assign.bind() : function (target) { for (var i = 1; i < arguments.length; i++) { var source = arguments[i]; for (var key in source) { if (Object.prototype.hasOwnProperty.call(source, key)) { target[key] = source[key]; } } } return target; }; return _extends.apply(this, arguments); }\nfunction _objectWithoutProperties(source, excluded) { if (source == null) return {}; var target = _objectWithoutPropertiesLoose(source, excluded); var key, i; if (Object.getOwnPropertySymbols) { var sourceSymbolKeys = Object.getOwnPropertySymbols(source); for (i = 0; i < sourceSymbolKeys.length; i++) { key = sourceSymbolKeys[i]; if (excluded.indexOf(key) >= 0) continue; if (!Object.prototype.propertyIsEnumerable.call(source, key)) continue; target[key] = source[key]; } } return target; }\nfunction _objectWithoutPropertiesLoose(source, excluded) { if (source == null) return {}; var target = {}; var sourceKeys = Object.keys(source); var key, i; for (i = 0; i < sourceKeys.length; i++) { key = sourceKeys[i]; if (excluded.indexOf(key) >= 0) continue; target[key] = source[key]; } return target; }\n/* @jsxRuntime classic */\n/* @jsx mdx */\n\nconst _frontmatter = {\n  \"title\": \"Checkbox\",\n  \"intro\": \"Checkboxes allow users to select one or more options from a list.\",\n  \"cmsgov\": {\n    \"figmaNodeId\": \"6-84\"\n  },\n  \"core\": {\n    \"figmaNodeId\": \"6-84\",\n    \"githubLink\": \"design-system/src/components/ChoiceList\",\n    \"storybookLink\": \"components-choicelist--docs\"\n  },\n  \"healthcare\": {\n    \"figmaNodeId\": \"6-84\"\n  },\n  \"medicare\": {\n    \"figmaNodeId\": \"6-84\"\n  }\n};\nconst makeShortcode = name => function MDXDefaultShortcode(props) {\n  console.warn(\"Component \" + name + \" was not imported, exported, or provided by MDXProvider as global scope\");\n  return mdx(\"div\", props);\n};\nconst StorybookExample = makeShortcode(\"StorybookExample\");\nconst StorybookDocLinks = makeShortcode(\"StorybookDocLinks\");\nconst StorybookDocLink = makeShortcode(\"StorybookDocLink\");\nconst ComponentThemeOptions = makeShortcode(\"ComponentThemeOptions\");\nconst MaturityChecklist = makeShortcode(\"MaturityChecklist\");\nconst layoutProps = {\n  _frontmatter\n};\nconst MDXLayout = \"wrapper\";\nreturn function MDXContent(_ref) {\n  let {\n      components\n    } = _ref,\n    props = _objectWithoutProperties(_ref, _excluded);\n  return mdx(MDXLayout, _extends({}, layoutProps, props, {\n    components: components,\n    mdxType: \"MDXLayout\"\n  }), mdx(\"h2\", {\n    \"id\": \"examples\",\n    \"style\": {\n      \"position\": \"relative\"\n    }\n  }, mdx(\"a\", {\n    parentName: \"h2\",\n    \"href\": \"#examples\",\n    \"aria-label\": \"examples permalink\",\n    \"className\": \"anchor before\"\n  }, mdx(\"svg\", {\n    parentName: \"a\",\n    \"aria-hidden\": \"true\",\n    \"focusable\": \"false\",\n    \"height\": \"16\",\n    \"version\": \"1.1\",\n    \"viewBox\": \"0 0 16 16\",\n    \"width\": \"16\"\n  }, mdx(\"path\", {\n    parentName: \"svg\",\n    \"fillRule\": \"evenodd\",\n    \"d\": \"M4 9h1v1H4c-1.5 0-3-1.69-3-3.5S2.55 3 4 3h4c1.45 0 3 1.69 3 3.5 0 1.41-.91 2.72-2 3.25V8.59c.58-.45 1-1.27 1-2.09C10 5.22 8.98 4 8 4H4c-.98 0-2 1.22-2 2.5S3 9 4 9zm9-3h-1v1h1c1 0 2 1.22 2 2.5S13.98 12 13 12H9c-.98 0-2-1.22-2-2.5 0-.83.42-1.64 1-2.09V6.25c-1.09.53-2 1.84-2 3.25C6 11.31 7.55 13 9 13h4c1.45 0 3-1.69 3-3.5S14.5 6 13 6z\"\n  }))), `Examples`), mdx(\"h3\", {\n    \"id\": \"checkbox-list\",\n    \"style\": {\n      \"position\": \"relative\"\n    }\n  }, mdx(\"a\", {\n    parentName: \"h3\",\n    \"href\": \"#checkbox-list\",\n    \"aria-label\": \"checkbox list permalink\",\n    \"className\": \"anchor before\"\n  }, mdx(\"svg\", {\n    parentName: \"a\",\n    \"aria-hidden\": \"true\",\n    \"focusable\": \"false\",\n    \"height\": \"16\",\n    \"version\": \"1.1\",\n    \"viewBox\": \"0 0 16 16\",\n    \"width\": \"16\"\n  }, mdx(\"path\", {\n    parentName: \"svg\",\n    \"fillRule\": \"evenodd\",\n    \"d\": \"M4 9h1v1H4c-1.5 0-3-1.69-3-3.5S2.55 3 4 3h4c1.45 0 3 1.69 3 3.5 0 1.41-.91 2.72-2 3.25V8.59c.58-.45 1-1.27 1-2.09C10 5.22 8.98 4 8 4H4c-.98 0-2 1.22-2 2.5S3 9 4 9zm9-3h-1v1h1c1 0 2 1.22 2 2.5S13.98 12 13 12H9c-.98 0-2-1.22-2-2.5 0-.83.42-1.64 1-2.09V6.25c-1.09.53-2 1.84-2 3.25C6 11.31 7.55 13 9 13h4c1.45 0 3-1.69 3-3.5S14.5 6 13 6z\"\n  }))), `Checkbox list`), mdx(\"p\", null, `A `, mdx(\"inlineCode\", {\n    parentName: \"p\"\n  }, `ChoiceList`), ` component can be used to render a `, mdx(\"a\", {\n    parentName: \"p\",\n    \"href\": \"/design-system/branch/tamara/WNMGDS-3027/add-wc-sections-to-component-pages/components/radio/\"\n  }, `radio`), ` button group or checkbox group. Use the `, mdx(\"inlineCode\", {\n    parentName: \"p\"\n  }, `type`), ` prop to specify the type of field to display.`), mdx(StorybookExample, {\n    componentName: \"choiceList\",\n    sourceFilePath: \"components/ChoiceList/ChoiceList.tsx\",\n    storyId: \"components-choicelist--default-checkbox\",\n    mdxType: \"StorybookExample\"\n  }), mdx(\"h3\", {\n    \"id\": \"checkbox-children\",\n    \"style\": {\n      \"position\": \"relative\"\n    }\n  }, mdx(\"a\", {\n    parentName: \"h3\",\n    \"href\": \"#checkbox-children\",\n    \"aria-label\": \"checkbox children permalink\",\n    \"className\": \"anchor before\"\n  }, mdx(\"svg\", {\n    parentName: \"a\",\n    \"aria-hidden\": \"true\",\n    \"focusable\": \"false\",\n    \"height\": \"16\",\n    \"version\": \"1.1\",\n    \"viewBox\": \"0 0 16 16\",\n    \"width\": \"16\"\n  }, mdx(\"path\", {\n    parentName: \"svg\",\n    \"fillRule\": \"evenodd\",\n    \"d\": \"M4 9h1v1H4c-1.5 0-3-1.69-3-3.5S2.55 3 4 3h4c1.45 0 3 1.69 3 3.5 0 1.41-.91 2.72-2 3.25V8.59c.58-.45 1-1.27 1-2.09C10 5.22 8.98 4 8 4H4c-.98 0-2 1.22-2 2.5S3 9 4 9zm9-3h-1v1h1c1 0 2 1.22 2 2.5S13.98 12 13 12H9c-.98 0-2-1.22-2-2.5 0-.83.42-1.64 1-2.09V6.25c-1.09.53-2 1.84-2 3.25C6 11.31 7.55 13 9 13h4c1.45 0 3-1.69 3-3.5S14.5 6 13 6z\"\n  }))), `Checkbox children`), mdx(\"p\", null, `Checkboxes can have optional checked or unchecked children that are conditionally shown based on the state of the checkbox.`), mdx(StorybookExample, {\n    componentName: \"choice\",\n    sourceFilePath: \"components/ChoiceList/Choice.tsx\",\n    storyId: \"components-choicelist--choice-children&args=type:checkbox\",\n    mdxType: \"StorybookExample\"\n  }), mdx(\"h2\", {\n    \"id\": \"code\",\n    \"style\": {\n      \"position\": \"relative\"\n    }\n  }, mdx(\"a\", {\n    parentName: \"h2\",\n    \"href\": \"#code\",\n    \"aria-label\": \"code permalink\",\n    \"className\": \"anchor before\"\n  }, mdx(\"svg\", {\n    parentName: \"a\",\n    \"aria-hidden\": \"true\",\n    \"focusable\": \"false\",\n    \"height\": \"16\",\n    \"version\": \"1.1\",\n    \"viewBox\": \"0 0 16 16\",\n    \"width\": \"16\"\n  }, mdx(\"path\", {\n    parentName: \"svg\",\n    \"fillRule\": \"evenodd\",\n    \"d\": \"M4 9h1v1H4c-1.5 0-3-1.69-3-3.5S2.55 3 4 3h4c1.45 0 3 1.69 3 3.5 0 1.41-.91 2.72-2 3.25V8.59c.58-.45 1-1.27 1-2.09C10 5.22 8.98 4 8 4H4c-.98 0-2 1.22-2 2.5S3 9 4 9zm9-3h-1v1h1c1 0 2 1.22 2 2.5S13.98 12 13 12H9c-.98 0-2-1.22-2-2.5 0-.83.42-1.64 1-2.09V6.25c-1.09.53-2 1.84-2 3.25C6 11.31 7.55 13 9 13h4c1.45 0 3-1.69 3-3.5S14.5 6 13 6z\"\n  }))), `Code`), mdx(\"h3\", {\n    \"id\": \"react\",\n    \"style\": {\n      \"position\": \"relative\"\n    }\n  }, mdx(\"a\", {\n    parentName: \"h3\",\n    \"href\": \"#react\",\n    \"aria-label\": \"react permalink\",\n    \"className\": \"anchor before\"\n  }, mdx(\"svg\", {\n    parentName: \"a\",\n    \"aria-hidden\": \"true\",\n    \"focusable\": \"false\",\n    \"height\": \"16\",\n    \"version\": \"1.1\",\n    \"viewBox\": \"0 0 16 16\",\n    \"width\": \"16\"\n  }, mdx(\"path\", {\n    parentName: \"svg\",\n    \"fillRule\": \"evenodd\",\n    \"d\": \"M4 9h1v1H4c-1.5 0-3-1.69-3-3.5S2.55 3 4 3h4c1.45 0 3 1.69 3 3.5 0 1.41-.91 2.72-2 3.25V8.59c.58-.45 1-1.27 1-2.09C10 5.22 8.98 4 8 4H4c-.98 0-2 1.22-2 2.5S3 9 4 9zm9-3h-1v1h1c1 0 2 1.22 2 2.5S13.98 12 13 12H9c-.98 0-2-1.22-2-2.5 0-.83.42-1.64 1-2.09V6.25c-1.09.53-2 1.84-2 3.25C6 11.31 7.55 13 9 13h4c1.45 0 3-1.69 3-3.5S14.5 6 13 6z\"\n  }))), `React`), mdx(StorybookDocLinks, {\n    mdxType: \"StorybookDocLinks\"\n  }, mdx(StorybookDocLink, {\n    storyId: \"components-choice--docs\",\n    mdxType: \"StorybookDocLink\"\n  }, \"Choice\"), mdx(StorybookDocLink, {\n    storyId: \"components-choicelist--docs\",\n    mdxType: \"StorybookDocLink\"\n  }, \"Choice List\")), mdx(\"h3\", {\n    \"id\": \"web-component\",\n    \"style\": {\n      \"position\": \"relative\"\n    }\n  }, mdx(\"a\", {\n    parentName: \"h3\",\n    \"href\": \"#web-component\",\n    \"aria-label\": \"web component permalink\",\n    \"className\": \"anchor before\"\n  }, mdx(\"svg\", {\n    parentName: \"a\",\n    \"aria-hidden\": \"true\",\n    \"focusable\": \"false\",\n    \"height\": \"16\",\n    \"version\": \"1.1\",\n    \"viewBox\": \"0 0 16 16\",\n    \"width\": \"16\"\n  }, mdx(\"path\", {\n    parentName: \"svg\",\n    \"fillRule\": \"evenodd\",\n    \"d\": \"M4 9h1v1H4c-1.5 0-3-1.69-3-3.5S2.55 3 4 3h4c1.45 0 3 1.69 3 3.5 0 1.41-.91 2.72-2 3.25V8.59c.58-.45 1-1.27 1-2.09C10 5.22 8.98 4 8 4H4c-.98 0-2 1.22-2 2.5S3 9 4 9zm9-3h-1v1h1c1 0 2 1.22 2 2.5S13.98 12 13 12H9c-.98 0-2-1.22-2-2.5 0-.83.42-1.64 1-2.09V6.25c-1.09.53-2 1.84-2 3.25C6 11.31 7.55 13 9 13h4c1.45 0 3-1.69 3-3.5S14.5 6 13 6z\"\n  }))), `Web Component`), mdx(StorybookDocLinks, {\n    tech: \"wc\",\n    mdxType: \"StorybookDocLinks\"\n  }, mdx(StorybookDocLink, {\n    tech: \"wc\",\n    storyId: \"web-components-ds-choice--docs\",\n    mdxType: \"StorybookDocLink\"\n  }, \"Choice\"), mdx(StorybookDocLink, {\n    tech: \"wc\",\n    storyId: \"web-components-ds-choice-list--docs\",\n    mdxType: \"StorybookDocLink\"\n  }, \"Choice List\")), mdx(\"h3\", {\n    \"id\": \"style-customization\",\n    \"style\": {\n      \"position\": \"relative\"\n    }\n  }, mdx(\"a\", {\n    parentName: \"h3\",\n    \"href\": \"#style-customization\",\n    \"aria-label\": \"style customization permalink\",\n    \"className\": \"anchor before\"\n  }, mdx(\"svg\", {\n    parentName: \"a\",\n    \"aria-hidden\": \"true\",\n    \"focusable\": \"false\",\n    \"height\": \"16\",\n    \"version\": \"1.1\",\n    \"viewBox\": \"0 0 16 16\",\n    \"width\": \"16\"\n  }, mdx(\"path\", {\n    parentName: \"svg\",\n    \"fillRule\": \"evenodd\",\n    \"d\": \"M4 9h1v1H4c-1.5 0-3-1.69-3-3.5S2.55 3 4 3h4c1.45 0 3 1.69 3 3.5 0 1.41-.91 2.72-2 3.25V8.59c.58-.45 1-1.27 1-2.09C10 5.22 8.98 4 8 4H4c-.98 0-2 1.22-2 2.5S3 9 4 9zm9-3h-1v1h1c1 0 2 1.22 2 2.5S13.98 12 13 12H9c-.98 0-2-1.22-2-2.5 0-.83.42-1.64 1-2.09V6.25c-1.09.53-2 1.84-2 3.25C6 11.31 7.55 13 9 13h4c1.45 0 3-1.69 3-3.5S14.5 6 13 6z\"\n  }))), `Style customization`), mdx(\"p\", null, `The following CSS variables can be overridden to customize choice fields:`), mdx(ComponentThemeOptions, {\n    componentname: \"choice\",\n    mdxType: \"ComponentThemeOptions\"\n  }), mdx(\"h4\", {\n    \"id\": \"form-components\",\n    \"style\": {\n      \"position\": \"relative\"\n    }\n  }, mdx(\"a\", {\n    parentName: \"h4\",\n    \"href\": \"#form-components\",\n    \"aria-label\": \"form components permalink\",\n    \"className\": \"anchor before\"\n  }, mdx(\"svg\", {\n    parentName: \"a\",\n    \"aria-hidden\": \"true\",\n    \"focusable\": \"false\",\n    \"height\": \"16\",\n    \"version\": \"1.1\",\n    \"viewBox\": \"0 0 16 16\",\n    \"width\": \"16\"\n  }, mdx(\"path\", {\n    parentName: \"svg\",\n    \"fillRule\": \"evenodd\",\n    \"d\": \"M4 9h1v1H4c-1.5 0-3-1.69-3-3.5S2.55 3 4 3h4c1.45 0 3 1.69 3 3.5 0 1.41-.91 2.72-2 3.25V8.59c.58-.45 1-1.27 1-2.09C10 5.22 8.98 4 8 4H4c-.98 0-2 1.22-2 2.5S3 9 4 9zm9-3h-1v1h1c1 0 2 1.22 2 2.5S13.98 12 13 12H9c-.98 0-2-1.22-2-2.5 0-.83.42-1.64 1-2.09V6.25c-1.09.53-2 1.84-2 3.25C6 11.31 7.55 13 9 13h4c1.45 0 3-1.69 3-3.5S14.5 6 13 6z\"\n  }))), `Form components`), mdx(\"p\", null, `This component also makes use of form field styles, which can be customized by the following variables:`), mdx(ComponentThemeOptions, {\n    componentname: \"form\",\n    mdxType: \"ComponentThemeOptions\"\n  }), mdx(\"h2\", {\n    \"id\": \"guidance\",\n    \"style\": {\n      \"position\": \"relative\"\n    }\n  }, mdx(\"a\", {\n    parentName: \"h2\",\n    \"href\": \"#guidance\",\n    \"aria-label\": \"guidance permalink\",\n    \"className\": \"anchor before\"\n  }, mdx(\"svg\", {\n    parentName: \"a\",\n    \"aria-hidden\": \"true\",\n    \"focusable\": \"false\",\n    \"height\": \"16\",\n    \"version\": \"1.1\",\n    \"viewBox\": \"0 0 16 16\",\n    \"width\": \"16\"\n  }, mdx(\"path\", {\n    parentName: \"svg\",\n    \"fillRule\": \"evenodd\",\n    \"d\": \"M4 9h1v1H4c-1.5 0-3-1.69-3-3.5S2.55 3 4 3h4c1.45 0 3 1.69 3 3.5 0 1.41-.91 2.72-2 3.25V8.59c.58-.45 1-1.27 1-2.09C10 5.22 8.98 4 8 4H4c-.98 0-2 1.22-2 2.5S3 9 4 9zm9-3h-1v1h1c1 0 2 1.22 2 2.5S13.98 12 13 12H9c-.98 0-2-1.22-2-2.5 0-.83.42-1.64 1-2.09V6.25c-1.09.53-2 1.84-2 3.25C6 11.31 7.55 13 9 13h4c1.45 0 3-1.69 3-3.5S14.5 6 13 6z\"\n  }))), `Guidance`), mdx(\"h3\", {\n    \"id\": \"when-to-use\",\n    \"style\": {\n      \"position\": \"relative\"\n    }\n  }, mdx(\"a\", {\n    parentName: \"h3\",\n    \"href\": \"#when-to-use\",\n    \"aria-label\": \"when to use permalink\",\n    \"className\": \"anchor before\"\n  }, mdx(\"svg\", {\n    parentName: \"a\",\n    \"aria-hidden\": \"true\",\n    \"focusable\": \"false\",\n    \"height\": \"16\",\n    \"version\": \"1.1\",\n    \"viewBox\": \"0 0 16 16\",\n    \"width\": \"16\"\n  }, mdx(\"path\", {\n    parentName: \"svg\",\n    \"fillRule\": \"evenodd\",\n    \"d\": \"M4 9h1v1H4c-1.5 0-3-1.69-3-3.5S2.55 3 4 3h4c1.45 0 3 1.69 3 3.5 0 1.41-.91 2.72-2 3.25V8.59c.58-.45 1-1.27 1-2.09C10 5.22 8.98 4 8 4H4c-.98 0-2 1.22-2 2.5S3 9 4 9zm9-3h-1v1h1c1 0 2 1.22 2 2.5S13.98 12 13 12H9c-.98 0-2-1.22-2-2.5 0-.83.42-1.64 1-2.09V6.25c-1.09.53-2 1.84-2 3.25C6 11.31 7.55 13 9 13h4c1.45 0 3-1.69 3-3.5S14.5 6 13 6z\"\n  }))), `When to use`), mdx(\"p\", null, mdx(\"strong\", {\n    parentName: \"p\"\n  }, `Checkboxes`)), mdx(\"ul\", null, mdx(\"li\", {\n    parentName: \"ul\"\n  }, `When a user can select any number of choices from a set list.`), mdx(\"li\", {\n    parentName: \"ul\"\n  }, `When a user needs to choose “yes” or “no” on only one option (use a stand-alone checkbox). For example, to toggle a setting on or off.`), mdx(\"li\", {\n    parentName: \"ul\"\n  }, `When users need to see all the available options at a glance.`), mdx(\"li\", {\n    parentName: \"ul\"\n  }, `When users should be able to select zero of the options.`)), mdx(\"h3\", {\n    \"id\": \"when-to-consider-alternatives\",\n    \"style\": {\n      \"position\": \"relative\"\n    }\n  }, mdx(\"a\", {\n    parentName: \"h3\",\n    \"href\": \"#when-to-consider-alternatives\",\n    \"aria-label\": \"when to consider alternatives permalink\",\n    \"className\": \"anchor before\"\n  }, mdx(\"svg\", {\n    parentName: \"a\",\n    \"aria-hidden\": \"true\",\n    \"focusable\": \"false\",\n    \"height\": \"16\",\n    \"version\": \"1.1\",\n    \"viewBox\": \"0 0 16 16\",\n    \"width\": \"16\"\n  }, mdx(\"path\", {\n    parentName: \"svg\",\n    \"fillRule\": \"evenodd\",\n    \"d\": \"M4 9h1v1H4c-1.5 0-3-1.69-3-3.5S2.55 3 4 3h4c1.45 0 3 1.69 3 3.5 0 1.41-.91 2.72-2 3.25V8.59c.58-.45 1-1.27 1-2.09C10 5.22 8.98 4 8 4H4c-.98 0-2 1.22-2 2.5S3 9 4 9zm9-3h-1v1h1c1 0 2 1.22 2 2.5S13.98 12 13 12H9c-.98 0-2-1.22-2-2.5 0-.83.42-1.64 1-2.09V6.25c-1.09.53-2 1.84-2 3.25C6 11.31 7.55 13 9 13h4c1.45 0 3-1.69 3-3.5S14.5 6 13 6z\"\n  }))), `When to consider alternatives`), mdx(\"ul\", null, mdx(\"li\", {\n    parentName: \"ul\"\n  }, `If there are too many options to display on a mobile screen. Consider a `, mdx(\"inlineCode\", {\n    parentName: \"li\"\n  }, `dropdown`), ` menu if you don’t have enough space to list out all available options, and if the user can only select one of the options.`), mdx(\"li\", {\n    parentName: \"ul\"\n  }, `Never use radio buttons for optional questions, since once a radio button is selected from a list, it or another choice will remain selected.`)), mdx(\"h3\", {\n    \"id\": \"usage\",\n    \"style\": {\n      \"position\": \"relative\"\n    }\n  }, mdx(\"a\", {\n    parentName: \"h3\",\n    \"href\": \"#usage\",\n    \"aria-label\": \"usage permalink\",\n    \"className\": \"anchor before\"\n  }, mdx(\"svg\", {\n    parentName: \"a\",\n    \"aria-hidden\": \"true\",\n    \"focusable\": \"false\",\n    \"height\": \"16\",\n    \"version\": \"1.1\",\n    \"viewBox\": \"0 0 16 16\",\n    \"width\": \"16\"\n  }, mdx(\"path\", {\n    parentName: \"svg\",\n    \"fillRule\": \"evenodd\",\n    \"d\": \"M4 9h1v1H4c-1.5 0-3-1.69-3-3.5S2.55 3 4 3h4c1.45 0 3 1.69 3 3.5 0 1.41-.91 2.72-2 3.25V8.59c.58-.45 1-1.27 1-2.09C10 5.22 8.98 4 8 4H4c-.98 0-2 1.22-2 2.5S3 9 4 9zm9-3h-1v1h1c1 0 2 1.22 2 2.5S13.98 12 13 12H9c-.98 0-2-1.22-2-2.5 0-.83.42-1.64 1-2.09V6.25c-1.09.53-2 1.84-2 3.25C6 11.31 7.55 13 9 13h4c1.45 0 3-1.69 3-3.5S14.5 6 13 6z\"\n  }))), `Usage`), mdx(\"ul\", null, mdx(\"li\", {\n    parentName: \"ul\"\n  }, `Don't rely on the visual difference between radio buttons and checkboxes. Make it clear with words when users can select one or multiple options.`), mdx(\"li\", {\n    parentName: \"ul\"\n  }, `Users should be able to tap on or click on either the text label or the checkbox to select or deselect an option.`), mdx(\"li\", {\n    parentName: \"ul\"\n  }, `In general, list choices vertically; horizontal listings can make it difficult to tell which label pertains to which choice. An exception is where you have binary choices with short labels, like 'Yes / No'. The convention here is for horizontal alignment.`), mdx(\"li\", {\n    parentName: \"ul\"\n  }, `Avoid using negative language in labels as they can be counterintuitive. For example, “I want to receive a promotional email” instead of “I don’t want to receive promotional email.”`), mdx(\"li\", {\n    parentName: \"ul\"\n  }, `Use caution if you decide to set a default value. Setting a default value can discourage users from making conscious decisions, seem pushy, or alienate users who don’t fit into your assumptions. In addition, you'll never know if the user explicitly chose that option or just didn't notice the question. If you're unsure, leave nothing selected by default.`)), mdx(\"p\", null, mdx(\"strong\", {\n    parentName: \"p\"\n  }, mdx(\"a\", {\n    parentName: \"strong\",\n    \"href\": \"/design-system/branch/tamara/WNMGDS-3027/add-wc-sections-to-component-pages/patterns/Forms/forms/\"\n  }, `View the \"Forms\" guidelines for additional guidance and best practices.`))), mdx(\"h3\", {\n    \"id\": \"checked-children-and-the-expose-within-pattern\",\n    \"style\": {\n      \"position\": \"relative\"\n    }\n  }, mdx(\"a\", {\n    parentName: \"h3\",\n    \"href\": \"#checked-children-and-the-expose-within-pattern\",\n    \"aria-label\": \"checked children and the expose within pattern permalink\",\n    \"className\": \"anchor before\"\n  }, mdx(\"svg\", {\n    parentName: \"a\",\n    \"aria-hidden\": \"true\",\n    \"focusable\": \"false\",\n    \"height\": \"16\",\n    \"version\": \"1.1\",\n    \"viewBox\": \"0 0 16 16\",\n    \"width\": \"16\"\n  }, mdx(\"path\", {\n    parentName: \"svg\",\n    \"fillRule\": \"evenodd\",\n    \"d\": \"M4 9h1v1H4c-1.5 0-3-1.69-3-3.5S2.55 3 4 3h4c1.45 0 3 1.69 3 3.5 0 1.41-.91 2.72-2 3.25V8.59c.58-.45 1-1.27 1-2.09C10 5.22 8.98 4 8 4H4c-.98 0-2 1.22-2 2.5S3 9 4 9zm9-3h-1v1h1c1 0 2 1.22 2 2.5S13.98 12 13 12H9c-.98 0-2-1.22-2-2.5 0-.83.42-1.64 1-2.09V6.25c-1.09.53-2 1.84-2 3.25C6 11.31 7.55 13 9 13h4c1.45 0 3-1.69 3-3.5S14.5 6 13 6z\"\n  }))), `Checked children and the expose within pattern`), mdx(\"ul\", null, mdx(\"li\", {\n    parentName: \"ul\"\n  }, `The `, mdx(\"inlineCode\", {\n    parentName: \"li\"\n  }, `<Choice>`), ` component includes a `, mdx(\"inlineCode\", {\n    parentName: \"li\"\n  }, `checkedChildren`), ` prop that can expose hidden text information or form elements. This `, mdx(\"strong\", {\n    parentName: \"li\"\n  }, `expose within`), ` pattern is especially useful if you need to collect data from follow up questions or give just-in-time feedback.`), mdx(\"li\", {\n    parentName: \"ul\"\n  }, `Checked children can be exposed by checking the parent checkbox or radio button`), mdx(\"li\", {\n    parentName: \"ul\"\n  }, `The `, mdx(\"inlineCode\", {\n    parentName: \"li\"\n  }, `checkedChildren`), ` prop should return one or more items wrapped in a `, mdx(\"inlineCode\", {\n    parentName: \"li\"\n  }, `div`), ` with the following className: `, mdx(\"inlineCode\", {\n    parentName: \"li\"\n  }, `.ds-c-choice__checkedChild`), `. This class sets the spacing and border color for the exposed elements.`), mdx(\"li\", {\n    parentName: \"ul\"\n  }, `Add the className `, mdx(\"inlineCode\", {\n    parentName: \"li\"\n  }, `.ds-c-choice__checkedChild--inverse`), ` to the `, mdx(\"inlineCode\", {\n    parentName: \"li\"\n  }, `div`), ` to show the inverse white border`), mdx(\"li\", {\n    parentName: \"ul\"\n  }, `You may need to add the className `, mdx(\"inlineCode\", {\n    parentName: \"li\"\n  }, `.ds-u-margin--0`), ` to your child element(s) to avoid extra top margin`), mdx(\"li\", {\n    parentName: \"ul\"\n  }, `If you opt for smaller radio buttons or checkboxes, add className `, mdx(\"inlineCode\", {\n    parentName: \"li\"\n  }, `.ds-c-choice__checkedChild--small`), ` to your checked child container`)), mdx(\"h3\", {\n    \"id\": \"accessibility-testing\",\n    \"style\": {\n      \"position\": \"relative\"\n    }\n  }, mdx(\"a\", {\n    parentName: \"h3\",\n    \"href\": \"#accessibility-testing\",\n    \"aria-label\": \"accessibility testing permalink\",\n    \"className\": \"anchor before\"\n  }, mdx(\"svg\", {\n    parentName: \"a\",\n    \"aria-hidden\": \"true\",\n    \"focusable\": \"false\",\n    \"height\": \"16\",\n    \"version\": \"1.1\",\n    \"viewBox\": \"0 0 16 16\",\n    \"width\": \"16\"\n  }, mdx(\"path\", {\n    parentName: \"svg\",\n    \"fillRule\": \"evenodd\",\n    \"d\": \"M4 9h1v1H4c-1.5 0-3-1.69-3-3.5S2.55 3 4 3h4c1.45 0 3 1.69 3 3.5 0 1.41-.91 2.72-2 3.25V8.59c.58-.45 1-1.27 1-2.09C10 5.22 8.98 4 8 4H4c-.98 0-2 1.22-2 2.5S3 9 4 9zm9-3h-1v1h1c1 0 2 1.22 2 2.5S13.98 12 13 12H9c-.98 0-2-1.22-2-2.5 0-.83.42-1.64 1-2.09V6.25c-1.09.53-2 1.84-2 3.25C6 11.31 7.55 13 9 13h4c1.45 0 3-1.69 3-3.5S14.5 6 13 6z\"\n  }))), `Accessibility testing`), mdx(\"h4\", {\n    \"id\": \"general-observations\",\n    \"style\": {\n      \"position\": \"relative\"\n    }\n  }, mdx(\"a\", {\n    parentName: \"h4\",\n    \"href\": \"#general-observations\",\n    \"aria-label\": \"general observations permalink\",\n    \"className\": \"anchor before\"\n  }, mdx(\"svg\", {\n    parentName: \"a\",\n    \"aria-hidden\": \"true\",\n    \"focusable\": \"false\",\n    \"height\": \"16\",\n    \"version\": \"1.1\",\n    \"viewBox\": \"0 0 16 16\",\n    \"width\": \"16\"\n  }, mdx(\"path\", {\n    parentName: \"svg\",\n    \"fillRule\": \"evenodd\",\n    \"d\": \"M4 9h1v1H4c-1.5 0-3-1.69-3-3.5S2.55 3 4 3h4c1.45 0 3 1.69 3 3.5 0 1.41-.91 2.72-2 3.25V8.59c.58-.45 1-1.27 1-2.09C10 5.22 8.98 4 8 4H4c-.98 0-2 1.22-2 2.5S3 9 4 9zm9-3h-1v1h1c1 0 2 1.22 2 2.5S13.98 12 13 12H9c-.98 0-2-1.22-2-2.5 0-.83.42-1.64 1-2.09V6.25c-1.09.53-2 1.84-2 3.25C6 11.31 7.55 13 9 13h4c1.45 0 3-1.69 3-3.5S14.5 6 13 6z\"\n  }))), `General observations`), mdx(\"ul\", null, mdx(\"li\", {\n    parentName: \"ul\"\n  }, `No other interactive elements (such as links or buttons) should be included inside the label or hint text.`), mdx(\"li\", {\n    parentName: \"ul\"\n  }, `A group of checkboxes should be wrapped in a `, mdx(\"inlineCode\", {\n    parentName: \"li\"\n  }, `<fieldset>`), ` that includes a `, mdx(\"inlineCode\", {\n    parentName: \"li\"\n  }, `<legend>`), ` element within.`, mdx(\"ul\", {\n    parentName: \"li\"\n  }, mdx(\"li\", {\n    parentName: \"ul\"\n  }, `The `, mdx(\"inlineCode\", {\n    parentName: \"li\"\n  }, `<legend>`), ` provides context for the grouping, much like a label.`), mdx(\"li\", {\n    parentName: \"ul\"\n  }, `Do not use `, mdx(\"inlineCode\", {\n    parentName: \"li\"\n  }, `fieldset`), ` and `, mdx(\"inlineCode\", {\n    parentName: \"li\"\n  }, `legend`), ` for a single checkbox element.`))), mdx(\"li\", {\n    parentName: \"ul\"\n  }, `Normally an individual checkbox should not be a required field to complete a form but a checkbox group may be.`), mdx(\"li\", {\n    parentName: \"ul\"\n  }, `Each input should have a semantic `, mdx(\"inlineCode\", {\n    parentName: \"li\"\n  }, `id`), ` attribute, and its corresponding `, mdx(\"inlineCode\", {\n    parentName: \"li\"\n  }, `label`), ` should have the same value in its `, mdx(\"inlineCode\", {\n    parentName: \"li\"\n  }, `for`), ` attribute.`), mdx(\"li\", {\n    parentName: \"ul\"\n  }, `Be mindful of color contrast ratios between the checkbox and its background color. For instance, a dark green or blue behind the component will most likely cause problems for users. `, mdx(\"a\", {\n    parentName: \"li\",\n    \"href\": \"https://design.cms.gov/foundation/system-color-tokens/#accessibility-considerations\"\n  }, `Read our guidance on color for more information`), `.`)), mdx(\"h4\", {\n    \"id\": \"keyboard-testing\",\n    \"style\": {\n      \"position\": \"relative\"\n    }\n  }, mdx(\"a\", {\n    parentName: \"h4\",\n    \"href\": \"#keyboard-testing\",\n    \"aria-label\": \"keyboard testing permalink\",\n    \"className\": \"anchor before\"\n  }, mdx(\"svg\", {\n    parentName: \"a\",\n    \"aria-hidden\": \"true\",\n    \"focusable\": \"false\",\n    \"height\": \"16\",\n    \"version\": \"1.1\",\n    \"viewBox\": \"0 0 16 16\",\n    \"width\": \"16\"\n  }, mdx(\"path\", {\n    parentName: \"svg\",\n    \"fillRule\": \"evenodd\",\n    \"d\": \"M4 9h1v1H4c-1.5 0-3-1.69-3-3.5S2.55 3 4 3h4c1.45 0 3 1.69 3 3.5 0 1.41-.91 2.72-2 3.25V8.59c.58-.45 1-1.27 1-2.09C10 5.22 8.98 4 8 4H4c-.98 0-2 1.22-2 2.5S3 9 4 9zm9-3h-1v1h1c1 0 2 1.22 2 2.5S13.98 12 13 12H9c-.98 0-2-1.22-2-2.5 0-.83.42-1.64 1-2.09V6.25c-1.09.53-2 1.84-2 3.25C6 11.31 7.55 13 9 13h4c1.45 0 3-1.69 3-3.5S14.5 6 13 6z\"\n  }))), `Keyboard testing`), mdx(\"ul\", null, mdx(\"li\", {\n    parentName: \"ul\"\n  }, `All checkboxes can be accessed using only the tab key.`), mdx(\"li\", {\n    parentName: \"ul\"\n  }, `The spacebar is used to check/uncheck a focussed checkbox.`), mdx(\"li\", {\n    parentName: \"ul\"\n  }, `There is a visible focus state.`), mdx(\"li\", {\n    parentName: \"ul\"\n  }, `The change in state is visible.`)), mdx(\"h4\", {\n    \"id\": \"screen-reader-testing\",\n    \"style\": {\n      \"position\": \"relative\"\n    }\n  }, mdx(\"a\", {\n    parentName: \"h4\",\n    \"href\": \"#screen-reader-testing\",\n    \"aria-label\": \"screen reader testing permalink\",\n    \"className\": \"anchor before\"\n  }, mdx(\"svg\", {\n    parentName: \"a\",\n    \"aria-hidden\": \"true\",\n    \"focusable\": \"false\",\n    \"height\": \"16\",\n    \"version\": \"1.1\",\n    \"viewBox\": \"0 0 16 16\",\n    \"width\": \"16\"\n  }, mdx(\"path\", {\n    parentName: \"svg\",\n    \"fillRule\": \"evenodd\",\n    \"d\": \"M4 9h1v1H4c-1.5 0-3-1.69-3-3.5S2.55 3 4 3h4c1.45 0 3 1.69 3 3.5 0 1.41-.91 2.72-2 3.25V8.59c.58-.45 1-1.27 1-2.09C10 5.22 8.98 4 8 4H4c-.98 0-2 1.22-2 2.5S3 9 4 9zm9-3h-1v1h1c1 0 2 1.22 2 2.5S13.98 12 13 12H9c-.98 0-2-1.22-2-2.5 0-.83.42-1.64 1-2.09V6.25c-1.09.53-2 1.84-2 3.25C6 11.31 7.55 13 9 13h4c1.45 0 3-1.69 3-3.5S14.5 6 13 6z\"\n  }))), `Screen reader testing`), mdx(\"p\", null, mdx(\"strong\", {\n    parentName: \"p\"\n  }, `For desktop users`)), mdx(\"ul\", null, mdx(\"li\", {\n    parentName: \"ul\"\n  }, `Some screen readers read the `, mdx(\"inlineCode\", {\n    parentName: \"li\"\n  }, `legend`), ` text for each form element within, so it should be brief and descriptive.`), mdx(\"li\", {\n    parentName: \"ul\"\n  }, `Each label should be announced for every checkbox.`), mdx(\"li\", {\n    parentName: \"ul\"\n  }, `The checkbox element should be identified with a role of checkbox.`), mdx(\"li\", {\n    parentName: \"ul\"\n  }, `If hints or errors are present, they are read after the label.`), mdx(\"li\", {\n    parentName: \"ul\"\n  }, `In a checkbox group, I should hear the question or title related to them via a legend inside a fieldset.`), mdx(\"li\", {\n    parentName: \"ul\"\n  }, `When the checkbox is selected, that state is read out.`)), mdx(\"p\", null, mdx(\"strong\", {\n    parentName: \"p\"\n  }, `For mobile users`)), mdx(\"ul\", null, mdx(\"li\", {\n    parentName: \"ul\"\n  }, `All the above from the desktop screen reader experience apply.`), mdx(\"li\", {\n    parentName: \"ul\"\n  }, `Swiping focuses on a checkbox.`), mdx(\"li\", {\n    parentName: \"ul\"\n  }, `Double tapping with the checkbox in focus makes a selection and announces its been selected.`)), mdx(\"h4\", {\n    \"id\": \"pointer-device-testing\",\n    \"style\": {\n      \"position\": \"relative\"\n    }\n  }, mdx(\"a\", {\n    parentName: \"h4\",\n    \"href\": \"#pointer-device-testing\",\n    \"aria-label\": \"pointer device testing permalink\",\n    \"className\": \"anchor before\"\n  }, mdx(\"svg\", {\n    parentName: \"a\",\n    \"aria-hidden\": \"true\",\n    \"focusable\": \"false\",\n    \"height\": \"16\",\n    \"version\": \"1.1\",\n    \"viewBox\": \"0 0 16 16\",\n    \"width\": \"16\"\n  }, mdx(\"path\", {\n    parentName: \"svg\",\n    \"fillRule\": \"evenodd\",\n    \"d\": \"M4 9h1v1H4c-1.5 0-3-1.69-3-3.5S2.55 3 4 3h4c1.45 0 3 1.69 3 3.5 0 1.41-.91 2.72-2 3.25V8.59c.58-.45 1-1.27 1-2.09C10 5.22 8.98 4 8 4H4c-.98 0-2 1.22-2 2.5S3 9 4 9zm9-3h-1v1h1c1 0 2 1.22 2 2.5S13.98 12 13 12H9c-.98 0-2-1.22-2-2.5 0-.83.42-1.64 1-2.09V6.25c-1.09.53-2 1.84-2 3.25C6 11.31 7.55 13 9 13h4c1.45 0 3-1.69 3-3.5S14.5 6 13 6z\"\n  }))), `Pointer device testing`), mdx(\"ul\", null, mdx(\"li\", {\n    parentName: \"ul\"\n  }, `Users may select either the text label or the checkbox itself to select an option.`), mdx(\"li\", {\n    parentName: \"ul\"\n  }, `Click/tap target area is a minimum of 24x24px.`)), mdx(\"p\", null, `Read our Form Validations guidance for communicating to users about form errors and how to fix them.`), mdx(\"h3\", {\n    \"id\": \"related-patterns\",\n    \"style\": {\n      \"position\": \"relative\"\n    }\n  }, mdx(\"a\", {\n    parentName: \"h3\",\n    \"href\": \"#related-patterns\",\n    \"aria-label\": \"related patterns permalink\",\n    \"className\": \"anchor before\"\n  }, mdx(\"svg\", {\n    parentName: \"a\",\n    \"aria-hidden\": \"true\",\n    \"focusable\": \"false\",\n    \"height\": \"16\",\n    \"version\": \"1.1\",\n    \"viewBox\": \"0 0 16 16\",\n    \"width\": \"16\"\n  }, mdx(\"path\", {\n    parentName: \"svg\",\n    \"fillRule\": \"evenodd\",\n    \"d\": \"M4 9h1v1H4c-1.5 0-3-1.69-3-3.5S2.55 3 4 3h4c1.45 0 3 1.69 3 3.5 0 1.41-.91 2.72-2 3.25V8.59c.58-.45 1-1.27 1-2.09C10 5.22 8.98 4 8 4H4c-.98 0-2 1.22-2 2.5S3 9 4 9zm9-3h-1v1h1c1 0 2 1.22 2 2.5S13.98 12 13 12H9c-.98 0-2-1.22-2-2.5 0-.83.42-1.64 1-2.09V6.25c-1.09.53-2 1.84-2 3.25C6 11.31 7.55 13 9 13h4c1.45 0 3-1.69 3-3.5S14.5 6 13 6z\"\n  }))), `Related patterns`), mdx(\"ul\", null, mdx(\"li\", {\n    parentName: \"ul\"\n  }, mdx(\"a\", {\n    parentName: \"li\",\n    \"href\": \"/design-system/branch/tamara/WNMGDS-3027/add-wc-sections-to-component-pages/components/dropdown/\"\n  }, `Dropdown`))), mdx(\"h2\", {\n    \"id\": \"learn-more\",\n    \"style\": {\n      \"position\": \"relative\"\n    }\n  }, mdx(\"a\", {\n    parentName: \"h2\",\n    \"href\": \"#learn-more\",\n    \"aria-label\": \"learn more permalink\",\n    \"className\": \"anchor before\"\n  }, mdx(\"svg\", {\n    parentName: \"a\",\n    \"aria-hidden\": \"true\",\n    \"focusable\": \"false\",\n    \"height\": \"16\",\n    \"version\": \"1.1\",\n    \"viewBox\": \"0 0 16 16\",\n    \"width\": \"16\"\n  }, mdx(\"path\", {\n    parentName: \"svg\",\n    \"fillRule\": \"evenodd\",\n    \"d\": \"M4 9h1v1H4c-1.5 0-3-1.69-3-3.5S2.55 3 4 3h4c1.45 0 3 1.69 3 3.5 0 1.41-.91 2.72-2 3.25V8.59c.58-.45 1-1.27 1-2.09C10 5.22 8.98 4 8 4H4c-.98 0-2 1.22-2 2.5S3 9 4 9zm9-3h-1v1h1c1 0 2 1.22 2 2.5S13.98 12 13 12H9c-.98 0-2-1.22-2-2.5 0-.83.42-1.64 1-2.09V6.25c-1.09.53-2 1.84-2 3.25C6 11.31 7.55 13 9 13h4c1.45 0 3-1.69 3-3.5S14.5 6 13 6z\"\n  }))), `Learn more`), mdx(\"ul\", null, mdx(\"li\", {\n    parentName: \"ul\"\n  }, mdx(\"a\", {\n    parentName: \"li\",\n    \"href\": \"/design-system/branch/tamara/WNMGDS-3027/add-wc-sections-to-component-pages/patterns/Forms/forms/\"\n  }, `Form Guidelines`)), mdx(\"li\", {\n    parentName: \"ul\"\n  }, mdx(\"a\", {\n    parentName: \"li\",\n    \"href\": \"https://paper.dropbox.com/doc/Radio-buttons-oIwWoxwBKClt5IXvDbnpF\"\n  }, `GOV.UK Checkbox/Radio buttons discussion`)), mdx(\"li\", {\n    parentName: \"ul\"\n  }, mdx(\"a\", {\n    parentName: \"li\",\n    \"href\": \"https://designnotes.blog.gov.uk/2016/11/30/weve-updated-the-radios-and-checkboxes-on-gov-uk/\"\n  }, `\"We've updated the radios and checkboxes on GOV.UK\"`)), mdx(\"li\", {\n    parentName: \"ul\"\n  }, mdx(\"a\", {\n    parentName: \"li\",\n    \"href\": \"http://www.formsthatwork.com/files/Articles/dropdown.pdf\"\n  }, `Four steps for choosing form elements on the Web (PDF)`))), mdx(\"h2\", {\n    \"id\": \"component-maturity\",\n    \"style\": {\n      \"position\": \"relative\"\n    }\n  }, mdx(\"a\", {\n    parentName: \"h2\",\n    \"href\": \"#component-maturity\",\n    \"aria-label\": \"component maturity permalink\",\n    \"className\": \"anchor before\"\n  }, mdx(\"svg\", {\n    parentName: \"a\",\n    \"aria-hidden\": \"true\",\n    \"focusable\": \"false\",\n    \"height\": \"16\",\n    \"version\": \"1.1\",\n    \"viewBox\": \"0 0 16 16\",\n    \"width\": \"16\"\n  }, mdx(\"path\", {\n    parentName: \"svg\",\n    \"fillRule\": \"evenodd\",\n    \"d\": \"M4 9h1v1H4c-1.5 0-3-1.69-3-3.5S2.55 3 4 3h4c1.45 0 3 1.69 3 3.5 0 1.41-.91 2.72-2 3.25V8.59c.58-.45 1-1.27 1-2.09C10 5.22 8.98 4 8 4H4c-.98 0-2 1.22-2 2.5S3 9 4 9zm9-3h-1v1h1c1 0 2 1.22 2 2.5S13.98 12 13 12H9c-.98 0-2-1.22-2-2.5 0-.83.42-1.64 1-2.09V6.25c-1.09.53-2 1.84-2 3.25C6 11.31 7.55 13 9 13h4c1.45 0 3-1.69 3-3.5S14.5 6 13 6z\"\n  }))), `Component maturity`), mdx(MaturityChecklist, {\n    a11yStandards: true,\n    color: true,\n    forcedColors: false,\n    screenReaders: true,\n    keyboardNavigable: true,\n    storybook: true,\n    responsive: true,\n    spanish: null,\n    completeUiKit: false,\n    responsiveUiKit: false,\n    tokensInCode: true,\n    tokensInSketch: true,\n    mdxType: \"MaturityChecklist\"\n  }));\n}\n;\nMDXContent.isMDXComponent = true;","tableOfContents":{"items":[{"url":"#examples","title":"Examples","items":[{"url":"#checkbox-list","title":"Checkbox list"},{"url":"#checkbox-children","title":"Checkbox children"}]},{"url":"#code","title":"Code","items":[{"url":"#react","title":"React"},{"url":"#web-component","title":"Web Component"},{"url":"#style-customization","title":"Style customization"}]},{"url":"#guidance","title":"Guidance","items":[{"url":"#when-to-use","title":"When to use"},{"url":"#when-to-consider-alternatives","title":"When to consider alternatives"},{"url":"#usage","title":"Usage"},{"url":"#checked-children-and-the-expose-within-pattern","title":"Checked children and the expose within pattern"},{"url":"#accessibility-testing","title":"Accessibility testing"},{"url":"#related-patterns","title":"Related patterns"}]},{"url":"#learn-more","title":"Learn more"},{"url":"#component-maturity","title":"Component maturity"}]}}},"pageContext":{"id":"44d7876e-0b39-5cea-bbc2-d918f7be40f9"}},"staticQueryHashes":["3481578012"]}