{"componentChunkName":"component---src-components-page-templates-info-page-tsx","path":"/components/dropdown/","result":{"data":{"mdx":{"id":"ef10fe02-5b52-5c83-a34b-1835f5e33067","frontmatter":{"title":"Dropdown","intro":"Dropdowns allow users to select one option from a temporary modal menu.","core":{"githubLink":"design-system/src/components/Dropdown","sketchLink":"dlpzO8L","storybookLink":"components-dropdown--docs"},"healthcare":{"sketchLink":"eK07830","storybookLink":null,"githubLink":null},"medicare":null},"slug":"components/dropdown","body":"var _excluded = [\"components\"];\nfunction _extends() { _extends = Object.assign ? Object.assign.bind() : function (target) { for (var i = 1; i < arguments.length; i++) { var source = arguments[i]; for (var key in source) { if (Object.prototype.hasOwnProperty.call(source, key)) { target[key] = source[key]; } } } return target; }; return _extends.apply(this, arguments); }\nfunction _objectWithoutProperties(source, excluded) { if (source == null) return {}; var target = _objectWithoutPropertiesLoose(source, excluded); var key, i; if (Object.getOwnPropertySymbols) { var sourceSymbolKeys = Object.getOwnPropertySymbols(source); for (i = 0; i < sourceSymbolKeys.length; i++) { key = sourceSymbolKeys[i]; if (excluded.indexOf(key) >= 0) continue; if (!Object.prototype.propertyIsEnumerable.call(source, key)) continue; target[key] = source[key]; } } return target; }\nfunction _objectWithoutPropertiesLoose(source, excluded) { if (source == null) return {}; var target = {}; var sourceKeys = Object.keys(source); var key, i; for (i = 0; i < sourceKeys.length; i++) { key = sourceKeys[i]; if (excluded.indexOf(key) >= 0) continue; target[key] = source[key]; } return target; }\n/* @jsxRuntime classic */\n/* @jsx mdx */\n\nvar _frontmatter = {\n  \"title\": \"Dropdown\",\n  \"intro\": \"Dropdowns allow users to select one option from a temporary modal menu.\",\n  \"core\": {\n    \"githubLink\": \"design-system/src/components/Dropdown\",\n    \"sketchLink\": \"dlpzO8L\",\n    \"storybookLink\": \"components-dropdown--docs\"\n  },\n  \"healthcare\": {\n    \"sketchLink\": \"eK07830\"\n  }\n};\nvar makeShortcode = function makeShortcode(name) {\n  return function MDXDefaultShortcode(props) {\n    console.warn(\"Component \" + name + \" was not imported, exported, or provided by MDXProvider as global scope\");\n    return mdx(\"div\", props);\n  };\n};\nvar StorybookExample = makeShortcode(\"StorybookExample\");\nvar PropTable = makeShortcode(\"PropTable\");\nvar ComponentThemeOptions = makeShortcode(\"ComponentThemeOptions\");\nvar MaturityChecklist = makeShortcode(\"MaturityChecklist\");\nvar layoutProps = {\n  _frontmatter: _frontmatter\n};\nvar MDXLayout = \"wrapper\";\nreturn function MDXContent(_ref) {\n  var components = _ref.components,\n    props = _objectWithoutProperties(_ref, _excluded);\n  return mdx(MDXLayout, _extends({}, layoutProps, props, {\n    components: components,\n    mdxType: \"MDXLayout\"\n  }), mdx(\"h2\", {\n    \"id\": \"examples\",\n    \"style\": {\n      \"position\": \"relative\"\n    }\n  }, mdx(\"a\", {\n    parentName: \"h2\",\n    \"href\": \"#examples\",\n    \"aria-label\": \"examples permalink\",\n    \"className\": \"anchor before\"\n  }, mdx(\"svg\", {\n    parentName: \"a\",\n    \"aria-hidden\": \"true\",\n    \"focusable\": \"false\",\n    \"height\": \"16\",\n    \"version\": \"1.1\",\n    \"viewBox\": \"0 0 16 16\",\n    \"width\": \"16\"\n  }, mdx(\"path\", {\n    parentName: \"svg\",\n    \"fillRule\": \"evenodd\",\n    \"d\": \"M4 9h1v1H4c-1.5 0-3-1.69-3-3.5S2.55 3 4 3h4c1.45 0 3 1.69 3 3.5 0 1.41-.91 2.72-2 3.25V8.59c.58-.45 1-1.27 1-2.09C10 5.22 8.98 4 8 4H4c-.98 0-2 1.22-2 2.5S3 9 4 9zm9-3h-1v1h1c1 0 2 1.22 2 2.5S13.98 12 13 12H9c-.98 0-2-1.22-2-2.5 0-.83.42-1.64 1-2.09V6.25c-1.09.53-2 1.84-2 3.25C6 11.31 7.55 13 9 13h4c1.45 0 3-1.69 3-3.5S14.5 6 13 6z\"\n  }))), \"Examples\"), mdx(StorybookExample, {\n    componentName: \"dropdown\",\n    storyId: \"components-dropdown--default\",\n    minHeight: 250,\n    mdxType: \"StorybookExample\"\n  }), mdx(\"h2\", {\n    \"id\": \"code\",\n    \"style\": {\n      \"position\": \"relative\"\n    }\n  }, mdx(\"a\", {\n    parentName: \"h2\",\n    \"href\": \"#code\",\n    \"aria-label\": \"code permalink\",\n    \"className\": \"anchor before\"\n  }, mdx(\"svg\", {\n    parentName: \"a\",\n    \"aria-hidden\": \"true\",\n    \"focusable\": \"false\",\n    \"height\": \"16\",\n    \"version\": \"1.1\",\n    \"viewBox\": \"0 0 16 16\",\n    \"width\": \"16\"\n  }, mdx(\"path\", {\n    parentName: \"svg\",\n    \"fillRule\": \"evenodd\",\n    \"d\": \"M4 9h1v1H4c-1.5 0-3-1.69-3-3.5S2.55 3 4 3h4c1.45 0 3 1.69 3 3.5 0 1.41-.91 2.72-2 3.25V8.59c.58-.45 1-1.27 1-2.09C10 5.22 8.98 4 8 4H4c-.98 0-2 1.22-2 2.5S3 9 4 9zm9-3h-1v1h1c1 0 2 1.22 2 2.5S13.98 12 13 12H9c-.98 0-2-1.22-2-2.5 0-.83.42-1.64 1-2.09V6.25c-1.09.53-2 1.84-2 3.25C6 11.31 7.55 13 9 13h4c1.45 0 3-1.69 3-3.5S14.5 6 13 6z\"\n  }))), \"Code\"), mdx(\"h3\", {\n    \"id\": \"react\",\n    \"style\": {\n      \"position\": \"relative\"\n    }\n  }, mdx(\"a\", {\n    parentName: \"h3\",\n    \"href\": \"#react\",\n    \"aria-label\": \"react permalink\",\n    \"className\": \"anchor before\"\n  }, mdx(\"svg\", {\n    parentName: \"a\",\n    \"aria-hidden\": \"true\",\n    \"focusable\": \"false\",\n    \"height\": \"16\",\n    \"version\": \"1.1\",\n    \"viewBox\": \"0 0 16 16\",\n    \"width\": \"16\"\n  }, mdx(\"path\", {\n    parentName: \"svg\",\n    \"fillRule\": \"evenodd\",\n    \"d\": \"M4 9h1v1H4c-1.5 0-3-1.69-3-3.5S2.55 3 4 3h4c1.45 0 3 1.69 3 3.5 0 1.41-.91 2.72-2 3.25V8.59c.58-.45 1-1.27 1-2.09C10 5.22 8.98 4 8 4H4c-.98 0-2 1.22-2 2.5S3 9 4 9zm9-3h-1v1h1c1 0 2 1.22 2 2.5S13.98 12 13 12H9c-.98 0-2-1.22-2-2.5 0-.83.42-1.64 1-2.09V6.25c-1.09.53-2 1.84-2 3.25C6 11.31 7.55 13 9 13h4c1.45 0 3-1.69 3-3.5S14.5 6 13 6z\"\n  }))), \"React\"), mdx(\"p\", null, \"Note that any \", mdx(\"em\", {\n    parentName: \"p\"\n  }, \"undocumented\"), \" props that you pass to this component will be passed to the \", mdx(\"inlineCode\", {\n    parentName: \"p\"\n  }, \"select\"), \" element, so you can use this to set additional attributes if necessary.\"), mdx(PropTable, {\n    componentName: \"Dropdown\",\n    mdxType: \"PropTable\"\n  }), mdx(\"h3\", {\n    \"id\": \"styles\",\n    \"style\": {\n      \"position\": \"relative\"\n    }\n  }, mdx(\"a\", {\n    parentName: \"h3\",\n    \"href\": \"#styles\",\n    \"aria-label\": \"styles permalink\",\n    \"className\": \"anchor before\"\n  }, mdx(\"svg\", {\n    parentName: \"a\",\n    \"aria-hidden\": \"true\",\n    \"focusable\": \"false\",\n    \"height\": \"16\",\n    \"version\": \"1.1\",\n    \"viewBox\": \"0 0 16 16\",\n    \"width\": \"16\"\n  }, mdx(\"path\", {\n    parentName: \"svg\",\n    \"fillRule\": \"evenodd\",\n    \"d\": \"M4 9h1v1H4c-1.5 0-3-1.69-3-3.5S2.55 3 4 3h4c1.45 0 3 1.69 3 3.5 0 1.41-.91 2.72-2 3.25V8.59c.58-.45 1-1.27 1-2.09C10 5.22 8.98 4 8 4H4c-.98 0-2 1.22-2 2.5S3 9 4 9zm9-3h-1v1h1c1 0 2 1.22 2 2.5S13.98 12 13 12H9c-.98 0-2-1.22-2-2.5 0-.83.42-1.64 1-2.09V6.25c-1.09.53-2 1.84-2 3.25C6 11.31 7.55 13 9 13h4c1.45 0 3-1.69 3-3.5S14.5 6 13 6z\"\n  }))), \"Styles\"), mdx(\"p\", null, \"The following CSS variables can be overridden to customize Dropdown components:\"), mdx(ComponentThemeOptions, {\n    componentname: \"dropdown\",\n    mdxType: \"ComponentThemeOptions\"\n  }), mdx(\"h4\", {\n    \"id\": \"text-input-options\",\n    \"style\": {\n      \"position\": \"relative\"\n    }\n  }, mdx(\"a\", {\n    parentName: \"h4\",\n    \"href\": \"#text-input-options\",\n    \"aria-label\": \"text input options permalink\",\n    \"className\": \"anchor before\"\n  }, mdx(\"svg\", {\n    parentName: \"a\",\n    \"aria-hidden\": \"true\",\n    \"focusable\": \"false\",\n    \"height\": \"16\",\n    \"version\": \"1.1\",\n    \"viewBox\": \"0 0 16 16\",\n    \"width\": \"16\"\n  }, mdx(\"path\", {\n    parentName: \"svg\",\n    \"fillRule\": \"evenodd\",\n    \"d\": \"M4 9h1v1H4c-1.5 0-3-1.69-3-3.5S2.55 3 4 3h4c1.45 0 3 1.69 3 3.5 0 1.41-.91 2.72-2 3.25V8.59c.58-.45 1-1.27 1-2.09C10 5.22 8.98 4 8 4H4c-.98 0-2 1.22-2 2.5S3 9 4 9zm9-3h-1v1h1c1 0 2 1.22 2 2.5S13.98 12 13 12H9c-.98 0-2-1.22-2-2.5 0-.83.42-1.64 1-2.09V6.25c-1.09.53-2 1.84-2 3.25C6 11.31 7.55 13 9 13h4c1.45 0 3-1.69 3-3.5S14.5 6 13 6z\"\n  }))), \"Text Input Options\"), mdx(\"p\", null, \"This component also makes use of some text input styles, which can be customized by the following variables:\"), mdx(ComponentThemeOptions, {\n    componentname: \"text-input\",\n    mdxType: \"ComponentThemeOptions\"\n  }), mdx(\"h2\", {\n    \"id\": \"guidance\",\n    \"style\": {\n      \"position\": \"relative\"\n    }\n  }, mdx(\"a\", {\n    parentName: \"h2\",\n    \"href\": \"#guidance\",\n    \"aria-label\": \"guidance permalink\",\n    \"className\": \"anchor before\"\n  }, mdx(\"svg\", {\n    parentName: \"a\",\n    \"aria-hidden\": \"true\",\n    \"focusable\": \"false\",\n    \"height\": \"16\",\n    \"version\": \"1.1\",\n    \"viewBox\": \"0 0 16 16\",\n    \"width\": \"16\"\n  }, mdx(\"path\", {\n    parentName: \"svg\",\n    \"fillRule\": \"evenodd\",\n    \"d\": \"M4 9h1v1H4c-1.5 0-3-1.69-3-3.5S2.55 3 4 3h4c1.45 0 3 1.69 3 3.5 0 1.41-.91 2.72-2 3.25V8.59c.58-.45 1-1.27 1-2.09C10 5.22 8.98 4 8 4H4c-.98 0-2 1.22-2 2.5S3 9 4 9zm9-3h-1v1h1c1 0 2 1.22 2 2.5S13.98 12 13 12H9c-.98 0-2-1.22-2-2.5 0-.83.42-1.64 1-2.09V6.25c-1.09.53-2 1.84-2 3.25C6 11.31 7.55 13 9 13h4c1.45 0 3-1.69 3-3.5S14.5 6 13 6z\"\n  }))), \"Guidance\"), mdx(\"h3\", {\n    \"id\": \"when-to-use\",\n    \"style\": {\n      \"position\": \"relative\"\n    }\n  }, mdx(\"a\", {\n    parentName: \"h3\",\n    \"href\": \"#when-to-use\",\n    \"aria-label\": \"when to use permalink\",\n    \"className\": \"anchor before\"\n  }, mdx(\"svg\", {\n    parentName: \"a\",\n    \"aria-hidden\": \"true\",\n    \"focusable\": \"false\",\n    \"height\": \"16\",\n    \"version\": \"1.1\",\n    \"viewBox\": \"0 0 16 16\",\n    \"width\": \"16\"\n  }, mdx(\"path\", {\n    parentName: \"svg\",\n    \"fillRule\": \"evenodd\",\n    \"d\": \"M4 9h1v1H4c-1.5 0-3-1.69-3-3.5S2.55 3 4 3h4c1.45 0 3 1.69 3 3.5 0 1.41-.91 2.72-2 3.25V8.59c.58-.45 1-1.27 1-2.09C10 5.22 8.98 4 8 4H4c-.98 0-2 1.22-2 2.5S3 9 4 9zm9-3h-1v1h1c1 0 2 1.22 2 2.5S13.98 12 13 12H9c-.98 0-2-1.22-2-2.5 0-.83.42-1.64 1-2.09V6.25c-1.09.53-2 1.84-2 3.25C6 11.31 7.55 13 9 13h4c1.45 0 3-1.69 3-3.5S14.5 6 13 6z\"\n  }))), \"When to use\"), mdx(\"ul\", null, mdx(\"li\", {\n    parentName: \"ul\"\n  }, mdx(\"strong\", {\n    parentName: \"li\"\n  }, \"Use sparingly\"), \". Use the dropdown component only when a user needs to choose from about seven to 15 possible options and you have limited space to display the options.\")), mdx(\"h3\", {\n    \"id\": \"when-to-consider-alternatives\",\n    \"style\": {\n      \"position\": \"relative\"\n    }\n  }, mdx(\"a\", {\n    parentName: \"h3\",\n    \"href\": \"#when-to-consider-alternatives\",\n    \"aria-label\": \"when to consider alternatives permalink\",\n    \"className\": \"anchor before\"\n  }, mdx(\"svg\", {\n    parentName: \"a\",\n    \"aria-hidden\": \"true\",\n    \"focusable\": \"false\",\n    \"height\": \"16\",\n    \"version\": \"1.1\",\n    \"viewBox\": \"0 0 16 16\",\n    \"width\": \"16\"\n  }, mdx(\"path\", {\n    parentName: \"svg\",\n    \"fillRule\": \"evenodd\",\n    \"d\": \"M4 9h1v1H4c-1.5 0-3-1.69-3-3.5S2.55 3 4 3h4c1.45 0 3 1.69 3 3.5 0 1.41-.91 2.72-2 3.25V8.59c.58-.45 1-1.27 1-2.09C10 5.22 8.98 4 8 4H4c-.98 0-2 1.22-2 2.5S3 9 4 9zm9-3h-1v1h1c1 0 2 1.22 2 2.5S13.98 12 13 12H9c-.98 0-2-1.22-2-2.5 0-.83.42-1.64 1-2.09V6.25c-1.09.53-2 1.84-2 3.25C6 11.31 7.55 13 9 13h4c1.45 0 3-1.69 3-3.5S14.5 6 13 6z\"\n  }))), \"When to consider alternatives\"), mdx(\"ul\", null, mdx(\"li\", {\n    parentName: \"ul\"\n  }, mdx(\"strong\", {\n    parentName: \"li\"\n  }, \"Fewer than seven options.\"), \" Use \", mdx(\"a\", {\n    parentName: \"li\",\n    \"href\": \"/design-system/branch/WNMGDS-2346/update-default-stories-to-have-one-component/components/radio\"\n  }, \"radio buttons\"), \" or \", mdx(\"a\", {\n    parentName: \"li\",\n    \"href\": \"/design-system/branch/WNMGDS-2346/update-default-stories-to-have-one-component/components/checkbox/\"\n  }, \"checkboxes\"), \" instead.\"), mdx(\"li\", {\n    parentName: \"ul\"\n  }, mdx(\"strong\", {\n    parentName: \"li\"\n  }, \"More than 15 options.\"), \" If the list of options is very long. Let users type the same information into a text input that suggests possible options instead.\"), mdx(\"li\", {\n    parentName: \"ul\"\n  }, mdx(\"strong\", {\n    parentName: \"li\"\n  }, \"Multi-select.\"), \" If you need to allow users to select more than one option at once. Users often don\\u2019t understand how to select multiple items from dropdowns. Use \", mdx(\"a\", {\n    parentName: \"li\",\n    \"href\": \"%7B%7Broot%7D%7D/components/choice\"\n  }, \"checkboxes\"), \" instead.\"), mdx(\"li\", {\n    parentName: \"ul\"\n  }, mdx(\"strong\", {\n    parentName: \"li\"\n  }, \"Site navigation.\"), \" Use the \", mdx(\"a\", {\n    parentName: \"li\",\n    \"href\": \"/design-system/branch/WNMGDS-2346/update-default-stories-to-have-one-component/components/vertical-nav/\"\n  }, \"navigation components\"), \" instead.\")), mdx(\"h3\", {\n    \"id\": \"usage\",\n    \"style\": {\n      \"position\": \"relative\"\n    }\n  }, mdx(\"a\", {\n    parentName: \"h3\",\n    \"href\": \"#usage\",\n    \"aria-label\": \"usage permalink\",\n    \"className\": \"anchor before\"\n  }, mdx(\"svg\", {\n    parentName: \"a\",\n    \"aria-hidden\": \"true\",\n    \"focusable\": \"false\",\n    \"height\": \"16\",\n    \"version\": \"1.1\",\n    \"viewBox\": \"0 0 16 16\",\n    \"width\": \"16\"\n  }, mdx(\"path\", {\n    parentName: \"svg\",\n    \"fillRule\": \"evenodd\",\n    \"d\": \"M4 9h1v1H4c-1.5 0-3-1.69-3-3.5S2.55 3 4 3h4c1.45 0 3 1.69 3 3.5 0 1.41-.91 2.72-2 3.25V8.59c.58-.45 1-1.27 1-2.09C10 5.22 8.98 4 8 4H4c-.98 0-2 1.22-2 2.5S3 9 4 9zm9-3h-1v1h1c1 0 2 1.22 2 2.5S13.98 12 13 12H9c-.98 0-2-1.22-2-2.5 0-.83.42-1.64 1-2.09V6.25c-1.09.53-2 1.84-2 3.25C6 11.31 7.55 13 9 13h4c1.45 0 3-1.69 3-3.5S14.5 6 13 6z\"\n  }))), \"Usage\"), mdx(\"ul\", null, mdx(\"li\", {\n    parentName: \"ul\"\n  }, mdx(\"strong\", {\n    parentName: \"li\"\n  }, \"Make sure to test.\"), \" Test dropdowns thoroughly with members of your target audience. Several usability experts suggest they should be the \\u201CUI of last resort.\\u201D Many users find them confusing and difficult to use.\"), mdx(\"li\", {\n    parentName: \"ul\"\n  }, mdx(\"strong\", {\n    parentName: \"li\"\n  }, \"Avoid dependent options.\"), \" Avoid making options in one dropdown menu change based on the input to another. Users often don\\u2019t understand how selecting an item in one impacts another.\"), mdx(\"li\", {\n    parentName: \"ul\"\n  }, mdx(\"strong\", {\n    parentName: \"li\"\n  }, \"Use a good default.\"), \" When most users will (or should) pick a particular option, make it the selected default. \", mdx(\"strong\", {\n    parentName: \"li\"\n  }, \"If a good default is not an option\"), \", use a descriptive placeholder like \", mdx(\"inlineCode\", {\n    parentName: \"li\"\n  }, \"- Select a state -\"), \" as the selected default.\"), mdx(\"li\", {\n    parentName: \"ul\"\n  }, mdx(\"strong\", {\n    parentName: \"li\"\n  }, \"Avoid auto-submission.\"), \" Don\\u2019t use JavaScript to automatically submit the form (or do anything else) when an option is selected. Auto-submission disrupts screen readers because they select each option as they read them.\")), mdx(\"p\", null, mdx(\"strong\", {\n    parentName: \"p\"\n  }, mdx(\"a\", {\n    parentName: \"strong\",\n    \"href\": \"/design-system/branch/WNMGDS-2346/update-default-stories-to-have-one-component/patterns/forms/\"\n  }, \"View the \\\"Forms\\\" guidelines for additional guidance and best practices.\"))), mdx(\"h3\", {\n    \"id\": \"accessibility\",\n    \"style\": {\n      \"position\": \"relative\"\n    }\n  }, mdx(\"a\", {\n    parentName: \"h3\",\n    \"href\": \"#accessibility\",\n    \"aria-label\": \"accessibility permalink\",\n    \"className\": \"anchor before\"\n  }, mdx(\"svg\", {\n    parentName: \"a\",\n    \"aria-hidden\": \"true\",\n    \"focusable\": \"false\",\n    \"height\": \"16\",\n    \"version\": \"1.1\",\n    \"viewBox\": \"0 0 16 16\",\n    \"width\": \"16\"\n  }, mdx(\"path\", {\n    parentName: \"svg\",\n    \"fillRule\": \"evenodd\",\n    \"d\": \"M4 9h1v1H4c-1.5 0-3-1.69-3-3.5S2.55 3 4 3h4c1.45 0 3 1.69 3 3.5 0 1.41-.91 2.72-2 3.25V8.59c.58-.45 1-1.27 1-2.09C10 5.22 8.98 4 8 4H4c-.98 0-2 1.22-2 2.5S3 9 4 9zm9-3h-1v1h1c1 0 2 1.22 2 2.5S13.98 12 13 12H9c-.98 0-2-1.22-2-2.5 0-.83.42-1.64 1-2.09V6.25c-1.09.53-2 1.84-2 3.25C6 11.31 7.55 13 9 13h4c1.45 0 3-1.69 3-3.5S14.5 6 13 6z\"\n  }))), \"Accessibility\"), mdx(\"ul\", null, mdx(\"li\", {\n    parentName: \"ul\"\n  }, mdx(\"strong\", {\n    parentName: \"li\"\n  }, \"Customize accessibly.\"), \" If you customize the dropdown, ensure it continues to meet the the \", mdx(\"a\", {\n    parentName: \"li\",\n    \"href\": \"https://designsystem.digital.gov/components/form-controls/\"\n  }, \"accessibility requirements that apply to all form controls\"), \".\"), mdx(\"li\", {\n    parentName: \"ul\"\n  }, mdx(\"strong\", {\n    parentName: \"li\"\n  }, \"Always use a label.\"), \" Make sure your dropdown has a label. Don\\u2019t replace it with the default menu option (for example, removing the \\u201CState\\u201D label and just having the dropdown read \\u201CSelect a state\\u201D by default).\"), mdx(\"li\", {\n    parentName: \"ul\"\n  }, mdx(\"strong\", {\n    parentName: \"li\"\n  }, \"Avoid auto-submission.\"), \" Don\\u2019t use JavaScript to automatically submit the form (or do anything else) when an option is selected. Auto-submission disrupts screen readers because they select each option as they read them.\")), mdx(\"h3\", {\n    \"id\": \"related-patterns\",\n    \"style\": {\n      \"position\": \"relative\"\n    }\n  }, mdx(\"a\", {\n    parentName: \"h3\",\n    \"href\": \"#related-patterns\",\n    \"aria-label\": \"related patterns permalink\",\n    \"className\": \"anchor before\"\n  }, mdx(\"svg\", {\n    parentName: \"a\",\n    \"aria-hidden\": \"true\",\n    \"focusable\": \"false\",\n    \"height\": \"16\",\n    \"version\": \"1.1\",\n    \"viewBox\": \"0 0 16 16\",\n    \"width\": \"16\"\n  }, mdx(\"path\", {\n    parentName: \"svg\",\n    \"fillRule\": \"evenodd\",\n    \"d\": \"M4 9h1v1H4c-1.5 0-3-1.69-3-3.5S2.55 3 4 3h4c1.45 0 3 1.69 3 3.5 0 1.41-.91 2.72-2 3.25V8.59c.58-.45 1-1.27 1-2.09C10 5.22 8.98 4 8 4H4c-.98 0-2 1.22-2 2.5S3 9 4 9zm9-3h-1v1h1c1 0 2 1.22 2 2.5S13.98 12 13 12H9c-.98 0-2-1.22-2-2.5 0-.83.42-1.64 1-2.09V6.25c-1.09.53-2 1.84-2 3.25C6 11.31 7.55 13 9 13h4c1.45 0 3-1.69 3-3.5S14.5 6 13 6z\"\n  }))), \"Related patterns\"), mdx(\"ul\", null, mdx(\"li\", {\n    parentName: \"ul\"\n  }, mdx(\"a\", {\n    parentName: \"li\",\n    \"href\": \"/design-system/branch/WNMGDS-2346/update-default-stories-to-have-one-component/components/checkbox\"\n  }, \"Checkbox\"), \" and \", mdx(\"a\", {\n    parentName: \"li\",\n    \"href\": \"/design-system/branch/WNMGDS-2346/update-default-stories-to-have-one-component/components/radio/\"\n  }, \"Radio\")), mdx(\"li\", {\n    parentName: \"ul\"\n  }, mdx(\"a\", {\n    parentName: \"li\",\n    \"href\": \"/design-system/branch/WNMGDS-2346/update-default-stories-to-have-one-component/components/text-field/\"\n  }, \"Text field\"))), mdx(\"h2\", {\n    \"id\": \"learn-more\",\n    \"style\": {\n      \"position\": \"relative\"\n    }\n  }, mdx(\"a\", {\n    parentName: \"h2\",\n    \"href\": \"#learn-more\",\n    \"aria-label\": \"learn more permalink\",\n    \"className\": \"anchor before\"\n  }, mdx(\"svg\", {\n    parentName: \"a\",\n    \"aria-hidden\": \"true\",\n    \"focusable\": \"false\",\n    \"height\": \"16\",\n    \"version\": \"1.1\",\n    \"viewBox\": \"0 0 16 16\",\n    \"width\": \"16\"\n  }, mdx(\"path\", {\n    parentName: \"svg\",\n    \"fillRule\": \"evenodd\",\n    \"d\": \"M4 9h1v1H4c-1.5 0-3-1.69-3-3.5S2.55 3 4 3h4c1.45 0 3 1.69 3 3.5 0 1.41-.91 2.72-2 3.25V8.59c.58-.45 1-1.27 1-2.09C10 5.22 8.98 4 8 4H4c-.98 0-2 1.22-2 2.5S3 9 4 9zm9-3h-1v1h1c1 0 2 1.22 2 2.5S13.98 12 13 12H9c-.98 0-2-1.22-2-2.5 0-.83.42-1.64 1-2.09V6.25c-1.09.53-2 1.84-2 3.25C6 11.31 7.55 13 9 13h4c1.45 0 3-1.69 3-3.5S14.5 6 13 6z\"\n  }))), \"Learn more\"), mdx(\"ul\", null, mdx(\"li\", {\n    parentName: \"ul\"\n  }, \"[Form Guidelines]\", \"/guidelines/forms/)\"), mdx(\"li\", {\n    parentName: \"ul\"\n  }, mdx(\"a\", {\n    parentName: \"li\",\n    \"href\": \"https://designnotes.blog.gov.uk/2013/12/05/asking-for-a-date-of-birth/\"\n  }, \"Asking for a date of birth\")), mdx(\"li\", {\n    parentName: \"ul\"\n  }, mdx(\"a\", {\n    parentName: \"li\",\n    \"href\": \"http://www.formsthatwork.com/files/Articles/dropdown.pdf\"\n  }, \"Four steps for choosing form elements on the Web (PDF)\")), mdx(\"li\", {\n    parentName: \"ul\"\n  }, mdx(\"a\", {\n    parentName: \"li\",\n    \"href\": \"https://www.nngroup.com/articles/drop-down-menus/\"\n  }, \"Dropdowns: Design Guidelines\"))), mdx(\"h2\", {\n    \"id\": \"component-maturity\",\n    \"style\": {\n      \"position\": \"relative\"\n    }\n  }, mdx(\"a\", {\n    parentName: \"h2\",\n    \"href\": \"#component-maturity\",\n    \"aria-label\": \"component maturity permalink\",\n    \"className\": \"anchor before\"\n  }, mdx(\"svg\", {\n    parentName: \"a\",\n    \"aria-hidden\": \"true\",\n    \"focusable\": \"false\",\n    \"height\": \"16\",\n    \"version\": \"1.1\",\n    \"viewBox\": \"0 0 16 16\",\n    \"width\": \"16\"\n  }, mdx(\"path\", {\n    parentName: \"svg\",\n    \"fillRule\": \"evenodd\",\n    \"d\": \"M4 9h1v1H4c-1.5 0-3-1.69-3-3.5S2.55 3 4 3h4c1.45 0 3 1.69 3 3.5 0 1.41-.91 2.72-2 3.25V8.59c.58-.45 1-1.27 1-2.09C10 5.22 8.98 4 8 4H4c-.98 0-2 1.22-2 2.5S3 9 4 9zm9-3h-1v1h1c1 0 2 1.22 2 2.5S13.98 12 13 12H9c-.98 0-2-1.22-2-2.5 0-.83.42-1.64 1-2.09V6.25c-1.09.53-2 1.84-2 3.25C6 11.31 7.55 13 9 13h4c1.45 0 3-1.69 3-3.5S14.5 6 13 6z\"\n  }))), \"Component maturity\"), mdx(MaturityChecklist, {\n    a11yStandards: true,\n    color: true,\n    forcedColors: true,\n    screenReaders: true,\n    keyboardNavigable: true,\n    storybook: true,\n    responsive: true,\n    spanish: null,\n    completeUiKit: false,\n    responsiveUiKit: false,\n    tokensInCode: true,\n    tokensInSketch: true,\n    mdxType: \"MaturityChecklist\"\n  }));\n}\n;\nMDXContent.isMDXComponent = true;","tableOfContents":{"items":[{"url":"#examples","title":"Examples"},{"url":"#code","title":"Code","items":[{"url":"#react","title":"React"},{"url":"#styles","title":"Styles"}]},{"url":"#guidance","title":"Guidance","items":[{"url":"#when-to-use","title":"When to use"},{"url":"#when-to-consider-alternatives","title":"When to consider alternatives"},{"url":"#usage","title":"Usage"},{"url":"#accessibility","title":"Accessibility"},{"url":"#related-patterns","title":"Related patterns"}]},{"url":"#learn-more","title":"Learn more"},{"url":"#component-maturity","title":"Component maturity"}]}}},"pageContext":{"id":"ef10fe02-5b52-5c83-a34b-1835f5e33067"}},"staticQueryHashes":["3481578012"]}