{"componentChunkName":"component---src-components-page-templates-info-page-tsx","path":"/components/radio/","result":{"data":{"mdx":{"id":"d1881b7d-6a9a-5ea5-8851-70ba5161670d","frontmatter":{"title":"Radio Button","intro":"Radio buttons allow users to select exactly one choice from a group.","core":{"githubLink":"design-system/src/components/ChoiceList","sketchLink":"eKVZm2P","storybookLink":"components-choicelist--docs"},"healthcare":{"sketchLink":"paqdxPr","storybookLink":null,"githubLink":null},"medicare":{"sketchLink":"qeZllRy","storybookLink":null,"githubLink":null}},"slug":"components/radio","body":"var _excluded = [\"components\"];\nfunction _extends() { _extends = Object.assign ? Object.assign.bind() : function (target) { for (var i = 1; i < arguments.length; i++) { var source = arguments[i]; for (var key in source) { if (Object.prototype.hasOwnProperty.call(source, key)) { target[key] = source[key]; } } } return target; }; return _extends.apply(this, arguments); }\nfunction _objectWithoutProperties(source, excluded) { if (source == null) return {}; var target = _objectWithoutPropertiesLoose(source, excluded); var key, i; if (Object.getOwnPropertySymbols) { var sourceSymbolKeys = Object.getOwnPropertySymbols(source); for (i = 0; i < sourceSymbolKeys.length; i++) { key = sourceSymbolKeys[i]; if (excluded.indexOf(key) >= 0) continue; if (!Object.prototype.propertyIsEnumerable.call(source, key)) continue; target[key] = source[key]; } } return target; }\nfunction _objectWithoutPropertiesLoose(source, excluded) { if (source == null) return {}; var target = {}; var sourceKeys = Object.keys(source); var key, i; for (i = 0; i < sourceKeys.length; i++) { key = sourceKeys[i]; if (excluded.indexOf(key) >= 0) continue; target[key] = source[key]; } return target; }\n/* @jsxRuntime classic */\n/* @jsx mdx */\n\nvar _frontmatter = {\n  \"title\": \"Radio Button\",\n  \"intro\": \"Radio buttons allow users to select exactly one choice from a group.\",\n  \"core\": {\n    \"githubLink\": \"design-system/src/components/ChoiceList\",\n    \"sketchLink\": \"eKVZm2P\",\n    \"storybookLink\": \"components-choicelist--docs\"\n  },\n  \"healthcare\": {\n    \"sketchLink\": \"paqdxPr\"\n  },\n  \"medicare\": {\n    \"sketchLink\": \"qeZllRy\"\n  }\n};\nvar makeShortcode = function makeShortcode(name) {\n  return function MDXDefaultShortcode(props) {\n    console.warn(\"Component \" + name + \" was not imported, exported, or provided by MDXProvider as global scope\");\n    return mdx(\"div\", props);\n  };\n};\nvar StorybookExample = makeShortcode(\"StorybookExample\");\nvar PropTable = makeShortcode(\"PropTable\");\nvar PropTableHtmlElementRow = makeShortcode(\"PropTableHtmlElementRow\");\nvar ComponentThemeOptions = makeShortcode(\"ComponentThemeOptions\");\nvar MaturityChecklist = makeShortcode(\"MaturityChecklist\");\nvar layoutProps = {\n  _frontmatter: _frontmatter\n};\nvar MDXLayout = \"wrapper\";\nreturn function MDXContent(_ref) {\n  var components = _ref.components,\n    props = _objectWithoutProperties(_ref, _excluded);\n  return mdx(MDXLayout, _extends({}, layoutProps, props, {\n    components: components,\n    mdxType: \"MDXLayout\"\n  }), mdx(\"h2\", {\n    \"id\": \"examples\",\n    \"style\": {\n      \"position\": \"relative\"\n    }\n  }, mdx(\"a\", {\n    parentName: \"h2\",\n    \"href\": \"#examples\",\n    \"aria-label\": \"examples permalink\",\n    \"className\": \"anchor before\"\n  }, mdx(\"svg\", {\n    parentName: \"a\",\n    \"aria-hidden\": \"true\",\n    \"focusable\": \"false\",\n    \"height\": \"16\",\n    \"version\": \"1.1\",\n    \"viewBox\": \"0 0 16 16\",\n    \"width\": \"16\"\n  }, mdx(\"path\", {\n    parentName: \"svg\",\n    \"fillRule\": \"evenodd\",\n    \"d\": \"M4 9h1v1H4c-1.5 0-3-1.69-3-3.5S2.55 3 4 3h4c1.45 0 3 1.69 3 3.5 0 1.41-.91 2.72-2 3.25V8.59c.58-.45 1-1.27 1-2.09C10 5.22 8.98 4 8 4H4c-.98 0-2 1.22-2 2.5S3 9 4 9zm9-3h-1v1h1c1 0 2 1.22 2 2.5S13.98 12 13 12H9c-.98 0-2-1.22-2-2.5 0-.83.42-1.64 1-2.09V6.25c-1.09.53-2 1.84-2 3.25C6 11.31 7.55 13 9 13h4c1.45 0 3-1.69 3-3.5S14.5 6 13 6z\"\n  }))), \"Examples\"), mdx(\"h3\", {\n    \"id\": \"radio-button-list\",\n    \"style\": {\n      \"position\": \"relative\"\n    }\n  }, mdx(\"a\", {\n    parentName: \"h3\",\n    \"href\": \"#radio-button-list\",\n    \"aria-label\": \"radio button list permalink\",\n    \"className\": \"anchor before\"\n  }, mdx(\"svg\", {\n    parentName: \"a\",\n    \"aria-hidden\": \"true\",\n    \"focusable\": \"false\",\n    \"height\": \"16\",\n    \"version\": \"1.1\",\n    \"viewBox\": \"0 0 16 16\",\n    \"width\": \"16\"\n  }, mdx(\"path\", {\n    parentName: \"svg\",\n    \"fillRule\": \"evenodd\",\n    \"d\": \"M4 9h1v1H4c-1.5 0-3-1.69-3-3.5S2.55 3 4 3h4c1.45 0 3 1.69 3 3.5 0 1.41-.91 2.72-2 3.25V8.59c.58-.45 1-1.27 1-2.09C10 5.22 8.98 4 8 4H4c-.98 0-2 1.22-2 2.5S3 9 4 9zm9-3h-1v1h1c1 0 2 1.22 2 2.5S13.98 12 13 12H9c-.98 0-2-1.22-2-2.5 0-.83.42-1.64 1-2.09V6.25c-1.09.53-2 1.84-2 3.25C6 11.31 7.55 13 9 13h4c1.45 0 3-1.69 3-3.5S14.5 6 13 6z\"\n  }))), \"Radio button list\"), mdx(\"p\", null, \"A \", mdx(\"inlineCode\", {\n    parentName: \"p\"\n  }, \"ChoiceList\"), \" component can be used to render a \", mdx(\"a\", {\n    parentName: \"p\",\n    \"href\": \"/design-system/branch/NO-TICKET/revise-dropdown-styles/components/radio/\"\n  }, \"radio\"), \" button group or checkbox group. Use the \", mdx(\"inlineCode\", {\n    parentName: \"p\"\n  }, \"type\"), \" prop to specify the type of field to display.\"), mdx(StorybookExample, {\n    componentName: \"choiceList-radio\",\n    sourceFilePath: \"components/ChoiceList/ChoiceList.tsx\",\n    storyId: \"components-choicelist--default-radio\",\n    mdxType: \"StorybookExample\"\n  }), mdx(\"h3\", {\n    \"id\": \"radio-button-children\",\n    \"style\": {\n      \"position\": \"relative\"\n    }\n  }, mdx(\"a\", {\n    parentName: \"h3\",\n    \"href\": \"#radio-button-children\",\n    \"aria-label\": \"radio button children permalink\",\n    \"className\": \"anchor before\"\n  }, mdx(\"svg\", {\n    parentName: \"a\",\n    \"aria-hidden\": \"true\",\n    \"focusable\": \"false\",\n    \"height\": \"16\",\n    \"version\": \"1.1\",\n    \"viewBox\": \"0 0 16 16\",\n    \"width\": \"16\"\n  }, mdx(\"path\", {\n    parentName: \"svg\",\n    \"fillRule\": \"evenodd\",\n    \"d\": \"M4 9h1v1H4c-1.5 0-3-1.69-3-3.5S2.55 3 4 3h4c1.45 0 3 1.69 3 3.5 0 1.41-.91 2.72-2 3.25V8.59c.58-.45 1-1.27 1-2.09C10 5.22 8.98 4 8 4H4c-.98 0-2 1.22-2 2.5S3 9 4 9zm9-3h-1v1h1c1 0 2 1.22 2 2.5S13.98 12 13 12H9c-.98 0-2-1.22-2-2.5 0-.83.42-1.64 1-2.09V6.25c-1.09.53-2 1.84-2 3.25C6 11.31 7.55 13 9 13h4c1.45 0 3-1.69 3-3.5S14.5 6 13 6z\"\n  }))), \"Radio button children\"), mdx(\"p\", null, \"Radio buttons can have optional checked or unchecked children that are conditionally shown based on the state of the checkbox.\"), mdx(StorybookExample, {\n    componentName: \"choice\",\n    sourceFilePath: \"components/ChoiceList/Choice.tsx\",\n    storyId: \"components-choicelist--choice-children\",\n    mdxType: \"StorybookExample\"\n  }), mdx(\"h2\", {\n    \"id\": \"code\",\n    \"style\": {\n      \"position\": \"relative\"\n    }\n  }, mdx(\"a\", {\n    parentName: \"h2\",\n    \"href\": \"#code\",\n    \"aria-label\": \"code permalink\",\n    \"className\": \"anchor before\"\n  }, mdx(\"svg\", {\n    parentName: \"a\",\n    \"aria-hidden\": \"true\",\n    \"focusable\": \"false\",\n    \"height\": \"16\",\n    \"version\": \"1.1\",\n    \"viewBox\": \"0 0 16 16\",\n    \"width\": \"16\"\n  }, mdx(\"path\", {\n    parentName: \"svg\",\n    \"fillRule\": \"evenodd\",\n    \"d\": \"M4 9h1v1H4c-1.5 0-3-1.69-3-3.5S2.55 3 4 3h4c1.45 0 3 1.69 3 3.5 0 1.41-.91 2.72-2 3.25V8.59c.58-.45 1-1.27 1-2.09C10 5.22 8.98 4 8 4H4c-.98 0-2 1.22-2 2.5S3 9 4 9zm9-3h-1v1h1c1 0 2 1.22 2 2.5S13.98 12 13 12H9c-.98 0-2-1.22-2-2.5 0-.83.42-1.64 1-2.09V6.25c-1.09.53-2 1.84-2 3.25C6 11.31 7.55 13 9 13h4c1.45 0 3-1.69 3-3.5S14.5 6 13 6z\"\n  }))), \"Code\"), mdx(\"h3\", {\n    \"id\": \"react\",\n    \"style\": {\n      \"position\": \"relative\"\n    }\n  }, mdx(\"a\", {\n    parentName: \"h3\",\n    \"href\": \"#react\",\n    \"aria-label\": \"react permalink\",\n    \"className\": \"anchor before\"\n  }, mdx(\"svg\", {\n    parentName: \"a\",\n    \"aria-hidden\": \"true\",\n    \"focusable\": \"false\",\n    \"height\": \"16\",\n    \"version\": \"1.1\",\n    \"viewBox\": \"0 0 16 16\",\n    \"width\": \"16\"\n  }, mdx(\"path\", {\n    parentName: \"svg\",\n    \"fillRule\": \"evenodd\",\n    \"d\": \"M4 9h1v1H4c-1.5 0-3-1.69-3-3.5S2.55 3 4 3h4c1.45 0 3 1.69 3 3.5 0 1.41-.91 2.72-2 3.25V8.59c.58-.45 1-1.27 1-2.09C10 5.22 8.98 4 8 4H4c-.98 0-2 1.22-2 2.5S3 9 4 9zm9-3h-1v1h1c1 0 2 1.22 2 2.5S13.98 12 13 12H9c-.98 0-2-1.22-2-2.5 0-.83.42-1.64 1-2.09V6.25c-1.09.53-2 1.84-2 3.25C6 11.31 7.55 13 9 13h4c1.45 0 3-1.69 3-3.5S14.5 6 13 6z\"\n  }))), \"React\"), mdx(\"p\", null, \"Radio buttons can be managed as a group using \", mdx(\"inlineCode\", {\n    parentName: \"p\"\n  }, \"<ChoiceList>\"), \" or individually using \", mdx(\"inlineCode\", {\n    parentName: \"p\"\n  }, \"<Choice>\"), \".\"), mdx(\"p\", null, \"Note that each of the items in the \", mdx(\"inlineCode\", {\n    parentName: \"p\"\n  }, \"choices\"), \" array represents props that will be passed to an individual \", mdx(\"inlineCode\", {\n    parentName: \"p\"\n  }, \"<Choice>\"), \" component. You can therefore define any of the props listed in the \", mdx(\"strong\", null, mdx(\"inlineCode\", {\n    parentName: \"p\"\n  }, \"<Choice>\"), \" component\"), \" table below, including all valid attributes of the \", mdx(\"a\", {\n    parentName: \"p\",\n    \"href\": \"https://developer.mozilla.org/en-US/docs/Web/HTML/Element/input\"\n  }, \"HTML input element\"), \".\"), mdx(\"h4\", {\n    \"id\": \"choicelist-component\",\n    \"style\": {\n      \"position\": \"relative\"\n    }\n  }, mdx(\"a\", {\n    parentName: \"h4\",\n    \"href\": \"#choicelist-component\",\n    \"aria-label\": \"choicelist component permalink\",\n    \"className\": \"anchor before\"\n  }, mdx(\"svg\", {\n    parentName: \"a\",\n    \"aria-hidden\": \"true\",\n    \"focusable\": \"false\",\n    \"height\": \"16\",\n    \"version\": \"1.1\",\n    \"viewBox\": \"0 0 16 16\",\n    \"width\": \"16\"\n  }, mdx(\"path\", {\n    parentName: \"svg\",\n    \"fillRule\": \"evenodd\",\n    \"d\": \"M4 9h1v1H4c-1.5 0-3-1.69-3-3.5S2.55 3 4 3h4c1.45 0 3 1.69 3 3.5 0 1.41-.91 2.72-2 3.25V8.59c.58-.45 1-1.27 1-2.09C10 5.22 8.98 4 8 4H4c-.98 0-2 1.22-2 2.5S3 9 4 9zm9-3h-1v1h1c1 0 2 1.22 2 2.5S13.98 12 13 12H9c-.98 0-2-1.22-2-2.5 0-.83.42-1.64 1-2.09V6.25c-1.09.53-2 1.84-2 3.25C6 11.31 7.55 13 9 13h4c1.45 0 3-1.69 3-3.5S14.5 6 13 6z\"\n  }))), mdx(\"inlineCode\", {\n    parentName: \"h4\"\n  }, \"<ChoiceList>\"), \" component\"), mdx(PropTable, {\n    componentName: \"ChoiceList\",\n    mdxType: \"PropTable\"\n  }), mdx(\"h4\", {\n    \"id\": \"choice-component\",\n    \"style\": {\n      \"position\": \"relative\"\n    }\n  }, mdx(\"a\", {\n    parentName: \"h4\",\n    \"href\": \"#choice-component\",\n    \"aria-label\": \"choice component permalink\",\n    \"className\": \"anchor before\"\n  }, mdx(\"svg\", {\n    parentName: \"a\",\n    \"aria-hidden\": \"true\",\n    \"focusable\": \"false\",\n    \"height\": \"16\",\n    \"version\": \"1.1\",\n    \"viewBox\": \"0 0 16 16\",\n    \"width\": \"16\"\n  }, mdx(\"path\", {\n    parentName: \"svg\",\n    \"fillRule\": \"evenodd\",\n    \"d\": \"M4 9h1v1H4c-1.5 0-3-1.69-3-3.5S2.55 3 4 3h4c1.45 0 3 1.69 3 3.5 0 1.41-.91 2.72-2 3.25V8.59c.58-.45 1-1.27 1-2.09C10 5.22 8.98 4 8 4H4c-.98 0-2 1.22-2 2.5S3 9 4 9zm9-3h-1v1h1c1 0 2 1.22 2 2.5S13.98 12 13 12H9c-.98 0-2-1.22-2-2.5 0-.83.42-1.64 1-2.09V6.25c-1.09.53-2 1.84-2 3.25C6 11.31 7.55 13 9 13h4c1.45 0 3-1.69 3-3.5S14.5 6 13 6z\"\n  }))), mdx(\"inlineCode\", {\n    parentName: \"h4\"\n  }, \"<Choice>\"), \" component\"), mdx(PropTable, {\n    componentName: \"Choice\",\n    mdxType: \"PropTable\"\n  }, mdx(PropTableHtmlElementRow, {\n    elements: ['input'],\n    mdxType: \"PropTableHtmlElementRow\"\n  })), mdx(\"h3\", {\n    \"id\": \"styles\",\n    \"style\": {\n      \"position\": \"relative\"\n    }\n  }, mdx(\"a\", {\n    parentName: \"h3\",\n    \"href\": \"#styles\",\n    \"aria-label\": \"styles permalink\",\n    \"className\": \"anchor before\"\n  }, mdx(\"svg\", {\n    parentName: \"a\",\n    \"aria-hidden\": \"true\",\n    \"focusable\": \"false\",\n    \"height\": \"16\",\n    \"version\": \"1.1\",\n    \"viewBox\": \"0 0 16 16\",\n    \"width\": \"16\"\n  }, mdx(\"path\", {\n    parentName: \"svg\",\n    \"fillRule\": \"evenodd\",\n    \"d\": \"M4 9h1v1H4c-1.5 0-3-1.69-3-3.5S2.55 3 4 3h4c1.45 0 3 1.69 3 3.5 0 1.41-.91 2.72-2 3.25V8.59c.58-.45 1-1.27 1-2.09C10 5.22 8.98 4 8 4H4c-.98 0-2 1.22-2 2.5S3 9 4 9zm9-3h-1v1h1c1 0 2 1.22 2 2.5S13.98 12 13 12H9c-.98 0-2-1.22-2-2.5 0-.83.42-1.64 1-2.09V6.25c-1.09.53-2 1.84-2 3.25C6 11.31 7.55 13 9 13h4c1.45 0 3-1.69 3-3.5S14.5 6 13 6z\"\n  }))), \"Styles\"), mdx(\"p\", null, \"The following CSS variables can be overridden to customize choice fields:\"), mdx(ComponentThemeOptions, {\n    componentname: \"choice\",\n    mdxType: \"ComponentThemeOptions\"\n  }), mdx(\"h4\", {\n    \"id\": \"form-components\",\n    \"style\": {\n      \"position\": \"relative\"\n    }\n  }, mdx(\"a\", {\n    parentName: \"h4\",\n    \"href\": \"#form-components\",\n    \"aria-label\": \"form components permalink\",\n    \"className\": \"anchor before\"\n  }, mdx(\"svg\", {\n    parentName: \"a\",\n    \"aria-hidden\": \"true\",\n    \"focusable\": \"false\",\n    \"height\": \"16\",\n    \"version\": \"1.1\",\n    \"viewBox\": \"0 0 16 16\",\n    \"width\": \"16\"\n  }, mdx(\"path\", {\n    parentName: \"svg\",\n    \"fillRule\": \"evenodd\",\n    \"d\": \"M4 9h1v1H4c-1.5 0-3-1.69-3-3.5S2.55 3 4 3h4c1.45 0 3 1.69 3 3.5 0 1.41-.91 2.72-2 3.25V8.59c.58-.45 1-1.27 1-2.09C10 5.22 8.98 4 8 4H4c-.98 0-2 1.22-2 2.5S3 9 4 9zm9-3h-1v1h1c1 0 2 1.22 2 2.5S13.98 12 13 12H9c-.98 0-2-1.22-2-2.5 0-.83.42-1.64 1-2.09V6.25c-1.09.53-2 1.84-2 3.25C6 11.31 7.55 13 9 13h4c1.45 0 3-1.69 3-3.5S14.5 6 13 6z\"\n  }))), \"Form components\"), mdx(\"p\", null, \"This component also makes use of form field styles, which can be customized by the following variables:\"), mdx(ComponentThemeOptions, {\n    componentname: \"form\",\n    mdxType: \"ComponentThemeOptions\"\n  }), mdx(\"h2\", {\n    \"id\": \"guidance\",\n    \"style\": {\n      \"position\": \"relative\"\n    }\n  }, mdx(\"a\", {\n    parentName: \"h2\",\n    \"href\": \"#guidance\",\n    \"aria-label\": \"guidance permalink\",\n    \"className\": \"anchor before\"\n  }, mdx(\"svg\", {\n    parentName: \"a\",\n    \"aria-hidden\": \"true\",\n    \"focusable\": \"false\",\n    \"height\": \"16\",\n    \"version\": \"1.1\",\n    \"viewBox\": \"0 0 16 16\",\n    \"width\": \"16\"\n  }, mdx(\"path\", {\n    parentName: \"svg\",\n    \"fillRule\": \"evenodd\",\n    \"d\": \"M4 9h1v1H4c-1.5 0-3-1.69-3-3.5S2.55 3 4 3h4c1.45 0 3 1.69 3 3.5 0 1.41-.91 2.72-2 3.25V8.59c.58-.45 1-1.27 1-2.09C10 5.22 8.98 4 8 4H4c-.98 0-2 1.22-2 2.5S3 9 4 9zm9-3h-1v1h1c1 0 2 1.22 2 2.5S13.98 12 13 12H9c-.98 0-2-1.22-2-2.5 0-.83.42-1.64 1-2.09V6.25c-1.09.53-2 1.84-2 3.25C6 11.31 7.55 13 9 13h4c1.45 0 3-1.69 3-3.5S14.5 6 13 6z\"\n  }))), \"Guidance\"), mdx(\"h3\", {\n    \"id\": \"when-to-use\",\n    \"style\": {\n      \"position\": \"relative\"\n    }\n  }, mdx(\"a\", {\n    parentName: \"h3\",\n    \"href\": \"#when-to-use\",\n    \"aria-label\": \"when to use permalink\",\n    \"className\": \"anchor before\"\n  }, mdx(\"svg\", {\n    parentName: \"a\",\n    \"aria-hidden\": \"true\",\n    \"focusable\": \"false\",\n    \"height\": \"16\",\n    \"version\": \"1.1\",\n    \"viewBox\": \"0 0 16 16\",\n    \"width\": \"16\"\n  }, mdx(\"path\", {\n    parentName: \"svg\",\n    \"fillRule\": \"evenodd\",\n    \"d\": \"M4 9h1v1H4c-1.5 0-3-1.69-3-3.5S2.55 3 4 3h4c1.45 0 3 1.69 3 3.5 0 1.41-.91 2.72-2 3.25V8.59c.58-.45 1-1.27 1-2.09C10 5.22 8.98 4 8 4H4c-.98 0-2 1.22-2 2.5S3 9 4 9zm9-3h-1v1h1c1 0 2 1.22 2 2.5S13.98 12 13 12H9c-.98 0-2-1.22-2-2.5 0-.83.42-1.64 1-2.09V6.25c-1.09.53-2 1.84-2 3.25C6 11.31 7.55 13 9 13h4c1.45 0 3-1.69 3-3.5S14.5 6 13 6z\"\n  }))), \"When to use\"), mdx(\"p\", null, mdx(\"strong\", {\n    parentName: \"p\"\n  }, \"Radio buttons\")), mdx(\"ul\", null, mdx(\"li\", {\n    parentName: \"ul\"\n  }, \"When users need to select only one option out of a set of mutually exclusive choices.\")), mdx(\"h3\", {\n    \"id\": \"when-to-consider-alternatives\",\n    \"style\": {\n      \"position\": \"relative\"\n    }\n  }, mdx(\"a\", {\n    parentName: \"h3\",\n    \"href\": \"#when-to-consider-alternatives\",\n    \"aria-label\": \"when to consider alternatives permalink\",\n    \"className\": \"anchor before\"\n  }, mdx(\"svg\", {\n    parentName: \"a\",\n    \"aria-hidden\": \"true\",\n    \"focusable\": \"false\",\n    \"height\": \"16\",\n    \"version\": \"1.1\",\n    \"viewBox\": \"0 0 16 16\",\n    \"width\": \"16\"\n  }, mdx(\"path\", {\n    parentName: \"svg\",\n    \"fillRule\": \"evenodd\",\n    \"d\": \"M4 9h1v1H4c-1.5 0-3-1.69-3-3.5S2.55 3 4 3h4c1.45 0 3 1.69 3 3.5 0 1.41-.91 2.72-2 3.25V8.59c.58-.45 1-1.27 1-2.09C10 5.22 8.98 4 8 4H4c-.98 0-2 1.22-2 2.5S3 9 4 9zm9-3h-1v1h1c1 0 2 1.22 2 2.5S13.98 12 13 12H9c-.98 0-2-1.22-2-2.5 0-.83.42-1.64 1-2.09V6.25c-1.09.53-2 1.84-2 3.25C6 11.31 7.55 13 9 13h4c1.45 0 3-1.69 3-3.5S14.5 6 13 6z\"\n  }))), \"When to consider alternatives\"), mdx(\"ul\", null, mdx(\"li\", {\n    parentName: \"ul\"\n  }, \"If there are too many options to display on a mobile screen. Consider a \", mdx(\"inlineCode\", {\n    parentName: \"li\"\n  }, \"dropdown\"), \" menu if you don\\u2019t have enough space to list out all available options, and if the user can only select one of the options.\"), mdx(\"li\", {\n    parentName: \"ul\"\n  }, \"Never use radio buttons for optional questions, since once a radio button is selected from a list, it or another choice will remain selected.\")), mdx(\"h3\", {\n    \"id\": \"usage\",\n    \"style\": {\n      \"position\": \"relative\"\n    }\n  }, mdx(\"a\", {\n    parentName: \"h3\",\n    \"href\": \"#usage\",\n    \"aria-label\": \"usage permalink\",\n    \"className\": \"anchor before\"\n  }, mdx(\"svg\", {\n    parentName: \"a\",\n    \"aria-hidden\": \"true\",\n    \"focusable\": \"false\",\n    \"height\": \"16\",\n    \"version\": \"1.1\",\n    \"viewBox\": \"0 0 16 16\",\n    \"width\": \"16\"\n  }, mdx(\"path\", {\n    parentName: \"svg\",\n    \"fillRule\": \"evenodd\",\n    \"d\": \"M4 9h1v1H4c-1.5 0-3-1.69-3-3.5S2.55 3 4 3h4c1.45 0 3 1.69 3 3.5 0 1.41-.91 2.72-2 3.25V8.59c.58-.45 1-1.27 1-2.09C10 5.22 8.98 4 8 4H4c-.98 0-2 1.22-2 2.5S3 9 4 9zm9-3h-1v1h1c1 0 2 1.22 2 2.5S13.98 12 13 12H9c-.98 0-2-1.22-2-2.5 0-.83.42-1.64 1-2.09V6.25c-1.09.53-2 1.84-2 3.25C6 11.31 7.55 13 9 13h4c1.45 0 3-1.69 3-3.5S14.5 6 13 6z\"\n  }))), \"Usage\"), mdx(\"ul\", null, mdx(\"li\", {\n    parentName: \"ul\"\n  }, \"Don't rely on the visual difference between radio buttons and checkboxes. Make it clear with words when users can select one or multiple options.\"), mdx(\"li\", {\n    parentName: \"ul\"\n  }, \"Users should be able to tap on or click on either the text label or the checkbox to select or deselect an option.\"), mdx(\"li\", {\n    parentName: \"ul\"\n  }, \"In general, list choices vertically; horizontal listings can make it difficult to tell which label pertains to which choice. An exception is where you have binary choices with short labels, like 'Yes / No'. The convention here is for horizontal alignment.\"), mdx(\"li\", {\n    parentName: \"ul\"\n  }, \"Avoid using negative language in labels as they can be counterintuitive. For example, \\u201CI want to receive a promotional email\\u201D instead of \\u201CI don\\u2019t want to receive promotional email.\\u201D\"), mdx(\"li\", {\n    parentName: \"ul\"\n  }, \"Use caution if you decide to set a default value. Setting a default value can discourage users from making conscious decisions, seem pushy, or alienate users who don\\u2019t fit into your assumptions. In addition, you'll never know if the user explicitly chose that option or just didn't notice the question. If you're unsure, leave nothing selected by default.\")), mdx(\"p\", null, mdx(\"strong\", {\n    parentName: \"p\"\n  }, mdx(\"a\", {\n    parentName: \"strong\",\n    \"href\": \"/design-system/branch/NO-TICKET/revise-dropdown-styles/patterns/forms/\"\n  }, \"View the \\\"Forms\\\" guidelines for additional guidance and best practices.\"))), mdx(\"h3\", {\n    \"id\": \"checked-children-and-the-expose-within-pattern\",\n    \"style\": {\n      \"position\": \"relative\"\n    }\n  }, mdx(\"a\", {\n    parentName: \"h3\",\n    \"href\": \"#checked-children-and-the-expose-within-pattern\",\n    \"aria-label\": \"checked children and the expose within pattern permalink\",\n    \"className\": \"anchor before\"\n  }, mdx(\"svg\", {\n    parentName: \"a\",\n    \"aria-hidden\": \"true\",\n    \"focusable\": \"false\",\n    \"height\": \"16\",\n    \"version\": \"1.1\",\n    \"viewBox\": \"0 0 16 16\",\n    \"width\": \"16\"\n  }, mdx(\"path\", {\n    parentName: \"svg\",\n    \"fillRule\": \"evenodd\",\n    \"d\": \"M4 9h1v1H4c-1.5 0-3-1.69-3-3.5S2.55 3 4 3h4c1.45 0 3 1.69 3 3.5 0 1.41-.91 2.72-2 3.25V8.59c.58-.45 1-1.27 1-2.09C10 5.22 8.98 4 8 4H4c-.98 0-2 1.22-2 2.5S3 9 4 9zm9-3h-1v1h1c1 0 2 1.22 2 2.5S13.98 12 13 12H9c-.98 0-2-1.22-2-2.5 0-.83.42-1.64 1-2.09V6.25c-1.09.53-2 1.84-2 3.25C6 11.31 7.55 13 9 13h4c1.45 0 3-1.69 3-3.5S14.5 6 13 6z\"\n  }))), \"Checked children and the expose within pattern\"), mdx(\"ul\", null, mdx(\"li\", {\n    parentName: \"ul\"\n  }, \"The \", mdx(\"inlineCode\", {\n    parentName: \"li\"\n  }, \"<Choice>\"), \" component includes a \", mdx(\"inlineCode\", {\n    parentName: \"li\"\n  }, \"checkedChildren\"), \" prop that can expose hidden text information or form elements. This \", mdx(\"strong\", {\n    parentName: \"li\"\n  }, \"expose within\"), \" pattern is especially useful if you need to collect data from follow up questions or give just-in-time feedback.\"), mdx(\"li\", {\n    parentName: \"ul\"\n  }, \"Checked children can be exposed by checking the parent checkbox or radio button\"), mdx(\"li\", {\n    parentName: \"ul\"\n  }, \"The \", mdx(\"inlineCode\", {\n    parentName: \"li\"\n  }, \"checkedChildren\"), \" prop should return one or more items wrapped in a \", mdx(\"inlineCode\", {\n    parentName: \"li\"\n  }, \"div\"), \" with the following className: \", mdx(\"inlineCode\", {\n    parentName: \"li\"\n  }, \".ds-c-choice__checkedChild\"), \". This class sets the spacing and border color for the exposed elements.\"), mdx(\"li\", {\n    parentName: \"ul\"\n  }, \"Add the className \", mdx(\"inlineCode\", {\n    parentName: \"li\"\n  }, \".ds-c-choice__checkedChild--inverse\"), \" to the \", mdx(\"inlineCode\", {\n    parentName: \"li\"\n  }, \"div\"), \" to show the inverse white border\"), mdx(\"li\", {\n    parentName: \"ul\"\n  }, \"You may need to add the className \", mdx(\"inlineCode\", {\n    parentName: \"li\"\n  }, \".ds-u-margin--0\"), \" to your child element(s) to avoid extra top margin\"), mdx(\"li\", {\n    parentName: \"ul\"\n  }, \"If you opt for smaller radio buttons or checkboxes, add className \", mdx(\"inlineCode\", {\n    parentName: \"li\"\n  }, \".ds-c-choice__checkedChild--small\"), \" to your checked child container\")), mdx(\"h3\", {\n    \"id\": \"accessibility\",\n    \"style\": {\n      \"position\": \"relative\"\n    }\n  }, mdx(\"a\", {\n    parentName: \"h3\",\n    \"href\": \"#accessibility\",\n    \"aria-label\": \"accessibility permalink\",\n    \"className\": \"anchor before\"\n  }, mdx(\"svg\", {\n    parentName: \"a\",\n    \"aria-hidden\": \"true\",\n    \"focusable\": \"false\",\n    \"height\": \"16\",\n    \"version\": \"1.1\",\n    \"viewBox\": \"0 0 16 16\",\n    \"width\": \"16\"\n  }, mdx(\"path\", {\n    parentName: \"svg\",\n    \"fillRule\": \"evenodd\",\n    \"d\": \"M4 9h1v1H4c-1.5 0-3-1.69-3-3.5S2.55 3 4 3h4c1.45 0 3 1.69 3 3.5 0 1.41-.91 2.72-2 3.25V8.59c.58-.45 1-1.27 1-2.09C10 5.22 8.98 4 8 4H4c-.98 0-2 1.22-2 2.5S3 9 4 9zm9-3h-1v1h1c1 0 2 1.22 2 2.5S13.98 12 13 12H9c-.98 0-2-1.22-2-2.5 0-.83.42-1.64 1-2.09V6.25c-1.09.53-2 1.84-2 3.25C6 11.31 7.55 13 9 13h4c1.45 0 3-1.69 3-3.5S14.5 6 13 6z\"\n  }))), \"Accessibility\"), mdx(\"ul\", null, mdx(\"li\", {\n    parentName: \"ul\"\n  }, \"Surround a related set of choices with a \", mdx(\"inlineCode\", {\n    parentName: \"li\"\n  }, \"<fieldset>\"), \". The \", mdx(\"inlineCode\", {\n    parentName: \"li\"\n  }, \"<legend>\"), \" provides context for the grouping. Do not use \", mdx(\"inlineCode\", {\n    parentName: \"li\"\n  }, \"fieldset\"), \" and \", mdx(\"inlineCode\", {\n    parentName: \"li\"\n  }, \"legend\"), \" for a single checkbox.\"), mdx(\"li\", {\n    parentName: \"ul\"\n  }, \"Some screen readers read the \", mdx(\"inlineCode\", {\n    parentName: \"li\"\n  }, \"legend\"), \" text for each \", mdx(\"inlineCode\", {\n    parentName: \"li\"\n  }, \"fieldset\"), \", so it should be brief and descriptive.\"), mdx(\"li\", {\n    parentName: \"ul\"\n  }, \"Each input should have a semantic \", mdx(\"inlineCode\", {\n    parentName: \"li\"\n  }, \"id\"), \" attribute, and its corresponding \", mdx(\"inlineCode\", {\n    parentName: \"li\"\n  }, \"label\"), \" should have the same value in its \", mdx(\"inlineCode\", {\n    parentName: \"li\"\n  }, \"for\"), \" attribute.\"), mdx(\"li\", {\n    parentName: \"ul\"\n  }, \"The custom checkboxes and radio buttons here are accessible to screen readers because the default fields are moved off-screen.\"), mdx(\"li\", {\n    parentName: \"ul\"\n  }, mdx(\"inlineCode\", {\n    parentName: \"li\"\n  }, \"checkedChildren\"), \" will be announced to screen readers when they are exposed. They have been tested with the following devices:\", mdx(\"ul\", {\n    parentName: \"li\"\n  }, mdx(\"li\", {\n    parentName: \"ul\"\n  }, \"Windows 10 + Internet Explorer 11 + JAWS screen reader\"), mdx(\"li\", {\n    parentName: \"ul\"\n  }, \"Windows 10 + Chrome + JAWS\"), mdx(\"li\", {\n    parentName: \"ul\"\n  }, \"Windows10 - Firefox + NVDA\", mdx(\"ul\", {\n    parentName: \"li\"\n  }, mdx(\"li\", {\n    parentName: \"ul\"\n  }, \"NVDA reads out the \", mdx(\"inlineCode\", {\n    parentName: \"li\"\n  }, \"<select>\"), \" label and every \", mdx(\"inlineCode\", {\n    parentName: \"li\"\n  }, \"<option>\"), \" value\"))), mdx(\"li\", {\n    parentName: \"ul\"\n  }, \"MacOS Mojave + Safari + VoiceOver\")))), mdx(\"h3\", {\n    \"id\": \"related-patterns\",\n    \"style\": {\n      \"position\": \"relative\"\n    }\n  }, mdx(\"a\", {\n    parentName: \"h3\",\n    \"href\": \"#related-patterns\",\n    \"aria-label\": \"related patterns permalink\",\n    \"className\": \"anchor before\"\n  }, mdx(\"svg\", {\n    parentName: \"a\",\n    \"aria-hidden\": \"true\",\n    \"focusable\": \"false\",\n    \"height\": \"16\",\n    \"version\": \"1.1\",\n    \"viewBox\": \"0 0 16 16\",\n    \"width\": \"16\"\n  }, mdx(\"path\", {\n    parentName: \"svg\",\n    \"fillRule\": \"evenodd\",\n    \"d\": \"M4 9h1v1H4c-1.5 0-3-1.69-3-3.5S2.55 3 4 3h4c1.45 0 3 1.69 3 3.5 0 1.41-.91 2.72-2 3.25V8.59c.58-.45 1-1.27 1-2.09C10 5.22 8.98 4 8 4H4c-.98 0-2 1.22-2 2.5S3 9 4 9zm9-3h-1v1h1c1 0 2 1.22 2 2.5S13.98 12 13 12H9c-.98 0-2-1.22-2-2.5 0-.83.42-1.64 1-2.09V6.25c-1.09.53-2 1.84-2 3.25C6 11.31 7.55 13 9 13h4c1.45 0 3-1.69 3-3.5S14.5 6 13 6z\"\n  }))), \"Related patterns\"), mdx(\"ul\", null, mdx(\"li\", {\n    parentName: \"ul\"\n  }, mdx(\"a\", {\n    parentName: \"li\",\n    \"href\": \"/design-system/branch/NO-TICKET/revise-dropdown-styles/components/dropdown/\"\n  }, \"Dropdown\"))), mdx(\"h2\", {\n    \"id\": \"learn-more\",\n    \"style\": {\n      \"position\": \"relative\"\n    }\n  }, mdx(\"a\", {\n    parentName: \"h2\",\n    \"href\": \"#learn-more\",\n    \"aria-label\": \"learn more permalink\",\n    \"className\": \"anchor before\"\n  }, mdx(\"svg\", {\n    parentName: \"a\",\n    \"aria-hidden\": \"true\",\n    \"focusable\": \"false\",\n    \"height\": \"16\",\n    \"version\": \"1.1\",\n    \"viewBox\": \"0 0 16 16\",\n    \"width\": \"16\"\n  }, mdx(\"path\", {\n    parentName: \"svg\",\n    \"fillRule\": \"evenodd\",\n    \"d\": \"M4 9h1v1H4c-1.5 0-3-1.69-3-3.5S2.55 3 4 3h4c1.45 0 3 1.69 3 3.5 0 1.41-.91 2.72-2 3.25V8.59c.58-.45 1-1.27 1-2.09C10 5.22 8.98 4 8 4H4c-.98 0-2 1.22-2 2.5S3 9 4 9zm9-3h-1v1h1c1 0 2 1.22 2 2.5S13.98 12 13 12H9c-.98 0-2-1.22-2-2.5 0-.83.42-1.64 1-2.09V6.25c-1.09.53-2 1.84-2 3.25C6 11.31 7.55 13 9 13h4c1.45 0 3-1.69 3-3.5S14.5 6 13 6z\"\n  }))), \"Learn more\"), mdx(\"ul\", null, mdx(\"li\", {\n    parentName: \"ul\"\n  }, mdx(\"a\", {\n    parentName: \"li\",\n    \"href\": \"/design-system/branch/NO-TICKET/revise-dropdown-styles/patterns/forms/\"\n  }, \"Form Guidelines\")), mdx(\"li\", {\n    parentName: \"ul\"\n  }, mdx(\"a\", {\n    parentName: \"li\",\n    \"href\": \"https://paper.dropbox.com/doc/Radio-buttons-oIwWoxwBKClt5IXvDbnpF\"\n  }, \"GOV.UK Checkbox/Radio buttons discussion\")), mdx(\"li\", {\n    parentName: \"ul\"\n  }, mdx(\"a\", {\n    parentName: \"li\",\n    \"href\": \"https://designnotes.blog.gov.uk/2016/11/30/weve-updated-the-radios-and-checkboxes-on-gov-uk/\"\n  }, \"\\\"We've updated the radios and checkboxes on GOV.UK\\\"\")), mdx(\"li\", {\n    parentName: \"ul\"\n  }, mdx(\"a\", {\n    parentName: \"li\",\n    \"href\": \"http://www.formsthatwork.com/files/Articles/dropdown.pdf\"\n  }, \"Four steps for choosing form elements on the Web (PDF)\"))), mdx(\"h2\", {\n    \"id\": \"component-maturity\",\n    \"style\": {\n      \"position\": \"relative\"\n    }\n  }, mdx(\"a\", {\n    parentName: \"h2\",\n    \"href\": \"#component-maturity\",\n    \"aria-label\": \"component maturity permalink\",\n    \"className\": \"anchor before\"\n  }, mdx(\"svg\", {\n    parentName: \"a\",\n    \"aria-hidden\": \"true\",\n    \"focusable\": \"false\",\n    \"height\": \"16\",\n    \"version\": \"1.1\",\n    \"viewBox\": \"0 0 16 16\",\n    \"width\": \"16\"\n  }, mdx(\"path\", {\n    parentName: \"svg\",\n    \"fillRule\": \"evenodd\",\n    \"d\": \"M4 9h1v1H4c-1.5 0-3-1.69-3-3.5S2.55 3 4 3h4c1.45 0 3 1.69 3 3.5 0 1.41-.91 2.72-2 3.25V8.59c.58-.45 1-1.27 1-2.09C10 5.22 8.98 4 8 4H4c-.98 0-2 1.22-2 2.5S3 9 4 9zm9-3h-1v1h1c1 0 2 1.22 2 2.5S13.98 12 13 12H9c-.98 0-2-1.22-2-2.5 0-.83.42-1.64 1-2.09V6.25c-1.09.53-2 1.84-2 3.25C6 11.31 7.55 13 9 13h4c1.45 0 3-1.69 3-3.5S14.5 6 13 6z\"\n  }))), \"Component maturity\"), mdx(MaturityChecklist, {\n    a11yStandards: true,\n    color: true,\n    forcedColors: true,\n    screenReaders: true,\n    keyboardNavigable: true,\n    storybook: true,\n    responsive: true,\n    spanish: null,\n    completeUiKit: false,\n    responsiveUiKit: false,\n    tokensInCode: true,\n    tokensInSketch: true,\n    mdxType: \"MaturityChecklist\"\n  }));\n}\n;\nMDXContent.isMDXComponent = true;","tableOfContents":{"items":[{"url":"#examples","title":"Examples","items":[{"url":"#radio-button-list","title":"Radio button list"},{"url":"#radio-button-children","title":"Radio button children"}]},{"url":"#code","title":"Code","items":[{"url":"#react","title":"React"},{"url":"#styles","title":"Styles"}]},{"url":"#guidance","title":"Guidance","items":[{"url":"#when-to-use","title":"When to use"},{"url":"#when-to-consider-alternatives","title":"When to consider alternatives"},{"url":"#usage","title":"Usage"},{"url":"#checked-children-and-the-expose-within-pattern","title":"Checked children and the expose within pattern"},{"url":"#accessibility","title":"Accessibility"},{"url":"#related-patterns","title":"Related patterns"}]},{"url":"#learn-more","title":"Learn more"},{"url":"#component-maturity","title":"Component maturity"}]}}},"pageContext":{"id":"d1881b7d-6a9a-5ea5-8851-70ba5161670d"}},"staticQueryHashes":["3481578012"]}